video_id,title,description,published_at,channel_country,channel_custom_url,channel_subscriber_count,channel_video_count,view_count,like_count,comment_count,category_id,engagement_rate
wRuexPRu3Sg,You Just Unboxed Your Samsung TV... Now What?,"Wondering how to set up your new TV? Get expert advice from a Samsung TV expert as he shares his top tips for setting up your new TV. From troubleshooting common issues to unlocking the full potential of your screen,  here’s everything you need to know. For more info, visit https://smsng.us/4hmkPlq  0:00 0:09 – Walk through so your Samsung TV looks and sounds its best 0:22 – Step 1: How to connect your TV to Wi-Fi 0:59 – Step 2: How to make your Smart Samsung TV Smarter 1:49 – Step 3: How to set up picture settings on your Samsung TV 2:55 – Step 4: How to install apps on your Samsung TV 4:20 – Step 5: How to connect your soundbar to your Samsung TV 5:09 – Step 6: How to connect a gaming console or laptop to your Samsung TV 5:26 – What is Samsung Gaming Hub? 5:41 – How to access Samsung Gaming Hub 6:19 – Step 7: Access free channels on Samsung TV Plus 6:45 – Step 8: How to clean you Samsung TV screen",2025-10-27T14:01:48Z,US,@samsungus,2030000,2416,963,33,4,24,3.8422
iaXaSomzm7I,Samsung Vision AI 4K QLED TV Review 2025,"Looking for the best smart TV under 40000 in India? In this video, I have reviewed the latest Samsung Vision AI TV in simple Hindi. Learn about its features, specifications, AI-powered enhancements, and much more, and whether the Samsung AI TV 2025 is worth it for your home.  #houseoftech #hindi #samsungaitv",2025-08-15T13:01:30Z,IN,@houseoftechyt,31700,462,106416,1386,40,28,1.34
CMsgD1XCEFY,"The Best TVs To Buy in 2025 | OLED, QLED, and Mini LED!","Get the Samsung S95F: https://www.rtings.com/afflink/AuQAAVoUAAA= Get the Samsung S90F: https://www.rtings.com/afflink/AuQAAWhNAAA= Get the TCL QM8K: https://www.rtings.com/afflink/AuQAAY2VAAA= Get the TCL QM7K: https://www.rtings.com/afflink/AuQAAVogAAA= Get the TCL QM6K: https://www.rtings.com/afflink/AuQAAVofAAA=  We’ve bought and tested over 500 TVs in the past 10 years, so we know a thing or two to help you out. Our picks consider a few things, like the price and availability. We don’t just recommend the best TV no matter the price; we tend to recommend the best deal overall at each price point or the best overall for most people.    TV Reviews: Samsung S95F: https://www.rtings.com/tv/reviews/samsung/s95f-oled Samsung S90F: https://www.rtings.com/tv/reviews/samsung/s90f-oled TCL QM8K: https://www.rtings.com/tv/reviews/tcl/qm8k TCL QM7K: https://www.rtings.com/tv/reviews/tcl/qm7k TCL QM6K: https://www.rtings.com/tv/reviews/tcl/qm6k  Follow our R&D process @RTINGScomRD  Support Us: https://www.rtings.com/insider  Careers: https://grnh.se/eb4de72f7us    Follow Us:    https://www.facebook.com/rtingscom    https://twitter.com/rtingsdotcom    https://www.instagram.com/rtingsdotcom/    ---    00:00 Intro 01:18 Best TV  03:00 Best TV Alternative  03:35 Best Upper Mid-Range TV  04:43 Best Upper Mid-Range TV Alternative  05:05 Best Mid-Range TV  06:18 Best Mid-Range TV Alternative  06:52 Best Lower Mid-Range TV  08:02 Best Lower Mid-Range TV Alternative  08:31 Best Budget TV  09:38 Best Budget TV Alternative  10:09 Recap  10:46 Outro  ---   We make money directly from you via insider access on our website (which gives you access to extra features: https://www.rtings.com/insider) and when you buy a product after clicking a link to a retailer. Learn more about how we work: https://www.rtings.com/company/about-us",2025-10-23T15:46:15Z,,@rtingsdotcom,392000,593,49920,1145,223,28,2.7404
VvI0TtwsqX0,Samsung’s Wireless Frame Pro TV Is a Disaster (And I’m Stuck With It),"Samsung's new $2,200 Wireless Frame Pro TV is AWFUL! Watch it implode under latency, bugs, and edge‑lit lies. Save on the Rhinoshield AirX at checkout using code ""SNAZZYLABS"" - https://url.rhinoshield.io/SNAZZYLABS Follow Snazzy Labs on Twitter - https://twitter.com/snazzylabs   Follow me on Bluesky - https://snazzy.fm/UW Follow me on Threads - https://snazzy.fm/XV Follow me on Mastodon - https://snazzy.fm/NN Follow me on Instagram - https://instagram.com/snazzyq  In this Samsung Frame Pro review, I explain why the $2,200 “wireless” TV is a disaster: the Wireless One Connect box causes latency, stutters, and constant disconnects, the micro‑HDMI 2.1 port lacks eARC/ARC for soundbars, Wi‑Fi 7/6GHz interference breaks stability, and HDMI‑CEC mangles Art Mode power behavior. Despite the matte panel and convincing Art Mode, the edge‑lit “Neo QLED powered by mini‑LED” display delivers poor contrast, vertical banding, smeary night scenes, and unhinged default picture settings—with no Dolby Vision. Software is painfully slow (TV Plus bloat), setup is infuriating (mounting/stud issues, cable routing), and even Samsung’s S801D soundbar drops audio over Wi‑Fi, forcing a lower‑quality Bluetooth fallback. If you want a main TV, buy an OLED; for an art TV, cheaper Hisense/TCL models are better. Bottom line: Samsung Frame Pro looks like wall art, but as a wireless TV it’s laggy, unreliable, and wildly overpriced.  0:00 - This is the worst TV I've ever owned 0:29 - What's the point of ""Frame""-style TVs? 2:39 - How Is It Wireless? 4:15 - Installation HELL 6:45 - eARC sound bar support is ABYSMAL 8:41 - Wireless TV? Wireless sound bar! (it's bad) 10:28 - WiFi 7 will absolutely jack up this TV 11:30 - Software is laughably bad—I've never used a worse TV 16:15 - Hardware is also bad: Apple TV issues, latency, stutter 18:42 - Samsung literally false advertised mini LED—picture quality stinks 21:27 - But this TV is about ART—so how is it?? 23:22 - ""Pro"" this TV is not—especially at night 24:04 - Do not buy this TV—it's garbage",2025-09-01T22:04:27Z,US,@snazzy,1220000,1213,720472,22359,2400,28,3.4365
_g8b74Vdp2Q,The FIRST MicroLED TV You can Buy: Samsung Micro RGB TV 115”,"This is the first production TV with MicroLED technology that you can buy. This Samsung MicroRGB TV is a massive 115” and has insane contrast levels but insanely bright. While it may not be the same level of contrast as OLED, it’s breath darn close and certainly much brigher.  Now we need to find some options that aren’t the size of my entire wall. Haha!  #samsungtv #samsung #microled #tv #oled #microrgb #television #theater #movieroom",2025-09-02T00:26:29Z,US,@thisistechtoday,476000,1063,17168,462,27,28,2.8483
Muv1qmhjiKY,"Installing the Samsung QN70F QLED TV – sleek design, stunning picture, and an easy setup!","In this short video, we’re unboxing and installing the Samsung QN70F QLED TV. Watch how simple the setup process is and get a first look at its sleek design and brilliant picture quality. Perfect for your living room upgrade or home theater setup!",2025-08-25T21:51:19Z,GB,@16ktv,134000,712,78508,1179,13,24,1.5183
nqL6JKEv3JU,"Samsung 43 Inch Smart TV UA43F5550FUXXL 🔥 Best 43 Inch TV 2025 🔥 43 Inch Smart TV Under ₹25,000","Diwali sale 2025 Samsung 43 Inch Smart TV Review 2025 | UA43F5550FUXXL | Best 43 Inch Smart TV Under ₹25,000 If you’re searching for a smart TV that delivers cinematic visuals, powerful sound, and smooth performance, your wait ends here! The Samsung 43 Inch Smart TV (UA43F5550FUXXL) is one of the most talked-about models of 2025 — a perfect blend of style, performance, and affordability. ⚡  In today’s video, I’ll show you why this Samsung Full HD LED Smart TV is dominating the market under ₹25,000. With HDR 10+ support, PurColor display, Object Tracking Sound Lite, and Adaptive Sound, every movie, show, and game looks and feels truly immersive. 🎬  You’ll also get Voice Assistant support, Digital Tuner, and Samsung Knox Security, making this one of the Best 43 Inch Smart TVs in India 2025    ✅Samsung 43 inch FHD Smart LED TV UA43F5550FUXXL https://amzn.to/3WaYNZp   ✅Samsung 43 inches  Crystal 4K Vista Ultra HD Smart LED TV UA43UE81AFULXL  https://amzn.to/42PDdxc  ✅Samsung  55 inch Crystal 4K Vista Pro Ultra HD Smart LED TV UA55UE86AFULXL https://amzn.to/46ZXSRJ    ✅𝐅𝐨𝐥𝐥𝐨𝐰 𝐔𝐒:- 🔔  Instagram - https://www.instagram.com/sikandar_mansuri_official  Twitter - https://x.com/SikandarMansur_  Contact Us:- E-mail 📨 perfectclipsroll@gmail.com     ✅Your Queries best 43 inch 4k tv under 30000 best 43 inch 4k tv under 25000 best 43 inch smart tv best 4k tv under 30000 43 inch tv best 43 inch tv 43 inch qled tv 43 inch led tv 43 inch qled tv flipkart sale diwali 43 inch tv sale flipkart tv sale amazon tv sale best 43 inch qled tv best 43 inch 4k tv best tv 2025 best 4k qled tv best 43 inch 4k tv in india best tv in india 2025 best 43 inch tv in india best tv in india best 4k tv best 4k tv 2025   #sikandarmansuri #smarttv",2025-10-20T03:30:40Z,IN,@sikandarmansuri,36500,712,5927,30,5,28,0.5905
PoBj8tlXlCw,SAMSUNG FREE TV SETUP 2025 || Samsung Free Channel Play Complete Demo || Samsung Tv Plus App Setting,"|| LIKE COMMENTS|SHARE|SUBSCRIBE ||❤❤ """"""""""""""""""""""""""""""""""""""""""""""""""""""""""""""""""""""'""""""""""""""""""""""""""""""""""""""""""""""""""""""""""""""""""""""""""""""""""""""""  Hello guys Soo presenting our new SAMSUNG LIVE TV FREE SETUP Unboxing video ,Get alerts when we release any new video,TURN ON THE BELL ICON on the channel!   𝗕𝘂𝘆 𝗟𝗶𝗻𝗸 ☞︎︎︎ 🄲🄾🄼🄸🄽🄶 🅂🄾🄾🄽  QUERY SOLVED: 1. How to Free Channel Complete Setup Samsung Tv 2025 2. How To Wifi Connection Samsung Smart Tv 2025 3. Samaung Free Channel Complete Review 2026 Model 4. How To Remote Control Setting Samsung Tv 2025 Model 5. How To Screen Mirroring Samsung Smart Tv 2025   💬 FOLLOW WITH TECHNICAL ASWINI  Follow on Twitter-https://twitter.com/AswiniS40941185?s=09  𝗙𝗼𝗹𝗹𝗼𝘄 𝗢𝗻 𝗜𝗻𝘀𝘁𝗮𝗴𝗿𝗮𝗺 ➪ https://www.instagram.com/invites/contact/?i=15fggbbedfsxa&utm_content=3wwl1ow   -------------------------------------------------------------------------------- For business inquiry -technicalaswini@gmail.com --------------------------------------------------------------------------------  ℍ𝕖𝕝𝕝𝕠 𝔽𝕣𝕚𝕖𝕟𝕕𝕤 𝕎𝕖𝕝𝕔𝕠𝕞𝕖 𝕋𝕠 𝕄𝕪 ℂ𝕙𝕒𝕟𝕟𝕖𝕝 🅃🄴🄲🄷🄽🄸🄲🄰🄻 🄰🅂🅆🄸🄽🄸.🅢︎🅤︎🅑︎🅢︎🅒︎🅡︎🅘︎🅑︎🅔︎ 𝕋𝕠 𝕆𝕦𝕣 ℂ𝕙𝕒𝕟𝕟𝕖𝕝 𝔸𝕟𝕕 𝕊𝕖𝕖 𝕀𝕗 𝕐𝕠𝕦 ℍ𝕒𝕧𝕖 𝕨𝕠𝕟 𝕒 ℕ𝕖𝕨 𝙷𝙾𝙼𝙴 𝙰𝙿𝙿𝙻𝙸𝙰𝙽𝙲𝙴𝚂 𝕒𝕟𝕕 𝙴𝙽𝚃𝙴𝚁𝚃𝙴𝚁𝙼𝙴𝙽𝚃 ℙ𝕣𝕠𝕕𝕦𝕔𝕥. 𝕀𝕗 𝕐𝕠𝕦 𝕃𝕚𝕜𝕖 𝕍𝕚𝕕𝕖𝕠 ℙ𝕝𝕖𝕒𝕤𝕖 🅻︎🅸︎🅺︎🅴︎ & 🆂︎🆄︎🅱︎🆂︎🅲︎🆁︎🅸︎🅱︎🅴︎ 𝕆𝕦𝕣 ℂ𝕙𝕒𝕟𝕟𝕖𝕝 𝕀𝕤 𝕀𝕟 𝕐𝕠𝕦𝕣 𝕊𝕖𝕣𝕧𝕚𝕔𝕖.  Copyright Disclaimer Under Section 107 of the Copyright Act 1976, allowance is made for 'Fair Use' for purposes such as criticism, comment, news reporting, teaching, scholarship, and research, Fair use is a permitted by copyright statute that might otherwise be infringing, Non-profit, educational or personal use tips the balance in favor of fair use.   𝗧𝗛𝗔𝗡𝗞 𝗬𝗢𝗨 𝗙𝗥𝗜𝗘𝗡𝗗𝗦 𝗙𝗢𝗥 𝗦𝗧𝗔𝗬𝗜𝗡𝗚 𝗪𝗜𝗧𝗛 𝗨𝗦.❤ #SAMSUNG #SAMSUNG_TV_PLUS #SamsungLiveTv #SamsungFreeChannel #SamsungLiveTvSetup #SamsungFreeChannelSetup #SamsungTvDemo #SamsungTv #TechnicalAswini",2025-09-01T14:32:00Z,IN,@technicalaswini,34800,489,1851,12,3,28,0.8104
x61xYdWzW98,"2025 Samsung 65"" S85F 4K OLED unboxing and wall mounting","Samsung TQ65S85FAE mounted on a plaster wall with fiberboards behind. I mount TVs for a living in Oslo, Norway and have mounted thousands of TVs. This was a good mounting. Nice TV and a great wall for installation.  If you have any questions about the TV, the wall mount or the mounting I am happy to answer.  Chapters: 00:00 Our car 🚐 00:49 Cleaning up 01:24 Whats inside the box 02:28 Connections 02:38 Samsung slim fit wall mount 06:05 Wall mounting begins 10:14 Lifting the 65"" 11:04 All done  Samsung TQ65S85FAEXXC montert på vegg av gips og MDF plater. Hvis du bor i Oslo området og ønsker hjelp med montering av TV så ta kontakt: https://www.oslotvmontering.no Vi monterer alle type skjermer i alle størrelser. Her er prisen for montering av denne Tvn: https://www.oslotvmontering.no/p/vegg65/  in the video: TV:                       https://amzn.to/4npHjnc Wall mount:        https://amzn.to/4qnEJAC Screws for wall: https://amzn.to/4oAtnYv",2025-10-24T14:01:48Z,NO,@oslotvmontering,29200,105,16249,215,10,22,1.3847
shxed5DiPNA,✅ 3 ways to use Samsung SmartThings on your Galaxy device and your Samsung TV,3 ways to use Samsung SmartThings on your Galaxy device and your Samsung TV to make your life easier ✨️ Did you know any of these tips? 💬 Follow us for more! 💙   #OLED #TV #SmartThings #TVHack #SamsungTV,2025-08-25T16:00:39Z,CA,@samsungcanada,64200,1188,21215,272,2,28,1.2915
7D8vL0Hdd00,How to Change Language on Samsung Smart TV #samsungsmarttv,"Learn step by step how to change language on Samsung Smart TV and easily switch your TV menu, apps, and voice settings to your preferred language. This guide helps you quickly navigate the settings and customize your Samsung Smart TV for a better viewing experience. Whether you want English, Hindi, or any other supported language, you’ll find the simple process explained here. Watch till the end to fix language issues on Samsung Smart TV effortlessly. Perfect for beginners and all Samsung TV users!  #samsungsmarttv #changelanguage   how to change language on samsung smart tv, samsung smart tv language settings, change menu language samsung tv, samsung tv change language to english, samsung tv change language to hindi, samsung smart tv settings tutorial, samsung tv language problem fix, samsung tv language setup guide, samsung tv change language easily, how to switch language samsung smart tv, samsung tv tips and tricks, samsung smart tv how to change language, samsung tv language settings explained, fix samsung tv language issues",2025-08-24T10:29:23Z,,@mjtube11,1020000,5969,14612,151,3,22,1.0539
EdbdS2RnqtM,How to install Samsung Frame TV,,2025-09-12T04:33:28Z,,@gtatvwallmounting,196,89,6017,61,3,28,1.0637
-J26aQSSgRs,How To Install Apps On Samsung Smart TV - Step By Step,"Learn how to install apps on samsung smart tv in this video. For more videos like this then please leave a like.  GuideRealm is the home of technology-based how-to's, guides & tips.  Equipment & tools I use (affiliate links): Tubebuddy (YouTube tools): https://www.tubebuddy.com/pricing?a=Tucker Microphone: https://amzn.to/43H8dAy Laptop: https://amzn.to/3ITBwom PC: https://amzn.to/3MPNgJL  Some of the links in this description are affiliate links. As an Amazon Associate and a partner of other affiliate programs, this means I will earn a small commission from qualifying purchases through these links.  Please like, subscribe, and comment.  GuideRealm",2025-09-19T23:00:01Z,US,@guiderealmvideos,1670000,13772,6312,18,1,26,0.301
6MGnCm_MTaY,Samsung Crystal 4K Infinity Vision UHD 43U8400F TV 🔥,"#SamsungTV, #4KTV, #InfinityVision, #SamsungCrystal4K, #43InchTV, #SmartTV, #UHDTV, #TVReview, #CrystalProcessor4K, #Best4KTV, #TizenOS, #HDR10Plus, #SamsungUHD, #TechReview, #NewTV",2025-10-11T16:00:09Z,IN,@cars2explore,140000,2177,16186,123,12,2,0.8341
r6A7tZa3ZR8,"115"" Samsung Micro RGB TV - First Look","Take the NEW TV QUIZ!!:  https://techquiz.ai and find out the Best TV for you!!!  Check out our New Creator storefront on Best Buy with all the best TVs easy to find.  https://creators.bestbuy.com/mypage/btheinstaller  Samsung 2025 TV Lineup - https://howl.link/iox0qmtpk7j11 115"" QN90F Neo MiniLED TV - https://howl.link/v39vf2b8gx5au 65"" QN90F Neo MiniLED TV - https://howl.link/t7quljrofcbcz 77"" Class OLED S95F TV - https://howl.link/bnk5j7cauwxte",2025-08-23T16:45:41Z,US,@btheinstaller,266000,407,152680,3116,225,28,2.1882
9X-3uLoRYp8,Top 5 Best Smart TV in 2025 with GST Cut | 📺🤩 #SmartTV #Technology #Electronics #TV #Innovation,"​Looking for a new Smart TV in 2025? With the recent GST rate cut, now is the perfect time to upgrade your home entertainment system! In this video, we break down the Top 5 Best Smart TVs of 2025 from leading brands like Sony, Samsung, LG, and more. ​We'll cover everything you need to know, including: ​Our Top 5 Picks: The best smart TVs for every budget, from premium OLEDs to value-for-money options. ​Key Features: What to look for in a 2025 Smart TV, including 4K/8K resolution, 120Hz refresh rates, HDMI 2.1, and the latest smart platforms like Google TV, Tizen, and WebOS.  ​The GST Cut Explained: How the recent reduction from 28% to 18% affects TV prices and how much you can save. ​Detailed Reviews: We compare picture quality, sound, gaming features, and smart functionality for each model. ​Whether you're a movie buff, a dedicated gamer, or just looking for a fantastic TV for your living room, this video will help you make the best buying decision. Don't buy a new TV without watching this! ​Don't forget to like, share, and subscribe for more tech reviews and buying guides! ​ ​#BestSmartTV #SmartTV2025 #GSTCut #SonyTV #SamsungTV #LGTV #4KTV #OLED #QLED #TechReview #BuyingGuide #India #Gadgets #Television #BestTV2025",2025-09-22T15:42:37Z,IN,@sevensensetech,133000,1888,204098,2835,54,28,1.4155
eZLzgMBsmX8,🔴 Samsung 32 inch Smart TV Unboxing 🔥 Full Features + Ports Explained in 1 Minute! #samsungtvs,"📦 Unboxing the all-new Samsung 32 inch Smart TV! Inside the box you get: 👉 Sleek Remote Control 👉 Power Cable + Quick Start Guide 👉 Sturdy Stand Pieces 👉 And finally — the stunning Samsung 32 inch HD Ready Smart TV (1366×768 pixels) ✨  ⚡ Features Highlight:  • Compact & Stylish Design with Slim Bezels  • Smart Hub with Netflix, Prime, YouTube & more  • Connectivity: 2 HDMI, 1 USB, LAN, Headphone Jack 🎮💻🎶  • Crystal-clear HD Ready Display (1366×768 pixels)  • Perfect for small rooms, bedrooms & budget smart TV buyers  🔥 Best choice for those who want Samsung trust + smart features at an affordable price!  #SamsungTV #SmartTV #Unboxing #TechShorts #Samsung32Inch #ElectronicsUnboxing #TVReview #Shorts  #SamsungTV #SmartTV #Samsung32Inch #TVUnboxing #TechShorts #ElectronicsUnboxing #SamsungIndia #SmartLiving #SamsungReview #SamsungSmartTV #UnboxingShorts #TechReels #BestSmartTV #BudgetSmartTV Samsung 32 inch Smart TV unboxing Samsung 32 inch Smart TV review Samsung 32 inch HD Ready Smart TV Samsung 32 inch TV features Samsung 32 inch Smart LED TV Samsung Smart TV 32 inch unboxing India Samsung 32 inch Smart TV price 2025 Samsung 32 inch Smart TV ports explained Best 32 inch Smart TV 2025 Samsung TV unboxing short video Samsung 32 inch TV Netflix YouTube Prime Samsung 32 inch Smart TV gaming test Samsung Smart Hub 32 inch TV review",2025-09-22T14:45:17Z,IN,@rahulkhurana2,8480,304,22259,260,2,27,1.1771
lPpqQCqHeEE,Samsung 55 inch crystal uhd 4K smart led tv 2025 | Samsung 55 inch smart led tv with 3 year warranty,,2025-09-13T10:14:06Z,IN,@electrobykeshav,23000,1360,11647,76,1,28,0.6611
cPJz6jk2gFE,"🔥 Samsung 32"" Smart TV 2025 📺 Full Features!",,2025-08-18T06:30:13Z,IN,@udrawat,184000,1739,37174,849,37,28,2.3834
i5glB0aTSP0,Samsung led tv 32 inch mobile connect | samsung led tv ko mobile se kaise connect kare | samsung tv,"Samsung led tv 32 inch mobile connect | samsung led tv ko mobile se kaise connect kare | samsung tv  1.samsung led tv ko mobile se kaise connect kare 2 how to connect mobile to tv samsung 3. samsung led tv 32 inch mobile connect usb 4.samsung led tv ko mobile se kaise connect kare wireless 5. samsung led 32 inch tv ko mobile se kaise connect kare 6. samsung led tv 32 inch mobile connect  Business Enquiries ✅👇 jkworld56@gmail.com   ➤ Instagram -  https://www.instagram.com/genuine_trader_jatin/  This Channel is owned by ➤ Jatinder   Note: Copying or Reproduction of content from this channel is strictly prohibited.  ---------------------------------------------------------------- -------------------------------  ➤ Disclaimer ⚠️  Copyright Disclaimer Under Section 107 of the Copyright Act 1976, allowance is made for  'Fair Use'  for purposes such as criticism, comment, news reporting, teaching, scholarship, and research,  Fair use is a permitted by copyright statute that might otherwise be infringing,  Non-profit, educational or personal use tips the balance in favor of fair use  --------------------------------------------------------------- -------------------------  #samsungledtvconnecttophone#connecttvtomobile#tvled   Your Enquiries 👇  1.samsung led tv ko mobile se kaise connect kare 2 how to connect mobile to tv samsung 3. samsung led tv 32 inch mobile connect usb 4.samsung led tv ko mobile se kaise connect kare wireless 5. samsung led 32 inch tv ko mobile se kaise connect kare 6. samsung led tv 32 inch mobile connect",2025-09-12T07:26:00Z,IN,@jossaworldbyjatinder,1160000,1089,62828,246,9,28,0.4059
eoE_efA4zPs,"Samsung 32 Inch Smart TV 😍 | Best Smart TV Under ₹12,000 in India 2025 📺","Looking for the best smart TV under ₹12,000 in India (2025)? 🤔 This video covers the Samsung 32 Inch Smart TV, which offers amazing picture quality, smart features, and value for money 📺🔥.  ✅ Perfect for budget buyers ✅ Crystal-clear HD viewing ✅ Smart apps & OTT support ✅ Best choice for under ₹12,000  If you are planning to buy a new smart TV in 2025, this could be the best 32-inch TV in this price range! 🙌  #SamsungTV #SmartTV #BestTVUnder12000  Samsung 32 inch Smart TV,Samsung TV under 12000,Best Smart TV under 12000 Rs,Samsung 32 inch TV review,Samsung Smart TV 2025,Best Smart TV in India 2025,Best budget Smart TV India,Samsung LED TV 32 inch,Best TV under 12000 in India,Samsung TV unboxing,Samsung TV review Hindi,Samsung TV features,Top Smart TV 2025,Best LED TV 2025,samsung smart tv 32 inch,samsung tv,lg tv,samsung qled,best smart tv,4k tv,samsung tv review,smart tv,samsung smart tv",2025-08-19T11:30:29Z,IN,@techtravellerblend,104000,511,144328,2938,35,28,2.0599
gh2_6BbMHu0,Samsung 75 inch QLED TV latest 2025 model#trending #shortvideo #shorts,,2025-08-23T07:44:32Z,IN,@ats-critiques,6630,306,122446,1616,14,28,1.3312
2S3pM8wJWhw,Xiaomi 32” F Series Fire TV Review 🔥 Best Budget Smart TV Under 15000?,"✅ Perfect YouTube Description (SEO Optimized)  Experience the new Xiaomi 80 cm (32 inch) F Series HD Ready Smart LED Fire TV – L32MB-FIN, powered by Fire OS, delivering smooth performance, vibrant picture quality, and seamless Alexa integration. In this video, I cover unboxing, design, picture quality, sound test, UI speed, and whether this TV is worth buying in 2025. ========================================== ✅ Key Features Covered:  1. 80 cm (32"") HD Ready Display 2. Vivid Picture Engine 3. Fire TV OS with Built-in Alexa 4. Dual Band Wi-Fi 5. 20W Speakers with Dolby Audio 6. Smooth performance with Quad-core processor  All major apps: Prime Video, Netflix, YouTube, Hotstar, etc. ========================================== Follow Me: Instagram: [https://www.instagram.com/tech_travellerblend] Facebook: [ https://www.facebook.com/abhishek.mulik.129 ] ========================================= We welcome you sharing our content to inspire others, but please be nice and play by our rules  📧 For Business Inquiries/Collaboration: [ abhishekmulik471@gmail.com ] ========================================= Disclaimer :  ""Some links in this description may be affiliate links. This helps support the channel at no additional cost to you."" ========================================= #smarttv #tv #Googletv #xiaomi #flipkart  ========================================= 👉 Check full video for sound test, picture clarity, gaming test, and overall verdict!  Xiaomi 32 inch TV,Xiaomi F Series Fire TV,Xiaomi 80 cm TV,Xiaomi L32MB FIN review,Xiaomi 32 inch unboxing,Best 32 inch TV 2025,Best smart TV under 15000,Xiaomi smart TV review,Mi TV 32 inch 2025,Fire TV vs Android TV,Xiaomi F Series 2025,smart tv,google tv,xiaomi,fire tv,xiaomi tv,xiaomi f2 fire tv,amazon fire tv stick,xiaomi mi tv stick,xiaomi tv f2,xiaomi f2 tv,xiaomi 4k tv,xiaomi tv unboxing,xiaomi fire tv,best 32 inch tv under 15000",2025-11-09T12:30:07Z,IN,@techtravellerblend,104000,511,1032,51,38,28,8.624
OUs6iSKbync,Find the PERFECT IPTV App! Easy Guide for Samsung TV,Find the PERFECT IPTV App! Easy Guide for Samsung TV,2025-08-13T16:39:11Z,,@ttgstreamz,200,440,8365,22,3,24,0.2989
