video_id,title,description,published_at,channel_country,channel_custom_url,channel_subscriber_count,channel_video_count,view_count,like_count,comment_count,category_id,engagement_rate
OxDKaKi6y9M,How to Install VPN on Samsung Smart TV: Easiest Setup Guaranteed,"🌐How to Install VPN on Samsung Smart TV🌐 1️⃣ Exclusive ExpressVPN Discount ➢ https://go.expressvpn.com/3egVYk 🔥  *Get 4 Extra Months for FREE!* 💎 This is our special coupon for you that's not available through ExpressVPN directly.  💎 Basic Plan  *Best Price: $3.49/mo with a 24-month plan (get 4 extra months for free!)       Other plans:       • The 12 month plan: $ 4.99/mo    • The monthly plan:$ 12.99/mo  💎 Advanced Plan  *Best Price: $4.49/mo with a 24-month plan (get 4 extra months for free!)       Other plans:       • The 12 month plan: $5.99/mo    • The monthly plan: $13.99/mo  💎 Pro Plan  *Best Price:  $7.49/mo with a 24-month plan (get 4 extra months for free!)       Other plans:       • The 12 month plan: $ 8.99/mo    • The monthly plan: $ 19.99/mo   ✔️ All plans come with a *30-day free trial*  2️⃣ Get NordVPN ➢ https://go.nordvpn.net/SHACk   🔥  *Get 3 Extra Months for FREE!*  💎 Basic Plan  *Best Price: $2.98/mo with a 24-month plan (plus 3 extra months for free!)       Other plans:       • The 12 month plan: $ 4.99/mo    • The monthly plan: $ 12.99/mo  💎 Plus Plan  *Best Price: $3.85/mo with a 24-month plan (plus 3 extra months for free!)      Other plans:       • The 12 month plan: $ 5.99/mo    • The monthly plan: $13.99/mo  💎 Complete Plan  *Best Price:  $4.81/mo with a 24-month plan (plus 3 extra months for free!)       Other plans:       • The 12 month plan: $ 6.99/mo    • The monthly plan: $ 14.99/mo  💎 Prime Plan  *Best Price:  $6.74/mo with a 24-month plan (plus 3 extra months for free!)       Other plans:       • The 12 month plan: $ 8.99/mo    • The monthly plan: $ 17.99/mo  ✔️ Comes with a *30-day free trial*  3️⃣ Get SurfsharkVPN ➢ https://get.surfshark.net/SH4YA   🔥   *Get 4 Extra Months for FREE!*  💎 Starter Plan  *Best Price: $1.89/mo with a 24-month plan (plus 4 extra months for free!)       Other plans:       • The 12 month plan: $ 2.99/mo (plus 4 extra months for free!)    • The monthly plan: $ 15.45/mo  💎 One Plan  *Best Price: $2.39/mo with a 24-month plan (plus 4 extra months for free!)       Other plans:       • The 12 month plan: $ 3.09/mo (plus 4 extra months for free!)    • The monthly plan: $ 17.95/mo  💎 One+ Plan  *Best Price:  $3.99/mo with a 24-month plan (plus 4 extra months for free!)       Other plans:       • The 12 month plan: $ 5.79/mo (plus 4 extra months for free!)    • The monthly plan: $ 20.85/mo  🚨4EXTRAMONTHS is the special code to use on order page🚨 ▬▬▬▬▬▬▬▬▬▬▬▬▬▬▬▬▬▬▬▬▬▬▬▬▬▬▬  Need more IN-DEPTH info?    ► ExpressVPN Review (In-depth) ➜ https://youtu.be/1qD___QgGEU ► NordVPN Review (In-depth) ➜ https://youtu.be/3HZ1Ejn7QGc ► Surfshark Review (In-depth) ➜ https://youtu.be/j7_wN2_md8c 👉 Watch this TOP 3 VPNs Review ➜ https://youtu.be/pMHG7PsG_kI  ------------------------------------------------ Introduction: ------------------------------------------------  Welcome back, everyone! Today's video is all about using VPNs on your Samsung Smart TV, and I've got three different methods to show you. But first, let's quickly cover what VPNs are and why they're useful for your TV. A VPN encrypts your internet connection and hides your IP address, making it difficult for third parties to monitor your online activities.   ------------------------------------------------ Methods for Setting Up VPN on Samsung Smart TV: ------------------------------------------------  Downloading VPN App: Method one involves downloading a VPN app directly onto your TV. If your TV runs on Android or Smart TV OS, it likely has an app store where you can find VPN apps. I'll share my top three picks later. Once downloaded, you can sign in, choose a server location, and enjoy encrypted streaming right on your TV.  ------------------------------------------------ VPN Recommendations and Conclusion: ------------------------------------------------  When choosing a VPN, ensure it supports the methods mentioned and offers advanced protocols for security. Now, my top three recommended VPNs are... (insert recommendations). Links for pricing, discounts, and detailed reviews are in the description below.    - DISCLOSURE -   I am affiliated, but not sponsored by any VPN provider. This means I might make money when you purchase paid services through the links provided and I might be able to offer discounts when available. Not being sponsored allows me to keep my own opinions and provide reviews and tutorials without bias. So, if you enjoyed the content consider using my affiliate links. All of my opinions on this channel are always my own!   Hope you enjoyed my How to Install VPN on Samsung Smart TV: Easiest Setup Guaranteed Video.  #HowtoInstallVPNonSamsungSmartTV #HowtoInstallVPNonSamsungTV #VPNforSamsungSmartTV  We do not support using a VPN to infringe on copyrights. Please make sure your online actions align with the legal regulations of your location.",2025-10-17T03:18:42Z,,@doyouma1,12700,120,2194,339,1,24,15.4968
l4tMaBFn84w,The Real Difference Between OLED and QLED TVs for Gaming,"Join me as I hunt down the best gadgets you absolutely need right now, and I’ll put them to the test to see if they live up to the hype!  ➟ Hisense 55A7NF - https://geni.us/5tZGAxJ  ➟ Vizio OLED H1  - https://geni.us/iAEJlT  ➟ Sony BRAVIA 8 II - https://geni.us/THArC7W  ➟ Amazon Fire TV - https://geni.us/NJA1psU  ➟ SAMSUNG QN55S90DA - https://geni.us/9Clo9gW    #shorts   Looking for the best 55 inch smart TV in 2025? This video reviews and compares the top-rated 55 inch smart TVs available in the market, considering factors such as picture quality, sound, features, and price. Whether you're a gamer, a movie enthusiast, or just looking for a great TV for everyday viewing, we've got you covered. From 4K resolution to OLED and QLED panels, we'll explore the latest technologies and innovations in the world of smart TVs. Join us as we dive into the world of 55 inch smart TVs and find out which one is the best fit for you. With our expert analysis and in-depth reviews, you'll be able to make an informed decision and find the perfect TV for your needs and budget.  Contact info - ytdotnet@gmail.com",2025-11-09T15:01:31Z,US,@wiredtech3444,83000,3855,897,4,1,24,0.5574
wIjfCb8e3RM,Samsung Tv Price In BD 2025 😱Tv Price In Bangladesh🔥Smart Led Tv Price In Bangladesh 2025,"Samsung Tv Price In BD 2025 😱Tv Price In Bangladesh🔥Smart Led Tv Price In Bangladesh 2025  Jvco Tv Price In BD 2025 😱Tv Price In Bangladesh🔥Smart Led Tv Price In Bangladesh 2025  Nova Tv Price In BD 2025 😱Tv Price In Bangladesh 2025🔥Smart Led Tv Price In Bangladesh  Address : ===================================== Shan Electronics 📲 01765542332 (imo-whatsapp) Shop: 410-411, 4th Floor, Alpana PlazA, New Elephant Road Dhaka 1205 ===================================== @MamunVlogsyt   স্মার্ট টিভি মাত্র ৭৮০০/- টাকায় 😱Tv Price In Bangladesh 2025🔥Smart Led Tv Price In Bangladesh  স্মার্ট টিভি মাত্র ১১৫০০/- টাকায় 😱Tv Price In Bangladesh 2025🔥Smart Led Tv Price In বাংলাদেশ  স্মার্ট টিভি মাত্র ১৩৮০০/- টাকায় 😱Tv Price In Bangladesh 2025🔥Smart Led Tv Price In Bangladesh  4k Google Tv Price In Bangladesh😱Best Price Smart Led Tv🔥Tv Price In Bangladesh 2025🔥Smart Tv price  4k Google Tv Price In Bangladesh 😱 Best Price Smart Led Tv🔥Tv Price In Bangladesh 2025| Smart Tv  4k Google Tv Price In Bangladesh 😱 Smart Tv 43 Inch Price🔥43 inch Best Smart Led Tv Low Price 4k Google Tv Price In Bangladesh 😱Google Tv 43 Inch Price🔥43 inch Best Smart Led Tv Low Price Vision Google TV Update Price In Bangladesh 2024 😱 Cheap Price Vision TV BD 2024 🔥 Tv Price In BD Jvco Tv Cheap Price In Bangladesh 🔥 4K Smart TV Price Bangladesh 2024 | Smart TV Price In BD 2024 43 inch 4k Tv Price In Bangladesh 2025 😱 Google Led Tv Price🔥Smart Tv Price In Bangladesh 2025 Vision Tv Price In Bangladesh 😱Google Tv 43 Inch Price 🔥43 inch 4k Tv Price In Bangladesh 2025  Mark Vision Tv Price In Bangladesh 😱Google Tv 43 Inch Price🔥43 inch Best Smart Led Tv Low Price  Nova Google Tv Price In Bangladesh 😱Google Tv 43 Inch Price🔥43 inch Best Smart Led Tv Low Price  #tvpriceinbd #smarttvpriceinbangladesh #smarttv #tvprice #ronyrahmansshow #tv #jvcotvpriceinbangladesh #haiertv #visiontv   Search Quarries : tv price in bangladesh 2024 smart tv price in bangladesh 2024 4k smart tv price bangladesh 2024 smart tv price in bangladesh tv price in bangladesh smart tv price 2024 jvco tv price in bangladesh smart tv price china led tv price 40 inch smart tv price 4k smart tv price 43 inch smart tv price 4k tv price in bangladesh 2024 4k tv price in bd smart tv led tv price aston tv price in bangladeshston 4k tv triton tv smart tv vs android tv intex tv 4k smart tv price bangladesh 2023 jvco tv cheap price in bangladesh tv price in bangladesh 2023 jvco tv price in bangladesh 2022 4k smart tv price in bd 2023 smart tv price in bangladesh 2023 smart tv price in bd 2023 smart tv price in bangladesh 2022 smart tv price in january 2023 4k tv price in bd 2023 jvco tv cheap price smart tv price in bangladesh jvco tv price july 2023 bd tv price in bangladesh 4k smart tv price china led tv price 4k Smart TV Price In Bangladesh 2023 TV Price In Bangladesh 2023 Android TV Price In Bangladesh 2023 smart tv price in january 2023 4k smart tv price in bd 2023 4k smart tv price in bd Smart TV Price In Bangladesh Haier Tv Price in Bangladesh 2023 Haier TV Price In BD smart tv price 4k smart tv price 4k tv price in bd haier tv price in bangladesh 2023 40 inch smart tv price 43 inch smart tv price 4k smart tv price bangladesh 2022",2025-11-09T09:38:19Z,BD,@ronyrahmansshow,177000,2653,342,11,0,22,3.2164
xVYw1u5PtA0,How to install VPN on Samsung Smart TV Easily,"🌐How to Install a VPN on Samsung Smart TV Easily🌐 1️⃣ Exclusive ExpressVPN Discount ➢ https://go.expressvpn.com/vNYo0y 🔥  *Get 4 Extra Months for FREE!* 💎 This is our special coupon for you that's not available through ExpressVPN directly.  💎 Basic Plan  *Best Price: $3.49/mo with a 24-month plan (get 4 extra months for free!)       Other plans:       • The 12 month plan: $ 4.99/mo    • The monthly plan:$ 12.99/mo  💎 Advanced Plan  *Best Price: $4.49/mo with a 24-month plan (get 4 extra months for free!)       Other plans:       • The 12 month plan: $5.99/mo    • The monthly plan: $13.99/mo  💎 Pro Plan  *Best Price:  $7.49/mo with a 24-month plan (get 4 extra months for free!)       Other plans:       • The 12 month plan: $ 8.99/mo    • The monthly plan: $ 19.99/mo   ✔️ All plans come with a *30-day free trial*  2️⃣ Get NordVPN ➢ https://go.nordvpn.net/SHADP  🔥  *Get 3 Extra Months for FREE!*  💎 Basic Plan  *Best Price: $2.98/mo with a 24-month plan (plus 3 extra months for free!)       Other plans:       • The 12 month plan: $ 4.99/mo    • The monthly plan: $ 12.99/mo  💎 Plus Plan  *Best Price: $3.85/mo with a 24-month plan (plus 3 extra months for free!)      Other plans:       • The 12 month plan: $ 5.99/mo    • The monthly plan: $13.99/mo  💎 Complete Plan  *Best Price:  $4.81/mo with a 24-month plan (plus 3 extra months for free!)       Other plans:       • The 12 month plan: $ 6.99/mo    • The monthly plan: $ 14.99/mo  💎 Prime Plan  *Best Price:  $6.74/mo with a 24-month plan (plus 3 extra months for free!)       Other plans:       • The 12 month plan: $ 8.99/mo    • The monthly plan: $ 17.99/mo  ✔️ Comes with a *30-day free trial*  3️⃣ Get SurfsharkVPN ➢ https://get.surfshark.net/SH4Yp   🔥   *Get 4 Extra Months for FREE!*  💎 Starter Plan  *Best Price: $1.89/mo with a 24-month plan (plus 4 extra months for free!)       Other plans:       • The 12 month plan: $ 2.99/mo (plus 4 extra months for free!)    • The monthly plan: $ 15.45/mo  💎 One Plan  *Best Price: $2.39/mo with a 24-month plan (plus 4 extra months for free!)       Other plans:       • The 12 month plan: $ 3.09/mo (plus 4 extra months for free!)    • The monthly plan: $ 17.95/mo  💎 One+ Plan  *Best Price:  $3.99/mo with a 24-month plan (plus 4 extra months for free!)       Other plans:       • The 12 month plan: $ 5.79/mo (plus 4 extra months for free!)    • The monthly plan: $ 20.85/mo  🚨4EXTRAMONTHS is the special code to use on order page🚨 ▬▬▬▬▬▬▬▬▬▬▬▬▬▬▬▬▬▬▬▬▬▬▬▬▬▬▬  Need more IN-DEPTH info?    ► ExpressVPN Review (In-depth) ➜ https://youtu.be/1qD___QgGEU ► NordVPN Review (In-depth) ➜ https://youtu.be/3HZ1Ejn7QGc ► Surfshark Review (In-depth) ➜ https://youtu.be/j7_wN2_md8c 👉 Watch this TOP 3 VPNs Review ➜ https://youtu.be/NHealwzfIvA  ------------------------------------------------ Introduction: ------------------------------------------------  Welcome back, everyone! Today's video is all about using VPNs on your Samsung Smart TV, and I've got three different methods to show you. But first, let's quickly cover what VPNs are and why they're useful for your TV. A VPN encrypts your internet connection and hides your IP address, making it difficult for third parties to monitor your online activities.   ------------------------------------------------ Methods for Setting Up VPN on Samsung Smart TV: ------------------------------------------------  Downloading VPN App: Method one involves downloading a VPN app directly onto your TV. If your TV runs on Android or Smart TV OS, it likely has an app store where you can find VPN apps. I'll share my top three picks later. Once downloaded, you can sign in, choose a server location, and enjoy encrypted streaming right on your TV.  ------------------------------------------------ VPN Recommendations and Conclusion: ------------------------------------------------  When choosing a VPN, ensure it supports the methods mentioned and offers advanced protocols for security. Now, my top three recommended VPNs are... (insert recommendations). Links for pricing, discounts, and detailed reviews are in the description below. Don't hesitate to comment with questions, and don't forget to like, subscribe, and hit the bell for future videos.   - DISCLOSURE -   I am affiliated, but not sponsored by any VPN provider. This means I might make money when you purchase paid services through the links provided and I might be able to offer discounts when available. Not being sponsored allows me to keep my own opinions and provide reviews and tutorials without bias. So, if you enjoyed the content consider using my affiliate links. All of my opinions on this channel are always my own!   Hope you enjoyed my How to install VPN on Samsung Smart TV Easily Video.  #HowtoInstallVPNonSamsungSmartTV #HowtoInstallVPNonSamsungTV #VPNforSamsungSmartTV  We do not support using a VPN to infringe on copyrights. Please make sure your online actions align with the legal regulations of your location.",2025-10-23T07:38:59Z,,@vpnacademy,11400,76,2224,375,1,22,16.9065
gz9lO06_dpU,Unboxing and Setup SAMSUNG Smart TV H5000F Tizen OS 2025,"In today's video, I am going to unboxing my New SAMSUNG smart TV model H500F 2025.  The new TV come with latest version of Tizen OS. First of all I will try to take out everything from the box. After that connect the TV to power supply and we will turn the TV ON. Setup it step by step together until we can use the TV.  Another thing you need to connect your TV with SAMSUNG account. If you plan to buy new SAMSUNG TV. Now download SmartThing App on your mobile. Connect it to SAMSUNG account. I will make you more easy to setup your TV faster.  Please also check out our related video in below link:  How to Factory Reset SAMSUNG Smart TV 2025 Model H5000F https://www.youtube.com/watch?v=AVZbp3eLlMI",2025-09-30T14:45:11Z,,@haknukman,49700,974,2446,16,6,26,0.8994
xLlv6_NQmr8,"Samsung 32 Inch Smart TV 2025 Review | Best Budget TV Under ₹15,000?","Samsung 32 Inch Smart TV 2025 Review | Best Budget TV Under ₹15,000?   Samsung 32 Inch Smart TV 2025 Edition (UA32H4500FUXXL) ka full review lekar aaya hoon. Is video me aapko milega design, display quality, sound performance, Tizen OS features, free channels, connectivity, Samsung Knox security aur pros & cons ka detailed explanation.  👉 Price: ₹13,990   🛒 More 43 Inch QLED Smart TVs – Check Here 🔵 Other's Recommended Smart Tv's Link: Mai rahta aapke jagah pe toh kaun si size me kaun sa tv buy karta :  32 Inch me :-  Acer V Pro QLED TV :  https://amzn.to/3R4ze9x  TCL  S Series FHD Smart Android LED TV:  https://amzn.to/4hqRg0t  Xiaomi A Series :   https://amzn.to/3DQdKKB  Redmi Fire TV :   https://amzn.to/4221bVP  40 Inch me :- acer  I Pro Series Full HD Smart LED Google TV:  https://amzn.to/4iIErQg  43 Inch me bahut saare option hai:   Acer Super Series ;  https://amzn.to/4kPe7pk  TCL C61B :  https://amzn.to/4hsYAc1  Samsung D Series Brighter Crystal 4K Vivid Pro Ultra HD Smart LED TV :  https://amzn.to/4hBxkIh  TOSHIBA 108 cm (43 inches) V Series Full HD Smart Android LED TV:  https://amzn.to/3FEdwXt  LG 108 cm (43 inches) 4K Ultra HD Smart LED TV:  https://amzn.to/3DFcY31  MI Xiaomi  A Pro 4K Dolby Vision Smart Google TV:  https://amzn.to/41JvuPL  Hisense E6N Series 4K Ultra HD Smart LED Google TV:  https://amzn.to/4223pEF  50 ,55 or 65 Inch me :- acer  I Pro Series 4K Ultra HD LED Smart Google TV:- https://amzn.to/3FrTkrP  acer (55 inches) I Pro Series 4K Ultra HD LED Smart Google TV :  https://amzn.to/3FpxFAB  acer 164 cm (65 inches) L Series 4K Ultra HD Smart Google TV:  https://amzn.to/4in3Dfm  TCL 126 cm (50 inches) 4K Ultra HD Smart QLED Google TV:  https://amzn.to/3DFfN47  TCL  (55 inches) 4K Ultra HD Smart QLED Google TV 55C655:  https://amzn.to/4iNVIrc  TCL  (65 inches) 4K Ultra HD Smart QLED Google TV 65C655: https://amzn.to/3DGRva2  LG 126 cm (50 inches) 4K Ultra HD Smart LED TV:  https://amzn.to/3DFglqH  LG 139 cm (55 inches) 4K Ultra HD Smart LED TV:  https://amzn.to/41NJCaF  LG  (65 inches) 4K Ultra HD Smart LED TV:  https://amzn.to/4kP6cbG  Sony  (55 inches) BRAVIA 2 4K Ultra HD Smart LED Google TV:  https://amzn.to/3Dql1Rq  Sony  (65 inches) BRAVIA 2 4K Ultra HD Smart LED Google TV :  https://amzn.to/3FthemY  (These are affiliate links. Purchasing through them helps support the channel at no extra cost to you.)       👉 Key Features:  32 Inch HD Ready Display (1366 x 768) with HDR10+ & PurColor  Object Tracking Sound Lite + Adaptive Sound + Q-Symphony  Tizen OS with 100+ Free Channels (Samsung TV Plus)  Voice Assistants Support – Bixby & Alexa  Samsung Knox Security for Data Protection  2 HDMI Ports, 1 USB, Wi-Fi & Bluetooth  ⚡ Pros & Cons clear kiye gaye hain taaki aapko decide karne me easy ho ki ye TV lena chahiye ya nahi.  #SamsungTV #SmartTVReview #TechTopstar  ✅ Agar video pasand aaye toh LIKE 👍, SHARE 📲 aur SUBSCRIBE 🔔 zaroor karein.     samsung 32 inch smart tv 2025 review  samsung 32 inch smart led tv 2025 edition  samsung 32 inch hd ready tv honest review  samsung tizen os tv 2025 india  samsung tv under 15000 in india 2025  best 32 inch smart tv 2025 india  samsung 32 inch tv hdr10+ review  samsung tv plus 100 free channels  samsung smart tv 2025 pros and cons  samsung tv 32 inch 2025 price in india   #samsungtv  #smarttv  #budgettv",2025-08-29T12:39:07Z,IN,@techtopstar,20100,314,25094,0,40,28,0.1594
KkhxzE890II,7 Things I HATE about Samsung Frame TV PRO (FULL Review),"**Price it/Learn more here: https://amzn.to/475cn7k **   I've reviewed nearly every iteration of the Samsung Frame TV, since it was first released back in 2017, and I know a lot about it… and since millions of you have seen those videos I decided it was time to buy this 2025 Pro version and test it out for myself so you can see if it might be worth it for you. Particularly because Samsung now has more competition in this art-TV category.  So what's new with the Samsung The Frame TV Pro, is it better than previous versions or is Samsung just jumping on the Pro Label bandwagon? What are the overall pros and cons and can I recommend it for you?  I bought the 65-inch Frame TV for my living room.  Join my channel for Exclusive members-only perks: https://www.youtube.com/channel/UCDGqNf14HSF9v8e-Qmp7VXA/join  ~Get My Newsletter: http://www.techgadgetscanada.com/newsletter-signup/  **May contain Affiliate Links: My YouTube channel is supported by the viewers. Occasionally I will include affiliate links in my reviews. This allows you to get more info easily, and I also may get a small commission from the click, which helps me keep the blog and this YouTube channel running. If you choose to use an affiliate link I thank you greatly for supporting my content. There's no obligation or cost to you for using these links. As an Amazon Associate I earn from qualifying purchases.   I’ll quickly touch on the basics of a Frame TV for those who might be newer to the concept. In essence this is a TV that doesn't look like a TV; when it's not in use playing ultra high definition 4K video and TV shows, the screen shows highly realistic and super high resolution artworks. Thanks to a special coating on the screen, you're not simply getting a screensaver, you're actually getting a display that melts into the background and genuinely becomes part of your decor. Customizable wooden frames, and an included flush mount with no-gap lets you make the screen disappear into your space, or pop like real artwork.   What’s new? I'm going to quickly cover what the new features are with the Frame Pro version. For starters the one connect box is now wireless… and I'll explain in more detail what that means, momentarily.   The display panel technology has also been updated; technically speaking the regular frame uses a QLED panel, while the pro version uses ‘’Neo QLED with Mini LED backlighting’…   Refresh rate on the pro version is also higher at 144hz (the regular Frame is 120hz) meaning it should be better able to handle faster action sequences and potentially even gaming. Samsung is also touting ‘enhanced AI features’… but I'll see what that actually translates to in practice. Samsung The Frame Pro is available in only 3 sizes: 65-inch, 75-inch, and 85-inch.   That's what's new with this version. Now let's get to what it's like to own one…  Set up & Installation If you're new to this TV the installation is not all that difficult. If you have an older model you might be disappointed to find that—Frustration Number one— the bracket has been altered just enough to make it slightly incompatible with the new Pro version, so no re-using the old mounts. Previously known as the ‘no gap wall mount’, you'll affix two mounting brackets onto your wall and a paper template included in the box makes this easier. Then attach to metal loops to the back of the TV. The loops will hang on the wall brackets to provide a stable yet flat support system for the TV that also offers a small amount of adjustability so you can get things square. Then you need to plug the TV in to power.  We had the TV installed and mounted in about an hour. Once the heavy lifting is done you'll plug in the new One Connect Box to power also, and get the TV onto your Wi-Fi network. From there you'll need to set up a handful of accounts and permissions and logins but you'll largely be ready to go.    ‘Wireless’ One Connect Box The most significant update in the Pro model is the new Wireless One Connect Box that comes with your Frame TV Pro. But this isn’t what it seems… and don’t let what you can’t see here in my set up fool you…   With the Samsung Frame TV Pro here, Samsung will tell you it made a huge leap for all of us, by getting rid of the translucent wire completely with their new Wireless One Connect box. But the joke is on all of us because—Frustration Number 2— while you don't have a thin translucent wire running from the One Connect box to the TV, you do still have to get power to the TV and for that Samsung has supplied a fat white power cable, and good luck hiding that without conduit inside the wall. Or…Here’s hoping you're one of those lucky few who has a power outlet high up on the wall where you can connect this to keep it out of view.",2025-09-12T12:00:44Z,CA,@erinlawrencetv,120000,1434,17225,462,78,28,3.135
Dq3gUqDA-Xw,"Would You Spend $30,000 for a Samsung TV 🤔",,2025-08-24T16:06:12Z,US,@tomsguideus,112000,2579,34400,2297,66,28,6.8692
zkC0dpz3AWw,Samsung’s new $30k Micro RGB TV is insane (Please… I’ll do ANYTHING) #c#carterpcst#techtechtok,Samsung’s new $30k Micro RGB TV is insane (Please… I’ll do ANYTHING) #c#carterpcst#techtechtok #samsung,2025-08-25T20:01:43Z,US,@actuallycarterpcs,1910000,3513,1107614,54100,699,22,4.9475
-VupI3fqlF0,Como Resetar Controle Smart TV Samsung,,2025-08-26T04:08:29Z,BR,@jhonescah,88900,9896,21288,89,3,10,0.4322
