video_id,title,description,published_at,channel_country,channel_custom_url,channel_subscriber_count,channel_video_count,view_count,like_count,comment_count,category_id,engagement_rate
YHevF1_acHA,Samsung QLED tv price in Bangladesh 2025🔥| Samsung 4k smart TV price in BD/ samsung smart tv price,"Samsung QLED tv price in Bangladesh 2025🔥| Samsung 4k smart TV price in BD/ samsung smart tv price Haier/ Hisense / samsung / Samsung QLED tv price in Bangladesh 2025🔥| Samsung smart TV price Samsung  QLED tv price in Bangladesh 2025🔥| Samsung smart TV price I Smart tv price in bangladesh 2025 ----------------------------------------------------------------------------------------------------- Chowdhury Electronics Alpana Plaza, Level-4, Shop-424,425,426, 51 New Elephant Road, Dhaka 1205 Mobile: 01785246248 (Imo/WhatsApp) ------------------------------------------------------------------------------------------------------ Xiaomi QLED TV Price In bd 2024🔥 | Google TV Price In BD 2025| Xiaomi Google TV Price In bd 2025  Xiaomi 4k TV Price In bd 2025🔥 | Google TV Price In BD 2025 | Xiaomi Google TV Price In bd 2025  4k Smart TV Price In Bangladesh 2024 | TV Price In Bangladesh | Android TV Price In Bangladesh 2024  Smart TV Price In Bangladesh🔥 Haier Tv Price in Bangladesh 2023 | Haier TV Price In BD | 4K Tv Price  Haier tv price in Bangladesh, Haier tv price in Bangladesh 2023, Haier 43 inch tv price in Bangladesh, Haier smart tv price in Bangladesh, television price in Bangladesh, Haier led tv 32 inch price in Bangladesh, Haier tv 32 inch price in Bangladesh  Haier HQLED Tv Price In Bangladesh haier tv price in bangladesh 2025 haier 32 inch smart tv price in bangladesh haier led tv price in bangladesh haier 43 inch 4k tv price in bangladesh haier android tv price in bangladesh  #smarttvprice #tv #price #2022      #smarttvpriceinbangladesh 2025 #tvpriceinbangladesh  #smarttv  #smarttvprice  #smarttvpriceinbangladesh2023 #tvpriceinbangladesh2022 #smarttvpriceinbd #tvpriceinbd #jvco_bangladesh  #jvco  #smarttv  #smarttvpriceinbangladesh  #jvco_electronics #Samsungtv  #Xiaomitv  #haiertv #marketupdatebd  smart tv price in Bangladesh, smart tv price in BD, smart tv price 2024, tv price in Bangladesh, tv price in BD, tv price 2025, Intex tv price in Bangladesh, Intex tv price in BD, Intex tv price 2025, jvco tv price in Bangladesh, jvco tv price in BD, 4k smart tv price, android tv box price, smart tv box price, 32 inch smart tv price, 40 inch smart tv price, 43 inch smart tv price, china led tv price, smart tv price, rony rahman show, smart, tv, price, Bangladesh smart tv price in bangladesh, আজীবন ফ্রি ডিশ, tv, tv price bd, bd tv price, tv price in bangladesh, led tv, led tv price, 4k tv price in bangladesh, 4k tv, 32 inch tv, 43 inch tv price bd, 65 inch tv, imran timran tv, daily needs, sony tv price in bangladesh, samsung tv price in bangladesh, lg tv price in bangladesh, sony bravia tv price in bangladesh, sony tv price bd, vlogs, smart android tv, new, 2025, smart tv, intex tv price in bangladesh, intex, netflix free smart tv price in bangladesh 2025, led tv price in bangladesh 2025, smart tv price in bangladesh, jvco tv price in bangladesh, android tv price in bangladesh, samsung led tv price in bangladesh, led tv price in bangladesh, china led tv price in bangladesh, smart tv price in bangladesh 2021, sony tv price in bangladesh, samsung tv price in bangladesh, samsung led smart tv price in bangladesh, tv price bd, tv price in bangladesh, top bd, led tv wholesale market, 40 inch led tv, mi tv price in bd  smart tv smart tv vs android tv smart tv 32 inch smart tv price in bd smart tv price in bangladesh smart tv price in bangladesh 2025 smart tv price smart tv price in bangladesh 2025 smart tv price in bangladesh walton smart tv price in bangladesh 32 inch smart tv price in bangladesh vision tv price in bangladesh 2025 television price in bangladesh jvco tv price in bangladesh  intex tv price in bangladesh tv price 2025 tv price bd tv price in bangladesh2025 led tv price in bangladesh led tv price bd led tv  led tv price in bangladesh 2025 china tv price in bangladesh china smart tv price in bangladesh china android tv price in bangladesh smart android tv price in bangladesh 4k smart tv price in bangladesh vision tv price in bangladesh vision tv price vision tv vision led tv android tv android tv price in bangladesh tv price টিভির দাম এলইডি টিভির দাম  smart tv price in bangladesh 2025,nabenvlogs,4k tv,smart tv,led tv,television,tv,4k television,best budget 4k tv,best,best 4k tvs,best smart tv,unboxing,review,best tv,4k,led,lcd,oled,samsung,toshiba,dhaka,bd,new vlog,sony plus,lg,android tv,2025,new,gaming,best tv 2025,best 4k tv 2025,পাইকারি দামে Smart TV কিনুন,Smart TV Wholesale Market in Bangladesh 2025,Mango smart android tv, 4k smart tV  smart tv price in bangladesh,tv price in bangladesh,smart tv,smart tv price in bangladesh 2025,smart tv price in bangladesh 2025,smart tv price in bd,tv price in bangladesh 2025,tv price in bd,led tv price in bangladesh,led tv price 32 inch,smart tv price 2025,tv price in dhaka,smart tv price 32 inch,mi tv price in bangladesh,Sony Tv,xiaomi tv price in bangladesh,samsung tv price in bangladesh,LG Tv,One Plus Tv,Sony TV,4k Tv,haier smart tv,Rowa Tv,bd, Market Update BD",2025-11-09T14:00:50Z,BD,@marketupdatebd,646,88,468,9,1,22,2.1368
MC6EhaCLZMU,Samsung Vs LG🔥Which is the best 32 inch smart tv  of 2025 ??🔥Best 32 Inch LED TV,"this video is about the best 32 inch smart tvs in india 2025. all the best smart tvs from best brands like redmi 32 inch tv, tcl 32 inch smart tv, lg 32 inch smart tv, samsung 32 inch tv and xiaomi best 32 inch smart tvs are covered in this video. so if you are looking for a new tv, its a must watch video for you.   ✅✅Buying links of best 32 inch smart tv  ✅✅  🖥️ Samsung 80 cm (32 inches) - https://amzn.to/45VB8BD  🖥️ LG 80 cms (32 inches) LR570 Series - https://amzn.to/4mGm0hL  #smarttv   #32inchtv #10tech  Topics Covered in this video -   32 inch smart tv samsung 32 inch smart tv best 32 inch smart tv best 32 inch smart tvs tcl 32 inch smart tv top 5 best 32 inch smart tv best 32 inch smart tv under 15000 best smart tv 32 inch 32 inch tv smart tv 32 inch smart tv best 32 inch led tv best 32 inch tv best 32 inch smart tv in india best 32 inch tvs best led tv 32 inch 32 inch tvs best smart tv under 15000 top 5 smart tv best smart 32 inch tv smart android tv vineet malhotra vm one techrx  NOTE: ALL THE IMAGES/PICTURES SHOWN IN THE VIDEO BELONGS TO THE RESPECTED OWNERS AND NOT ME. I AM NOT THE OWNER OF ANY PICTURES SHOWED IN THE VIDEO  ★ Copyright Disclaimer Under Section 107 of the Copyright Act 1976, allowance is made for ""fair use"" for purposes such as criticism, comment, news reporting, teaching, scholarship, and research. Fair use is a use permitted by copyright statute that might otherwise be infringing. Non-profit, educational, or personal use tips the balance in favor of fair use Note- “Amazon and the Amazon logo are trademarks of Amazon.com, Inc. or its affiliates.”  ""We are a part of Amazon LLC Associates Program, an affiliate advertising program""  ""CERTAIN CONTENT THAT APPEARS ON THIS SITE, COMES FROM AMAZON SELLER SERVICES PRIVATE LIMITED. THIS CONTENT IS PROVIDED 'AS IS' AND IS SUBJECT TO CHANGE OR REMOVAL AT ANY TIME.""",2025-08-19T14:30:25Z,IN,@10tech_official,14000,966,46782,235,15,22,0.5344
GDTlYDeQhRQ,Samsung 80 cm (32 inches) HD Smart LED TV UA32H4550FUXXL/25 How to set up Your Samsung TV Unboxing ,"Samsung 80 cm (32 inches) HD Smart LED TV UA32H4550FUXXL/25 How to set up Your Samsung TV Unboxing  #unboxing #samsung #ledtv  Key Features Operating System: Tizen Resolution: LED (1366 x 768 -HD) Connectivity: Wi-Fi, Bluetooth, 2 HDMI Ports, 1 USB-A Port, 1 Ethernet (LAN) Port, 1 RF In Port, HDMi eARC support, Anynet+ (HDMI-CEC) Refresh Rate: 50 Hertz Smart TV Features: Hyper Real Picture Engine, Voice Assistant Remote, Slim Look Design, Samsung Knox Security, Endless free content with Samsung Smart TV Display: LED Audio Formats: MP3,MPEG,FLAC,OGG,WMA,WAV,MIDI,APE,AIFF,ALAC",2025-10-20T11:09:07Z,IN,@zk_unboxing,11100,730,1535,16,0,22,1.0423
OVuR0w-p2p8,Samsung Smart TV Setup Kaise Kare ( Using Remote ),Samsung Smart TV Setup Kaise Kare ( Using Remote ),2025-10-04T15:13:23Z,IN,@trueupdate,65200,91,13853,125,5,28,0.9384
2Af2bGvptL4,Samsung Frame Pro – The Most Stylish Smart TV Ever Made!,"The Samsung Frame Pro isn’t just another TV — it’s a statement piece. In this review, we break down everything you need to know about Samsung’s latest evolution of The Frame series. From its stunning QLED display, improved Matte finish, and Art Mode upgrades, to the sleek Frame customization options that make this TV disappear right into your wall.  We’ll test the picture quality, gaming performance, and smart features powered by Tizen OS, to see if the Frame Pro is more than just good looks. Is this finally the perfect balance of design and performance?  If you’re looking for a premium lifestyle TV that looks like art and performs like a flagship, the Samsung Frame Pro 2025 might just be the one.  ►►►SUBSCRIBE for more - http://bit.ly/SubscribeToBoored  Gear Nanlite Pavotube: https://geni.us/jT0nA Sony A7III: https://geni.us/ykmf Tamron 28-75: https://geni.us/9wsOvq  Amazon: https://geni.us/EKZfH B&H Affiliate Link: http://goo.gl/A4jaVM   Check out more Booredatwork: 1) Google STADIA vs Project xCloud: https://youtu.be/edHJNnZcLjo 2)  Samsung CHG 90 49-inch ULtrawide: https://youtu.be/bbN2Yi6paXc  3) The First iPhone X Hands-On Experience: https://youtu.be/KPYe5343jdQ  Follow BooredatWork on social media: Facebook - https://www.facebook.com/Booredatwork/?fref=ts Twitter - http://twitter.com/booredatwork Periscope: Booredatwork Twitch: http://www.twitch.tv/booredatwork/ Pinterest- http://pinterest.com/booredatwork/   Here’s where you can find more of the Boored family on Youtube! OnBoored: http://www.youtube.com/c/OnBoored BooredFemme: https://youtube.com/user/Booredfemme Booredgamer: https://www.youtube.com/user/Booredgamers  Be sure to comment below, your feedback is what we look for. Thanks for watching! #Samsung #samsungtv",2025-10-27T14:10:58Z,US,@booredatwork,681000,6100,85780,138,10,28,0.1725
d0KpULFsHxU,Samsung S95F QD-OLED TV Review - The Best OLED TV For Most People,Samsung's S95F QD-OLED Glare-Free TV surface might be a turn-off for videophile purists. But it's arguably the best OLED TV for most consumers in a bright room. And that's most of you. Check out my full review!  0:00 Intro 1:10 Unboxing & Setup 1:37 Glare Free Screen 3:08 Image Quality 3:35 Glare Free Comparison 4:46 Brightness 5:38 AI Processing 5:53 HDR10+  7:34 Gaming 8:17 Design 9:08 Audio 10:00 Vision AI 10:30 Sizes & Pricing 11:05 Conclusion  #samsung #4koledtv #s95f,2025-11-03T18:11:29Z,US,@briantong,326000,916,18538,446,82,28,2.8482
Fee_VqxpsgQ,🔥 Samsung Neo QLED 55” Review. Best TV in 2025? 🤔🔥,,2025-08-19T05:30:06Z,IN,@udrawat,184000,1739,18498,400,13,28,2.2327
McarPQqkNe8,"Bought a new 55-inch TV for just 21,900. Thanks for the advice 🤑 #television #unboxing #sumiitalks",#tv #unboxingvideo #unbox #unboxingshorts #best #budgetfriendly #moneysavingtips #cheapest,2025-09-08T01:30:16Z,IN,@sumiitalks,688000,835,6397654,86565,352,22,1.3586
GbtdeNk3g74,⚡Samsung 43” Crystal 4K🔥Amazing Picture + Sound💥Best Under 30K😍#SamsungTV #4KTV #HDR10Plus #smarttv,,2025-11-09T10:09:24Z,IN,@udrawat,184000,1739,3446,42,7,28,1.4219
Hb2SDbCv3ds,77” Samsung S90F OLED 4K Vision AI Smart TV (2025) at Costco $3499.99 #CostcoFinds #TechDeal,,2025-08-22T06:04:19Z,US,@ghureashi,29200,4823,48583,187,3,24,0.3911
eIfB6RnZbhM,Samsung Vision AI QLed 4K Ultra Hd Smart Tv Review #qledtv,"This is short review video of samsung vision ai qled ultra hd 4k smart tv. It is new 2025 qled tv model from samsung brand. It comes with amazing picture quality because of it's qled 4k screen. It comes in various screen sizes such as 43, 55 and 65 inches. It works on tizen operating system and it supports various ott apps. It has 1 usb and 3 hdmi ports. It also supports 4k upscaling and hdr. It has Q4 AI processor for smooth 4k picture playback.  #samsung  #ledtv  #samsungvisionai  #tv   Disclaimer :- This review video is my own opinion on products which is seen in the video. It is not the expert opinion. It is strictly not the expert recommendation to buy the products. Before buying any products you must visit the product's official website and read the necessary information about the products.",2025-08-18T05:50:19Z,IN,@productreviewofficial,47200,1608,30895,103,1,28,0.3366
th0gqYbD42A,Samsung's OLED S95F TV Just Fixed Everything WRONG With Your Living Room Setup,"Are you tired of your TV becoming a mirror every time the sun hits it? I know I was. In this video, I'm diving deep into Samsung’s OLED S95F TV and the matching QS700F Soundbar, a duo that just might solve all your viewing problems.   🛒 Get them here: Samsung OLED S95F TV: Shopee (MY) - https://invl.me/clmy206  Lazada (MY) - https://invl.me/clmy208   Samsung QS700F Soundbar:  Shopee (MY) - https://invl.me/clmy204  Lazada (MY) - https://invl.me/clmy20a   ----------------------------------------------------  🌐 Visit our website for the written reviews & daily tech news! https://www.adamlobo.tv  📷 Do show some love to our IG account (@adamlobotv)!  https://www.instagram.com/adamlobotv/  🚀 Swing by our buzzing Discord community https://discord.gg/taRdMMwBYk  🧰 My Equipment My A-Roll Equipment: https://kit.co/AdamLoboTV/altv-a-roll-kit My B-Roll Equipment: https://kit.co/AdamLoboTV/altv-b-roll-kit  ----------------------------------------------------  ⏲️ Timestamps: 00:00 - Intro 00:26 - Design 01:45 - Anti-Glare Game Changer 02:58 - Picture Quality 05:53 - Sound & Q-Symphony 07:13 - Gaming 08:03 - Software 09:02 - Conclusion  ----------------------------------------------------  📢 SOCIAL MEDIA: YouTube (Adam Lobo TV) - https://www.youtube.com/c/adamlobotv/​ Facebook (Adam Lobo TV) - https://www.facebook.com/adamlobotv/ ​Instagram (@adamlob0) - https://www.instagram.com/adamlob0/ ​Instagram (@adamlobotv) - https://www.instagram.com/adamlobotv/ ​Twitter (@adam_lobo) - https://twitter.com/adam_lobo ​TikTok (@adamlob0) - https://www.tiktok.com/@adamlob0/ Discord - https://discord.gg/taRdMMwBYk   #SamsungS95F #QS700F #SamsungOLED #AdamLoboTV #Samsung",2025-09-07T12:03:00Z,MY,@adamlobotv,210000,1244,14144,120,35,28,1.0959
rAyXusIy8RY,Best 55 Inch TV | Best TV 2025 | Best QLED TV 2025 | Best 55 Inch QLED TV,"Buying the best 55 Inch TV in India is a difficult task, especially when there are 100s of options available to choose from, because you may get a good deal on a 55 Inch QLED TV, but how would you know its picture quality compared with another 55 Inch 4K TV? That is why I am bringing you a side-by-side comparison of the best TVs in 2025. You can only be sure of your decision by seeing and comparing the picture quality of all the best 4K TVs. I will not only compare them side by side but also tell you their pros & cons so you can make an informed decision about buying the best 55 Inch TV under 50000. I will not only talk about the Best 55 Inch TVs and their picture quality in this 55 Inch TV comparison video.    All the links below are affiliate links. Using them for your purchase won't increase the price, but VM-One may get some affiliate commission. This helps us run our YouTube channel without featuring any sponsored content, and we would appreciate your help.    • VM-ONE TV LIST 2025: https://bit.ly/vm-TV   • BEST DEALS ON AMAZON TODAY: https://amzn.to/3dr7wOe   • BEST OFFERS ON TV TODAY: https://amzn.to/3kiGMUO      Featured 55 Inch TVs   • TCL Q6C MINI LED 55 Inch: https://amzn.to/4k6LlyW    • TCL Q6C MINI LED 65 Inch: https://amzn.to/3TGGDNE      • TCL T8C QLED 55 Inch: https://amzn.to/4lqjjiB    • TCL T8C QLED 65 Inch: https://amzn.to/4kTZGQz      • Samsung Vision AI QLED 55 Inch: https://amzn.to/42V0oXh    • Samsung Vision AI QLED 65 Inch: https://amzn.to/43dX20m      • LG UA82 55 Inch: https://amzn.to/3GIXuMX    • LG UA82 65 Inch: https://amzn.to/3TFKFGd      • Sony Bravia 3 55 Inch: https://amzn.to/3zL5Uj7    • Sony Bravia 3 65 Inch: https://amzn.to/4cJxegr      • Sony Bravia 2 MK2 55 Inch: https://amzn.to/4k0L0i6    • Sony Bravia 2 MK2 65 Inch: https://amzn.to/4k6KFJU      • Lumio Vision 7 QLED 55 Inch: https://amzn.to/45KCz6w      • VU Vibe DV QLED 55 Inch: https://amzn.to/4loXkJD    • VU Vibe DV QLED 65 Inch: https://amzn.to/4f7ckdb      • Xiaomi FX Pro QLED 55 Inch: https://amzn.to/4j7Fzwu      • Samsung Vista 55 Inch: https://amzn.to/4dns8aF    • Samsung Vista 65 Inch: https://amzn.to/4jbP3H8      • Samsung Vista Pro 55 Inch: https://amzn.to/3FdiRFC    • Samsung Vista Pro 65 Inch: https://amzn.to/4k0TcyS      • LG UR75 55 Inch: https://amzn.to/3Kb5GnP    • LG UR75 55 Inch: https://amzn.to/4eSftgG      • Xiaomi FX Series 55 Inch: https://amzn.to/3SA5OB0      • Hisense E6N 55 Inch: https://amzn.to/3y2Y8R0    • Hisense E6N 65 Inch: https://amzn.to/41XvFrR      • VM-ONE TV LIST 2025: https://bit.ly/vm-TV   • BEST DEALS ON AMAZON TODAY: https://amzn.to/3dr7wOe   • BEST OFFERS ON TV TODAY: https://amzn.to/3kiGMUO      MUST DOWNLOAD VM-ONE LIST FOR 2025  • TV LIST: https://bit.ly/vm-TV  • WASHING MACHINE LIST: https://bit.ly/vm-wm  • KITCHEN APPLIANCES LIST: https://bit.ly/vm-ka  • HOME APPLIANCES LIST: https://bit.ly/vm-ha  • GEYSER & HEATER LIST: https://bit.ly/vm-gy  • SOUNDBAR LIST: https://bit.ly/vm-su  • REFRIGERATOR LIST: https://bit.ly/vm-ref  • MICROWAVE & OTG LIST: https://bit.ly/vm-mic  • APPLIANCES UNDER 2000 LIST: https://bit.ly/vm-gft  • AC LIST: https://bit.ly/vm-AC  • AIR COOLER LIST: https://bit.ly/vm-aco  • CEILING FAN LIST: https://bit.ly/vm-fa  • INVERTER & BATTERY LIST: https://bit.ly/vm-in      best 55 inch qled tv best tv 2025 best qled tv 2025 best 65 inch qled tv best tv 55 inch 2025 best tv 55 inch best tv 65 inch best 4k qled tv best tv in india 2025 best 55 inch tv best 65 inch tv 55 inch qled tv 65 inch qled tv best tv under 40000 55 inch tv under 40000 best tv under 50000 65 inch tv under 50000 best 55 inch qled best 65 inch qled best 55 inch 4k tv 55 inch qled tv best tv in india 55 inch tv 65 inch tv best qled tv qled tv 55 inch qled tv 65 inch best 55 inch tv 2025 vm one   00:00 Intro 01:35 How I made this video 02:39 Samsung Infinity Vision, Samsung Crystal Vivid Pro, LG UA8200 08:42 Samsung Vision AI, Sony Bravia 2 MK2 & TCL T89C 13:33 Sony Bravia 3 & TCL Q6CS MINI LED 18:58 Support My Work 20:23 Ending   Disclaimer: I have shared my opinions on the products, their features, and their after-sales service in this video. Others may hold different views on these. I take no responsibility for any details, specifications, features, or after-sales service mentioned in this video. I do not intend to persuade or influence anyone to purchase or use any product or brand. Please consider this information carefully before making any purchase decision.  #vmone #tv #qledtv",2025-11-08T05:15:07Z,IN,@vmone,3580000,882,43076,1091,283,28,3.1897
hG9hzAEHUCE,"Samsung Frame TV Wireless one connect box?  Yep, it’s a thing!",Samsung frame tv - wireless one connect box,2025-08-12T20:48:54Z,US,@coolgeekztv,1010,90,16276,65,3,26,0.4178
ITXJquX9FqM,Official Replay | Galaxy Event October 2025 | Samsung,"Introducing Galaxy XR, a new AI-native device designed to deliver immersive experiences in a form factor optimized for multimodal AI. As the first product built on the new Android XR platform, Galaxy XR showcases the future of discovery, play, and work, enabling users to enjoy natural and deeply immersive experiences—from daily tasks to bold new frontiers. It’s the first step in Samsung’s long-term XR journey, with innovations to come across the full spectrum of XR form factors.  Learn more: http://smsng.co/Oct-2025_Replay_yt  #GalaxyXR #MultimodalAI #samsungtv   00:00 Galaxy Event 00:47 Opening 03:32 New Era of XR 07:04 Android XR 08:00 Google Gemini 08:54 Qualcomm 11:26 Innovation behind Galaxy XR 12:43 Built for Multimodal AI Experiences  14:53 A New Dimension of Discovery 27:45 A New Dimension of Play 41:37 A New Dimension of Work 47:14 Launch Date & Price 48:32 Explorer Pack 51:52 Closing",2025-10-22T02:59:34Z,KR,@samsung,7570000,2367,84001887,0,0,28,0.0
eFLkF9ZHkJE,"Samsung 75"" smart tv",,2025-10-16T02:51:15Z,PH,@crusher-vappliancestrading,34400,303,11679,109,2,22,0.9504
d8RWYdaXkys,The new OLED S95F TV is here 💙,"Perfect for movie nights, playoff games and an amazing gaming experience with Samsung Gaming Hub. Looking for a new TV? Follow us to see more 👀   #OLED #TvGuide #tech #SamsungTV #TV",2025-09-01T14:00:32Z,CA,@samsungcanada,64200,1188,20565,162,1,28,0.7926
O_z6_BiLUW8,The new king for 2025! QLED vs Mini-LED TVs,"▶️ CHECK OUT THIS VIDEO: OLED vs LED/LCD TVs https://youtu.be/iMgafkqAdkA  TV companies are trying to confuse you! The differences between QLED and Mini-LED TVs are not as cut and dry as they should be. Let's cut through all the noise and answer the real questions. Is QLED even worth it anymore? Is Mini-LED always better? Or should you just buy a TV that combines both? Let's find out!  📺 TVs Featured • LG QNED81 https://www.lg.com/my/tv-soundbars/qned/50qned81sra/ • Samsung QN90D https://amzn.to/3K4X313 • Samsung Q8F https://amzn.to/488VFV5 • Sony X90L https://amzn.to/42mVMZj • Sony Bravia 9 https://amzn.to/3KNKE1v • Hisense U9 https://amzn.to/4pQtKj4 • Hisense U8QG https://amzn.to/4nWe7Vt • Hisense U6H  https://www.hisense-usa.com/support/televisions-55-inch-u6h-series-quantum-uled-4k-smart-google-tv-2022-55u6h • TCL QM6K https://amzn.to/3UDJqbb • TCL QM7K https://amzn.to/3VvcLoj • TCL QM8K https://amzn.to/4g7PN0e  👍 If you found this helpful or entertaining, let us know in the comments, and don't forget to leave a like.  Hey everyone — if you were already subscribed, welcome to the new direction! This used to be Interstellar News, a space channel I was incredibly proud of. Shifting to TVs and home entertainment wasn’t easy, but it’s something I’m passionate about and excited to grow. I still love space — always will. If this change isn’t for you, I get it. But if you’re curious, I’d love to have you stick around for what’s next. Thanks for being here.",2025-10-01T19:21:08Z,US,@theviewingangle,570000,28,317693,1080,144,28,0.3853
dqey3zyseeE,Samsung UHD 4k 75inch TV unboxing #samsung #samsungtv #unboxing #vasimgamerpro,,2025-10-22T18:46:30Z,IN,@vasimgamerpro,2550,1070,1976,27,3,20,1.5182
1rg_optiLlA,Disable Samsung TV Plus Channels on Samsung Smart TV | Stop Auto Playing Background Channels,"Learn how to disable Samsung TV Plus channels on your Samsung Smart TV and stop the annoying auto-playing background channels. This step-by-step guide helps you remove unwanted channels and prevent them from running automatically in the background. Improve your Smart TV experience and make your home screen cleaner and faster. Perfect for all Samsung TV models. Watch till the end to fix it easily.  #SamsungTVPlus #samsungsmarttv   disable samsung tv plus channels, samsung smart tv tips, remove auto background channels, stop samsung tv plus autoplay, samsung tv settings, samsung tv tricks, samsung tv guide, samsung tv plus fix, samsung tv tutorial, how to disable samsung tv plus  Facebook : https://www.facebook.com/mjtube11 Follow on Instagram : https://www.instagram.com/mjtube11 Follow on twitter:  https://twitter.com/mjtube11 Website : http://www.bsocialshine.com  ============ Disclaimer: Software, apps, videos, images, and audio shown in this video are for informational and educational purposes only. The troubleshooting method and procedure shown in this video are performed at your own risk. We do not have any rights to the content displayed in this video. We neither endorse nor encourage illegal activities. As responsible individuals, we respect all terms, policies, and copyright content. We make every effort to comply with copyright policies. If you find any objectionable content in this video, please contact us via the email provided in the channel’s about section. Don’t use our content without proper permission.   Copyright Disclaimer Under Section 107 of the Copyright Act 1976, allowance is made for ""fair use"" for purposes such as criticism, comment, news reporting, teaching, scholarship, and research. Fair use is a use permitted by copyright statute that might otherwise be infringing. Non-profit, educational, or personal use tips the balance in favor of fair use. ============",2025-10-17T10:37:31Z,,@mjtube11,1020000,5969,1827,13,0,22,0.7115
