video_id,title,description,published_at,channel_country,channel_custom_url,channel_subscriber_count,channel_video_count,view_count,like_count,comment_count,category_id,engagement_rate
Jfgi3X5jBY0,9 Samsung TV Settings Tips And Tricks For The Ultimate Experience,"On this video, I'm going to show you nine of my favorite features on a Samsung TV. The reason I say premium tv is because all of these options are not available on every Samsung TV. These features will enhance your 4k tv viewing experience and makes your tv a smart tv.  Samsung S95F 83"" https://geni.us/804H Samsung S95F 77"" https://geni.us/AXQvoJK Samsung S95F 65"" https://geni.us/5P0TQUy ""USED ON VIDEO"" Samsung S95F 55"" https://geni.us/0GgF  🔹 Join My Community https://geni.us/KZ0yXs8 🔹 Steve Merch https://geni.us/PuwI6C 🔹 Camera Gear I Use:  https://geni.us/FCGtGM 🔹Social Media https://geni.us/yBwF  🔉🔉🔉 Listen To Podcast On 🔉🔉🔉  ➡️Apple Podcast https://geni.us/NaZPyL7 ➡️iHeart Radio https://geni.us/6ZXAni ➡️Deezer https://geni.us/oRCki ➡️Spotify https://geni.us/cT5tv ➡️Amazon Music https://geni.us/B3AgaJK  Subscribe Tech Steve YouTube Channel https://geni.us/TWuA8F  Support The Creator 🏪Amazon Store https://www.amazon.com/shop/techsteve 💵Buy Me A Coffee https://geni.us/oI3KX 💵Donate Via Paypal https://geni.us/qmLi  👍🏽 Subscribe, Why not it’s FREE! https://geni.us/TWuA8F  ➡️ DISCLAIMER: This video and description contains affiliate links, The channel gets a small commission for purchases made via these links.  This helps the channel purchase more products for reviews and allow me to create better content for your viewing.  Chapters 00:00 Introduction 00:24 INITIAL SETUP WITH REMOTE 03:01 HOW TO FACTORY RESET TV 03:25 INITIAL SETUP WITH SMARTTHINGS MOBILE APP 05:12 AMBIENT MODE, DAILY+, SMARTTHINGS, DEX 08:31 BUILT-IN STREAMING GAMING APPS 10:54 HOME SCREEN AND CUSTOMIZE APPS 12:33 SMARTTHING APP CALIBRATION 13:42 HOW TO STOP AUTOMATIC FEATURES 14:26 HOW TO SET UP AMAZON ALEXA 16:33 HOW TO USE MULTI VIEW",2025-09-19T20:26:45Z,US,@techsteve,220000,1042,9192,156,14,28,1.8494
AOg-iVmy1j4,BEST Samsung TVs Ranked (2025) — Don’t Buy the Wrong One!,"Thinking about buying a new Samsung TV in 2025? Stop right there. Samsung drops so many models every year — OLED, QLED, Neo QLED — that it’s almost impossible to know which one is actually worth your money. And here’s the ugly truth: not every “premium” Samsung TV delivers premium performance.  In this video, we rank the BEST Samsung TVs in 2025 — from budget-friendly models to flagship OLED monsters — so you don’t waste thousands on the wrong one.  We’ve tested Samsung’s most popular TVs side by side: ✔️ In bright rooms and dark home theaters ✔️ For gaming on PS5, Xbox, and PC ✔️ Streaming movies, sports, and live TV  Here’s what you’ll discover:  The #1 Samsung TV for the ultimate home theater setup  The best gaming-ready Samsung OLED for PS5 & Xbox  Budget-friendly models that deliver 90% of the performance for half the price  Which Samsung TVs are overpriced hype machines you should avoid  Don’t buy a Samsung TV until you watch this — it could save you thousands and get you way better picture quality.  This video is for educational and informational purposes only. The views expressed are based on publicly available information, personal analysis, and opinion. We do not intend to defame, harm, or misrepresent any individual, company, or brand mentioned. Always do your own research before making financial, dietary, or lifestyle decisions.  At FRUGAL CHOISE, we believe in spending smart — and that starts with asking better questions.",2025-09-04T15:15:01Z,US,@frugalchoise,23600,48,14956,150,9,28,1.0631
RgR0HZcKRpM,2025 S95F: Full Feature Video | Samsung,"Enrich your experience with Samsung Vision AI. Powered by the NQ4 AI Gen3 Processor, the S95F boasts a Glare Free screen with OLED HDR Pro, for unrivalled immersion. Experience Ultimate Gaming Pack with S95F now! 🕹️  For more information, visit http://smsng.co/tvs  #2025NewAITV #VisionAI #4KTV #S95F #OLED #SamsungTV #AITV",2025-09-11T01:03:32Z,KR,@samsung,7570000,2367,96437,2477,156,28,2.7303
hf-sEOuvcRA,LG Vs Samsung TV | LG QNED TV | Samsung Crystal TV ✅,"#LGVsSamsung, #LGQNED, #SamsungCrystal, #TVComparison, #BestTV, #SmartTV, #4KTV, #QLEDvsQNED, #LGTV, #SamsungTV, #TVReview, #TechReview, #HomeEntertainment, #Gadgets, #BuyingGuide  Don’t buy LG TV light bleeding issue explained: https://hosturl.site/vtpdF4  Buy LG UHDTV: https://amzn.to/47eNh63  Thanks for watching ❤️👍🏻",2025-08-24T13:01:16Z,IN,@cars2explore,140000,2177,9215,60,1,28,0.662
UkBS6gzxiRI,Samsung TV Black Friday Buyer's Guide 2025 | OLED & QLED To Buy & Avoid!,"In this ultimate Samsung TV buying guide for Black Friday 2025, I will help you figure out which Samsung 4K TV is best for you?   ✅ Order or Check Samsung TVs Black Friday Prices & Availability Through These Links from Best Buy - https://bestbuycreators.7tiv.net/ra56B3 from Samsung - https://howl.link/2a4c4if23v7hz from Amazon -  https://amzn.to/3FwVGGl  I may earn a commission from purchases made through the links above, at no extra cost to you. Thank you for your support!  =================  0:00 Intro & Why This Samsung Guide Will Help You 0:26 Crystal UHD Lineup - Why They Are All Similar 1:18 QLED (Q6F, Q7F, Q8F) - Small Upgrades Over Crystal UHD 2:55 The Frame TV - Are You Overpaying for the Art Look? 4:10 Neo QLED (Mini-LED) Lineup 4:24 QN70F (Edge-Lit Mini-LED) vs. Frame Pro 5:08 QN80F vs. QN90F (Full Array Mini-LED) 5:18 The Glare-Free Coating (Only on QN90F) 6:37 Why Entry-Level OLED Beats Neo QLED in Dark Rooms 7:07 Entry-Level OLEDs (S84F & S85F) Explained 8:40 Why the Contrast of Entry-Level OLED Still Outshines Neo QLED 8:51 Flagship QD-OLED Lineup | S90F vs QN90F Real Truth 9:46 S90F QD-OLED - The Best Value Premium TV 11:05 S90F (Glossy Screen) vs. S95F (Glare-Free Coating) 11:34 S95F Brightness & 83-inch WOLED Panel Difference 11:42 Final Buying Advice: Which Samsung TV is Right for You?",2025-11-09T14:00:50Z,US,@techwithkg,44900,483,3488,124,50,28,4.9885
Qvp4hYSbLMg,Best Samsung TVs 2025 | Top 5 Samsung TV Review!,"Best Samsung TVs 2025 | OLED vs QLED Which is Best? 👉 Links to The Best Samsung TVs we listed in this video:  1. Samsung S95D QD-OLED TV  https://bit.ly/4noy730  2. SAMSUNG 65-Inch QLED The Frame Series   https://bit.ly/4nSpbCS  3. Samsung QLED Q80D  https://bit.ly/42eTMCv  4. Samsung QN90D Neo QLED  https://bit.ly/4nqoFfD  5. Samsung Q60D QLED  https://bit.ly/3VBqFFI     #tv #samsungtv #samsung #hometheater  Searching for the perfect Samsung TV to upgrade your entertainment setup? In this video, we explore the Best Samsung TVs that deliver stunning picture quality, immersive sound, and cutting-edge features. Whether you want a cinematic 4K experience, a premium QLED display with vibrant colors, or a sleek smart TV loaded with apps and streaming options, we’ve got you covered. From budget-friendly models to top-tier options, you’ll find the right fit for your home. Discover which Samsung TV is worth your investment and why. Stay tuned and make your next binge-watch or gaming session truly unforgettable!   📌 You Can Also Watch:  https://youtu.be/BKGcGHZYl0A?si=rN4c-z6xiK2iKZow https://youtu.be/gfcri31eFTQ?si=vLxg3G2r9ulPWnBs  ************************** Thank you for watching this video. Please like and subscribe to our channel, and for more updated videos, hit the bell button. If you have any questions related to the products in this video, please leave a comment below, and I will respond as soon as possible.  ************************** Disclaimer: The following video abides by the YouTube Community Guidelines. The footage used in this video is for educational purposes.  Copyright Issue:- If you find any of your copyrighted material in this video, please leave us a message so we can resolve the issue within 24 hours.  I hope you enjoyed the 'Best Samsung TVs 2025' Video.",2025-09-28T19:08:59Z,US,@best5zone1,1620,167,1277,12,1,28,1.018
wLQUVIk3eR4,"OLED Is OVER... Micro RGB TVs Are The New Gold Standard | Samsung 115"" Micro-RGB TV","I got a chance to see the new Samsung Micro RGB TV. The technology behind it is pretty incredible. Using RGB, the 115” TV can achieve 100% of the BT.2020 color space. Will this new TV tech bump OLED down to second place in the TV hierarchy?  💥💥*UPDATED PRICES*💥💥  👉 115"" Samsung Micro RGB TV  https://geni.us/WqvaS  👉 Samsung QN90F Best Buy https://geni.us/i6ABRX Amazon https://geni.us/Bq84yT  👉 Samsung HW-Q990F Soundbar Best Buy https://geni.us/MjvsH95  Amazon https://geni.us/B8lKI  📢  Stay Connected With Me:  Instagram: https://www.instagram.com/justcallme_antwan TikTok : https://www.tiktok.com/@newstufftv Threads: https://www.threads.net/@justcallme_antwan Facebook: https://www.facebook.com/JustCallMeAntwan  00:00 Introduction 00:05 Samsung 115"" QN90F 3:33 Samsung 115"" Micro RGB TV   ============================== Links listed in this video are affiliate links and the content creator may be paid a commission based on purchases made  For Collaboration and Business inquiries, please use the contact information below: 📩  Email: NewStuff@justdoinlife.com",2025-08-19T14:22:03Z,US,@newstufftv1,168000,1246,34544,928,136,28,3.0801
nImBWUvxU1I,Samsung U7900F: Everything You Need to Know,"Current Samsung TV Offers https://geni.us/kK6c8S 85"" Samsung U7900F  https://geni.us/vwpdoxT 75"" Samsung U7900F  https://geni.us/hW9e 70"" Samsung U7900F  https://geni.us/JxaQJs 65"" Samsung U7900F  https://geni.us/Vzb7rs 58"" Samsung U7900F  https://geni.us/AogVDy3 55"" Samsung U7900F https://geni.us/tXYKEW 50"" Samsung U7900F  https://geni.us/epWu2g3  Samsung S95F Matte Screen https://geni.us/ALrQIA How to setup Samsung TV https://youtu.be/Jfgi3X5jBY0  ➡️ DISCLAIMER: This video and description contains affiliate links, The channel gets a small commission for purchases made via these links.  This helps the channel purchase more products for reviews and allow me to create better content for your viewing.  Product Highlights: Crystal Processor 4K: Experience lifelike entertainment with dazzling 4K resolution and powerful upscaling that enhances every detail in movies, shows, games, and sports. Sleek MetalStream Design: Elevate your space with a slim, aircraft-inspired design crafted from a single sheet of metal—minimal bezels for maximum immersion. Samsung Knox Security: Stay protected with triple-layer security that blocks unauthorized apps, phishing websites, and safeguards connected devices and personal data. Endless Free Content: Access 2,700+ free channels and 400+ premium Samsung TV Plus channels, including live news, sports, movies, kids’ shows, and more. Motion Xcelerator & HDR: Enjoy smooth, fast-motion clarity for gaming and sports, plus HDR10+ for deeper contrast, enhanced detail, and cinematic realism in every scene. Color Booster & Object Tracking Sound Lite: Immerse yourself with vibrant, dynamic colors and audio that follows on-screen action for a more engaging viewing experience.  🔹 Join My Community https://geni.us/KZ0yXs8 🔹 Steve Merch https://geni.us/PuwI6C 🔹 Camera Gear I Use:  https://geni.us/FCGtGM 🔹Social Media https://geni.us/yBwF  Calman Calibration Solution  https://geni.us/42BchX  🔉🔉🔉 Listen To Podcast On 🔉🔉🔉  ➡️Apple Podcast https://geni.us/NaZPyL7 ➡️iHeart Radio https://geni.us/6ZXAni ➡️Deezer https://geni.us/oRCki ➡️Spotify https://geni.us/cT5tv ➡️Amazon Music https://geni.us/B3AgaJK  Subscribe Tech Steve YouTube Channel https://geni.us/TWuA8F  Support The Creator 🏪Amazon Store https://www.amazon.com/shop/techsteve 💵Buy Me A Coffee https://geni.us/oI3KX 💵Donate Via Paypal https://geni.us/qmLi  ******************************************************************  ""Game Content Usage Rules"" using assets and it is not endorsed ******************************************************************  #ad, #sponsored #samsung   🎥 Video Chapters: 00:00 Introduction 00:20 Ad 00:42 Overview 01:16 Sizes 01:52 In The Box 02:06 Remote 02:46 Bottom Of TV 04:15 Connections 04:43 Glare Test 05:35 Setup Options 06:12 Smart Thing App For Voice 06:38 Tizen OS 07:54 Movie Demos 09:37 Gaming 12:44 Picture Testing 15:58 Audio",2025-10-02T16:55:04Z,US,@techsteve,220000,1042,26256,382,60,28,1.6834
ePrN6aX-g6g,2025 OLED S95F: Feature Video | Samsung,"Enrich your experience with Samsung Vision AI.  Powered by the NQ4 AI Gen3 Processor, the #OLED #S95F boasts a #GlareFree screen with OLED HDR Pro, for unrivalled immersion. Experience Ultimate Gaming Pack with S95F now! 🕹️  For more information, visit: http://spr.ly/MY_OLEDS95F4K_yt  #2025NewAITV #VisionAI #4KTV #S95F #OLED #SamsungAI #SamsungTV #AITV #Samsung",2025-08-22T10:00:49Z,MY,@samsungmalaysia,657000,3344,2493,36,1,28,1.4842
qNn1SLTjA2g,You bought the wrong TV!,"➡️ Stay connected with an @UbigiOfficial Travel eSIM: https://go.ubigi.com/RG9062 💵 Use promo code JON10 to save 10%!   Shopping for a Samsung TV in 2025 can be confusing, but this guide explains what the letters mean, which models are better for bright rooms or gaming, and why clearance 2024 sets like the Q80D and QN95D are often a better choice. So, here's your Samsung lineup cheat sheet for 2025!  📢 Check out The Viewing Angle - https://www.youtube.com/channel/UCEZkzP56Hp79jBA2B2j_-Xw  📺 TVs Featured Samsung QN90F https://amzn.to/3Wa8S8E Samsung S95F https://amzn.to/3Is70VN Samsung QN990F https://amzn.to/4pFBXGD Samsung U8000F https://amzn.to/4pOgLyr Samsung Q7F https://amzn.to/4pHwEqe Samsung Q8F https://amzn.to/3Wesg4l Samsung Q80D (2024) https://amzn.to/42JtOXJ Samsung QN95D (2024) https://www.bestbuy.com/product/samsung-qn95d-qn75qn95daf-75-inches-4k-smart-led-tv-titan-black-graphite-black-2024-uhd-3840-x-2160-resolution-high-d/J3ZYG2H4FK/sku/10772937?ref=212&loc=marketplace Samsung QN900F https://amzn.to/4pFCcS3 Samsung S95D (2024) https://amzn.to/3IHWABk Samsung S90F https://amzn.to/4mGwtc1 Samsung S85F https://amzn.to/4nSIPPf Samsung The Frame Pro https://amzn.to/4gKEco4  🎥 GEAR: https://kit.co/JonRettinger/youtube-gear-2020 🎵 My music comes from Musicbed; check them out: http://share.mscbd.fm/jonrettinger  👋 Follow me! Instagram: https://www.instagram.com/jonrettinger/ X: https://twitter.com/Jon4Lakers Facebook: https://www.facebook.com/JonRettingerYT/ Website: https://www.jon4lakers.tech",2025-09-25T23:06:29Z,US,@jon4lakers,1650000,5066,503543,834,48,28,0.1752
XI9H5uIz3-0,How to remove the back cover of a Samsung TV without screws #tv #television #samsung #repair,,2025-10-13T16:03:50Z,ID,@jupriselektronik4017,44400,544,18298,155,0,28,0.8471
C6ojyr2ePvc,Art or television! Love this Samsung Frame TV! #interiordesign #frametv #television #samsung,,2025-10-10T03:14:55Z,IN,@coloraza,158000,666,401578,6022,53,26,1.5128
srZMLNJT9_Y,Samsung 55 inch crystal uhd 4k smart tv #samsungledtv #55inchtv #55inch #qledtv #QLED,"samsung 55 inch crystal uhd 4k smart tv #SamsungTV #VisionAI #SamsungQLED #4KUltraHD #SmartTV #SamsungIndia #Samsung55Inch #QLEDTV #TechReview #HomeEntertainment #TizenOS #BestSmartTV #SamsungVisionAI #TVReview #4KTV     Samsung Vision AI 55 inch TV, Samsung 4K QLED Smart TV, Samsung QA55QEF1AULXL review, Samsung Vision AI QLED features, Samsung 55 inch QLED price in India, Samsung Vision AI TV specs, Samsung Ultra HD Smart QLED 55 inch, Best 55 inch 4K Smart TV 2025, Samsung Vision AI 4K TV comparison, Samsung Vision AI Smart QLED rating, Samsung Vision AI picture quality, Samsung Vision AI sound quality, Samsung Vision AI gaming performance, Samsung Vision AI Tizen OS TV, Samsung Vision AI QLED buying guide",2025-10-09T11:55:23Z,IN,@8thpaycommissionnews,83500,139,7667,25,1,27,0.3391
YbuJ1XW_LSg,Samsung’s MASSIVE new 115” 4K QLED TV (QN90F),"I remember when 50” TVs were coming out and thought they were HUGE. Now, ultra large TVs over 98” are the fastest growing segment, and the Samsung QN90F is Samsung’s largest TV at a maximum size of 115”. It’s MASSIVE! This Quantum Dot /QLED TV is also great for gamers with a high refresh rate in every single HDMI port, so you can have multiple systems hooked up to it. It’s also bright and has Samsung’s “Glare-Free” technology, so it’s great for bright rooms as well.  Are you amongst those looking for ultra-large TVs? Let me know in the comments.   #samsung #samsungtv #TV #QLED #QLEDTV",2025-09-02T22:22:27Z,US,@thisistechtoday,476000,1063,12629,272,10,28,2.233
ij2Qu8Pjzxc,connect HDMI cable to samsung smart tv #connect #hdmi #shorts,connect HDMI cable to samsung smart tv #connect #hdmi #shorts    how to connect HDMI cable to samsung smart tv    #connect  #hdmi  #cable  #samsungtv  #shorts  #tv  #technology,2025-08-30T11:51:43Z,IN,@24technomx,17200,528,582705,3850,28,28,0.6655
ToVGr0_f6JI,Samsung Smart TV App Store Missing? How to Fix & Install Apps [Updated],"Suddenly, the App Store is missing on Samsung 4K Smart TV with Tizen OS after the latest Update, and now can't find a way to install new Apps?   Need help to get the App Store back on your Samsung Smart TV when it's not showing on the home screen or App Drawer, so you can search and get the apps you want effortlessly? Don't panic, this updated guide will show you exactly how to fix the ""Samsung TV app store not showing up"" issue and install your favorite apps and games easily.   #SamsungSmartTVAppStoreMissing #AppstoreNotShowingSamsungTV",2025-10-21T08:03:18Z,US,@fix.369,289000,5208,2126,8,2,26,0.4704
DUyropoiUGQ,How to use Samsung Vision AI Companion,"Smarter conversations. Seamless control. With Samsung Vision AI Companion, your TV becomes more than a screen — it’s your everyday helper. 💬  👉 To start: 1️⃣   Press the AI button on the remote. 2️⃣   Ask your companion anything — from what’s on your mind to what’s on your screen. 3️⃣   Watch as Samsung Vision AI Companion brings answers, ideas, and entertainment right to your living room. 🌟  That’s the power of Samsung Vision AI Companion — simplifying, enhancing, and empowering your day. 🚀  #VisionAICompanion #SamsungVisionAI #VisionAI #SamsungAITV #AITV",2025-10-24T08:01:37Z,KR,@samsung,7570000,2367,70664,881,58,28,1.3288
V8UELS4di2g,"Best Buy Black Friday Deals 2025: 65"" OLED Doorbuster $899 S84F!","The Best Buy Black Friday TV deals are here, and the TV deals are too good to ignore from OLED to QLED! This video is your guide to the best early TV sales, comparing the performance and prices of Samsung, LG, TCL, Hisense, and Sony flagship TVs.  Please consider supporting the channel by making your next purchase from one of the below website's affiliate links  🛒 Best Buy - https://creators.bestbuy.com/mypage/techwithkg 🛒 Amazon - https://amzn.to/4nqFC97 🛒 Samsung - https://howl.link/z4pj25tg18f6d 🛒 LG - https://howl.link/xt8acu90kw25w 🛒 Sony - https://howl.link/e1gy99fodrvth  With above affiliate links I may earn a commission from eligible purchases. As an Amazon Associate I earn from qualifying purchases  0:00 Intro & Early Black Friday TV Deals at Best Buy 0:33 Samsung S84F OLED (65"" $899) - Best Door Buster Deal 1:25 Entry-Level LCDs & QLEDs (When to Buy TCL/Hisense) 3:07 Samsung S90F QD-OLED (65"" $1399 / 77"" $1999) 3:49 LG G5 OLED - Premium Flagship & 5-Year Warranty 5:26 TVs to AVOID  6:42 LG B5 vs Samsung S84F (77"" $1499 Price Match) 9:04 Sony Bravia 5 Mini-LED (Processing vs. Brightness) 9:45 98-inch is the only size OLED can't crack 10:48 Sony XR8B OLED & Sony A95L QD-OLED Prices 11:15 Sony Bravia 8 Mark II - Best TV of the Year Contender 12:21 Samsung S95F QD-OLED (Glare-Free & 165Hz Gaming) 13:16 Which 65-inch OLED Should You Buy? (S84F vs S90F) 15:18 The Argument Against Overpriced LCD TVs This Year 17:45 Final Thoughts & Viewer Q&A Information",2025-11-07T16:00:59Z,US,@techwithkg,44900,483,10101,183,79,28,2.5938
ernTUIHFqlQ,How To Change Inputs On A Samsung TV,"Have Questions? Ask Bolt, Your Personal Shopping Assistant: https://www.abt.com/bolt?utm_source=youtube&utm_medium=video&utm_campaign=ask-bolt-how-to-change-inputs-samsung-short In this short, we show you how to quickly change inputs on your new Samsung TV. The model used in this video is the QN65QN90F, but this method will work with any of the 2025 models, as well as most 2024 models.   #abtelectronics #samsung #howto #shortcuts #tvshortcuts",2025-08-12T16:16:40Z,US,@abtelectronics,188000,5286,26861,265,8,28,1.0163
ovSa5WhVp4M,Use Your Samsung Galaxy Watch to Control Your Samsung TV,"Did you know you could do this with your Samsung Galaxy Watch and Samsung TV? It is called pointer mode. If you have a recent 2025+ Samsung TV with Vision AI and a supported Samsung Galaxy Watch, you can enable a mode that lets you move your hand around like a pointer and make different hand gestures for various actions.   Do you think this is cool, or a gimmick?.   #samsung #samsunggalaxywatch #samsungtv #samsunggalaxywatch6 #samsungqled #samsunggalaxyultra #samsunggalaxy #galaxyultra #galaxywatch",2025-09-01T03:14:15Z,US,@thisistechtoday,476000,1063,20013,835,14,28,4.2422
OefNxP-ZrEI,"Samsung 32 Inch Smart TV for ₹8,500 | After 15 Days Full Review (2025) | LED TV GURU","Welcome to LED TV GURU! In this video, we bring you the complete 15-day usage review of the Samsung 32 Inch Smart TV (2025 model) — all for just ₹8,500!  👉 Watch till the end to know:  Picture & Sound Quality  Connectivity & Smart Features  Real User Experience after 15 Days  Value for Money Verdict   💡 If you're planning to buy a new budget smart TV, this review will help you make the right choice!   ---  📢 Promotion & Collaboration  For business inquiries, promotion, or brand collaboration, contact: 📧 kumawatsachin26@gmail.com 📧 kumawatsachin1986@gmail.com   ---  ❤️ Support the Channel  Don’t forget to LIKE, SHARE, and SUBSCRIBE to our channel — LED TV GURU — for more honest reviews, comparisons, and tech updates every week!  📺 YouTube Channel: LED TV GURU (Add your real link here)   --   #SamsungTV #SmartTVReview #BudgetSmartTV #LEDTVGURU #TechReview #Samsung32Inch #SmartTV2025 #AffordableTV #TechHindi #ElectronicsReview #VUtv #TCLtv #OnePlusTV #AndroidTV #TVComparison #TVReviewIndia #BestTVUnder10000 #LEDTVDeals",2025-11-04T15:38:32Z,IN,@ledtvguru,119000,762,3094,32,18,28,1.616
gdriFKO8Ye8,"Samsung 55"" Crystal 4k UHD ismart TV| UA55UE84AFULXL | #rahulkhurana #samsungtv #4ktv",#rahulkhurana #samsung #4ktv #uhd #smarttv  #samsungtv  Led 55 inch Samsung  Samsung 55inch smart tv  Best Led tv 2025  Best 55 inch smart tv 2025  Best Led tv 📺 2025 under budget  Penasonic 55 inch smart Tv  Haier 55 ich smart tv 2025 #rahulkhurana #samsungtv #bestledtv #55inch #shortsfeed #viralgrowth,2025-09-27T18:42:28Z,IN,@rahulkhurana2,8480,304,223950,0,66,24,0.0295
DahDC_Gr2vE,Top 5 Smart TVs to Buy in 2025 (And 2 to AVOID!),"Looking for the best smart TV to buy in 2025? Stop right there. Not every TV on the shelf is worth your money. Some are amazing deals. Others? Overpriced headaches.  In this video, we rank the Top 5 Smart TVs to Buy in 2025 — from budget-friendly picks to premium models — and reveal which ones are actually worth it.  We cover: ✅ Best budget smart TV for everyday streaming ✅ Best mid-range option with premium features ✅ Best OLED TVs for movies and gaming ✅ Samsung vs LG vs Sony vs TCL vs Hisense ✅ What to buy — and what to skip  Whether you want a 4K OLED, Mini-LED QLED, or a budget-friendly 4K TV, this guide will help you make the right choice before you spend a dime.  This video is for educational and informational purposes only. The views expressed are based on publicly available information, personal analysis, and opinion. We do not intend to defame, harm, or misrepresent any individual, company, or brand mentioned. Always do your own research before making financial, dietary, or lifestyle decisions.  At FRUGAL CHOISE, we believe in spending smart — and that starts with asking better questions.  #besttv2025 #smarttv #frugalchoise #oledtv #qledtv #techreview",2025-08-28T15:28:19Z,US,@frugalchoise,23600,48,197968,1315,35,28,0.6819
wWuxYEPovv0,How To Connect Phone To Samsung TV - Step By Step,"Learn how to connect phone to samsung tv in this video. For more videos like this then please leave a like.  GuideRealm is the home of technology-based how-to's, guides & tips.  Equipment & tools I use (affiliate links): Tubebuddy (YouTube tools): https://www.tubebuddy.com/pricing?a=Tucker Microphone: https://amzn.to/43H8dAy Laptop: https://amzn.to/3ITBwom PC: https://amzn.to/3MPNgJL  Some of the links in this description are affiliate links. As an Amazon Associate and a partner of other affiliate programs, this means I will earn a small commission from qualifying purchases through these links.  Please like, subscribe, and comment.  GuideRealm",2025-09-07T21:01:01Z,US,@guiderealmvideos,1670000,13772,3658,15,2,26,0.4647
