video_id,comment_id,comment_type,parent_comment_id,comment_text_display,like_count,reply_count,published_at
m_LCI2rFDUY,Ugyw49WdwByQMeXy_C14AaABAg.AOxlUVnqVU4AOzKeAaGXEG,reply,Ugyw49WdwByQMeXy_C14AaABAg,"My parents have a Samsun plasma display from 2012 and i have a B&amp;O MX5500 from 92, both have amazing displays!",1,0,2025-11-01T11:53:56Z
m_LCI2rFDUY,Ugyw49WdwByQMeXy_C14AaABAg.AOxlUVnqVU4AP-AjgFDmMn,reply,Ugyw49WdwByQMeXy_C14AaABAg,Amazing TV!,1,0,2025-11-01T19:46:33Z
m_LCI2rFDUY,Ugyw49WdwByQMeXy_C14AaABAg.AOxlUVnqVU4AP0toeOL71l,reply,Ugyw49WdwByQMeXy_C14AaABAg,"I still have my Panasonic Viera ZT60 that i keep for sports and old consoles like Dreamcast, Saturn, 3DO and PS1/2.",1,0,2025-11-02T11:48:25Z
m_LCI2rFDUY,Ugyw49WdwByQMeXy_C14AaABAg.AOxlUVnqVU4AP1pzUNQVlA,reply,Ugyw49WdwByQMeXy_C14AaABAg,I agree plasma has most natural colors of all technologies. It&#39;s not vivid like OLED it&#39;s not black crush like OLED or MVA it is great for moovies.. I has some builthin motion blur and fast motion does!&#39;t look stuttering like on LCDs,1,0,2025-11-02T20:34:11Z
m_LCI2rFDUY,Ugyw49WdwByQMeXy_C14AaABAg.AOxlUVnqVU4AP2XXMMqROa,reply,Ugyw49WdwByQMeXy_C14AaABAg,"I&#39;ve had a samsung tv since 2013 and only recently it needed a small cheap fix, good tv",1,0,2025-11-03T03:03:26Z
m_LCI2rFDUY,UgxwYmIBqTM0mFZfbxN4AaABAg,top_level,,You made a mistake and left out one of the other reasons LG is dominant: You said competitors started focusing on smart TVs and voice control. LG purchased webOS from HP/Palm. That operating system is leagues above other TVs. Palm&#39;s webOS is the reason all of our iPhones and Android devices work as smoothly and helpfully as they do today. LG saw that and incorporated it into their TVs. It&#39;s the epitome of &quot;smart TV&quot;. User interface is a huge reason LG has taken as big a slice as they have. Palm created a world-leading operating system with webOS.,8,1,2025-11-03T15:18:59Z
m_LCI2rFDUY,UgxwYmIBqTM0mFZfbxN4AaABAg.AP3qhlVaHReAP775kmFumq,reply,UgxwYmIBqTM0mFZfbxN4AaABAg,You are much better off connecting an Apple TV and not using any of the so-called smart functionality on any TV of today.,0,0,2025-11-04T21:48:40Z
m_LCI2rFDUY,UgxLcjzl7CmsgKk_N2l4AaABAg,top_level,,Samsung has actually developed its own OLED technology called QD-OLED that&#39;s now used in their and Sony&#39;s flagship TVs.<br><br>Also Sony is developing RGB-Mini-LED tech for 2026 which is LCD based but has OLED like picture quality.,73,7,2025-10-31T20:05:17Z
m_LCI2rFDUY,UgxLcjzl7CmsgKk_N2l4AaABAg.AOxd52bNV-dAOxesZ5hlwb,reply,UgxLcjzl7CmsgKk_N2l4AaABAg,Sounds great but people arent buying it in numbers,4,0,2025-10-31T20:20:55Z
m_LCI2rFDUY,UgxLcjzl7CmsgKk_N2l4AaABAg.AOxd52bNV-dAOxp3lJewY3,reply,UgxLcjzl7CmsgKk_N2l4AaABAg,"RGB mini led is insanely overrated. It is nothing like oled. It has some advantages, but the price is absolutely ridiculous right now and the base tech is very much LCD like. QD-oled is still by far the best display technology all things considered. Especially for gaming in HDR",15,0,2025-10-31T21:49:58Z
m_LCI2rFDUY,UgxLcjzl7CmsgKk_N2l4AaABAg.AOxd52bNV-dAOyuQ-kroNp,reply,UgxLcjzl7CmsgKk_N2l4AaABAg,No. Samsung working for led tv (not organic) and luminescent quantum (now they only reflect ligth)<br><br>Qd-oled is only one step of many in this process.,1,0,2025-11-01T07:55:56Z
m_LCI2rFDUY,UgxLcjzl7CmsgKk_N2l4AaABAg.AOxd52bNV-dAOzkWxNOtyJ,reply,UgxLcjzl7CmsgKk_N2l4AaABAg,"This is not true, they use QLED, not QD OLED, QLED is quantum dot LED.",1,0,2025-11-01T15:48:45Z
m_LCI2rFDUY,UgxLcjzl7CmsgKk_N2l4AaABAg.AOxd52bNV-dAOzlf961aXM,reply,UgxLcjzl7CmsgKk_N2l4AaABAg,"@peaj4812Search for Samsung QD-OLED on Google, you will see it.",0,0,2025-11-01T15:58:44Z
m_LCI2rFDUY,UgxJfxKHbT_Pm6fXMd54AaABAg,top_level,,LG is pretty nuts. They&#39;ve pretty much cornered both the OLED and IPS panel markets at virtually the same time.,66,7,2025-10-31T19:20:36Z
m_LCI2rFDUY,UgxJfxKHbT_Pm6fXMd54AaABAg.AOxYyh9ui8HAOxZCehDy2t,reply,UgxJfxKHbT_Pm6fXMd54AaABAg,Facts,6,0,2025-10-31T19:22:38Z
m_LCI2rFDUY,UgxJfxKHbT_Pm6fXMd54AaABAg.AOxYyh9ui8HAOyvjga933R,reply,UgxJfxKHbT_Pm6fXMd54AaABAg,And they lost on smartphone which are much more profitable,5,0,2025-11-01T08:07:30Z
m_LCI2rFDUY,UgxJfxKHbT_Pm6fXMd54AaABAg.AOxYyh9ui8HAOz2Ss7_N33,reply,UgxJfxKHbT_Pm6fXMd54AaABAg,"in case you want to know.   LG OLED are NOT sell ing well in 2025.   OLED market is Cornered by Samsung :   QD-OLED. <br>LED space is --- Dominated by ( Hisense + TCL ) 6 yr straight.  (d reason OLED mark down because their OLED color can NOT compete , VERY Washed out. <br>🏵🧩🐸🙉🍉 🐬vs 🥮🐦‍🔥🏬🦜🪲🪼<br>The LARGER of TV , Image &gt;  &gt; &gt; STRETCH OUT &lt; &lt;  &lt;. You need Denser Color to look:    3D <br>        <br> ( Rtings) tested at 10000 cd/m— HDR  <br>              🔮Color Volume 🔮<br>Red Luminance =<br>A90J      72                   ( OLED ) SONY<br>B4            89     cd/m²  ( OLED )    LG <br>C1            84     cd/m²                     LG <br>A80L       92     cd/m²  ( OLED ) SONY<br>Z80A   ==        ( B4 tier )     Panasonic <br>Z85A      100    ( OLED )      Panasonic <br>   <br>C4          104     ( OLED )               LG         <br>C5          134<br>G4          140     ( OLED ) —-         LG       <br>G3          140     ( OLED ) —-         LG <br>A95K     190   (QD-OMED)<br>S95C      272   (QD-OLED) Samsung<br>S95D      371  <br>S90D      281   (QD-OLED) Samsung <br>S90F       309  (QD-OLED) Samsung <br>U75QG  410 🔔( mini LED)  Hisense <br><br>A95L       221   (QD-OLED)      SONY   <br>Z95B       219     ( OLED )   Panasonic <br>G5           248     ( OLED ) —-        LG    <br>S95F       420   (QD-OLED)Samsung<br>Bravia8|| 344   (QD-OLED)      SONY            <br>U8QG🐦‍🔥527   ( Mini LED    Hisense              <br>U9N   🐦‍🔥564   (Min LED )   Hisense<br>85”UX    530   2023             Hisense <br>Bravia9   551   ( Min LED )      SONY <br>U8N 75”  421                         Hisense         <br>U8N         381    ( Min LED)   Hisense                  <br>U8K         318     ( Min LED)   Hisense<br>QN90C    382    ( Min LED )Samsung            <br>QM8K     394   (Min LED )        TCL <br><br>Qm851    585   ( Min LED)        TCL   <br>Qm8         404   ( Min LED)        TCL   <br>Qm7K       221               <br>QM7         291   ( Min LED)        TCL <br>QM6K      103 <br>Bravia7    356   ( Min LED)      SONY<br>X95L        225   ( Min LED)      SONY <br>X90L        272   &lt;  FALD  &gt;       SONY         <br>Bravia5    137 &lt; FALD-M LED&gt;SONY <br>              <br>“<br>Green Luminance=<br>A90J        237     ( OLED )         SONY<br>B4            306   (  OLED )            LG<br>C1             291   (  OLED )            LG<br>C4            333    ( OLED )            LG<br>C5            478<br>A80L        317    ( OLED )           SONY<br>Z80A == ( same as B4 tier )Panasonic <br>Z85A        337   (  OLED )     Panasonic <br>G4            426   (  OLED )            LG<br>G3            420   ( OLED )             LG<br>A95K        606   ( OLED )          SONY <br>S95C        882   (QD-OLED)Samsung<br>S95D      1167   (QD-OLED)Samsung<br>S90D        856   (QD-OLED)Samsung   <br>S90F      1,145 (QD-OLED)Samsung   <br>U75QG  1415🔔  (Min LED ) Hisense<br> <br>A95L         679  (QD-OLED)    SONY <br>Z95B        734     ( OLED )  Panasonic <br>G5             887     ( OLED )           LG<br>S95F      1,551   (QD-OLED)Samsung<br>Bravia8|| 1,074  (QD-OLED)   SONY <br>U8Q🥬 2,073   (Min LED)  Hisense <br>U9N🥬 1,917     ( Mini LED ) Hisense    <br>Qm8K    1,206    ( Mini LED )     TCL<br><br>——🥬2024 UX 110” ——NOT Tested. <br>85”UX   1,656          2023     Hisense<br>Bravia9  1,130    ( Mini LED )     SONY <br>U8N 75” 1,400   ( Min LED )  Hisense<br>U8N        1,433   ( Min LED )  Hisense<br>U8K         1,157   ( Min LED )  Hisense<br>U8H           915   ( Min LED )  Hisense <br>U7N           501   ( Min LED )  Hisense<br><br>QN90C    1360  ( Mini LED ) Samsung  <br><br>Qm851    1,885  ( Mini LED )       TCL<br>Qm8         1,250  ( Mini LED )      TCL<br>Qm7K          678  ( Mini LED )      TCL<br>QM7            826  ( Mini LED )      TCL<br>QM6K         343 <br>Bravia7       834  ( Mini LED )    SONY<br>X95L            781  ( Mini LED )    SONY<br>X90L            778  &lt;  FALD  &gt;      SONY ‘s = BEST SELLER <br>Bravia5        420  &lt;  FALD-Mini LED &gt;  SONY ( NO quantum Dot)",0,0,2025-11-01T09:14:58Z
m_LCI2rFDUY,UgxJfxKHbT_Pm6fXMd54AaABAg.AOxYyh9ui8HAP-TsTkLPF2,reply,UgxJfxKHbT_Pm6fXMd54AaABAg,well in IPS space there is also Au Optronix. And I would say Au Optronix panels are better,0,0,2025-11-01T22:33:46Z
m_LCI2rFDUY,UgxJfxKHbT_Pm6fXMd54AaABAg.AOxYyh9ui8HAP0x4M4X6Vp,reply,UgxJfxKHbT_Pm6fXMd54AaABAg,LG? You mean the company that lost &quot;best TV&quot; to Sony and Samsung this year and the previous few?<br><br>They don&#39;t need to fix the issues that plague their new models. Every idiot alive will just buy them.,3,0,2025-11-02T12:16:55Z
m_LCI2rFDUY,UgwW2kmisb-LGVwUiqt4AaABAg,top_level,,And then came QD-Oled,118,6,2025-10-31T19:39:55Z
m_LCI2rFDUY,UgwW2kmisb-LGVwUiqt4AaABAg.AOxaBDY8pCuAOy285Wk2g3,reply,UgwW2kmisb-LGVwUiqt4AaABAg,and Samsung Aids forced ads is why many buy TCL now.,19,0,2025-10-31T23:52:54Z
m_LCI2rFDUY,UgwW2kmisb-LGVwUiqt4AaABAg.AOxaBDY8pCuAOzfUmS9GZh,reply,UgwW2kmisb-LGVwUiqt4AaABAg,"Yeah he stops right when Samsung enters the OLED TV market in 2023, of course Samsung doesn&#39;t have a high OLED TV market share in the year THEY START MAKING THEM lol.",11,0,2025-11-01T15:04:46Z
m_LCI2rFDUY,UgwW2kmisb-LGVwUiqt4AaABAg.AOxaBDY8pCuAP-hiV7o0mo,reply,UgwW2kmisb-LGVwUiqt4AaABAg,​@TheAsmileXDthey use LG panels. LG is making money even when customer doesn&#39;t pick their TV. They won.,7,0,2025-11-02T00:43:29Z
m_LCI2rFDUY,UgwW2kmisb-LGVwUiqt4AaABAg.AOxaBDY8pCuAP-vq1kk16W,reply,UgwW2kmisb-LGVwUiqt4AaABAg,@TheAsmileXD wdym ? the first qd-oled (S95B) came out in 2022,2,0,2025-11-02T02:46:51Z
m_LCI2rFDUY,UgwW2kmisb-LGVwUiqt4AaABAg.AOxaBDY8pCuAP3wdmXM6Fk,reply,UgwW2kmisb-LGVwUiqt4AaABAg,​@TheAsmileXD By 2019 it was said Samsung had an Oled market share of over 90%..<br>How is that possible? you might ask.<br>Cellphones.. almost every single oled screen for a Cellphone up to 2020 was made by Samsung.,0,0,2025-11-03T16:10:52Z
m_LCI2rFDUY,UgzwcjtkKRGDWAoxzON4AaABAg,top_level,,"Wow, a lot of misinformation in this video <br><br>Samsung actually developed their own technology QD-OLED and launched it in 2023 when the patents that LG acquired in 2009 ran out",67,6,2025-10-31T19:55:49Z
m_LCI2rFDUY,UgzwcjtkKRGDWAoxzON4AaABAg.AOxc-d6A9vPAOxfjrGTBKy,reply,UgzwcjtkKRGDWAoxzON4AaABAg,Appreciate that correction man,15,0,2025-10-31T20:28:28Z
m_LCI2rFDUY,UgzwcjtkKRGDWAoxzON4AaABAg.AOxc-d6A9vPAOy2C3fc9IL,reply,UgzwcjtkKRGDWAoxzON4AaABAg,"and Samsung Aids, forced ads is why many buy TCL now.",5,0,2025-10-31T23:53:26Z
m_LCI2rFDUY,UgzwcjtkKRGDWAoxzON4AaABAg.AOxc-d6A9vPAOy3H2SaRF9,reply,UgzwcjtkKRGDWAoxzON4AaABAg,"What misinformation? Samsung didn&#39;t buy LG OLED screens? They don&#39;t buy now? QD-OLED is a recent technology, it would takes years to perfect.",5,0,2025-11-01T00:02:51Z
m_LCI2rFDUY,UgzwcjtkKRGDWAoxzON4AaABAg.AOxc-d6A9vPAOyKRSkY-U7,reply,UgzwcjtkKRGDWAoxzON4AaABAg,@nanonymous9139 you miss the point samsung is not reinventing the wheel here. is that LG patents ran out so they can now just use the same base technology.,13,0,2025-11-01T02:32:49Z
m_LCI2rFDUY,UgzwcjtkKRGDWAoxzON4AaABAg.AOxc-d6A9vPAOyMs9qXcjO,reply,UgzwcjtkKRGDWAoxzON4AaABAg,"@Seraphine_KDA_TFT I never said anything about reinvention, I am talking about  industrial capacity. What point did I miss?",0,0,2025-11-01T02:54:05Z
m_LCI2rFDUY,Ugwls4QDy_g88_w3mdt4AaABAg,top_level,,"I bought 2 LG plasma TVs 15 years ago. They are both working fine with exceptional picture quality. Power consumption is negligible. One of them is in my ski condo at 7,000 feet (remember the myth that plasmas fail at altitude?). I never understood why they stopped making them.",6,0,2025-11-02T17:53:43Z
dkB8QLsR_Kw,Ugwvq6zRGKJyaWen4sJ4AaABAg,top_level,,Trust ke karan hi aap ke channel aate hai ...sahi guidance milegi krke,7,0,2025-09-03T03:12:13Z
dkB8QLsR_Kw,UgwnuKRxTmQKfPLc-Ld4AaABAg,top_level,,"For those who are wondering about the difference between the UA8200, UA8250, UA8300, and UA8350: they are essentially the same TVs, but the UA8300 and UA8350 come with a Magic Remote.",57,32,2025-09-01T12:15:27Z
dkB8QLsR_Kw,UgwnuKRxTmQKfPLc-Ld4AaABAg.AMXIcMs1sWwAMXTYoN7UOC,reply,UgwnuKRxTmQKfPLc-Ld4AaABAg,Sir Lg UA8250 55 inch 8gen vs Lg UR7550 55 inch 6gen with magic remote which one is best to buy both price rate is same.,4,0,2025-09-01T13:50:57Z
dkB8QLsR_Kw,UgwnuKRxTmQKfPLc-Ld4AaABAg.AMXIcMs1sWwAMXUZI0v42E,reply,UgwnuKRxTmQKfPLc-Ld4AaABAg,"​​@KhananifAs Vineet Malhotra said, if the price difference is minimal, then go for the newer version. But if it’s significant, you should definitely buy the older version. The older version also offers better connectivity options, and the UR7550 comes with a magic remote. So, it all comes down to the pricing of both products. Just wait for the festival sale.",7,0,2025-09-01T13:59:45Z
dkB8QLsR_Kw,UgwnuKRxTmQKfPLc-Ld4AaABAg.AMXIcMs1sWwAMXw4APp0Ri,reply,UgwnuKRxTmQKfPLc-Ld4AaABAg,"​@bookert2315 recommend a good smarttv under 50k, 55inch",0,0,2025-09-01T18:08:54Z
dkB8QLsR_Kw,UgwnuKRxTmQKfPLc-Ld4AaABAg.AMXIcMs1sWwAMZdaTN-i4j,reply,UgwnuKRxTmQKfPLc-Ld4AaABAg,Always go with the newer processor.Wait for festive sale.,2,0,2025-09-02T10:05:55Z
dkB8QLsR_Kw,UgwnuKRxTmQKfPLc-Ld4AaABAg.AMXIcMs1sWwAM_W97n0thF,reply,UgwnuKRxTmQKfPLc-Ld4AaABAg,Vu vibe dv ka review kariye,0,0,2025-09-02T18:11:23Z
dkB8QLsR_Kw,Ugy4-OLVqeIBvd46Izt4AaABAg,top_level,,First line... : confused between UA8200 and UR7500. Exactly..  the question i came for.,14,5,2025-09-12T05:35:36Z
dkB8QLsR_Kw,Ugy4-OLVqeIBvd46Izt4AaABAg.AMxubTEP8xxANigUvWMPrx,reply,Ugy4-OLVqeIBvd46Izt4AaABAg,UA82 is 2025 model,1,0,2025-10-01T04:15:02Z
dkB8QLsR_Kw,Ugy4-OLVqeIBvd46Izt4AaABAg.AMxubTEP8xxANjc0H_yhZ2,reply,Ugy4-OLVqeIBvd46Izt4AaABAg,1 processor<br>2 release date <br>3 magic remote<br><br>All of these are included best in ua82,1,0,2025-10-01T12:55:08Z
dkB8QLsR_Kw,Ugy4-OLVqeIBvd46Izt4AaABAg.AMxubTEP8xxANueY558hye,reply,Ugy4-OLVqeIBvd46Izt4AaABAg,​@naiduch1923well ... I bought the UA82006 model... 55 inch.,0,0,2025-10-05T19:48:52Z
dkB8QLsR_Kw,Ugy4-OLVqeIBvd46Izt4AaABAg.AMxubTEP8xxAO0ZTLSbMEH,reply,Ugy4-OLVqeIBvd46Izt4AaABAg,"​@naiduch1923I think magic remote is not there in ua82 , I saw in flipkart",4,0,2025-10-08T12:10:29Z
dkB8QLsR_Kw,Ugy4-OLVqeIBvd46Izt4AaABAg.AMxubTEP8xxAOhXs4AmAH7,reply,Ugy4-OLVqeIBvd46Izt4AaABAg,​@himanshunegi3985no magic remote. But I use LG ThinQ app on my phone.,0,0,2025-10-25T14:03:06Z
dkB8QLsR_Kw,UgzYWsPitw0wLIOBmkd4AaABAg,top_level,,Finally most awaited tv review is here...,7,0,2025-09-01T05:29:49Z
dkB8QLsR_Kw,UgylJhKVNWhZzu_ixiN4AaABAg,top_level,,"I bought 8300 and I saw the real TV in showrooms first, compared it and then bought it. The output is just fabulous. I was going to go for some QLED TV but the picture quality of this TV is just awesome.",21,15,2025-09-03T11:01:35Z
dkB8QLsR_Kw,UgylJhKVNWhZzu_ixiN4AaABAg.AMbJl6Yh7JEAN-LiB-F5I-,reply,UgylJhKVNWhZzu_ixiN4AaABAg,How&#39;s the sound for this tv,5,0,2025-09-13T04:19:40Z
dkB8QLsR_Kw,UgylJhKVNWhZzu_ixiN4AaABAg.AMbJl6Yh7JEAN-NIkLjuk_,reply,UgylJhKVNWhZzu_ixiN4AaABAg,@viralpoonamvsit is good. You dont have to buy a soundbar.<br>Only if you need really loud and high bass for immersive experience you can attach. The speakers are good enough for daily casual viewing. We keep around 20 volume,5,0,2025-09-13T04:33:32Z
dkB8QLsR_Kw,UgylJhKVNWhZzu_ixiN4AaABAg.AMbJl6Yh7JEANBE07C1lJS,reply,UgylJhKVNWhZzu_ixiN4AaABAg,Did you compare it to qled of Xiaomi by any chance?,0,0,2025-09-17T19:03:15Z
dkB8QLsR_Kw,UgylJhKVNWhZzu_ixiN4AaABAg.AMbJl6Yh7JEANCAnlJJKBU,reply,UgylJhKVNWhZzu_ixiN4AaABAg,"@SuperMinnaznice question. I was actually looking out to buy xiaomi unit. But no one has it in display, so couldnt take chance.",1,0,2025-09-18T03:54:27Z
dkB8QLsR_Kw,UgylJhKVNWhZzu_ixiN4AaABAg.AMbJl6Yh7JEANIulJr3eN0,reply,UgylJhKVNWhZzu_ixiN4AaABAg,What is different in between ua82 and ua83..??,2,0,2025-09-20T18:40:15Z
dkB8QLsR_Kw,UgzyWewnyuFZXhKd4tF4AaABAg,top_level,,"Hi sir, I&#39;ve been a longtime viewer of your channel and really appreciate the in-depth reviews and comparisons you do.I&#39;ve learned so much from your content.<br>I&#39;d love to see a comparison video on the 2025 55-inch 4K TVs, specifically:<br> * Samsung Crystal 4K Vista<br> * Samsung Crystal 4K Vivid<br> * Samsung Vision AI QLED<br> * LG AI TV QNED 8AA<br> * Sony BRAVIA 2 II<br>It&#39;s such a competitive space this year, and your expert analysis would be so helpful in deciding which one to buy.<br>Thanks for all your hard work!❤",9,0,2025-09-02T05:29:21Z
dkB8QLsR_Kw,UgwP_9h8VzcyjFfzEqp4AaABAg,top_level,,Good video sir i am waiting of Maha comparison tv 😊😊😊😊,1,0,2025-09-01T18:38:44Z
dkB8QLsR_Kw,UgxMQuLMznZMNC6y-BZ4AaABAg,top_level,,Thank you review bro,1,0,2025-10-25T04:02:01Z
dkB8QLsR_Kw,UgwBkmQ3zjfwnMMbMeV4AaABAg,top_level,,Waiting for Lg Qned 8AA 43 inch tv review,11,1,2025-09-01T06:29:39Z
dkB8QLsR_Kw,UgwBkmQ3zjfwnMMbMeV4AaABAg.AMWg2iYdZdsAMm0lRRXY5T,reply,UgwBkmQ3zjfwnMMbMeV4AaABAg,Dont go for qned which has edge lit display lit . As an edge lit are prone to panel burn at the bottom of the tv,0,0,2025-09-07T14:47:15Z
dkB8QLsR_Kw,Ugwuy0pulbPtYN_MGjV4AaABAg,top_level,,Please bring a video on QNED…. Thank you for all those informative videos❤,0,0,2025-09-11T15:51:38Z
dkB8QLsR_Kw,UgzFJEWV45qUy3FM_Vl4AaABAg,top_level,,Greatly explain 👍,0,0,2025-10-06T05:51:06Z
dkB8QLsR_Kw,UgxZn-mXfdntxSkiOaB4AaABAg,top_level,,"Thank you Sir, Really amazing video from you. It&#39;s really true view.",0,0,2025-10-16T05:44:44Z
dkB8QLsR_Kw,UgweeMbHJd7xouZ8bZh4AaABAg,top_level,,Very good suggestion and very good man sir ji 🙏🙏🙏🙏,0,0,2025-09-24T09:48:35Z
dkB8QLsR_Kw,Ugx3EoKp1B639KteeTR4AaABAg,top_level,,Thank you very much for this video<br>I was waiting for this one for so long<br>I also commented in your previous video<br>Idk you did seen it or not <br>But my job is done<br>Thank you again.,3,2,2025-09-01T07:53:07Z
dkB8QLsR_Kw,Ugx3EoKp1B639KteeTR4AaABAg.AMWpb0-N_DYAMX2Rb-s8ZM,reply,Ugx3EoKp1B639KteeTR4AaABAg,I see everything my friend. Thanks for waiting.,1,0,2025-09-01T09:54:02Z
dkB8QLsR_Kw,Ugx3EoKp1B639KteeTR4AaABAg.AMWpb0-N_DYAMf4Z091wtN,reply,Ugx3EoKp1B639KteeTR4AaABAg,"​@VMone hi sir your reply matters, I need to buy tv this week please suggest me between this LG tv or Samsung U8100F in terms of picture quality for movies. Suggest 1 please",0,0,2025-09-04T22:05:41Z
dkB8QLsR_Kw,UgxeJeeJK_bGwZYy78N4AaABAg,top_level,,Ab soch raha hu koi budget tv lu anaye wali sale pr ..aap kay mostly video dakhta hu..wait karunga aap ka video ka koi sasta tv aaye 55 inch ka  sale may 🙂🙏,0,0,2025-09-05T19:19:17Z
dkB8QLsR_Kw,UgzPFVLquKanViZPqbZ4AaABAg,top_level,,Thanks sir...... Very very nice and helpful,0,0,2025-09-29T18:36:07Z
dkB8QLsR_Kw,UgxQ70KVl_V_yPca6fp4AaABAg,top_level,,Sir please upload a video about chimney 2025 model asap,2,0,2025-09-01T07:11:46Z
dkB8QLsR_Kw,Ugw_WTWlYOQeI6DhzLV4AaABAg,top_level,,Sir comparison with LG UA8200 vs Xiaomi X pro or FX pro<br>Your review is super<br>Which one is the Best,1,0,2025-09-01T13:53:29Z
dkB8QLsR_Kw,Ugx4VK3SD8fDNvkRKd94AaABAg,top_level,,Vineeth malhotra <br>The  true reviewer 🎉❤ great job 👏👏,1,0,2025-10-30T11:07:23Z
dkB8QLsR_Kw,UgytkNP5h-rLCMVbz6Z4AaABAg,top_level,,Please add a section on motion control on different inputs whenever you are doing a TV review/test. Its a major part of viewing experience. @vmone,0,0,2025-09-04T18:39:22Z
RA726k1libI,UgzC4n2cfcTC8ANvaq54AaABAg,top_level,,Sound me clarity hai sach me or dusre brands ko isse inspire hona chahiye ❤,9,0,2025-09-03T15:21:35Z
RA726k1libI,Ugx2pVaz3wPb2jQS_eR4AaABAg,top_level,,"Loved the review, this is why good reviewers who use a display colorimeter to test these claims are so important. Looking forward to the vu vibe dv review, hopefully it&#39;s the next tv",9,0,2025-09-03T07:15:13Z
RA726k1libI,UgyWhZs4-2XKNph1Ei54AaABAg,top_level,,"Thank you Vineet ji for this long awaited video. I have both Sony Bravia 2 II (2025) and Lumio Vision 9 . But surprisingly Lumio Vision 9 outperformed it. Moreover I think the comparable Tv for Lumio Vision 9 is Sony Bravia 5 atleast. I&#39;m very lucky for having Vision 9. If u compare Vision 7 to Vision 9 its just like comparing IPS with OLED. Its damn good. Lumio Vision 9 is The The The Best TV around under Rs. 150000. No TV even Sony can beat it. Vision 9 got it all, all the USB ports u want (incl. 3.0), HDMI&#39;s u want, Dolby-Vision, Dolby-Atmos, ALLM, many many features in OS to control brightness, audio. And the sound is so good. and Damn bright. The fastest u want. I am using it for 4 months now, no lag at all. Please do a review with Lumio Vision 9. Hands down Lumio Vision 9. Period...",7,0,2025-09-27T07:40:46Z
RA726k1libI,UgzKF3liqvg-v3obBdd4AaABAg,top_level,,Sir aap k videos dekh ne k baad hi kuch kharid ta hu. Really honest true analysis,6,0,2025-09-03T07:16:05Z
RA726k1libI,UgyEKo0P_F13GnFq-c54AaABAg,top_level,,Apne bohat hi Clarity ke sath video banaya but me ye tv kharid ne bad ye video dekh rha hu vrna apki link se hi kharidta,4,1,2025-10-10T17:04:39Z
RA726k1libI,UgyEKo0P_F13GnFq-c54AaABAg.AO6Eif8YM_tAOThUUGGto4,reply,UgyEKo0P_F13GnFq-c54AaABAg,Kaisa hai? Quality? Color? Brightness? Sharpness?,0,0,2025-10-19T19:47:15Z
RA726k1libI,UgyE_njSsEKYdaedIKR4AaABAg,top_level,,Finally muze jo chahiye tha wo aa gaya thankyou sir❤❤,4,0,2025-09-03T02:51:11Z
RA726k1libI,UgxDpdZsxWA0QqRv7vN4AaABAg,top_level,,Lumio 9 review as well please sir,9,0,2025-09-03T07:26:14Z
RA726k1libI,Ugw4Rokodcs5WbTyuXl4AaABAg,top_level,,"Sir, Your Reviews were always Best Please make a detailed Video on TCL 43 P71K QLED TV with ONKYO Woofers",2,0,2025-09-07T18:46:55Z
RA726k1libI,UgyCbqwu1dIXhngne8N4AaABAg,top_level,,"is channel pr projectors ka bhi review ana chahiye ,budget to gud price projectors",6,0,2025-09-04T02:30:37Z
RA726k1libI,UgwauYlIRN0X0fs8HrR4AaABAg,top_level,,You should tell us about the  viewing angles and comparing it with TVs in similar range,3,0,2025-09-03T08:49:54Z
RA726k1libI,UgyHZS0_PuU7LBbZQAJ4AaABAg,top_level,,Thanks for this review... Could you also review Lumio 9 please.,3,0,2025-09-03T12:18:50Z
RA726k1libI,Ugw2ZX_sAxyJR8HL2ct4AaABAg,top_level,,Your videos has helped me a lot in choosing my Electronics. Can you please help us with a dedicated video on printers as well.,1,0,2025-09-03T13:48:12Z
RA726k1libI,UgzmYjhM6NXKgZAogrN4AaABAg,top_level,,"Thank you sir, i was waiting for your video on Lumio vision 7 &amp; vision 9. 👍👍",1,0,2025-09-03T05:44:26Z
RA726k1libI,UgwKUkmLpF3he57_yp54AaABAg,top_level,,"Hi! Could you please compare the 43-inch QLED TVs from Kodak, TCL, Xiaomi, and Motorola before the sale? I&#39;m trying to figure out which one offers the best value right now-especially in terms of picture quality, smart features, and audio performance. Your insights would be a huge help. Thanks in advance!",4,0,2025-09-07T10:19:28Z
RA726k1libI,Ugw1FvkFLmMLFjwOcqN4AaABAg,top_level,,Thank you for this review. Sir please review lumio vision 9 as well. And please tell which is better TCL Q6CS vs Lumio Vision 9. It&#39;s a comparison of best tv,3,0,2025-09-03T07:57:36Z
RA726k1libI,UgwdbMWEKkXFznvancB4AaABAg,top_level,,"Sir ji, thanks for this review. I had been eagerly waiting for this. Iska ek aur tv hai vision 9 Mini led TV, uska bhi agar aap review de do to maza aa ayega",1,0,2025-09-03T05:48:17Z
RA726k1libI,UgxVjRWkpkcnjgvYw0l4AaABAg,top_level,,This is very good review 🎉,1,0,2025-09-14T16:28:21Z
RA726k1libI,UgyZC2y8OI252mCo8K94AaABAg,top_level,,Make in India day by day 📈,1,0,2025-09-14T16:06:49Z
RA726k1libI,UgzewrySf8S9VASXu-l4AaABAg,top_level,,"I have the 43in version of this TV, got it in July, 43in, so far, its going well, not using any of the smart features as its a monitor for my 2nd PC, the display is good and bright but not washed out.",2,6,2025-09-15T11:47:35Z
RA726k1libI,UgzewrySf8S9VASXu-l4AaABAg.AN5IZ_dJeQ6ANE_sG5L4Sa,reply,UgzewrySf8S9VASXu-l4AaABAg,Hey can you tell me can you install Xiaomi TV+ app in Lumio TV? Please try and tell me if it&#39;s possible,0,0,2025-09-19T02:20:44Z
RA726k1libI,UgzewrySf8S9VASXu-l4AaABAg.AN5IZ_dJeQ6ANEqa9D2Fag,reply,UgzewrySf8S9VASXu-l4AaABAg,"Can you please check?  While watching cricket, the screen is very jittery and flickering.",0,0,2025-09-19T04:46:48Z
RA726k1libI,UgzewrySf8S9VASXu-l4AaABAg.AN5IZ_dJeQ6ANMLF4ga4bQ,reply,UgzewrySf8S9VASXu-l4AaABAg,​@geetanshmehta9710did you have this Tv??<br>I planing to buy one,0,0,2025-09-22T02:38:06Z
RA726k1libI,UgzewrySf8S9VASXu-l4AaABAg.AN5IZ_dJeQ6ANMMs-8ta3r,reply,UgzewrySf8S9VASXu-l4AaABAg,@RoshanBurnwal-w1q planning to buy,0,0,2025-09-22T02:52:17Z
RA726k1libI,UgzewrySf8S9VASXu-l4AaABAg.AN5IZ_dJeQ6ANSxLuAJmRa,reply,UgzewrySf8S9VASXu-l4AaABAg,​@RoshanBurnwal-w1q yes,0,0,2025-09-24T16:15:15Z
RA726k1libI,UgwYZOdl8qf0dIAnipp4AaABAg,top_level,,I really loved the tv and the comapny...even at start their services centers are really great,0,0,2025-09-03T08:28:46Z
yTkCXDdheOc,UgyeYA6xJFOljLM4jft4AaABAg,top_level,,"Jaldi se LIKE aur SHARE kardo <a href=""http://www.youtube.com/results?search_query=%23tgfamily"">#TGFamily</a>!!!",37,11,2025-09-26T12:22:50Z
yTkCXDdheOc,UgyeYA6xJFOljLM4jft4AaABAg.ANXgLG5pvovANXvoHGvvx4,reply,UgyeYA6xJFOljLM4jft4AaABAg,Aaloo khaoge???!!🥔🥔<br>You know about new phone Tv and other electronic item but you know about aaloo khaoge?,2,0,2025-09-26T14:38:00Z
