video_id,comment_id,comment_type,parent_comment_id,collected_at,author_display_name,author_profile_image_url,author_channel_url,author_channel_id,comment_text_display,comment_text_original,comment_text_length,like_count,reply_count,moderation_status,published_at,updated_at,viewer_rating,can_rate,sentiment_score,sentiment_category,subjectivity_score,brand_mentions,competitor_mentions,analyzed_at
KXROGtfpKMI,Ugwu9e1_4gGybauiMLF4AaABAg.AO1UW2UUPFOAO3xqKpt62i,reply,Ugwu9e1_4gGybauiMLF4AaABAg,2025-10-12T13:09:18.599419,@oslotvmontering,https://yt3.ggpht.com/2Sip6123e6oOYcZBa6dd5YueneALVpC0lz-i8PwEXyuP5QHwyBLehf2qGE7IfAOhiW-srP9DcQ=s48-c-k-c0x00ffffff-no-rj,http://www.youtube.com/@oslotvmontering,UCzVGVs_ridRZmU7qkltuY0w,"Hi. C-10, still a great TV. 😊","Hi. C-10, still a great TV. 😊",29,1,0,,2025-10-09T19:49:56Z,2025-10-09T19:49:56Z,none,True,0.9,positive,0.75,,,2025-10-12T13:09:25.529884
KXROGtfpKMI,UgxNO2njKiR5o59jBTV4AaABAg,top_level,,2025-10-12T13:09:18.599419,@pascalsaint-germain1417,https://yt3.ggpht.com/EvXFN-_nDoTEc9BALQb0X6dcza2nu6_10gpYhdEaNvtjh97u-Gx8wChcsqmVQePs_GcJkvTU=s48-c-k-c0x00ffffff-no-rj,http://www.youtube.com/@pascalsaint-germain1417,UCQGLJgqI2Z2cQSUn4YnVJeA,Amazing !,Amazing !,9,0,0,,2025-10-03T22:20:45Z,2025-10-03T22:20:45Z,none,True,0.875,positive,0.9,,,2025-10-12T13:09:25.529884
KXROGtfpKMI,UgxrOvU_cPClRDKiqqN4AaABAg,top_level,,2025-10-12T13:09:18.599419,@nielsdebaets6972,https://yt3.ggpht.com/ytc/AIdro_mgC-KeDEHtyHdgGeNy3ZRqaltkdiQ8p8AW0ZKTO6M=s48-c-k-c0x00ffffff-no-rj,http://www.youtube.com/@nielsdebaets6972,UCz8TFpAcmwoZ0skcqOO8PkA,"Hi, there is a screen protector... You just have to look really close. I have the same tv and it was really hard to get it off.","Hi, there is a screen protector... You just have to look really close. I have the same tv and it was really hard to get it off.",127,0,0,,2025-10-06T20:33:31Z,2025-10-06T20:33:31Z,none,True,-0.015,neutral,0.289,,,2025-10-12T13:09:25.530880
KXROGtfpKMI,UgyT3SWUy0WES5mKbS94AaABAg,top_level,,2025-10-12T13:09:18.599419,@lukasz123_,https://yt3.ggpht.com/ytc/AIdro_lbmWMHUlhulWqXppjlBroFj1AF1nIcYFZ79QrxRiw4o-k=s48-c-k-c0x00ffffff-no-rj,http://www.youtube.com/@lukasz123_,UC1f73ItPn8zpcvFtLFJeRuw,"Nice work, nice tv","Nice work, nice tv",18,0,0,,2025-10-05T12:09:11Z,2025-10-05T12:09:11Z,none,True,0.3,positive,1.0,,,2025-10-12T13:09:25.530880
KXROGtfpKMI,UgyYn1_aWmv6UE4p8B94AaABAg,top_level,,2025-10-12T13:09:18.599419,@EduardoHenriqueamorim-e2t,https://yt3.ggpht.com/1oS4aBc2nBCZQCOeX_ObfzVGUaf8rvfALLHAZS1T8o8D9xiHGpf-3qayKuPMrZbnsBlZjnxSUAw=s48-c-k-c0x00ffffff-no-rj,http://www.youtube.com/@EduardoHenriqueamorim-e2t,UCCpdEkoQEDs61ZS4ZvYViGQ,"Amo seus vídeos, assisto todos, &quot;PARABÉNS&quot; por seu trabalho. Pena que essa tv de &quot;77&quot; não virá para o Brasil, seria minha primeira opção de compra.","Amo seus vídeos, assisto todos, ""PARABÉNS"" por seu trabalho. Pena que essa tv de ""77"" não virá para o Brasil, seria minha primeira opção de compra.",167,0,0,,2025-10-11T21:54:41Z,2025-10-11T21:54:41Z,none,True,0.0,neutral,0.0,,,2025-10-12T13:09:25.530880
KXROGtfpKMI,UgyAGWMXUrwy56_Po8J4AaABAg,top_level,,2025-10-12T13:09:18.599419,@Doni245y,https://yt3.ggpht.com/VxQ8mvPQYU5zB-UBJmVc-TIAf2ZLLLiPd8zAIvlF5PIO9d8B7-5Ro0G5Hboj9MNWy2Q0DUzc=s48-c-k-c0x00ffffff-no-rj,http://www.youtube.com/@Doni245y,UCdRwT553JRYJ-FNUXx6wqNg,Отличный теливизор! Поздравляю Вас👍,Отличный теливизор! Поздравляю Вас👍,35,0,0,,2025-10-09T21:28:52Z,2025-10-09T21:28:52Z,none,True,0.0,neutral,0.0,,,2025-10-12T13:09:25.531876
KXROGtfpKMI,UgwVFHjB7zA8CilSGoV4AaABAg,top_level,,2025-10-12T13:09:18.599419,@muzafferc.,https://yt3.ggpht.com/Uv4JNMH7Be6OyKT2e5-NUbDCoVeMlqyAYTLSXxYEyMBnkWEGqfw2NV8ge9QXQdPY1i0fmHe7Sg=s48-c-k-c0x00ffffff-no-rj,http://www.youtube.com/@muzafferc.,UCeK60xjGcEt4mMRkji0HM0w,"Forget about the TV, your socks are great...","Forget about the TV, your socks are great...",44,0,1,,2025-10-06T06:25:24Z,2025-10-06T06:25:24Z,none,True,0.9,positive,0.75,,,2025-10-12T13:09:25.531876
KXROGtfpKMI,UgwVFHjB7zA8CilSGoV4AaABAg.ANvnO73k06zANxFdvthcV3,reply,UgwVFHjB7zA8CilSGoV4AaABAg,2025-10-12T13:09:18.599419,@oslotvmontering,https://yt3.ggpht.com/2Sip6123e6oOYcZBa6dd5YueneALVpC0lz-i8PwEXyuP5QHwyBLehf2qGE7IfAOhiW-srP9DcQ=s48-c-k-c0x00ffffff-no-rj,http://www.youtube.com/@oslotvmontering,UCzVGVs_ridRZmU7qkltuY0w,Hi. Thank you for noticing 😍,Hi. Thank you for noticing 😍,28,1,0,,2025-10-06T20:00:20Z,2025-10-06T20:00:20Z,none,True,0.0,neutral,0.0,,,2025-10-12T13:09:25.531876
KXROGtfpKMI,UgxKZxjMQWbz2Z9D72d4AaABAg,top_level,,2025-10-12T13:09:18.599419,@bon7245,https://yt3.ggpht.com/YoraMFrFaBDpY1ul4b3Uf8SLQuiNdtZvJc-XKrJxLEWM5lTaVqPuUu9lVWIcWUPrMs9HIsiu=s48-c-k-c0x00ffffff-no-rj,http://www.youtube.com/@bon7245,UCnLpvW_SV6J7Vg9SHEUK-Kw,i like serious attitude while doing the job..,i like serious attitude while doing the job..,45,1,1,,2025-10-08T07:38:39Z,2025-10-08T07:38:39Z,none,True,-0.167,negative,0.667,,,2025-10-12T13:09:25.532873
KXROGtfpKMI,UgxKZxjMQWbz2Z9D72d4AaABAg.AO04MMcvekAAO1PQ3xOPz0,reply,UgxKZxjMQWbz2Z9D72d4AaABAg,2025-10-12T13:09:18.599419,@oslotvmontering,https://yt3.ggpht.com/2Sip6123e6oOYcZBa6dd5YueneALVpC0lz-i8PwEXyuP5QHwyBLehf2qGE7IfAOhiW-srP9DcQ=s48-c-k-c0x00ffffff-no-rj,http://www.youtube.com/@oslotvmontering,UCzVGVs_ridRZmU7qkltuY0w,I like this comment. 😅,I like this comment. 😅,22,2,0,,2025-10-08T20:01:54Z,2025-10-08T20:01:54Z,none,True,0.0,neutral,0.0,,,2025-10-12T13:09:25.532873
KXROGtfpKMI,Ugx1U5FfSnaGTR4Wlbx4AaABAg,top_level,,2025-10-12T13:09:18.599419,@telemaq76,https://yt3.ggpht.com/ytc/AIdro_mR7Iu-fRwv6LWva9HtG9VumOXNmPdZIut9Wlb_g9m0KWM=s48-c-k-c0x00ffffff-no-rj,http://www.youtube.com/@telemaq76,UCE41TSVxg1qdCnNWbfzaTyA,"why every flat tv owner always install their tv that High. it s a tv, it s not a painting.  i know everyone do that of habit but it s not good. It should be at the level of the soundbar , actually even lower","why every flat tv owner always install their tv that High. it s a tv, it s not a painting.  i know everyone do that of habit but it s not good. It should be at the level of the soundbar , actually even lower",207,30,6,,2025-10-05T05:47:39Z,2025-10-05T05:47:39Z,none,True,0.473,positive,0.341,,,2025-10-12T13:09:25.532873
KXROGtfpKMI,Ugx1U5FfSnaGTR4Wlbx4AaABAg.ANt9GkAZtdUANuf-x4Xexf,reply,Ugx1U5FfSnaGTR4Wlbx4AaABAg,2025-10-12T13:09:18.599419,@oslotvmontering,https://yt3.ggpht.com/2Sip6123e6oOYcZBa6dd5YueneALVpC0lz-i8PwEXyuP5QHwyBLehf2qGE7IfAOhiW-srP9DcQ=s48-c-k-c0x00ffffff-no-rj,http://www.youtube.com/@oslotvmontering,UCzVGVs_ridRZmU7qkltuY0w,"Hi. This TV was mounted about 70 cm from the floor to the bottom of the TV. If you put it  lower than a soundbar it will be under the height of the couch, so the couch and your feet will be in the way when you&#39;re laying down watching TV. I would not recommend that..","Hi. This TV was mounted about 70 cm from the floor to the bottom of the TV. If you put it  lower than a soundbar it will be under the height of the couch, so the couch and your feet will be in the way when you're laying down watching TV. I would not recommend that..",270,11,0,,2025-10-05T19:52:57Z,2025-10-05T19:52:57Z,none,True,0.422,positive,0.289,,,2025-10-12T13:09:25.533871
KXROGtfpKMI,Ugx1U5FfSnaGTR4Wlbx4AaABAg.ANt9GkAZtdUANui9NFnxU0,reply,Ugx1U5FfSnaGTR4Wlbx4AaABAg,2025-10-12T13:09:18.599419,@telemaq76,https://yt3.ggpht.com/ytc/AIdro_mR7Iu-fRwv6LWva9HtG9VumOXNmPdZIut9Wlb_g9m0KWM=s48-c-k-c0x00ffffff-no-rj,http://www.youtube.com/@telemaq76,UCE41TSVxg1qdCnNWbfzaTyA,​@oslotvmontering the center of the image must be a bit lower than the height of the eyes when you are sit.,​@oslotvmontering the center of the image must be a bit lower than the height of the eyes when you are sit.,107,1,0,,2025-10-05T20:20:27Z,2025-10-05T20:20:27Z,none,True,-0.05,neutral,0.1,,,2025-10-12T13:09:25.533871
KXROGtfpKMI,Ugx1U5FfSnaGTR4Wlbx4AaABAg.ANt9GkAZtdUANvItxdBKiV,reply,Ugx1U5FfSnaGTR4Wlbx4AaABAg,2025-10-12T13:09:18.599419,@kazakhkazakhstan7816,https://yt3.ggpht.com/ytc/AIdro_nNtRPpmQCaadw5MQ7LT8a3n_tdKQIzyy1X7_vvummbIxQ=s48-c-k-c0x00ffffff-no-rj,http://www.youtube.com/@kazakhkazakhstan7816,UC15U-DLlx1Mbeogy-Wzkqgg,"​@@telemaq76The center of the TV screen should be at eye level when you&#39;re seated. The bottom of the screen should be 60-70 centimeters from the floor, depending on the height of the sofa you&#39;re sitting on.","​@@telemaq76The center of the TV screen should be at eye level when you're seated. The bottom of the screen should be 60-70 centimeters from the floor, depending on the height of the sofa you're sitting on.",214,3,0,,2025-10-06T01:50:16Z,2025-10-06T01:50:16Z,none,True,-0.05,neutral,0.1,,,2025-10-12T13:09:25.534868
KXROGtfpKMI,Ugx1U5FfSnaGTR4Wlbx4AaABAg.ANt9GkAZtdUAO1HC_O1xHI,reply,Ugx1U5FfSnaGTR4Wlbx4AaABAg,2025-10-12T13:09:18.599419,@gideonowoahene4565,https://yt3.ggpht.com/ytc/AIdro_kglsjG2sVwGC54uYvy8Nnjf6DDk_erTcyKzdJFXLYNsXI=s48-c-k-c0x00ffffff-no-rj,http://www.youtube.com/@gideonowoahene4565,UCWhB7LEmEEVuwhhIf21ocWg,"The G5 series is designed as a gallery TV, so what do you expect? Everyone has different tastes, buy yours and set it up the way you like.","The G5 series is designed as a gallery TV, so what do you expect? Everyone has different tastes, buy yours and set it up the way you like.",138,3,0,,2025-10-08T18:50:09Z,2025-10-08T18:50:09Z,none,True,0.0,neutral,0.6,,,2025-10-12T13:09:25.534868
KXROGtfpKMI,Ugx1U5FfSnaGTR4Wlbx4AaABAg.ANt9GkAZtdUAO1Q4riyA1J,reply,Ugx1U5FfSnaGTR4Wlbx4AaABAg,2025-10-12T13:09:18.599419,@oslotvmontering,https://yt3.ggpht.com/2Sip6123e6oOYcZBa6dd5YueneALVpC0lz-i8PwEXyuP5QHwyBLehf2qGE7IfAOhiW-srP9DcQ=s48-c-k-c0x00ffffff-no-rj,http://www.youtube.com/@oslotvmontering,UCzVGVs_ridRZmU7qkltuY0w,@@gideonowoahene4565 Agree. 👍,@@gideonowoahene4565 Agree. 👍,29,0,0,,2025-10-08T20:07:44Z,2025-10-08T20:07:44Z,none,True,0.0,neutral,0.0,,,2025-10-12T13:09:25.534868
KXROGtfpKMI,UgzPzRlJjM7lraKQcq54AaABAg,top_level,,2025-10-12T13:09:18.599419,@ridvan190333,https://yt3.ggpht.com/ytc/AIdro_nX2Z-o4dJY08A55iSjAZQSJiYUHG7Z4Iup_Gu1YzMaU_Y=s48-c-k-c0x00ffffff-no-rj,http://www.youtube.com/@ridvan190333,UCqC5wI4Hht3fEMSMFPaeJBw,2025 KİNG 🤩,2025 KİNG 🤩,11,0,0,,2025-10-09T06:43:43Z,2025-10-09T06:43:43Z,none,True,0.0,neutral,0.0,,,2025-10-12T13:09:25.535865
KXROGtfpKMI,Ugx1FTebFoRNMZdMe1l4AaABAg,top_level,,2025-10-12T13:09:18.599419,@KristelJoy-b5p,https://yt3.ggpht.com/ytc/AIdro_m4jJbEjL0SIaIOtfApQMcEAEbnC-hAy2naWEzpzZ-wcWvyVBEhmP2ZNn6PyBDPQpvKQA=s48-c-k-c0x00ffffff-no-rj,http://www.youtube.com/@KristelJoy-b5p,UC9UmgH4RBFZt6HKwAoBrYcQ,What is that LED stand thing that sync the tv?,What is that LED stand thing that sync the tv?,46,1,1,,2025-10-09T15:52:27Z,2025-10-09T15:52:27Z,none,True,0.0,neutral,0.0,,,2025-10-12T13:09:25.535865
KXROGtfpKMI,Ugx1FTebFoRNMZdMe1l4AaABAg.AO3XewF18mJAO3yFtKcLyx,reply,Ugx1FTebFoRNMZdMe1l4AaABAg,2025-10-12T13:09:18.599419,@oslotvmontering,https://yt3.ggpht.com/2Sip6123e6oOYcZBa6dd5YueneALVpC0lz-i8PwEXyuP5QHwyBLehf2qGE7IfAOhiW-srP9DcQ=s48-c-k-c0x00ffffff-no-rj,http://www.youtube.com/@oslotvmontering,UCzVGVs_ridRZmU7qkltuY0w,"<a href=""https://amzn.to/42xauNy"">https://amzn.to/42xauNy</a> 👍",https://amzn.to/42xauNy 👍,63,2,0,,2025-10-09T19:53:33Z,2025-10-09T19:53:33Z,none,True,0.0,neutral,0.0,,,2025-10-12T13:09:25.535865
KXROGtfpKMI,UgyYJU7VDWX06I7xmYt4AaABAg,top_level,,2025-10-12T13:09:18.599419,@FadetoblackBS,https://yt3.ggpht.com/ytc/AIdro_no7OoWhNSrbw3ZZXoNRmfWiaJO0qOjebICiQ-nA92GrEJAGZ8yTqrZipZENrF2zTqaqg=s48-c-k-c0x00ffffff-no-rj,http://www.youtube.com/@FadetoblackBS,UCfqjyIhR-EVZV8oYNF8z0bw,I am not so experienced as you. If I dont get the LG mount completely horizontal as you do - can I do some finetuning/adjustment after it is mounted? Or is the horizontal position fixed forever…? 😅<br>Maybe you can show this detail in another video? THANKS,"I am not so experienced as you. If I dont get the LG mount completely horizontal as you do - can I do some finetuning/adjustment after it is mounted? Or is the horizontal position fixed forever…? 😅
Maybe you can show this detail in another video? THANKS",256,0,0,,2025-10-11T20:40:19Z,2025-10-11T20:40:19Z,none,True,0.15,positive,0.425,lg,,2025-10-12T13:09:25.535865
KXROGtfpKMI,UgxyQE_Ss3k9RzKNH5N4AaABAg,top_level,,2025-10-12T13:09:18.599419,@alexchong35,https://yt3.ggpht.com/iaYm_oBpraRNhrovjyIUdBoQiD2ioUQlh7cDyRvC-lOdnLo-bB1YuEP3DFhLZw2gsQ4tKOgtJ9Q=s48-c-k-c0x00ffffff-no-rj,http://www.youtube.com/@alexchong35,UCg8m_NU6vX9d-nwqhiKjokA,"Привет.Отличная работа. Жаль только у нас в России Ютуб не показывает, заблокирован 🎉🎉🎉","Привет.Отличная работа. Жаль только у нас в России Ютуб не показывает, заблокирован 🎉🎉🎉",87,0,1,,2025-10-05T07:46:52Z,2025-10-05T07:47:15Z,none,True,0.0,neutral,0.0,,,2025-10-12T13:09:25.535865
KXROGtfpKMI,UgxyQE_Ss3k9RzKNH5N4AaABAg.ANtMuukiZrIANucb6cyKYT,reply,UgxyQE_Ss3k9RzKNH5N4AaABAg,2025-10-12T13:09:18.599419,@oslotvmontering,https://yt3.ggpht.com/2Sip6123e6oOYcZBa6dd5YueneALVpC0lz-i8PwEXyuP5QHwyBLehf2qGE7IfAOhiW-srP9DcQ=s48-c-k-c0x00ffffff-no-rj,http://www.youtube.com/@oslotvmontering,UCzVGVs_ridRZmU7qkltuY0w,Hi. Thank you! 😊,Hi. Thank you! 😊,16,0,0,,2025-10-05T19:31:57Z,2025-10-05T19:31:57Z,none,True,0.0,neutral,0.0,,,2025-10-12T13:09:25.536864
KXROGtfpKMI,Ugwr0nHwtL0wSD54ah94AaABAg,top_level,,2025-10-12T13:09:18.599419,@JimmyDoyle-b1l,https://yt3.ggpht.com/ytc/AIdro_mhYMd8eRIZw_raiPQ_0axWm9uyydiERTzQTiAUmcLwaXTp-LIqnfZZsPeFGM2BjEvxXw=s48-c-k-c0x00ffffff-no-rj,http://www.youtube.com/@JimmyDoyle-b1l,UCLWU7ynWQOQ_lqTPOP8PUUA,Nice but you need to hide the cords now.,Nice but you need to hide the cords now.,40,0,1,,2025-10-09T03:21:11Z,2025-10-09T03:21:11Z,none,True,0.3,positive,1.0,,,2025-10-12T13:09:25.536864
KXROGtfpKMI,Ugwr0nHwtL0wSD54ah94AaABAg.AO2BgWL-bN9AO3xztFl2fs,reply,Ugwr0nHwtL0wSD54ah94AaABAg,2025-10-12T13:09:18.599419,@oslotvmontering,https://yt3.ggpht.com/2Sip6123e6oOYcZBa6dd5YueneALVpC0lz-i8PwEXyuP5QHwyBLehf2qGE7IfAOhiW-srP9DcQ=s48-c-k-c0x00ffffff-no-rj,http://www.youtube.com/@oslotvmontering,UCzVGVs_ridRZmU7qkltuY0w,"Hi. I just mount the TVs, other people come after me to do that. 👍","Hi. I just mount the TVs, other people come after me to do that. 👍",66,0,0,,2025-10-09T19:51:14Z,2025-10-09T19:51:14Z,none,True,-0.062,neutral,0.375,,,2025-10-12T13:09:25.536864
KXROGtfpKMI,UgwozejKFxMJod5_xxl4AaABAg,top_level,,2025-10-12T13:09:18.599419,@adnanzain8970,https://yt3.ggpht.com/ytc/AIdro_lzh-WYZCPBMu2ovJi2KJMTwR_42IEHi6sOwGYDUjQ=s48-c-k-c0x00ffffff-no-rj,http://www.youtube.com/@adnanzain8970,UC6BeU47m9QEVrAK3cnnnp3A,Khushnaseeb log lete hain ye led.good,Khushnaseeb log lete hain ye led.good,37,0,0,,2025-10-07T14:36:12Z,2025-10-07T14:36:12Z,none,True,0.5,positive,0.0,,,2025-10-12T13:09:25.536864
KXROGtfpKMI,UgztgSDs9G-a0Tn8GEJ4AaABAg,top_level,,2025-10-12T13:09:18.599419,@Lexi20255,https://yt3.ggpht.com/tMje9xIzeUvWUoZRmsrMYTdLO0m5udavwWQOQYh6V7dPoRshdU6bjDLBE_XXRtwcMoU118kF=s48-c-k-c0x00ffffff-no-rj,http://www.youtube.com/@Lexi20255,UCOZ7YPEXzZOQCuQrds26ASw,What sound bar is tht,What sound bar is tht,21,0,0,,2025-10-11T22:51:32Z,2025-10-11T22:51:32Z,none,True,0.2,positive,0.4,,,2025-10-12T13:09:25.536864
KXROGtfpKMI,UgwnzAQBRP8pernEWH54AaABAg,top_level,,2025-10-12T13:09:18.599419,@Matt-rj3vw,https://yt3.ggpht.com/ytc/AIdro_m00sjytUtITQktFijgI7e85mKpmEuqbYqwO-Isl4M=s48-c-k-c0x00ffffff-no-rj,http://www.youtube.com/@Matt-rj3vw,UCPUaQKVHCeWVFHhDJsbNE0A,Premium class TV has no protective film?,Premium class TV has no protective film?,40,2,3,,2025-10-04T17:17:46Z,2025-10-04T17:17:46Z,none,True,0.0,neutral,0.0,,,2025-10-12T13:09:25.536864
KXROGtfpKMI,UgwnzAQBRP8pernEWH54AaABAg.ANroSPOH_6hANryiaA9JC_,reply,UgwnzAQBRP8pernEWH54AaABAg,2025-10-12T13:09:18.599419,@oslotvmontering,https://yt3.ggpht.com/2Sip6123e6oOYcZBa6dd5YueneALVpC0lz-i8PwEXyuP5QHwyBLehf2qGE7IfAOhiW-srP9DcQ=s48-c-k-c0x00ffffff-no-rj,http://www.youtube.com/@oslotvmontering,UCzVGVs_ridRZmU7qkltuY0w,"Hi. There usually is, I was very surprised with that.. 🤔","Hi. There usually is, I was very surprised with that.. 🤔",56,2,0,,2025-10-04T18:47:29Z,2025-10-04T18:47:29Z,none,True,-0.03,neutral,0.625,,,2025-10-12T13:09:25.536864
KXROGtfpKMI,UgwnzAQBRP8pernEWH54AaABAg.ANroSPOH_6hANsqwnD2TSI,reply,UgwnzAQBRP8pernEWH54AaABAg,2025-10-12T13:09:18.599419,@kwekudanso991,https://yt3.ggpht.com/ytc/AIdro_nHd9YdXzCqHYipLlK8uJD7lwed2ouPCGKn57aS9OIYnoo=s48-c-k-c0x00ffffff-no-rj,http://www.youtube.com/@kwekudanso991,UCDrLIXdrqR7Y9447jl1to0Q,Now all their TVs don’t have protective films anymore. Because of the problem with screen burning. Many users leave it on,Now all their TVs don’t have protective films anymore. Because of the problem with screen burning. Many users leave it on,121,0,0,,2025-10-05T02:58:46Z,2025-10-05T02:58:46Z,none,True,-0.25,negative,0.5,,don,2025-10-12T13:09:25.537860
KXROGtfpKMI,UgwnzAQBRP8pernEWH54AaABAg.ANroSPOH_6hANt3XWnl8bw,reply,UgwnzAQBRP8pernEWH54AaABAg,2025-10-12T13:09:18.599419,@kazakhkazakhstan7816,https://yt3.ggpht.com/ytc/AIdro_nNtRPpmQCaadw5MQ7LT8a3n_tdKQIzyy1X7_vvummbIxQ=s48-c-k-c0x00ffffff-no-rj,http://www.youtube.com/@kazakhkazakhstan7816,UC15U-DLlx1Mbeogy-Wzkqgg,"Why not, it&#39;s there. I personally removed the screen protector from my 77G5.","Why not, it's there. I personally removed the screen protector from my 77G5.",80,0,0,,2025-10-05T04:57:31Z,2025-10-05T04:57:31Z,none,True,0.0,neutral,0.3,,,2025-10-12T13:09:25.537860
KXROGtfpKMI,UgzPEASEjB9rAzt3aTF4AaABAg,top_level,,2025-10-12T13:09:18.599419,@Тимур-и9е8ш,https://yt3.ggpht.com/ytc/AIdro_kr7sIRefycWokFVEkytwAkaI1BTreGw295-opLCWa7AVI=s48-c-k-c0x00ffffff-no-rj,http://www.youtube.com/@%D0%A2%D0%B8%D0%BC%D1%83%D1%80-%D0%B89%D0%B58%D1%88,UCTfp7g7OLizAbLLMyRsJ5ZA,Nice,Nice,4,0,0,,2025-10-06T10:48:21Z,2025-10-06T10:48:21Z,none,True,0.3,positive,1.0,,,2025-10-12T13:09:25.537860
KXROGtfpKMI,UgyprFYXQslTYV3-EuF4AaABAg,top_level,,2025-10-12T13:09:18.599419,@markovojicic5460,https://yt3.ggpht.com/ytc/AIdro_k_OE5sp50bE1P0cdEGVYJZERBsS4y1idkVqMqpXj9XQVU=s48-c-k-c0x00ffffff-no-rj,http://www.youtube.com/@markovojicic5460,UCJwPqKl03DHms1b216uWbJQ,Where did you buy the LED light? What is it called? Thanks,Where did you buy the LED light? What is it called? Thanks,58,1,1,,2025-10-07T15:00:12Z,2025-10-07T15:00:12Z,none,True,0.15,positive,0.45,,,2025-10-12T13:09:25.537860
KXROGtfpKMI,UgyprFYXQslTYV3-EuF4AaABAg.ANzI5_CijR4ANztIFx3lyR,reply,UgyprFYXQslTYV3-EuF4AaABAg,2025-10-12T13:09:18.599419,@oslotvmontering,https://yt3.ggpht.com/2Sip6123e6oOYcZBa6dd5YueneALVpC0lz-i8PwEXyuP5QHwyBLehf2qGE7IfAOhiW-srP9DcQ=s48-c-k-c0x00ffffff-no-rj,http://www.youtube.com/@oslotvmontering,UCzVGVs_ridRZmU7qkltuY0w,Hi. Philips hue signe,Hi. Philips hue signe,21,0,0,,2025-10-07T20:33:59Z,2025-10-07T20:33:59Z,none,True,0.0,neutral,0.0,,,2025-10-12T13:09:25.537860
KXROGtfpKMI,UgxhadG6wvuJg9dV3Dl4AaABAg,top_level,,2025-10-12T13:09:18.599419,@orlandoperezgonzalez8951,https://yt3.ggpht.com/ytc/AIdro_lcSLXOyKvV_mAynpHKFM0b0iJ36G8Yf0BlLSInWY4=s48-c-k-c0x00ffffff-no-rj,http://www.youtube.com/@orlandoperezgonzalez8951,UCMBI7CdlESmWDWKPe5yAXpA,❤❤❤❤❤❤,❤❤❤❤❤❤,6,0,0,,2025-10-11T03:16:42Z,2025-10-11T03:16:42Z,none,True,0.0,neutral,0.0,,,2025-10-12T13:09:25.537860
KXROGtfpKMI,Ugx3nYYvY_ph-DUqI2d4AaABAg,top_level,,2025-10-12T13:09:18.599419,@Karavanc,https://yt3.ggpht.com/ytc/AIdro_meZQDvkVwIytlz05tUr4sKYRoxduo30MYm6fDWZDFwo5Dx5x44u4bpmQY2f_R4uW4yGQ=s48-c-k-c0x00ffffff-no-rj,http://www.youtube.com/@Karavanc,UCC_f2Or06qZcsGCUgIkFFiw,G5 /  G4 den cokmu iyi ? Aralarında çok fark gorüyormusun?,G5 /  G4 den cokmu iyi ? Aralarında çok fark gorüyormusun?,58,1,1,,2025-10-03T14:04:34Z,2025-10-03T14:04:34Z,none,True,0.0,neutral,0.0,,,2025-10-12T13:09:25.538857
KXROGtfpKMI,Ugx3nYYvY_ph-DUqI2d4AaABAg.ANotYSeiInhANpRKGqnxuP,reply,Ugx3nYYvY_ph-DUqI2d4AaABAg,2025-10-12T13:09:18.599419,@oslotvmontering,https://yt3.ggpht.com/2Sip6123e6oOYcZBa6dd5YueneALVpC0lz-i8PwEXyuP5QHwyBLehf2qGE7IfAOhiW-srP9DcQ=s48-c-k-c0x00ffffff-no-rj,http://www.youtube.com/@oslotvmontering,UCzVGVs_ridRZmU7qkltuY0w,Hi. Both are great TVs. The G5 is a little bit better.,Hi. Both are great TVs. The G5 is a little bit better.,54,0,0,,2025-10-03T19:08:28Z,2025-10-03T19:08:28Z,none,True,0.685,positive,0.583,,,2025-10-12T13:09:25.538857
KXROGtfpKMI,Ugzfjs0bIj-31v-fBbV4AaABAg,top_level,,2025-10-12T13:09:18.599419,@gudirj,https://yt3.ggpht.com/ytc/AIdro_mMuIh1oibxGyBnPplJt_rtJCiNFpX5_71PwHB2KhlMxQ=s48-c-k-c0x00ffffff-no-rj,http://www.youtube.com/@gudirj,UCRJTEY3fpFRaqGBGZWvHpNA,"I&#39;d like to know what those RGB floor lamps are on both sides of the TV? What&#39;s their brand, price, and where can I buy them?<br>I&#39;ll also be buying an LG G5, but in 83 inches.<br><br>Best regards.","I'd like to know what those RGB floor lamps are on both sides of the TV? What's their brand, price, and where can I buy them?
I'll also be buying an LG G5, but in 83 inches.

Best regards.",209,1,3,,2025-10-05T08:00:45Z,2025-10-05T08:00:45Z,none,True,0.5,positive,0.0,lg,,2025-10-12T13:09:25.539856
KXROGtfpKMI,Ugzfjs0bIj-31v-fBbV4AaABAg.ANtOVdb_dAgANtXNiAL4Cy,reply,Ugzfjs0bIj-31v-fBbV4AaABAg,2025-10-12T13:09:18.599419,@pascalsaint-germain1417,https://yt3.ggpht.com/EvXFN-_nDoTEc9BALQb0X6dcza2nu6_10gpYhdEaNvtjh97u-Gx8wChcsqmVQePs_GcJkvTU=s48-c-k-c0x00ffffff-no-rj,http://www.youtube.com/@pascalsaint-germain1417,UCQGLJgqI2Z2cQSUn4YnVJeA,Hello ! It&#39;s &quot;Philips hue Gradient Signe&quot; . You also have &quot;Nanoleaf Matter Smart Multicolor Floor Lamp&quot;. Price and other thinks (google it),"Hello ! It's ""Philips hue Gradient Signe"" . You also have ""Nanoleaf Matter Smart Multicolor Floor Lamp"". Price and other thinks (google it)",163,0,0,,2025-10-05T09:18:19Z,2025-10-05T09:18:19Z,none,True,0.022,neutral,0.509,google,,2025-10-12T13:09:25.539856
KXROGtfpKMI,Ugzfjs0bIj-31v-fBbV4AaABAg.ANtOVdb_dAgANuck-j7lTH,reply,Ugzfjs0bIj-31v-fBbV4AaABAg,2025-10-12T13:09:18.599419,@oslotvmontering,https://yt3.ggpht.com/2Sip6123e6oOYcZBa6dd5YueneALVpC0lz-i8PwEXyuP5QHwyBLehf2qGE7IfAOhiW-srP9DcQ=s48-c-k-c0x00ffffff-no-rj,http://www.youtube.com/@oslotvmontering,UCzVGVs_ridRZmU7qkltuY0w,"Hi. I only mount the TV so I do not have any info about them unfortunately, but I do agree that they look great with the TV.","Hi. I only mount the TV so I do not have any info about them unfortunately, but I do agree that they look great with the TV.",124,0,0,,2025-10-05T19:33:10Z,2025-10-05T19:33:10Z,none,True,0.55,positive,0.917,,,2025-10-12T13:09:25.539856
KXROGtfpKMI,Ugzfjs0bIj-31v-fBbV4AaABAg.ANtOVdb_dAgANyNlhlK-L0,reply,Ugzfjs0bIj-31v-fBbV4AaABAg,2025-10-12T13:09:18.599419,@motoshandu,https://yt3.ggpht.com/ytc/AIdro_kKfs-RS8ueXBj-25NYVf5DOJWr0bDuiFd8b1_qJ6s=s48-c-k-c0x00ffffff-no-rj,http://www.youtube.com/@motoshandu,UClJ-yUtHKgrRMBAwoVgOfxg,Phillips hue signe is the lamps 😊,Phillips hue signe is the lamps 😊,33,0,0,,2025-10-07T06:30:33Z,2025-10-07T06:30:33Z,none,True,0.0,neutral,0.0,,,2025-10-12T13:09:25.539856
KXROGtfpKMI,UgxRrqa1JIxtNct-op14AaABAg,top_level,,2025-10-12T13:09:18.599419,@АртемАртемчик-х3ь,https://yt3.ggpht.com/ytc/AIdro_mkQGYwAAyi2NDT1XkZmIA-dQTJBiUp2hiPOXrpE71zQw1A4GXoLK-FHZ-wrVa_E5mvCcc=s48-c-k-c0x00ffffff-no-rj,http://www.youtube.com/@%D0%90%D1%80%D1%82%D0%B5%D0%BC%D0%90%D1%80%D1%82%D0%B5%D0%BC%D1%87%D0%B8%D0%BA-%D1%853%D1%8C,UCsZsQouFDUti6YshTbGXJYg,What are those lamps at the end?,What are those lamps at the end?,32,1,5,,2025-10-03T18:20:24Z,2025-10-03T18:20:24Z,none,True,0.0,neutral,0.0,,,2025-10-12T13:09:25.539856
KXROGtfpKMI,UgxRrqa1JIxtNct-op14AaABAg.ANpLpMr_jdKANpRkIi4_ZU,reply,UgxRrqa1JIxtNct-op14AaABAg,2025-10-12T13:09:18.599419,@oslotvmontering,https://yt3.ggpht.com/2Sip6123e6oOYcZBa6dd5YueneALVpC0lz-i8PwEXyuP5QHwyBLehf2qGE7IfAOhiW-srP9DcQ=s48-c-k-c0x00ffffff-no-rj,http://www.youtube.com/@oslotvmontering,UCzVGVs_ridRZmU7qkltuY0w,Hi. I just mounted the TV so I do not know unfortunately. But those were really cool lamps. 😎,Hi. I just mounted the TV so I do not know unfortunately. But those were really cool lamps. 😎,93,0,0,,2025-10-03T19:12:08Z,2025-10-03T19:12:08Z,none,True,-0.038,neutral,0.825,,,2025-10-12T13:09:25.539856
KXROGtfpKMI,UgxRrqa1JIxtNct-op14AaABAg.ANpLpMr_jdKANpZjbGjSVc,reply,UgxRrqa1JIxtNct-op14AaABAg,2025-10-12T13:09:18.599419,@АртемАртемчик-х3ь,https://yt3.ggpht.com/ytc/AIdro_mkQGYwAAyi2NDT1XkZmIA-dQTJBiUp2hiPOXrpE71zQw1A4GXoLK-FHZ-wrVa_E5mvCcc=s48-c-k-c0x00ffffff-no-rj,http://www.youtube.com/@%D0%90%D1%80%D1%82%D0%B5%D0%BC%D0%90%D1%80%D1%82%D0%B5%D0%BC%D1%87%D0%B8%D0%BA-%D1%853%D1%8C,UCsZsQouFDUti6YshTbGXJYg,@@oslotvmonteringok🤝👍,@@oslotvmonteringok🤝👍,21,0,0,,2025-10-03T20:21:57Z,2025-10-03T20:21:57Z,none,True,0.0,neutral,0.0,,,2025-10-12T13:09:25.540853
KXROGtfpKMI,UgxRrqa1JIxtNct-op14AaABAg.ANpLpMr_jdKANpmQpzy4Mf,reply,UgxRrqa1JIxtNct-op14AaABAg,2025-10-12T13:09:18.599419,@pascalsaint-germain1417,https://yt3.ggpht.com/EvXFN-_nDoTEc9BALQb0X6dcza2nu6_10gpYhdEaNvtjh97u-Gx8wChcsqmVQePs_GcJkvTU=s48-c-k-c0x00ffffff-no-rj,http://www.youtube.com/@pascalsaint-germain1417,UCQGLJgqI2Z2cQSUn4YnVJeA,It&#39;s Philips hue Gradient Signe. Nanoleaf Matter Smart Multicolor Floor Lamp are good too,It's Philips hue Gradient Signe. Nanoleaf Matter Smart Multicolor Floor Lamp are good too,93,2,0,,2025-10-03T22:21:35Z,2025-10-03T22:28:17Z,none,True,0.729,positive,0.621,,,2025-10-12T13:09:25.540853
