video_id,comment_id,comment_type,parent_comment_id,collected_at,author_display_name,author_profile_image_url,author_channel_url,author_channel_id,comment_text_display,comment_text_original,comment_text_length,like_count,reply_count,moderation_status,published_at,updated_at,viewer_rating,can_rate,sentiment_score,sentiment_category,subjectivity_score,brand_mentions,competitor_mentions,analyzed_at
o9y8lPgmG5E,UgzJ__teGhBoGWat0kh4AaABAg.AMNnAzKrWzOAO6CP9VJM0F,reply,UgzJ__teGhBoGWat0kh4AaABAg,2025-10-12T13:09:16.220848,@colmlivingstone5540,https://yt3.ggpht.com/ytc/AIdro_nZ7Dow_XW1VMS26yDixoIXUR53qCkU2Yz2ziE0ZfjnD4Y=s48-c-k-c0x00ffffff-no-rj,http://www.youtube.com/@colmlivingstone5540,UC1gNgsTnFxnPlu5HfL3WdkQ,What did you end up going for?,What did you end up going for?,30,0,0,,2025-10-10T16:44:23Z,2025-10-10T16:44:23Z,none,True,0.0,neutral,0.0,,,2025-10-12T13:09:25.461092
o9y8lPgmG5E,UgzJ__teGhBoGWat0kh4AaABAg.AMNnAzKrWzOAO6DFJPS5Fa,reply,UgzJ__teGhBoGWat0kh4AaABAg,2025-10-12T13:09:16.220848,@dabike,https://yt3.ggpht.com/0Xtt67cq41YIHZTASyRWk_QQuzjTdquZtLfaEnIyClT0Cg1UdgfysJBIl6wfIegCEV1o5Al0oAQ=s48-c-k-c0x00ffffff-no-rj,http://www.youtube.com/@dabike,UChjIjkwxSsKCsT3CrzUPTmA,@@colmlivingstone5540after watching many reviews and checking options s at Best Buy I went with an 85” QNED92A with a Sonus Ultra Arc soundbar in the family room and a 65” QNED85A in the Den. <br><br>They don’t get delivered and  installed for another 2 weeks.,"@@colmlivingstone5540after watching many reviews and checking options s at Best Buy I went with an 85” QNED92A with a Sonus Ultra Arc soundbar in the family room and a 65” QNED85A in the Den. 

They don’t get delivered and  installed for another 2 weeks.",260,0,0,,2025-10-10T16:51:46Z,2025-10-10T16:51:46Z,none,True,0.875,positive,0.4,,,2025-10-12T13:09:25.461092
o9y8lPgmG5E,UgyljMdBAcZSOo6rDeB4AaABAg,top_level,,2025-10-12T13:09:16.220848,@Kudammxknesebeck,https://yt3.ggpht.com/ytc/AIdro_n7417ek-18wzJI3ZENBm0JLEsWrCcksbQ7WKdHv1tzFUdXjGULqP2rM3Knc8d3lEC4qw=s48-c-k-c0x00ffffff-no-rj,http://www.youtube.com/@Kudammxknesebeck,UCcunTZbRxiohnP_wEkWECRQ,G5 white is white and c5 is Blue.,G5 white is white and c5 is Blue.,33,12,1,,2025-08-23T07:58:15Z,2025-08-23T07:58:15Z,none,True,0.0,neutral,0.033,,,2025-10-12T13:09:25.461092
o9y8lPgmG5E,UgyljMdBAcZSOo6rDeB4AaABAg.AM9f1fOAdonAO9BWdO3xHC,reply,UgyljMdBAcZSOo6rDeB4AaABAg,2025-10-12T13:09:16.220848,@zombieimpact2790,https://yt3.ggpht.com/axScQ324WGXxScRZWazmFmfdmsbWEO5qh5b1Ga4fINTMyOlXBV_fpUf_-JtySXrpoBZlMY6sMw=s48-c-k-c0x00ffffff-no-rj,http://www.youtube.com/@zombieimpact2790,UCa4PgT6D1XZx_uz3khph3vg,No it&#39;s not. Not on mine. White is white on mine.,No it's not. Not on mine. White is white on mine.,53,0,0,,2025-10-11T20:34:23Z,2025-10-11T20:34:23Z,none,True,0.0,neutral,0.0,,,2025-10-12T13:09:25.462063
o9y8lPgmG5E,Ugz39G5qLBgm_6ViIH14AaABAg,top_level,,2025-10-12T13:09:16.220848,@jeff15,https://yt3.ggpht.com/uH5xjlKKKCuFfXL6h6KCk8ekUxXS0E3repLp6rDzuZapyzVMxSjSHBmZTStTAzqZkGI0m9Sb=s48-c-k-c0x00ffffff-no-rj,http://www.youtube.com/@jeff15,UCk08B2dTx5kjO7H_dJRspHg,"I have the c5, and i love it. It&#39;s my first 4k tv ever. 😊  my ps5 looks great. One negative comment about it is that i don&#39;t like it when using amazon Prime scrolling the different movies/shows the mode filmmaker activates randomly. It&#39;s so strange. Waiting to see which sound bar to get in the future to pair it with. Right now i have it hookeup to my Logitech 5.1 surround sound thx edition. I would recommend this tv","I have the c5, and i love it. It's my first 4k tv ever. 😊  my ps5 looks great. One negative comment about it is that i don't like it when using amazon Prime scrolling the different movies/shows the mode filmmaker activates randomly. It's so strange. Waiting to see which sound bar to get in the future to pair it with. Right now i have it hookeup to my Logitech 5.1 surround sound thx edition. I would recommend this tv",431,16,3,,2025-08-22T20:58:40Z,2025-08-22T20:58:40Z,none,True,0.614,positive,0.429,,,2025-10-12T13:09:25.463064
o9y8lPgmG5E,Ugz39G5qLBgm_6ViIH14AaABAg.AM8UYmG47JBAM8hN09vE0j,reply,Ugz39G5qLBgm_6ViIH14AaABAg,2025-10-12T13:09:16.220848,@GOLFADDICT65,https://yt3.ggpht.com/SXhehArQrcK7Cxx9o3qruSgMsAXuOJZ2sKIPL32pO0uwV2YeN3XNTzpk41E5VCXR3pZZdV3xgA=s48-c-k-c0x00ffffff-no-rj,http://www.youtube.com/@GOLFADDICT65,UCs2EPma6TddxNN6hGMoMGUA,are you in a bright room ? or a dark room ?  size ?,are you in a bright room ? or a dark room ?  size ?,51,1,0,,2025-08-22T22:59:24Z,2025-08-22T22:59:24Z,none,True,0.138,positive,0.6,,,2025-10-12T13:09:25.463064
o9y8lPgmG5E,Ugz39G5qLBgm_6ViIH14AaABAg.AM8UYmG47JBAM8ledaRT_G,reply,Ugz39G5qLBgm_6ViIH14AaABAg,2025-10-12T13:09:16.220848,@jeff15,https://yt3.ggpht.com/uH5xjlKKKCuFfXL6h6KCk8ekUxXS0E3repLp6rDzuZapyzVMxSjSHBmZTStTAzqZkGI0m9Sb=s48-c-k-c0x00ffffff-no-rj,http://www.youtube.com/@jeff15,UCk08B2dTx5kjO7H_dJRspHg,"​@GOLFADDICT65 dark room, basement. The size is 65 inches. Definitely worth it. 😊","​@GOLFADDICT65 dark room, basement. The size is 65 inches. Definitely worth it. 😊",81,1,0,,2025-08-22T23:36:54Z,2025-08-22T23:36:54Z,none,True,0.037,neutral,0.25,,,2025-10-12T13:09:25.464058
o9y8lPgmG5E,Ugz39G5qLBgm_6ViIH14AaABAg.AM8UYmG47JBANVQeAA2XbM,reply,Ugz39G5qLBgm_6ViIH14AaABAg,2025-10-12T13:09:16.220848,@kerosenefilms,https://yt3.ggpht.com/ytc/AIdro_lmQayFZ5uogQBa9_qGZYM6N2WxYK4QyIsgXox4eEDXtw=s48-c-k-c0x00ffffff-no-rj,http://www.youtube.com/@kerosenefilms,UC6BTAfOORo6s3xdKKnXo8_g,There should be a compensation mode you can disable. There is on the Sony.,There should be a compensation mode you can disable. There is on the Sony.,74,0,0,,2025-09-25T15:18:31Z,2025-09-25T15:18:31Z,none,True,0.0,neutral,0.0,sony,,2025-10-12T13:09:25.464058
o9y8lPgmG5E,Ugy0uUPf8rCTlKMgKyV4AaABAg,top_level,,2025-10-12T13:09:16.220848,@Deffine,https://yt3.ggpht.com/aBfoYoByc60ddeDjwCXSokxiN0HxeyC6SqCCOOvJ-2A-FiJZs5jIfryL4QXApXuqq-f-2tQUE5A=s48-c-k-c0x00ffffff-no-rj,http://www.youtube.com/@Deffine,UC9ZdchAkMfvR3snvBwaT66g,"<a href=""https://www.youtube.com/watch?v=o9y8lPgmG5E&amp;t=438"">7:18</a> So the G5 traps light, meaning there is some kind of haze in the panel to reduce reflections. Anything that affects clarity is not a good. You want reflections with clarity vs. lack of clarity with less reflections.","7:18 So the G5 traps light, meaning there is some kind of haze in the panel to reduce reflections. Anything that affects clarity is not a good. You want reflections with clarity vs. lack of clarity with less reflections.",288,5,0,,2025-08-23T13:03:14Z,2025-08-23T13:03:58Z,none,True,0.56,positive,0.567,,,2025-10-12T13:09:25.465055
o9y8lPgmG5E,UgyVJQ_w6d20_AC4SmZ4AaABAg,top_level,,2025-10-12T13:09:16.220848,@Joshua-xh6bm,https://yt3.ggpht.com/ytc/AIdro_mXKArO40DmM71W81ssK-Mpm5_5jSRNjpWR6Q0HpCU=s48-c-k-c0x00ffffff-no-rj,http://www.youtube.com/@Joshua-xh6bm,UCqtqZRDqp7M61mBHGbPUlrQ,That gaming difference in Cyberpunk....sweet jesus.,That gaming difference in Cyberpunk....sweet jesus.,51,3,0,,2025-08-22T23:10:41Z,2025-08-22T23:10:41Z,none,True,0.0,neutral,0.0,,,2025-10-12T13:09:25.465055
o9y8lPgmG5E,UgzZXCfzG1ij4e8U1Fl4AaABAg,top_level,,2025-10-12T13:09:16.220848,@ninji7400,https://yt3.ggpht.com/ytc/AIdro_mPHO0uxHxPcdabVMw-D_4fRiF0D1AQW0-e9KiaPs6FRuMF=s48-c-k-c0x00ffffff-no-rj,http://www.youtube.com/@ninji7400,UCG1cEzKqPK22TWrmZac2wlA,"My question is:<br>Where does the LG 48G5 rank? It occupies a special position, as, as far as I know, it already has the RGB tandem OLED panel and different heat dissipation, and therefore isn&#39;t as bright as the 55-inch and above models.<br>For me, it reaches a maximum brightness of 1390 nits.<br>A test of this would be very interesting. :)<br><br>I wish you all a nice evening ;)","My question is:
Where does the LG 48G5 rank? It occupies a special position, as, as far as I know, it already has the RGB tandem OLED panel and different heat dissipation, and therefore isn't as bright as the 55-inch and above models.
For me, it reaches a maximum brightness of 1390 nits.
A test of this would be very interesting. :)

I wish you all a nice evening ;)",391,2,1,,2025-08-25T22:32:58Z,2025-08-25T22:32:58Z,none,True,0.1,positive,0.703,lg,,2025-10-12T13:09:25.465055
o9y8lPgmG5E,UgzZXCfzG1ij4e8U1Fl4AaABAg.AMGNj018Mt0AMYnAVq1Wyz,reply,UgzZXCfzG1ij4e8U1Fl4AaABAg,2025-10-12T13:09:16.220848,@PacoElFlaco9135,https://yt3.ggpht.com/Q97h-EzUacPHSpjIHV5ets92xAyfk-l2lB_DfKluDpUJFha6heZeZIdd3EFJk77DG5Z6SvVQrA=s48-c-k-c0x00ffffff-no-rj,http://www.youtube.com/@PacoElFlaco9135,UCrTTm8DkWWjeKf3WNJYDCTg,I have the same question,I have the same question,24,0,0,,2025-09-02T02:10:22Z,2025-09-02T02:10:22Z,none,True,0.0,neutral,0.125,,,2025-10-12T13:09:25.465055
o9y8lPgmG5E,UgxzfrBTmbXKADDJ0FN4AaABAg,top_level,,2025-10-12T13:09:16.220848,@Hudsonscorner22,https://yt3.ggpht.com/ytc/AIdro_kvFAA9CIn51Wix2JeKkmbUbHGM5N0PdofHXp5dYTk8fII=s48-c-k-c0x00ffffff-no-rj,http://www.youtube.com/@Hudsonscorner22,UCG4xc24ncukdIa7iaXoJlGg,"I’m currently tossed between the C5 and the G4 since right now they’re very similar in price, I checked Amazon today and there’s a C5 about $200 cheaper than the G4, but I REALLY want the G4 but money is super tight, I have the C3 and it’s been easily one of the best TVs I’ve ever had, so I can’t imagine I’d be upset with the C5, but if I could see both TV’s in person that would be so awesome","I’m currently tossed between the C5 and the G4 since right now they’re very similar in price, I checked Amazon today and there’s a C5 about $200 cheaper than the G4, but I REALLY want the G4 but money is super tight, I have the C3 and it’s been easily one of the best TVs I’ve ever had, so I can’t imagine I’d be upset with the C5, but if I could see both TV’s in person that would be so awesome",395,3,18,,2025-08-22T22:26:58Z,2025-08-22T22:26:58Z,none,True,0.337,positive,0.527,,i,2025-10-12T13:09:25.466051
o9y8lPgmG5E,UgxzfrBTmbXKADDJ0FN4AaABAg.AM8deQUqyY5AM8p9KxwEw-,reply,UgxzfrBTmbXKADDJ0FN4AaABAg,2025-10-12T13:09:16.220848,@daveb9402,https://yt3.ggpht.com/ytc/AIdro_nVMD60Kn5hdiewPO2RajB8V5WEFXGdZ3WuSYe_kxE=s48-c-k-c0x00ffffff-no-rj,http://www.youtube.com/@daveb9402,UC9BW5gk_kkOPzFw_KmzA-FQ,"Honestly, I would go for the G4. It&#39;s brighter, does support DTS and there&#39;s no banding in HDR10.","Honestly, I would go for the G4. It's brighter, does support DTS and there's no banding in HDR10.",105,5,0,,2025-08-23T00:07:26Z,2025-08-23T00:07:26Z,none,True,0.3,positive,0.9,,,2025-10-12T13:09:25.466051
o9y8lPgmG5E,UgxzfrBTmbXKADDJ0FN4AaABAg.AM8deQUqyY5AM8pRv5_Y7a,reply,UgxzfrBTmbXKADDJ0FN4AaABAg,2025-10-12T13:09:16.220848,@djorgen,https://yt3.ggpht.com/ytc/AIdro_nOpSTzJ5s_EveYaMe4wJv4Y59T9KsNp-BCXl1hMxg=s48-c-k-c0x00ffffff-no-rj,http://www.youtube.com/@djorgen,UCW0U0OkLrtiERvOr1VHwO9Q,"You already have a C3, you want a C5 that is a tad better than the C3, and money is tight? What?","You already have a C3, you want a C5 that is a tad better than the C3, and money is tight? What?",96,6,0,,2025-08-23T00:09:58Z,2025-08-23T00:09:58Z,none,True,0.08,neutral,0.393,,the,2025-10-12T13:09:25.467049
o9y8lPgmG5E,UgxzfrBTmbXKADDJ0FN4AaABAg.AM8deQUqyY5AM8puR1L1vf,reply,UgxzfrBTmbXKADDJ0FN4AaABAg,2025-10-12T13:09:16.220848,@Hudsonscorner22,https://yt3.ggpht.com/ytc/AIdro_kvFAA9CIn51Wix2JeKkmbUbHGM5N0PdofHXp5dYTk8fII=s48-c-k-c0x00ffffff-no-rj,http://www.youtube.com/@Hudsonscorner22,UCG4xc24ncukdIa7iaXoJlGg,"@@djorgenwell the new tv is for our theater room, the c3 is just a 48” for the bedroom, the size I’m looking for is 77” for the theater room","@@djorgenwell the new tv is for our theater room, the c3 is just a 48” for the bedroom, the size I’m looking for is 77” for the theater room",140,2,0,,2025-08-23T00:14:00Z,2025-08-23T00:14:00Z,none,True,0.068,neutral,0.455,,,2025-10-12T13:09:25.467049
o9y8lPgmG5E,UgxzfrBTmbXKADDJ0FN4AaABAg.AM8deQUqyY5AM8qVzD5VT9,reply,UgxzfrBTmbXKADDJ0FN4AaABAg,2025-10-12T13:09:16.220848,@Hudsonscorner22,https://yt3.ggpht.com/ytc/AIdro_kvFAA9CIn51Wix2JeKkmbUbHGM5N0PdofHXp5dYTk8fII=s48-c-k-c0x00ffffff-no-rj,http://www.youtube.com/@Hudsonscorner22,UCG4xc24ncukdIa7iaXoJlGg,"I just looked at Amazon and there’s G4 is back to around $3000, but the C5 is down to $2300, I mean I think I could make it work for the G4, but would that really be worth the $700 dollars? Both models I’m looking at are 77”","I just looked at Amazon and there’s G4 is back to around $3000, but the C5 is down to $2300, I mean I think I could make it work for the G4, but would that really be worth the $700 dollars? Both models I’m looking at are 77”",224,0,0,,2025-08-23T00:19:16Z,2025-08-23T00:19:16Z,none,True,-0.021,neutral,0.269,,,2025-10-12T13:09:25.467049
o9y8lPgmG5E,UgxzfrBTmbXKADDJ0FN4AaABAg.AM8deQUqyY5AM8rLDj_acR,reply,UgxzfrBTmbXKADDJ0FN4AaABAg,2025-10-12T13:09:16.220848,@spiteightseven,https://yt3.ggpht.com/ytc/AIdro_kgeb3tvIBGrdY-IdjHykSG-MSKpwcehWUAO3_O6TXPgadO46BAk4RkoG8qNgXDJBfHxg=s48-c-k-c0x00ffffff-no-rj,http://www.youtube.com/@spiteightseven,UC1JnjT3x4SwyVH6QMHD0vpg,Why are you upgrading? I&#39;m still with a C2 and it&#39;s fantastic,Why are you upgrading? I'm still with a C2 and it's fantastic,69,1,0,,2025-08-23T00:26:32Z,2025-08-23T00:26:32Z,none,True,0.7,positive,0.9,,,2025-10-12T13:09:25.467049
o9y8lPgmG5E,UgxFtSc3MQVQxbmzwc54AaABAg,top_level,,2025-10-12T13:09:16.220848,@amitavraja3385,https://yt3.ggpht.com/ytc/AIdro_mlzDxLjAE_f4dnnjQ86rg9yBRBNGoeiY6I5NuHz67ss1o=s48-c-k-c0x00ffffff-no-rj,http://www.youtube.com/@amitavraja3385,UC_Z7Fy4ivYZQwpPh9moEbtQ,"LG are using the customers as Beta testers. They had more updates than any other TV companies and still some issues are not resolved. You can bet your bottom dollar that the next year’s G6 would be far better, with most of the gremlins ironed out.","LG are using the customers as Beta testers. They had more updates than any other TV companies and still some issues are not resolved. You can bet your bottom dollar that the next year’s G6 would be far better, with most of the gremlins ironed out.",247,29,2,,2025-08-23T07:20:50Z,2025-08-23T07:20:50Z,none,True,-0.377,negative,0.479,lg,,2025-10-12T13:09:25.468048
o9y8lPgmG5E,UgxFtSc3MQVQxbmzwc54AaABAg.AM9akf8kW8WAMSR_JI6dXx,reply,UgxFtSc3MQVQxbmzwc54AaABAg,2025-10-12T13:09:16.220848,@DanKapil,https://yt3.ggpht.com/Bq32eVYMtk1hWrs52w8WOat4lnP9d9LMKJgAgddkSC97LbxhprdNodkMTkw8WQNz2cLoKk8H=s48-c-k-c0x00ffffff-no-rj,http://www.youtube.com/@DanKapil,UCcy2ZFJ-CgZ0W9FRrpUQaMg,"You can bet that the year after, the g7 will be even better :0 lol","You can bet that the year after, the g7 will be even better :0 lol",66,7,0,,2025-08-30T14:57:28Z,2025-08-30T14:57:28Z,none,True,0.325,positive,0.6,,,2025-10-12T13:09:25.468048
o9y8lPgmG5E,UgxFtSc3MQVQxbmzwc54AaABAg.AM9akf8kW8WAMV4JPw8fUd,reply,UgxFtSc3MQVQxbmzwc54AaABAg,2025-10-12T13:09:16.220848,@redstar397,https://yt3.ggpht.com/ytc/AIdro_m3sZY0LOEzDyURVw1V8kOg0154T7BxL33XPIt_qO8=s48-c-k-c0x00ffffff-no-rj,http://www.youtube.com/@redstar397,UCL-FkLs_2t4wUPieJKyRS2Q,"Yeah that’s how technology works, next gen is always an improvement","Yeah that’s how technology works, next gen is always an improvement",67,2,0,,2025-08-31T15:31:55Z,2025-08-31T15:31:55Z,none,True,0.0,neutral,0.0,,,2025-10-12T13:09:25.468048
o9y8lPgmG5E,UgwkpDsyIyKN4ohIKiJ4AaABAg,top_level,,2025-10-12T13:09:16.220848,@chrisa9834,https://yt3.ggpht.com/ytc/AIdro_ka_Gk19dr8iMRU_1TqRV3Q6zz651k2u0Ut6IsLyDs=s48-c-k-c0x00ffffff-no-rj,http://www.youtube.com/@chrisa9834,UCa-f64X2tWTIvufds50i2_w,"I think I’m going with the C5. I’m coming from a 2010 Panny plasma that will not die. So really anything will be amazing. I still have my Kuro Elite from 2009. Honestly, both the Panny and Pioneer still look incredible for this day and age. Time to upgrade and move on from plasma. 😢","I think I’m going with the C5. I’m coming from a 2010 Panny plasma that will not die. So really anything will be amazing. I still have my Kuro Elite from 2009. Honestly, both the Panny and Pioneer still look incredible for this day and age. Time to upgrade and move on from plasma. 😢",283,2,8,,2025-08-22T23:27:31Z,2025-08-22T23:30:16Z,none,True,0.787,positive,0.725,,,2025-10-12T13:09:25.468048
o9y8lPgmG5E,UgwkpDsyIyKN4ohIKiJ4AaABAg.AM8ka07LXEHAM8rH1T4RvV,reply,UgwkpDsyIyKN4ohIKiJ4AaABAg,2025-10-12T13:09:16.220848,@spiteightseven,https://yt3.ggpht.com/ytc/AIdro_kgeb3tvIBGrdY-IdjHykSG-MSKpwcehWUAO3_O6TXPgadO46BAk4RkoG8qNgXDJBfHxg=s48-c-k-c0x00ffffff-no-rj,http://www.youtube.com/@spiteightseven,UC1JnjT3x4SwyVH6QMHD0vpg,Damn you&#39;re going to be blown away with that step up,Damn you're going to be blown away with that step up,56,0,0,,2025-08-23T00:25:58Z,2025-08-23T00:25:58Z,none,True,0.0,neutral,0.0,,,2025-10-12T13:09:25.469044
o9y8lPgmG5E,UgwkpDsyIyKN4ohIKiJ4AaABAg.AM8ka07LXEHAMAPfHgVvaG,reply,UgwkpDsyIyKN4ohIKiJ4AaABAg,2025-10-12T13:09:16.220848,@turrican4d599,https://yt3.ggpht.com/ytc/AIdro_mdSnw_VzAIxgNcpdcfUABre8PsCeWx9r_rAWgaDcM=s48-c-k-c0x00ffffff-no-rj,http://www.youtube.com/@turrican4d599,UCcfzM7BIrBjHF3_E8bwNnUw,Your plasma has horrible blacks but perfect motion. The OLEDs are the opposite,Your plasma has horrible blacks but perfect motion. The OLEDs are the opposite,78,0,0,,2025-08-23T14:54:29Z,2025-08-23T14:54:29Z,none,True,0.0,neutral,0.667,oppo,,2025-10-12T13:09:25.469044
o9y8lPgmG5E,UgwkpDsyIyKN4ohIKiJ4AaABAg.AM8ka07LXEHAMAPjq2OyEz,reply,UgwkpDsyIyKN4ohIKiJ4AaABAg,2025-10-12T13:09:16.220848,@turrican4d599,https://yt3.ggpht.com/ytc/AIdro_mdSnw_VzAIxgNcpdcfUABre8PsCeWx9r_rAWgaDcM=s48-c-k-c0x00ffffff-no-rj,http://www.youtube.com/@turrican4d599,UCcfzM7BIrBjHF3_E8bwNnUw,​@@spiteightseven Not as soon as he watches football or play games he&#39;s not,​@@spiteightseven Not as soon as he watches football or play games he's not,79,0,0,,2025-08-23T14:55:06Z,2025-08-23T14:55:06Z,none,True,0.0,neutral,0.0,,,2025-10-12T13:09:25.469044
o9y8lPgmG5E,UgwkpDsyIyKN4ohIKiJ4AaABAg.AM8ka07LXEHAMB-pPQqoYQ,reply,UgwkpDsyIyKN4ohIKiJ4AaABAg,2025-10-12T13:09:16.220848,@thomas.becker,https://yt3.ggpht.com/NF83VXbWjrqvjzyad71aPDVYf3HDJUed9bVLTkop3ccTnoHoApz3qzjpWTVPdGPOd4dVth2rCg=s48-c-k-c0x00ffffff-no-rj,http://www.youtube.com/@thomas.becker,UC-WCuZpE-KXYBOPEL_AjcLQ,"@@spiteightseven I just &quot;upgraded&quot; from a 2013 pana plasma (last gen) and i&#39;m pretty disappointed with the c5. maybe in 4k hdr content there are some advantages, but they don&#39;t compensate for the sdr experience, the horrible sound and the annoyance of having to turning off the picture enhancers and motions smoothing garbage. you have to constantly tune the c5 to get a decent picture. the pana plasma just worked.","@@spiteightseven I just ""upgraded"" from a 2013 pana plasma (last gen) and i'm pretty disappointed with the c5. maybe in 4k hdr content there are some advantages, but they don't compensate for the sdr experience, the horrible sound and the annoyance of having to turning off the picture enhancers and motions smoothing garbage. you have to constantly tune the c5 to get a decent picture. the pana plasma just worked.",433,1,0,,2025-08-23T20:27:55Z,2025-08-23T20:27:55Z,none,True,-0.567,negative,0.602,,,2025-10-12T13:09:25.469044
o9y8lPgmG5E,UgwkpDsyIyKN4ohIKiJ4AaABAg.AM8ka07LXEHAMBTMNlFvU8,reply,UgwkpDsyIyKN4ohIKiJ4AaABAg,2025-10-12T13:09:16.220848,@joeAK7.62,https://yt3.ggpht.com/pseqRhmH5bmixx4faHOf8UAnyXRDt0d-gMlGqvSae6psmtvGUwsMyQwDrEU_7FE-LiCsx02u9g=s48-c-k-c0x00ffffff-no-rj,http://www.youtube.com/@joeAK7.62,UCWXWrqBffUjg2AoM7aMhPQA,​@@thomas.beckerthen why didnt you buy the pana z95b?,​@@thomas.beckerthen why didnt you buy the pana z95b?,53,0,0,,2025-08-24T00:45:58Z,2025-08-24T00:45:58Z,none,True,0.0,neutral,0.0,,,2025-10-12T13:09:25.470042
o9y8lPgmG5E,UgyoOY3Enoy5FDG66op4AaABAg,top_level,,2025-10-12T13:09:16.220848,@brenttitus2134,https://yt3.ggpht.com/ytc/AIdro_mj8z0GFdLtGzj1n2U4dN6m40H92dV8yr8GqcM2wRgczQ=s48-c-k-c0x00ffffff-no-rj,http://www.youtube.com/@brenttitus2134,UCdknFPgv-MB8avbUDccp29g,"Technically, game mode is still broke on both C5/G5. Completely unacceptable at this point. 👎 Glad I held onto my G4.","Technically, game mode is still broke on both C5/G5. Completely unacceptable at this point. 👎 Glad I held onto my G4.",117,54,21,,2025-08-22T20:42:10Z,2025-08-22T20:43:09Z,none,True,0.033,neutral,0.6,,,2025-10-12T13:09:25.470042
o9y8lPgmG5E,UgyoOY3Enoy5FDG66op4AaABAg.AM8SeuRIG_mAM8UCzfh2Pf,reply,UgyoOY3Enoy5FDG66op4AaABAg,2025-10-12T13:09:16.220848,@eugenecia9424,https://yt3.ggpht.com/ytc/AIdro_nBVs9OgvNq1hJYrXxAPm14kYdpcDJQZQNpQn2zAJU=s48-c-k-c0x00ffffff-no-rj,http://www.youtube.com/@eugenecia9424,UC1O6Zl4TJQYo2IDSpVGdZAg,"Just play in game mode on my ps5 pro, no banding, no problem at all, I have 65 inches.","Just play in game mode on my ps5 pro, no banding, no problem at all, I have 65 inches.",86,11,0,,2025-08-22T20:55:42Z,2025-08-22T20:55:42Z,none,True,-0.7,negative,0.4,,,2025-10-12T13:09:25.470042
o9y8lPgmG5E,UgyoOY3Enoy5FDG66op4AaABAg.AM8SeuRIG_mAM8owd8hQVR,reply,UgyoOY3Enoy5FDG66op4AaABAg,2025-10-12T13:09:16.220848,@brenttitus2134,https://yt3.ggpht.com/ytc/AIdro_mj8z0GFdLtGzj1n2U4dN6m40H92dV8yr8GqcM2wRgczQ=s48-c-k-c0x00ffffff-no-rj,http://www.youtube.com/@brenttitus2134,UCdknFPgv-MB8avbUDccp29g,@@eugenecia9424This is false and a lie. The problem is real and still exists in game mode. You are just turning the other cheek or don’t notice it.,@@eugenecia9424This is false and a lie. The problem is real and still exists in game mode. You are just turning the other cheek or don’t notice it.,147,16,0,,2025-08-23T00:05:34Z,2025-08-23T00:05:34Z,none,True,-0.591,negative,0.419,,,2025-10-12T13:09:25.470042
o9y8lPgmG5E,UgyoOY3Enoy5FDG66op4AaABAg.AM8SeuRIG_mAM8u3CDWK7g,reply,UgyoOY3Enoy5FDG66op4AaABAg,2025-10-12T13:09:16.220848,@eugenecia9424,https://yt3.ggpht.com/ytc/AIdro_nBVs9OgvNq1hJYrXxAPm14kYdpcDJQZQNpQn2zAJU=s48-c-k-c0x00ffffff-no-rj,http://www.youtube.com/@eugenecia9424,UC1O6Zl4TJQYo2IDSpVGdZAg,"​@brenttitus2134 I have g5 and no problems, and you know better. 😅😅","​@brenttitus2134 I have g5 and no problems, and you know better. 😅😅",67,14,0,,2025-08-23T00:50:17Z,2025-08-23T00:50:17Z,none,True,-0.25,negative,0.5,,,2025-10-12T13:09:25.470042
o9y8lPgmG5E,UgyoOY3Enoy5FDG66op4AaABAg.AM8SeuRIG_mAM8yDDBdtdu,reply,UgyoOY3Enoy5FDG66op4AaABAg,2025-10-12T13:09:16.220848,@SlimShadyTX,https://yt3.ggpht.com/ytc/AIdro_mbdw79JGc5mlEFb4L_fDS_eNfnZ3cB5TODqlDQLt_5YWQ-7_FLklstw7UB2tMe0YfK6w=s48-c-k-c0x00ffffff-no-rj,http://www.youtube.com/@SlimShadyTX,UCB7HRi3H0OpQA-Gfa2UNiAw,I have a 77” LG G5 and I guess I just don’t notice any of the talked about issues. I can’t believe how amazing this tv is on my ps5 pro. I haven’t even hooked the tv up to the internet as I don’t want any “work around updates” for problems I don’t even see. Stream from Apple TV 4K and game on ps5 pro and can barely pry myself away to tend the other aspects of my life lol!,I have a 77” LG G5 and I guess I just don’t notice any of the talked about issues. I can’t believe how amazing this tv is on my ps5 pro. I haven’t even hooked the tv up to the internet as I don’t want any “work around updates” for problems I don’t even see. Stream from Apple TV 4K and game on ps5 pro and can barely pry myself away to tend the other aspects of my life lol!,374,13,0,,2025-08-23T01:26:36Z,2025-08-23T01:26:36Z,none,True,-0.054,neutral,0.495,"apple, lg",,2025-10-12T13:09:25.471065
o9y8lPgmG5E,UgyoOY3Enoy5FDG66op4AaABAg.AM8SeuRIG_mAM90ZzoarWA,reply,UgyoOY3Enoy5FDG66op4AaABAg,2025-10-12T13:09:16.220848,@brenttitus2134,https://yt3.ggpht.com/ytc/AIdro_mj8z0GFdLtGzj1n2U4dN6m40H92dV8yr8GqcM2wRgczQ=s48-c-k-c0x00ffffff-no-rj,http://www.youtube.com/@brenttitus2134,UCdknFPgv-MB8avbUDccp29g,"⁠​⁠@@eugenecia9424And? I have a G4 that actually has a proper working game mode. G5 still broke. Either it’s a hardware issue or LG simply cannot fix it. We will see if they ever fix it through firmware. If it’s been this long already and provided a workaround using filmmaker mode, seems doubtful. 👎","⁠​⁠@@eugenecia9424And? I have a G4 that actually has a proper working game mode. G5 still broke. Either it’s a hardware issue or LG simply cannot fix it. We will see if they ever fix it through firmware. If it’s been this long already and provided a workaround using filmmaker mode, seems doubtful. 👎",300,9,0,,2025-08-23T01:55:56Z,2025-08-23T01:58:10Z,none,True,-0.604,negative,0.376,lg,,2025-10-12T13:09:25.471065
o9y8lPgmG5E,Ugz9Zth1AXu2Zs6rxhl4AaABAg,top_level,,2025-10-12T13:09:16.220848,@nickchristian3490,https://yt3.ggpht.com/ytc/AIdro_mQmiSd7CsGyM-wSEDLyRZH8axM9obV0SV-Dg_l_hU=s48-c-k-c0x00ffffff-no-rj,http://www.youtube.com/@nickchristian3490,UCY3DwIi-Puqwo4NPaqEdtag,Why has lg not fixed the game optimizer brightness issue?,Why has lg not fixed the game optimizer brightness issue?,57,58,13,,2025-08-22T21:15:58Z,2025-08-22T21:15:58Z,none,True,-0.613,negative,0.3,lg,,2025-10-12T13:09:25.471065
o9y8lPgmG5E,Ugz9Zth1AXu2Zs6rxhl4AaABAg.AM8WXQOafkaAM9O0fsjyMr,reply,Ugz9Zth1AXu2Zs6rxhl4AaABAg,2025-10-12T13:09:16.220848,@GregoryCunningham,https://yt3.ggpht.com/ytc/AIdro_ld3tM5Aq0QAVOxlktp-Ct9AB_eSq_-ZYfTn7bk1OzhuQ=s48-c-k-c0x00ffffff-no-rj,http://www.youtube.com/@GregoryCunningham,UCQgrf9sjAN6-zji5KAh2gOg,"Easy answer, they don&#39;t know how....yet.","Easy answer, they don't know how....yet.",44,2,0,,2025-08-23T05:20:49Z,2025-08-23T05:20:49Z,none,True,0.217,positive,0.833,,,2025-10-12T13:09:25.471065
o9y8lPgmG5E,Ugz9Zth1AXu2Zs6rxhl4AaABAg.AM8WXQOafkaAM9eTtOFG1M,reply,Ugz9Zth1AXu2Zs6rxhl4AaABAg,2025-10-12T13:09:16.220848,@Blafard666,https://yt3.ggpht.com/ytc/AIdro_l4vfwmCGGqQvoUUcRwYsjktlTWuTXnar5L7Cta4cQ=s48-c-k-c0x00ffffff-no-rj,http://www.youtube.com/@Blafard666,UCukbhRg2-YVyAENWdeC26ig,What is the issue ?,What is the issue ?,19,0,0,,2025-08-23T07:53:22Z,2025-08-23T07:53:22Z,none,True,-0.5,negative,0.0,,,2025-10-12T13:09:25.472036
