video_id,search_keyword,search_region,search_order,collected_at,title,description,channel_id,channel_title,published_at,category_id,default_language,default_audio_language,live_broadcast_content,tags,thumbnail_default,thumbnail_medium,thumbnail_high,thumbnail_standard,thumbnail_maxres,view_count,like_count,dislike_count,favorite_count,comment_count,duration_seconds,duration_iso,dimension,definition,caption,licensed_content,content_rating,projection,has_custom_thumbnail,upload_status,privacy_status,license,embeddable,public_stats_viewable,made_for_kids,self_declared_made_for_kids,topic_ids,relevant_topic_ids,topic_categories,recording_date,location_latitude,location_longitude,location_altitude,channel_subscriber_count,channel_video_count,channel_total_view_count,channel_description,channel_country,channel_custom_url,channel_published_at
vl_JdsRPu_Y,samsung tv,US,relevance,2025-10-05T13:42:55.483943,"Best 4K TV 2025 - Budget to Ultimate - Sony, LG, Samsung, Panasonic, Hisense & TCL! (Must Watch!)","Looking for the best 4K TV this year? In this video, we rank and review the top models from Sony, LG, Samsung, TCL, and Hisense — covering everything from budget options to ultimate flagship TVs. Whether you want a bright Mini-LED, a cinematic OLED, or a gaming powerhouse with HDMI 2.1 and high refresh rates, we’ve got you covered. #BestTV2025 #4KTV #SonyTV #LGOLED #SamsungTV #TCLTV #HisenseTV #MiniLED #OLEDTV #GamingTV #hometheater   We break down key features like picture quality, HDR performance, refresh rates, gaming support, and smart TV platforms so you can find the perfect screen for movies, sports, and gaming. From value-packed TVs like TCL and Hisense to premium OLEDs from Sony, LG, and Samsung, this guide will help you choose the right TV for your home theater or living room setup.  ⭐🌟⭐ Top 7 BEST 4K TVs of 2025 | Check Today’s Prices & Deals Here 👇 👇  📺 TCL  QM7K Series QD-Mini LED 4K UHD Google Smart TV Best Premium Mini-LED TV - QLED, 144hz, 240hz Gaming Rate, Anti-Reflective Screen, Bang & Olufsen Audio, Atmos (QM7K, 2025 Model) 👉 https://amzn.to/41VyvNU  📺 Hisense U8N/U8 Series Mini-LED ULED 4K UHD Google Smart TV (U8N) - QLED, Dolby Vision IQ, Dolby Atmos, Full Array Local Dimming Pro, 144Hz Game Mode Pro, Alexa Compatibility 👉 https://amzn.to/4n1LTZn  📺 PANASONIC Z95 Series (2025 Model) 55-inch OLED 4K Ultra HD Smart Fire TV, HDR10+ Adaptive, Dolby Vision IQ, 360 Soundscape Pro, 144Hz Refresh Rate and Hands-Free Alexa 👉 https://amzn.to/48jbJDt  📺 Sony BRAVIA 8 II TV, QD OLED, 4K Smart Google TV, XR Processor with AI Technology, Ultra Slim Design, 120hz Television, Dolby Vision/Atmos, Exclusive Features for PS5, 2025 Model👉 https://amzn.to/4ny3VCj  📺 LG C5 OLED evo AI 4K C5 Series Smart TV w/Dolby Atmos, Dolby Vision, HDR10, AI Super Upscaling 4K, Filmmaker Mode, Wow Orchestra, Alexa Built-in 👉 https://amzn.to/3IgMF5K  📺 Samsung S95F OLED S95F 4K Glare Free Smart TV (2025 Model) NQ4 AI Gen3 Processor, OLED HDR Pro, Motion Xcelerator 164Hz, Dolby Atmos, Samsung Vision AI, Alexa Built-in 👉 https://amzn.to/3VnvzpH  📺 LG G5 OLED evo AI 4K G5 Series Smart TV w/Dolby Atmos, Dolby Vision, HDR10, AI Super Upscaling 4K, Filmmaker Mode, Wow Orchestra, Alexa Built-in 👉 https://amzn.to/42pR9h6   ✮✮✮ Try Amazon Prime 30-Day FREE Trial | Unlimited Fast and Free Two-Day Shipping with Amazon Prime ► https://amzn.to/3oJ04DB ◄ ✮✮✮ Get a FREE 6 Month Amazon Prime Shipping, if you're a STUDENT: ► https://amzn.to/2MlVRZG ◄ ✮✮✮ Try FREE Audible Plus and Get Two Free Audiobooks ► https://amzn.to/3ar4Dxn ◄ ✮✮✮ Try 30 Days Free Amazon Prime Video ► https://amzn.to/36CQnk2 ◄ ✮✮✮ Try Amazon Fresh  ► https://amzn.to/3NXFRcW ◄  Amazon Affiliate Disclosure Notice: Tech Legend is a participant in the Amazon Services LLC Associates Program. As an Amazon Associate, I earn from qualifying purchases made through affiliate links. Your support through these links helps us continue creating content that assists you in making informed decisions.  Business inquiries: techlegendofficial@gmail.com  Subscribe: https://www.youtube.com/techlegend?sub_confirmation=1 Facebook: https://facebook.com/techlegendhq Twitter: https://twitter.com/techlegendhq Instagram: https://www.instagram.com/techlegendhq/ Website: https://www.techlegend.us  ⏱️ Timestamps 0:00 – Intro: Best 4K TVs Ranked from Budget to Flagship 0:40 – TCL QM7K Series QD-Mini LED – Affordable Premium with 288Hz Gaming 2:19 – Hisense U8N Mini-LED – Value Workhorse with Hi-View Engine Pro 3:58 – Panasonic Z95 OLED – Cinematic Accuracy & HDR Brilliance 5:46 – Sony Bravia 8 II OLED – QD-OLED with Acoustic Surface Audio+ 10:05 – LG C5 OLED – The All-Around Gaming & Entertainment TV 13:08 – Samsung S95F OLED – QD-OLED with Best Anti-Glare Screen 14:36 – LG G5 OLED – Brightest OLED Ever with META Technology 17:57 – Final Verdict – Best TV for Value, Gaming, Movies & Overall Winner  Best TV 2025, Best 4K TV 2025, Sony Bravia 8, LG C5 OLED, LG G5 OLED, Samsung S95F OLED, TCL QM7K, Hisense U8N, Best OLED TV 2025, Best Mini-LED TV 2025, Best Gaming TV 2025, Top TVs 2025, Budget TV 2025, Flagship TV 2025, Best Smart TV 2025, Best TV for PS5 2025, Best TV for Xbox Series X 2025, Dolby Vision TV 2025, HDR10+ TV 2025, HDMI 2.1 TV 2025, 144Hz TV, 120Hz TV, Best Home Theater TV 2025, Best TV for Movies 2025, Best TV for Sports 2025, Best Value TV 2025, TCL vs Hisense 2025, Sony vs LG OLED 2025, Samsung vs LG OLED 2025, best 4k tv 2025  Disclaimer: The footage in this video was made with fair use in mind and was created as promotional/educational material. Some of the footage of these products was gathered from multiple sources, including manufacturers, fellow creators, and various other sources. However, if you are the creator or owner of any footage and prefer not to have your content promoted or have any concerns about its use in our video, please contact us at [techlegendofficial@gmail.com], and we will promptly remove it. Thank you!  © All rights reserved by respective owners",UCybLjt4Vp59aSXVVcI2RS1w,Tech Legend,2025-09-17T02:53:13Z,28,en,en,none,"best 4k tv,best 4k tv 2025,best 4k tv for gaming,best 4k tv under 500,best 4k tv for ps5,best 4k tv for movies,best 4k tv for xbox series x,best 4k tv under 1000,best 4k tv on a budget,best 4k tv as computer monitor,best affordable 4k tv,best 4k android tv,best 4k tv budget,best 4k tv brand,Best TV 2025,Best 4K TV 2025,Sony Bravia 8,LG C5 OLED,LG G5 OLED,Samsung S95F OLED,TCL QM7K,Hisense U8N,Best OLED TV 2025,Best Gaming TV 2025,4k,120hz,gaming,pc",https://i.ytimg.com/vi/vl_JdsRPu_Y/default.jpg,https://i.ytimg.com/vi/vl_JdsRPu_Y/mqdefault.jpg,https://i.ytimg.com/vi/vl_JdsRPu_Y/hqdefault.jpg,https://i.ytimg.com/vi/vl_JdsRPu_Y/sddefault.jpg,https://i.ytimg.com/vi/vl_JdsRPu_Y/maxresdefault.jpg,1251,265,0,0,3,1204,PT20M4S,2d,hd,false,True,{},rectangular,False,processed,public,youtube,True,False,False,False,,,https://en.wikipedia.org/wiki/Technology,,,,,109000,127,1917641,"👋 Welcome to our channel, where we provide comprehensive and insightful content on the latest and most advanced technology available in today's market across each category that we review. Our videos cover a broad range of tech products, meticulously reviewing them to help you make informed purchasin",US,@techlegend,2017-09-06T09:14:21Z
uFw76IXAbjI,samsung tv,US,relevance,2025-10-05T13:42:55.483943,Samsung 32” Smart TV at Shocking Price! 💥 Prime Day + GOAT Sale,"Looking for a smart TV upgrade under budget? This Samsung 32"" HD Smart LED TV (2025) is LIVE in the Prime Day + Flipkart GOAT Sale 🔥 ✅ Tizen OS — Fast & Smooth Interface ✅ Crystal Processor | Ultra Clean View ✅ Smart Hub, YouTube, Netflix, Prime Built-in ✅ 2025 Model with Slim Bezel Design ✅ 20W Sound Output | Screen Mirroring ✅ Samsung Warranty + Trust 💯  ⚡ Early buyers are grabbing it for under ₹11K — act fast before stock ends!  #SamsungTV #SmartTV #32InchLED #PrimeDayLiveSale #FlipkartGOATSale #TVDeals #BudgetTV #SamsungTizen #ShoppingGallery",UC3QzMtXej4kiNsijuXyoYgQ,Shopping gallery ,2025-07-12T11:18:26Z,22,en-IN,en-IN,none,,https://i.ytimg.com/vi/uFw76IXAbjI/default.jpg,https://i.ytimg.com/vi/uFw76IXAbjI/mqdefault.jpg,https://i.ytimg.com/vi/uFw76IXAbjI/hqdefault.jpg,https://i.ytimg.com/vi/uFw76IXAbjI/sddefault.jpg,https://i.ytimg.com/vi/uFw76IXAbjI/maxresdefault.jpg,65242,235,0,0,8,11,PT11S,2d,hd,false,False,{},rectangular,False,processed,public,youtube,True,True,False,False,,,https://en.wikipedia.org/wiki/Technology,,,,,3780,1299,3643955,"Loot discounts of over 95% off on top products available on Amazon, Flipkart, Myntra, and Ajio. Don't miss out – this incredible offer is valid for less than 5 minutes!  https://www.youtube.com/channel/UC3QzMtXej4kiNsijuXyoYgQ?sub_confirmation=1 Mail us:  digitalmeadow4@gmail.com ",IN,@shoppinggallery021,2024-06-15T09:46:02.726494Z
t-fh_HIcX8Q,samsung tv,US,relevance,2025-10-05T13:42:55.483943,Samsung TV 32 inch 🔥 UA32H4500FUXXL Unboxing Video #samsung #viral #smarttv #unboxing,Samsung TV 32 inch 🔥 UA32H4500FUXXL Unboxing Video #samsung #viral #smarttv #unboxing   #samsung  #tv,UCsJk98tScVXFWgvfErq_Vzg,Meher Kitchen's Vlogs ,2025-07-23T14:13:50Z,22,en,ru,none,"#samsung,#tv,#unboxing,#smarttv",https://i.ytimg.com/vi/t-fh_HIcX8Q/default.jpg,https://i.ytimg.com/vi/t-fh_HIcX8Q/mqdefault.jpg,https://i.ytimg.com/vi/t-fh_HIcX8Q/hqdefault.jpg,https://i.ytimg.com/vi/t-fh_HIcX8Q/sddefault.jpg,https://i.ytimg.com/vi/t-fh_HIcX8Q/maxresdefault.jpg,66279,769,0,0,26,37,PT37S,2d,hd,false,False,{},rectangular,False,processed,public,youtube,True,True,False,False,,,"https://en.wikipedia.org/wiki/Lifestyle_(sociology),https://en.wikipedia.org/wiki/Technology",,,,,72,9,83532,"🙏 ସ୍ୱାଗତ କରୁଛି Meher Kitchen Vlogs | ସ୍ୱାଦ ଓ ପ୍ରେମରେ ପରିପୂର୍ଣ୍ଣ 🏡ଘରୋଇ ରେସିପି 😋  Meher Kitchen Vlogs କୁ ସ୍ୱାଗତ! 🙏 ଏଠି ଆପଣ ପାଇବେ ସହଜ, ସ୍ୱାସ୍ଥ୍ୟକର ଓ ସ୍ୱାଦିଷ୍ଟ ଘରୋଇ ରେସିପି ଯାହା ଘରେ ସହଜରେ ବନାଇପାରିବେ। ଆମ ଉଦ୍ଦେଶ୍ୟ — ପ୍ରତ୍ୟେକ ବୟସ ଓ ଆବଶ୍ୟକତା ପାଇଁ ଘରୋଇ ଶୈଳୀରେ କିଛି ବିଶେଷ ପ୍ରସ୍ତୁତ କରିବା।  ଆମର ଚ୍ୟାନେଲ୍‌ରେ ଆପଣ ପା",,@meherkitchenvlogs,2020-09-01T11:08:26.731894Z
RgR0HZcKRpM,samsung tv,US,relevance,2025-10-05T13:42:55.483943,2025 S95F: Full Feature Video | Samsung,"Enrich your experience with Samsung Vision AI. Powered by the NQ4 AI Gen3 Processor, the S95F boasts a Glare Free screen with OLED HDR Pro, for unrivalled immersion. Experience Ultimate Gaming Pack with S95F now! 🕹️  For more information, visit http://smsng.co/tvs  #2025NewAITV #VisionAI #4KTV #S95F #OLED #SamsungTV #AITV",UCWwgaK7x0_FR1goeSRazfsQ,Samsung,2025-09-11T01:03:32Z,28,en,en,none,,https://i.ytimg.com/vi/RgR0HZcKRpM/default.jpg,https://i.ytimg.com/vi/RgR0HZcKRpM/mqdefault.jpg,https://i.ytimg.com/vi/RgR0HZcKRpM/hqdefault.jpg,https://i.ytimg.com/vi/RgR0HZcKRpM/sddefault.jpg,https://i.ytimg.com/vi/RgR0HZcKRpM/maxresdefault.jpg,78673,2278,0,0,141,289,PT4M49S,2d,hd,false,False,{},rectangular,False,processed,public,youtube,True,True,False,False,,,"https://en.wikipedia.org/wiki/Technology,https://en.wikipedia.org/wiki/Video_game_culture",,,,,7460000,2344,2915238026,"Welcome to the official Samsung global channel, a place to discover the latest Samsung brand stories, events, innovative technologies, apps & services, B2B solutions, and developer community.   Samsung inspires the world and shapes the future with transformative ideas and technologies. The company i",KR,@samsung,2006-03-11T06:57:39Z
iRv23U1IJw8,samsung tv,US,relevance,2025-10-05T13:42:55.483943,Easily Set Your Own Picture as Wallpaper on Samsung Smart TV,"Learn how to set your own picture as wallpaper on your Samsung Smart TV in just a few simple steps! This easy guide shows you how to personalize your TV background using your favorite photos from USB or SmartThings. Whether you want to display family photos or stunning landscapes, this trick makes your Samsung TV truly yours. Works on most Samsung Smart TVs, including the latest models. Watch till the end for bonus tips to make your display look amazing. Perfect for any Samsung TV user looking to customize their screen!  #SetPictureasSamsungTVWallpaper #ChangeTVWallpaper  how to set your own picture as wallpaper on samsung smart tv, samsung smart tv wallpaper settings, set personal photo as samsung tv wallpaper, change samsung tv background image, samsung tv ambient mode wallpaper, use photos as wallpaper on samsung tv, samsung tv usb photo wallpaper, how to add wallpaper on samsung tv, samsung tv screen customization, samsung tv photo slideshow, samsung tv custom background, samsung smart tv display tips, samsung tv personalization tricks, samsung tv wallpaper from phone, samsung smart tv hindi tutorial",UCzvmBKjsw19OY5RBauMtVpA,MJ Tube,2025-08-03T15:34:14Z,22,en,en,none,"how to set your own picture as wallpaper on samsung smart tv,samsung smart tv wallpaper settings,set personal photo as samsung tv wallpaper,change samsung tv background image,samsung tv ambient mode wallpaper,use photos as wallpaper on samsung tv,how to add wallpaper on samsung tv,samsung tv screen customization,samsung tv photo slideshow,samsung tv custom background,samsung smart tv display tips,samsung tv wallpaper from phone",https://i.ytimg.com/vi/iRv23U1IJw8/default.jpg,https://i.ytimg.com/vi/iRv23U1IJw8/mqdefault.jpg,https://i.ytimg.com/vi/iRv23U1IJw8/hqdefault.jpg,https://i.ytimg.com/vi/iRv23U1IJw8/sddefault.jpg,,3032,15,0,0,1,249,PT4M9S,2d,hd,false,True,{},rectangular,False,processed,public,youtube,True,True,False,False,,,https://en.wikipedia.org/wiki/Technology,,,,,1010000,5917,502878921,"Product Unboxing & Review | How to | Android Apps & Troubleshoot | Windows 10 & Computer Tips, Tricks & Troubleshoot | Health & Fitness | MS Office | Software & Updates | Internet Tips & Troubleshoot | Home/Office Design & Decoration | Ubuntu & Mac Troubleshoot Tips & Tricks |   ==Please do Subscrib",,@mjtube11,2013-08-21T12:39:49Z
LMRBvCTfXlA,samsung tv,US,relevance,2025-10-05T13:42:55.483943,Top 5 BEST Samsung TVs in (2025) || BEST Samsung TVs Reviews,"Top 5 BEST Samsung TVs in (2025)   visit our website for more details : https://trendtechreview.com/  1 🛒► Samsung S95F. ●Amazon: https://amzn.to/4pILH2Z US : https://trendtechreview.com/best-samsung-tvs-2025/ -------------  2 🛒► Samsung QN90F. ●Amazon: https://amzn.to/46pqIur US : https://trendtechreview.com/best-samsung-tvs-2025/ -------------  3🛒 ► Samsung the Frame. ●Amazon: https://amzn.to/46t4yaE US : https://trendtechreview.com/best-samsung-tvs-2025/ -------------  4🛒► Samsung Neo. ●Amazon: https://amzn.to/42dlWO9 US:https://trendtechreview.com/best-samsung-tvs-2025/ -------------  5🛒► Samsung DU7200 ●Amazon: https://amzn.to/4nxKZ7m US:https://trendtechreview.com/best-samsung-tvs-2025/ ------------- ........................................................................................................................... ➤ Don't forget to:      ★ Subscribe      ★ Like      ★ Comment      ★ Share with your friends Hey guys in this video we are going to be checking out the best product . You Can Buy Right Now. We made This List Based On Our Personal Opinion and hours of research & we have listed them based on type of  features and Price. We have Included options for every type of user so whether you are looking for a best budget. If you want more information and updated pricing on the product mentioned be sure to check the links in the description. ----------------- #ad  _________ DISCLAIMER:  Portions of footage found in this video are not original content produced by This channel. Portions of stock footage of products were gathered from multiple sources including, amazon manufacturers, fellow creators, and various other sources. ""All claims, guarantees, and product specifications are provided by the manufacturer or vendor. This Channel cannot be held responsible for these claims, guarantees or specifications""  “As an Amazon Associate, I Earn From Qualifying Purchases.” Thankyou For Watching~  ➤ Copyright Issue:-       If you find any of your copyrighted material in this video, please        leave us a message (gadgetcorner1357@gmail.com)        so we can resolve the issue.© All rights reserved by respective        owners.",UChag9UcohaOhVfpj-TuIa0w,Gadget Corner,2025-10-01T14:00:36Z,28,en-US,en,none,"gadget corner,Top 5 BEST Samsung TVs in 2025,BEST Samsung TVs Reviews,Top 5 BEST Samsung TVs,best samsung tvs 2025,best samsung tvs,top 5 best samsung tvs of 2025,best tvs for ps5 you can buy in 2026,best samsung tv 2025,best samsung tv 2024,best samsung tv,best 65-inch tvs in 2025,best tvs for ps5 2026,the best samsung tv,best samsung,best samsung 4k tv,best samsung oled tv 2025,best samsung 2025 qled,samsung tvs,best samsung oled tv,samsung 2025 tvs",https://i.ytimg.com/vi/LMRBvCTfXlA/default.jpg,https://i.ytimg.com/vi/LMRBvCTfXlA/mqdefault.jpg,https://i.ytimg.com/vi/LMRBvCTfXlA/hqdefault.jpg,https://i.ytimg.com/vi/LMRBvCTfXlA/sddefault.jpg,https://i.ytimg.com/vi/LMRBvCTfXlA/maxresdefault.jpg,697,3,0,0,0,629,PT10M29S,2d,hd,false,True,{},rectangular,False,processed,public,youtube,True,True,False,False,,,https://en.wikipedia.org/wiki/Technology,2025-10-01T00:00:00Z,38.7945952,-106.5348379,0,10500,1024,461775,"About Hello Everyone!  Welcome to gadget corner ""gadget corner  is an ultimate reviews channel of all the best products. 'gadget corner' research and analyze the market, find out the best-selling or recommended products. Check the details information of the manufacturer of that product and see the p",US,@gadgetcorner1357,2022-12-24T17:42:02.963204Z
ElxSK6uKcLE,samsung tv,US,relevance,2025-10-05T13:42:55.483943,"$30,000 Samsung Micro RGB TV 😭👀 #samsungtv",,UCik8xvfR6s8GQ74QNEGNzwg,Tom’s Guide,2025-08-22T17:59:18Z,28,en,en,none,,https://i.ytimg.com/vi/ElxSK6uKcLE/default.jpg,https://i.ytimg.com/vi/ElxSK6uKcLE/mqdefault.jpg,https://i.ytimg.com/vi/ElxSK6uKcLE/hqdefault.jpg,https://i.ytimg.com/vi/ElxSK6uKcLE/sddefault.jpg,https://i.ytimg.com/vi/ElxSK6uKcLE/maxresdefault.jpg,6548,99,0,0,1,16,PT16S,2d,hd,false,True,{},rectangular,False,processed,public,youtube,True,True,False,False,,,"https://en.wikipedia.org/wiki/Lifestyle_(sociology),https://en.wikipedia.org/wiki/Technology",,,,,108000,2521,61197522,"Think of us as your geeky friend who's always on call. From smartphones to cord-cutting to video games, we've got your tech needs covered.   ",US,@tomsguideus,2014-12-18T15:52:53Z
LKdztNtK6G8,samsung tv,US,relevance,2025-10-05T13:42:55.483943,Top 3 Best 32 inch Smart TV Under 15000 Deals on Flipkart Big Billion Days Sale 2025,first samsung led second lg third xiaomi by mi,UCcrlfuLcQGdjYsgePISy-9A,CHROME TECH,2025-09-21T14:58:07Z,28,en-IN,ta,none,"best smart tv under 15000,best smart tv under 15000 in 2025,best 32 inch tv,best 32 inch tv under 15000,best 32 inch smart tv 2025 under 15000,best 32 inch smart tv,best 32 inch smart tv 2025,best tv under 15000,best smat tv 32 inch,32 inch smart tv best 2025",https://i.ytimg.com/vi/LKdztNtK6G8/default.jpg,https://i.ytimg.com/vi/LKdztNtK6G8/mqdefault.jpg,https://i.ytimg.com/vi/LKdztNtK6G8/hqdefault.jpg,https://i.ytimg.com/vi/LKdztNtK6G8/sddefault.jpg,https://i.ytimg.com/vi/LKdztNtK6G8/maxresdefault.jpg,18685,118,0,0,2,23,PT23S,2d,hd,false,True,{},rectangular,False,processed,public,youtube,True,True,False,False,,,https://en.wikipedia.org/wiki/Technology,,,,,86500,2426,32714890,AC TV Laptop Review in Tamil Welcome to our CHROME TECH India Official Channel. Our Videos Contains a Honest Full Review of Air Conditioner LED TV Refrigerator Washing Machine Dishwasher Air Cooler and Stabilizer etc. Including product comparison Buying guide - pros and cons explained for viewers. W,IN,@chrometech,2020-06-28T15:50:27.538535Z
wLQUVIk3eR4,samsung tv,US,relevance,2025-10-05T13:42:55.483943,"OLED Is OVER... Micro RGB TVs Are The New Gold Standard | Samsung 115"" Micro-RGB TV","I got a chance to see the new Samsung Micro RGB TV. The technology behind it is pretty incredible. Using RGB, the 115” TV can achieve 100% of the BT.2020 color space. Will this new TV tech bump OLED down to second place in the TV hierarchy?  💥💥*UPDATED PRICES*💥💥  👉 115"" Samsung Micro RGB TV  https://geni.us/WqvaS  👉 Samsung QN90F Best Buy https://geni.us/i6ABRX Amazon https://geni.us/Bq84yT  👉 Samsung HW-Q990F Soundbar Best Buy https://geni.us/MjvsH95  Amazon https://geni.us/B8lKI  📢  Stay Connected With Me:  Instagram: https://www.instagram.com/justcallme_antwan TikTok : https://www.tiktok.com/@newstufftv Threads: https://www.threads.net/@justcallme_antwan Facebook: https://www.facebook.com/JustCallMeAntwan  00:00 Introduction 00:05 Samsung 115"" QN90F 3:33 Samsung 115"" Micro RGB TV   ============================== Links listed in this video are affiliate links and the content creator may be paid a commission based on purchases made  For Collaboration and Business inquiries, please use the contact information below: 📩  Email: NewStuff@justdoinlife.com",UCnFHXvPvKR0eezgZLYhzlhg,New Stuff TV,2025-08-19T14:22:03Z,28,en,en,none,"New Stuff TV,samsung micro rgb tv,samsung 115 inch tv 2025,hisense rgb mini led,samsung rgb micro led tv,Samsung rgb led TV",https://i.ytimg.com/vi/wLQUVIk3eR4/default.jpg,https://i.ytimg.com/vi/wLQUVIk3eR4/mqdefault.jpg,https://i.ytimg.com/vi/wLQUVIk3eR4/hqdefault.jpg,https://i.ytimg.com/vi/wLQUVIk3eR4/sddefault.jpg,https://i.ytimg.com/vi/wLQUVIk3eR4/maxresdefault.jpg,32442,907,0,0,131,511,PT8M31S,2d,hd,false,True,{},rectangular,False,processed,public,youtube,True,False,False,False,,,https://en.wikipedia.org/wiki/Technology,,,,,168000,1242,34652673,"Down-to-earth video showcases of projectors, TVs, soundbars, and home theater stuff. Enjoy your stay, keep coming back and share with your friends! 🙌  For Collaboration and Business inquiries, please use the contact information below:  📩  Email: NewStuff@justdoinlife.com  ",US,@newstufftv1,2016-09-17T13:56:48Z
9Ts5JJs38qU,samsung tv,US,relevance,2025-10-05T13:42:55.483943,2025 Samsung 85” The Frame Pro 4K unboxing and wall mounting,"Samsung The Frame pro 85 TQ85LS03F mounted on a double plaster wall on the included Samsung slim fit wall mount. I mount TVs for a living in Oslo, Norway, I have mounted thousands of Samsung The frame over the years. Always fun when the new models start arriving.  Enjoy the video. If you have any questions about the TV, the wall mount or the mounting I am happy to answer.  Chapters: 01:53 Whats inside the box 02:09 One connect box pro 03:50 Samsung slim fit wall mount 05:26 Applying the mounts on the TV 07:20 Wall mounting 07:47 Fischer DuoPower 8x40 13:29 Lifting the 85"" 15:16 All done  Samsung the frame 85 Pro montert på dobbel gipsvegg.  Hvis du bor i Oslo området og ønsker hjelp med montering av TV så ta kontakt. Vi monterer alle type skjermer i alle størrelser. Her er priser for montering: https://www.oslotvmontering.no/priser/?collection=priseksempler",UCzVGVs_ridRZmU7qkltuY0w,Oslo Tv-montering AS,2025-07-18T14:00:22Z,22,en,en,none,,https://i.ytimg.com/vi/9Ts5JJs38qU/default.jpg,https://i.ytimg.com/vi/9Ts5JJs38qU/mqdefault.jpg,https://i.ytimg.com/vi/9Ts5JJs38qU/hqdefault.jpg,https://i.ytimg.com/vi/9Ts5JJs38qU/sddefault.jpg,https://i.ytimg.com/vi/9Ts5JJs38qU/maxresdefault.jpg,358527,2445,0,0,90,939,PT15M39S,2d,hd,false,True,{},rectangular,False,processed,public,youtube,True,True,False,False,,,"https://en.wikipedia.org/wiki/Lifestyle_(sociology),https://en.wikipedia.org/wiki/Technology",,,,,26000,102,11498830,"Oslo Tv-montering AS (Oslo Tv-mount inc.) is a Tv-mounting company based in Oslo, Norway.  We do Installations of all kinds of TVs/screens in Oslo area.  This channel is dedicated to TV wall mounting. More wall mounting videos coming soon. If you have any questions about what we do, let me know, I a",NO,@oslotvmontering,2022-04-30T09:47:11.011717Z
