video_id,search_keyword,search_region,search_order,collected_at,title,description,channel_id,channel_title,published_at,category_id,default_language,default_audio_language,live_broadcast_content,tags,thumbnail_default,thumbnail_medium,thumbnail_high,thumbnail_standard,thumbnail_maxres,view_count,like_count,dislike_count,favorite_count,comment_count,duration_seconds,duration_iso,dimension,definition,caption,licensed_content,content_rating,projection,has_custom_thumbnail,upload_status,privacy_status,license,embeddable,public_stats_viewable,made_for_kids,self_declared_made_for_kids,topic_ids,relevant_topic_ids,topic_categories,recording_date,location_latitude,location_longitude,location_altitude,channel_subscriber_count,channel_video_count,channel_total_view_count,channel_description,channel_country,channel_custom_url,channel_published_at
xHG7ZIIiD2Y,samsung tv,US,relevance,2025-10-05T13:42:55.483943,"Samsung QLED Q7F 55” 4K TV Stunning Picture & Smart Features, Smart Quantum Dot, gaming, streaming","Discover the Samsung QLED Q7F 55” (138 cm) 4K TV – a premium television with breathtaking picture quality, vibrant colors, and powerful smart features. In this video, we take a closer look at the design, performance, and everything that makes the Q7F stand out.   55” (138 cm) QLED Display  4K Ultra HD resolution  Quantum Dot technology for rich colors  Smart TV with streaming apps  Sleek, modern design  Whether you’re watching movies, gaming, or streaming your favorite shows, the Samsung Q7F delivers an incredible viewing experience.  👉 Don’t forget to like, comment, and subscribe for more tech reviews!   Experience the Samsung QLED Q7F 55” (138 cm) 4K Smart TV with stunning Quantum Dot technology, vibrant colors, and ultra-clear picture quality. Perfect for movies, gaming, and streaming, the Samsung Q7F brings premium design and powerful performance to your home entertainment.   Samsung QLED Q7F Samsung Q7F review Samsung Q7F 55 inch Samsung 138 cm TV Samsung QLED TV review Samsung 4K QLED Samsung Smart TV Best 55 inch TV 2025 QLED vs OLED Samsung TV unboxing Samsung QLED gaming TV Quantum Dot TV Samsung HDR 4K TV Samsung QLED setup Samsung QLED picture quality",UCqGwwwrASIMQjcX5Uuny7oA,IT show channel,2025-10-02T07:23:39Z,28,en,en,none,,https://i.ytimg.com/vi/xHG7ZIIiD2Y/default.jpg,https://i.ytimg.com/vi/xHG7ZIIiD2Y/mqdefault.jpg,https://i.ytimg.com/vi/xHG7ZIIiD2Y/hqdefault.jpg,https://i.ytimg.com/vi/xHG7ZIIiD2Y/sddefault.jpg,https://i.ytimg.com/vi/xHG7ZIIiD2Y/maxresdefault.jpg,816,3,0,0,0,192,PT3M12S,2d,hd,false,False,{},rectangular,False,processed,public,youtube,True,True,False,False,,,https://en.wikipedia.org/wiki/Technology,,,,,10700,523,7234792,"Welcome to ITshowtech! Get honest, hands-on reviews, unboxings, and first impressions of the latest tech — from laptops and smartphones to smart home gadgets and other cool devices.  Whether you're a tech enthusiast or just looking for your next smart buy, you’re in the right place. I break down eac",HU,@itshowtech,2017-01-31T13:07:47Z
gdriFKO8Ye8,samsung tv,US,relevance,2025-10-05T13:42:55.483943,"Samsung 55"" Crystal 4k UHD ismart TV| UA55UE84AFULXL | #rahulkhurana #samsungtv #4ktv",#rahulkhurana #samsung #4ktv #uhd #smarttv  #samsungtv  Led 55 inch Samsung  Samsung 55inch smart tv  Best Led tv 2025  Best 55 inch smart tv 2025  Best Led tv 📺 2025 under budget  Penasonic 55 inch smart Tv  Haier 55 ich smart tv 2025 #rahulkhurana #samsungtv #bestledtv #55inch #shortsfeed #viralgrowth,UCJ57ypzKvVWlYsmUgJ_p9aw,Rahul Khurana,2025-09-27T18:42:28Z,24,en-IN,hi,none,"Led 55 inch Samsung,Samsung 55inch smart tv,Best Led tv 2025,Best 55 inch smart tv 2025,Best Led tv 📺 2025 under budget,Penasonic 55 inch smart Tv,Haier 55 ich smart tv 2025",https://i.ytimg.com/vi/gdriFKO8Ye8/default.jpg,https://i.ytimg.com/vi/gdriFKO8Ye8/mqdefault.jpg,https://i.ytimg.com/vi/gdriFKO8Ye8/hqdefault.jpg,https://i.ytimg.com/vi/gdriFKO8Ye8/sddefault.jpg,https://i.ytimg.com/vi/gdriFKO8Ye8/maxresdefault.jpg,20649,0,0,0,25,25,PT25S,2d,hd,false,True,{},rectangular,False,processed,public,youtube,True,True,False,False,,,"https://en.wikipedia.org/wiki/Lifestyle_(sociology),https://en.wikipedia.org/wiki/Technology",,,,,7510,291,4117505,"Namaste🙏...    Welcome to my channel, my name is Rahul Khurana and this channel is your  destination for electronic appliance unboxings, in-depth testing, and practical tips and tricks. We bring you honest reviews and hands-on insights to help you make informed decisions. Whether you’re shopping for",IN,@rahulkhurana2,2024-03-05T06:16:50.741922Z
gh2_6BbMHu0,samsung tv,US,relevance,2025-10-05T13:42:55.483943,Samsung 75 inch QLED TV latest 2025 model#trending #shortvideo #shorts,,UCfq14pd2JgOw_-VQ-jkvetA,ATS CRITIQUES,2025-08-23T07:44:32Z,28,en-IN,en-IN,none,,https://i.ytimg.com/vi/gh2_6BbMHu0/default.jpg,https://i.ytimg.com/vi/gh2_6BbMHu0/mqdefault.jpg,https://i.ytimg.com/vi/gh2_6BbMHu0/hqdefault.jpg,https://i.ytimg.com/vi/gh2_6BbMHu0/sddefault.jpg,https://i.ytimg.com/vi/gh2_6BbMHu0/maxresdefault.jpg,54537,688,0,0,7,28,PT28S,2d,hd,false,True,{},rectangular,False,processed,public,youtube,True,True,False,False,,,https://en.wikipedia.org/wiki/Technology,,,,,5830,296,6397039,"Hey Guys! Welcome to my channel* Join with me to have fun and get knowledge in audio products and home appliances ..(subscribe and cheers🔥)  ATS CRITIQUES is a Tech Review News Portal that gives users information, tools, and advice to help them get the most out of the Tech. For business inquiries:",IN,@ats-critiques,2022-01-10T13:47:52.454421Z
wWuxYEPovv0,samsung tv,US,relevance,2025-10-05T13:42:55.483943,How To Connect Phone To Samsung TV - Step By Step,"Learn how to connect phone to samsung tv in this video. For more videos like this then please leave a like.  GuideRealm is the home of technology-based how-to's, guides & tips.  Equipment & tools I use (affiliate links): Tubebuddy (YouTube tools): https://www.tubebuddy.com/pricing?a=Tucker Microphone: https://amzn.to/43H8dAy Laptop: https://amzn.to/3ITBwom PC: https://amzn.to/3MPNgJL  Some of the links in this description are affiliate links. As an Amazon Associate and a partner of other affiliate programs, this means I will earn a small commission from qualifying purchases through these links.  Please like, subscribe, and comment.  GuideRealm",UCWdCOEFAsnzUJQgQOw3vu5Q,GuideRealm,2025-09-07T21:01:01Z,26,en,en,none,"how to connect phone to samsung tv,connect phone to samsung tv",https://i.ytimg.com/vi/wWuxYEPovv0/default.jpg,https://i.ytimg.com/vi/wWuxYEPovv0/mqdefault.jpg,https://i.ytimg.com/vi/wWuxYEPovv0/hqdefault.jpg,https://i.ytimg.com/vi/wWuxYEPovv0/sddefault.jpg,https://i.ytimg.com/vi/wWuxYEPovv0/maxresdefault.jpg,1638,10,0,0,2,43,PT43S,2d,hd,false,True,{},rectangular,False,processed,public,youtube,True,True,False,False,,,https://en.wikipedia.org/wiki/Technology,,,,,1620000,13120,539857676,"Welcome to GuideRealm - Your go-to destination for technology-based how-to's, guides & tips. ",US,@guiderealmvideos,2012-11-03T17:03:50Z
JoJoiyuTHbs,samsung tv,US,relevance,2025-10-05T13:42:55.483943,"98"" Samsung TV Installation Mounting & Screen Peel!","In this video, we’re unboxing and installing a massive 98-inch Samsung TV in an office space! 🎉 Watch as the Simply AV team carefully unbox this stunning display and mount it securely on the wall for the perfect professional setup.  Whether you’re upgrading your meeting room, creating a wow factor for clients, or just curious about how a screen this big gets installed, this video will take you through the full process step by step.  At SimplyAV.co.uk, we specialize in professional AV solutions - from TVs and projectors to complete office installations. If you’re considering a similar upgrade, get in touch with us today.  👉 Don’t forget to like, comment, and subscribe for more tech installations, unboxings, and reviews!  Join this channel to get access to perks: https://www.youtube.com/channel/UC8BSZ6Kq4LIN9RZQ7QM-8tQ/join",UC8BSZ6Kq4LIN9RZQ7QM-8tQ,Simply AV,2025-09-20T08:31:00Z,26,en,zxx,none,"QLED,OLED,Neo QLED,OLED TV,Qled TV,Samsung,Samsung TV,Home Cinema,Projector,Home Audio,Simply AV,#Samsung,#SamsungGalaxy,#SamsungLife,#SamsungLovers,#SamsungAddict,#SamsungFans,#SamsungElectronics,#SamsungCommunity,#SamsungStyle,#SamsungVibes,#SamsungWorld,#SamsungUnboxing,#SamsungDaily,#SamsungExperience,#SamsungFamily,#SamsungInnovation,#SamsungTech,#SamsungSmartTV,#SamsungUpgrade,#SamsungLove,#SamsungPassion,#SamsungCrew,#SamsungHub,#SamsungDevices",https://i.ytimg.com/vi/JoJoiyuTHbs/default.jpg,https://i.ytimg.com/vi/JoJoiyuTHbs/mqdefault.jpg,https://i.ytimg.com/vi/JoJoiyuTHbs/hqdefault.jpg,https://i.ytimg.com/vi/JoJoiyuTHbs/sddefault.jpg,https://i.ytimg.com/vi/JoJoiyuTHbs/maxresdefault.jpg,1156,23,0,0,0,30,PT30S,2d,hd,false,True,{},rectangular,False,processed,public,youtube,True,True,False,False,,,https://en.wikipedia.org/wiki/Technology,2025-09-19T00:00:00Z,51.5072178,-0.1275862,0,117000,679,128813320,"Website: www.simplyav.co.uk  WhatsApp or Call: 07780350222  Email: sales@simplyav.co.uk  From consultation to installation, we take care of everything. Subscribe for expert advice, inspiration, and behind-the-scenes content.",GB,@16ktv,2014-11-14T21:39:28Z
vev4acQN-zM,samsung tv,US,relevance,2025-10-05T13:42:55.483943,How To Fix AirPlay Not Working On Samsung TV - Step By Steo,"Learn how to fix airplay not working on samsung tv in this video. For more videos like this then please leave a like.  GuideRealm is the home of technology-based how-to's, guides & tips.  Equipment & tools I use (affiliate links): Tubebuddy (YouTube tools): https://www.tubebuddy.com/pricing?a=Tucker Microphone: https://amzn.to/43H8dAy Laptop: https://amzn.to/3ITBwom PC: https://amzn.to/3MPNgJL  Some of the links in this description are affiliate links. As an Amazon Associate and a partner of other affiliate programs, this means I will earn a small commission from qualifying purchases through these links.  Please like, subscribe, and comment.  GuideRealm",UCWdCOEFAsnzUJQgQOw3vu5Q,GuideRealm,2025-09-19T04:01:13Z,26,en,en,none,"how to fix airplay not working on samsung tv,airplay not working on samsung tv",https://i.ytimg.com/vi/vev4acQN-zM/default.jpg,https://i.ytimg.com/vi/vev4acQN-zM/mqdefault.jpg,https://i.ytimg.com/vi/vev4acQN-zM/hqdefault.jpg,https://i.ytimg.com/vi/vev4acQN-zM/sddefault.jpg,https://i.ytimg.com/vi/vev4acQN-zM/maxresdefault.jpg,504,3,0,0,0,94,PT1M34S,2d,hd,false,True,{},rectangular,False,processed,public,youtube,True,True,False,False,,,https://en.wikipedia.org/wiki/Technology,,,,,1620000,13120,539857676,"Welcome to GuideRealm - Your go-to destination for technology-based how-to's, guides & tips. ",US,@guiderealmvideos,2012-11-03T17:03:50Z
qO_xd63nbJM,samsung tv,US,relevance,2025-10-05T13:42:55.483943,"Best Smart TV For Everyone🔥Best 32"" 43"" 55"" Smart TV In BBD & Amazon Great Indian Festival Sale","The best 43 inch 4k google smart tv under rs.20000/-, the top best 4k smart tv under rs.20000/-, as well as the best 43 inch 4k android smart tv under 20000 in India 2025, Best 43 inch 4k smart google tv in 2025, have been comprehensively reviewed in the video.  Best 4K Smart TV Under 20000🔥Best 4K Google Smart TV🔥Best 43 Inch 4K Smart TV Under 20000 in India 2025  ✅✅ Buying Links of Best TV 32 inch ✅✅   ➡️ Samsung 80 cm (32 inches) - https://amzn.to/3IctyJZ  ➡️ VW 80 cm (32 inches) - https://amzn.to/46wqYrn  ✅✅ Buying Links of Best TV 43 inch ✅✅   ➡️ Redmi Xiaomi 108 cm (43 inch) F Series - https://amzn.to/46hWqbJ  ➡️ Samsung 108 cm (43 inches) - https://amzn.to/4gDhZsd  ✅✅ Buying Links of Best TV 55 inch ✅✅   ➡️ TCL 139 cm (55 inches) - https://amzn.to/4gk9n9C  ➡️ Xiaomi 138 cm (55 inch) FX Pro QLED - https://amzn.to/4npu863  ✅✅ Buying Links of Best TV 65 inch ✅✅   ➡️ Sony 164 cm (65 inches) BRAVIA 2 - https://amzn.to/3VIeBST  ➡️ TCL 164 cm (65 inches) 4K Ultra HD - https://amzn.to/4nqs1yM  The Best 43 Inch 4K Google Smart Tv Under 20000, The Best 43 Inch Qled 4K Smart TV, The Best 43 Inch Android Smart TV Under Rs 20000, Best 43 Inch Google Smart TV Under Rs 20000, As Well As the best 43 Inch 4K Google Smart Tv Under 20000 in 2025, Latest 4K Smart TV, 43 Inch Google Smart Led Tv Under 20000, Best smart TV Under 20000, Budget 4K Smart TV Under 20000 in 2025, Best 5 Google TV Under 20000, Best 4K Smart TV Under 20000 in 2025  Topics covered in this video -   best 43 inch 4k tv best 43 inch 4k tv in india best 43 inch 4k tv in india 2025 best 43 inch 4k smart tv in india best 43 inch 4k smart tv  best 43 inch 4k smart tv in india 2025 best 43 inch 4k smart tv 2025 best 43 inch 4k android tv best 43 inch 4k android tv in india best 43 inch 4k android tv 2025 best 43 inch 4k android tv in india 2025 best 43 inch 4k google tv best 43 inch 4k google tv in india best 43 inch 4k google tv 2025 best 43 inch 4k google tv in india 2025 best 43 inch 4k tv 2025 best 43 inch 4k tv 2025 under 30000 best 43 inch 4k tv 2025 under 20000 best 43 inch 4k tv 2025 under 25000 best 43 inch 4k tv under 30000 best 43 inch 4k android tv 2025 best 43 inch 4k budget tv 4k tv 43 inch best buy best 43 inch 4k tv under 20000 best 43 inch 4k tv under 25000 best 43 inch 4k tv under 30000 Sony best 43 inch 4k tv best 43 inch 4k tv Lg best smart tv 2025 43 inch best android tv 2025 43 inch best google tv 2025 43 inch best 43 inches 4k tv best 43 inches 4k tv in india best 43 inches 4k tv in india 2025 best 43 inches 4k smart tv in india best 43 inches 4k smart tv  best 43 inches 4k smart tv in india 2025 best 43 inches 4k smart tv 2025  NOTE: ALL THE IMAGES/PICTURES SHOWN IN THE VIDEO BELONGS TO THE RESPECTED OWNERS AND NOT ME. I AM NOT THE OWNER OF ANY PICTURES SHOWED IN THE VIDEO  ★ Copyright Disclaimer Under Section 107 of the Copyright Act 1976, allowance is made for ""fair use"" for purposes such as criticism, comment, news reporting, teaching, scholarship, and research. Fair use is a use permitted by copyright statute that might otherwise be infringing. Non-profit, educational, or personal use tips the balance in favor of fair use Note- “Amazon and the Amazon logo are trademarks of Amazon.com, Inc. or its affiliates.”  ""We are a part of Amazon LLC Associates Program, an affiliate advertising program""  ""CERTAIN CONTENT THAT APPEARS ON THIS SITE, COMES FROM AMAZON SELLER SERVICES PRIVATE LIMITED. THIS CONTENT IS PROVIDED 'AS IS' AND IS SUBJECT TO CHANGE OR REMOVAL AT ANY TIME.""",UChTj0XvlEtuE9GgszbBkbfQ,Ten Tech,2025-09-11T13:44:54Z,22,en,en,none,"32 inch tv in bbd sale,43 inch tv in bbd sale,55 inch tv in bbd sale,best tv to buy in flipkart bbd sale,best tv deals,tv deals in amazon sale and flipkart sale,bes tv under 10000,best tv under 20000,best tv under 30000,best 32 inch tv,best 43 inch tv,best 55 inch smart tv,to deals on amazon,tv deals on flipkart,tv to buy in this festival sale,best 43 inch 4k tv,best 4k tv,latest 4k tv 43 inch,43 inch 4k tv,samsung smart tv,best led tv,android smart tv",https://i.ytimg.com/vi/qO_xd63nbJM/default.jpg,https://i.ytimg.com/vi/qO_xd63nbJM/mqdefault.jpg,https://i.ytimg.com/vi/qO_xd63nbJM/hqdefault.jpg,https://i.ytimg.com/vi/qO_xd63nbJM/sddefault.jpg,https://i.ytimg.com/vi/qO_xd63nbJM/maxresdefault.jpg,31344,173,0,0,11,290,PT4M50S,2d,hd,false,True,{},rectangular,False,processed,public,youtube,True,True,False,False,,,https://en.wikipedia.org/wiki/Technology,,,,,13600,910,5824016,Contact us at - contact.technick@gmail.com,IN,@10tech_official,2023-11-14T11:29:24.585075Z
qJsMT2jn6s0,samsung tv,US,relevance,2025-10-05T13:42:55.947636,How to Mirror iPad Screen to Samsung TV | iPad Wireless Display | Screen Mirroring,"How to Mirror iPad Screen to Samsung TV | iPad Wireless Display | Screen Mirroring  Learn how to screen mirror any Apple iPad to a Samsung TV, Free and wireless, without downloading any 3rd-party apps on your iPad.   To Screen Mirror an iPad to a Samsung TV, everything is built in, and we will be using Apple's Screen Mirroring Feature.  Join YT: https://www.youtube.com/channel/UChTVX3EkwfbhovaVaPIUgmQ/join  More about Screen Mirroring: https://howscreenmirroring.net/  Reddit Community for more help: https://www.reddit.com/r/HowtoScreenMirroring/  Amazon Affiliate: Chromecast: https://amzn.to/3FeiE00 Roku TV: https://amzn.to/39XIh6K iPhone: https://amzn.to/3B4GGYB Gaming Monitors: https://amzn.to/3a2dANH Sony Cameras: https://amzn.to/2YdbwQd  Thank you so very much for your support, like, comment and subscribe!  Social Accounts:  Instagram ► https://www.instagram.com/rizisuper/ Facebook Page ► https://www.fb.com/rizisuper Channel ► https://www.youtube.com/c/rizisuper Twitter ► https://twitter.com/rizisuperYT  Music: Track: Burst — Land of Fire [Audio Library Release] Music provided by Audio Library Plus Watch:     https://youtu.be/8QW7eYTDHGA Free Download / Stream: https://alplus.io/burst",UChTVX3EkwfbhovaVaPIUgmQ,rizisuper,2025-09-11T18:55:43Z,26,en-GB,en,none,"rizisuper,How to Mirror iPad Screen to Samsung TV,iPad Wireless Display,Screen Mirroring,Screen Mirroring iPad to Samsung TV,Samsung TV mirroring with iPad,iPad screen mirroring with Samsung TV,How to Screen Mirror Apple iPad to Samsung TV,iPad wireless display,Wireless display with ipad,how to connect iPad to tv,how to connect iPad display to tv,how to mirror ipad screen to tv,how to screen cast ipad to tv,how to mirror ipad to samsung tv free,ipad to tv free",https://i.ytimg.com/vi/qJsMT2jn6s0/default.jpg,https://i.ytimg.com/vi/qJsMT2jn6s0/mqdefault.jpg,https://i.ytimg.com/vi/qJsMT2jn6s0/hqdefault.jpg,https://i.ytimg.com/vi/qJsMT2jn6s0/sddefault.jpg,https://i.ytimg.com/vi/qJsMT2jn6s0/maxresdefault.jpg,347,4,0,0,0,386,PT6M26S,2d,hd,false,True,{},rectangular,False,processed,public,youtube,True,True,False,False,,,"https://en.wikipedia.org/wiki/Lifestyle_(sociology),https://en.wikipedia.org/wiki/Technology",,,,,77800,259,66101840,"Hey there, thanks for visiting my channel. I'm a tech YouTuber, mainly Android and Apple. I make videos regarding various features of Android and Apple.  Thank you so much for your support.  For business enquiries: contact.rizisuper@gmail.com   Official Site for All the Screen Mirroring Content: htt",,@rizisuper,2011-08-01T04:41:39Z
Tsgbrzej0GM,samsung tv,US,relevance,2025-10-05T13:42:55.947636,Use Storage Share on your Samsung TV,"Storage Share makes it easy to access your files from your Samsung Galaxy devices on your  Samsung Smart TV. View your photos, videos and other files on a bigger screen without switching between devices.   To use Storage Share, ensure that all devices are signed into the same Samsung Account, the Storage Share setting is switched on for each device and that both Bluetooth and Wi-Fi are enabled.   To find your Samsung product's user manual, head to https://www.samsung.com/au/support/user-manuals-and-guide/",UChO7xlACgCNpOOIA3Wk6MVQ,Samsung Australia,2025-09-24T03:41:56Z,28,en,en-GB,none,"storage share,samsung tv,play photos from phone,play videos on tv,share files samsung tv,samsung television,Australia",https://i.ytimg.com/vi/Tsgbrzej0GM/default.jpg,https://i.ytimg.com/vi/Tsgbrzej0GM/mqdefault.jpg,https://i.ytimg.com/vi/Tsgbrzej0GM/hqdefault.jpg,https://i.ytimg.com/vi/Tsgbrzej0GM/sddefault.jpg,https://i.ytimg.com/vi/Tsgbrzej0GM/maxresdefault.jpg,424,4,0,0,0,73,PT1M13S,2d,hd,false,True,{},rectangular,False,processed,public,youtube,True,True,False,False,,,https://en.wikipedia.org/wiki/Technology,,,,,118000,1760,59396910,"Welcome to the official channel of Samsung Australia, where you can find the latest videos about our company and products. Subscribe to our channel so you will be the first to see Samsung product news, releases and promotions.",AU,@samsungaustralia,2010-03-24T23:25:14Z
yBuli7vp9xc,samsung tv,US,relevance,2025-10-05T13:42:55.947636,How To Fix Screen Mirroring Not Working On Samsung TV - Step By Step,"Learn how to fix screen mirroring not working on samsung tv in this video. For more videos like this then please leave a like.  GuideRealm is the home of technology-based how-to's, guides & tips.  Equipment & tools I use (affiliate links): Tubebuddy (YouTube tools): https://www.tubebuddy.com/pricing?a=Tucker Microphone: https://amzn.to/43H8dAy Laptop: https://amzn.to/3ITBwom PC: https://amzn.to/3MPNgJL  Some of the links in this description are affiliate links. As an Amazon Associate and a partner of other affiliate programs, this means I will earn a small commission from qualifying purchases through these links.  Please like, subscribe, and comment.  GuideRealm",UCWdCOEFAsnzUJQgQOw3vu5Q,GuideRealm,2025-09-19T18:01:05Z,26,en,en,none,"how to fix screen mirroring not working on samsung tv,screen mirroring not working on samsung tv",https://i.ytimg.com/vi/yBuli7vp9xc/default.jpg,https://i.ytimg.com/vi/yBuli7vp9xc/mqdefault.jpg,https://i.ytimg.com/vi/yBuli7vp9xc/hqdefault.jpg,https://i.ytimg.com/vi/yBuli7vp9xc/sddefault.jpg,https://i.ytimg.com/vi/yBuli7vp9xc/maxresdefault.jpg,953,5,0,0,1,81,PT1M21S,2d,hd,false,True,{},rectangular,False,processed,public,youtube,True,True,False,False,,,https://en.wikipedia.org/wiki/Technology,,,,,1620000,13120,539857676,"Welcome to GuideRealm - Your go-to destination for technology-based how-to's, guides & tips. ",US,@guiderealmvideos,2012-11-03T17:03:50Z
