video_id,search_keyword,search_region,search_order,collected_at,title,description,channel_id,channel_title,published_at,category_id,default_language,default_audio_language,live_broadcast_content,tags,thumbnail_default,thumbnail_medium,thumbnail_high,thumbnail_standard,thumbnail_maxres,view_count,like_count,dislike_count,favorite_count,comment_count,duration_seconds,duration_iso,dimension,definition,caption,licensed_content,content_rating,projection,has_custom_thumbnail,upload_status,privacy_status,license,embeddable,public_stats_viewable,made_for_kids,self_declared_made_for_kids,topic_ids,relevant_topic_ids,topic_categories,recording_date,location_latitude,location_longitude,location_altitude,channel_subscriber_count,channel_video_count,channel_total_view_count,channel_description,channel_country,channel_custom_url,channel_published_at
k5k1tNPmVsw,Samsung OLED,US,relevance,2025-10-12T13:08:19.590224,Samsung OLED x T1 Brand Film (Glare Free),"Wait, I thought it was ‘Faker’ on the screen! Stop @WING from distracting the gameplay, with Glare Free.  Discover more at https://www.samsung.com/au/  #TogetherAs1 #T1 #BEATPELLAHOUSE #OLED #GamingMonitor #OLEDTV #Gaming #TeamOdyssey #TeamSamsungTV #Samsung",UChO7xlACgCNpOOIA3Wk6MVQ,Samsung Australia,2025-08-12T09:01:16Z,28,en,en-GB,none,,https://i.ytimg.com/vi/k5k1tNPmVsw/default.jpg,https://i.ytimg.com/vi/k5k1tNPmVsw/mqdefault.jpg,https://i.ytimg.com/vi/k5k1tNPmVsw/hqdefault.jpg,https://i.ytimg.com/vi/k5k1tNPmVsw/sddefault.jpg,https://i.ytimg.com/vi/k5k1tNPmVsw/maxresdefault.jpg,2716,99,0,0,0,23,PT23S,2d,hd,false,True,{},rectangular,False,processed,public,youtube,True,True,False,False,,,https://en.wikipedia.org/wiki/Technology,,,,,118000,1766,60287535,"Welcome to the official channel of Samsung Australia, where you can find the latest videos about our company and products. Subscribe to our channel so you will be the first to see Samsung product news, releases and promotions.",AU,@samsungaustralia,2010-03-24T23:25:14Z
bj5t5KcbbIQ,Samsung OLED,US,relevance,2025-10-12T13:08:19.590224,Bắt trọn nhịp nhà vô địch – dẫn lối chiến thắng cùng OLED TV & Odyssey OLED | Samsung,"⚡ G-Sync Compatible + FreeSync Premium Pro combat mượt mà, không gián đoạn. 🔥 Đam mê luôn rực cháy, nhưng vẫn đủ “cold head” để outplay mọi tình huống. 🎒 Back To School: nhập mã BTS_ODYSSEY25 giảm tới 41%.  👉 Khám phá ngay: http://spr.ly/6055AyNk1 #Samsung #SamsungOdyssey  #T1 #TogetherAs1",UCSGD1TbYm5ZEZtGKQlkZ69A,Samsung Vietnam,2025-09-10T06:42:44Z,24,vi,vi,none,,https://i.ytimg.com/vi/bj5t5KcbbIQ/default.jpg,https://i.ytimg.com/vi/bj5t5KcbbIQ/mqdefault.jpg,https://i.ytimg.com/vi/bj5t5KcbbIQ/hqdefault.jpg,https://i.ytimg.com/vi/bj5t5KcbbIQ/sddefault.jpg,https://i.ytimg.com/vi/bj5t5KcbbIQ/maxresdefault.jpg,167515,12,0,0,0,78,PT1M18S,2d,hd,false,False,{},rectangular,False,processed,public,youtube,True,True,False,False,,,https://en.wikipedia.org/wiki/Technology,,,,,2270000,3380,4096070223,"Chào mừng bạn đến với trang chính thức của Samsung Việt Nam. Hãy đăng ký theo dấu (subscribe) chúng tôi ngay, để là người đầu tiên được xem các video mới nhất về Samsung, sản phẩm hàng đầu và các chương trình khuyến mãi của chúng tôi.",VN,@samsungvietnam,2011-02-17T07:06:48Z
6vbB_HAYb9g,Samsung OLED,US,relevance,2025-10-12T13:08:19.590224,LG G5 vs Samsung S95F vs Sony BRAVIA 8 II: Best OLED For You in 2025?,"Get the Sony BRAVIA 8 II: https://www.rtings.com/afflink/Aq8AAWhYAAA= Get the Samsung S95F: https://www.rtings.com/afflink/Aq8AAVoUAAA= Get the LG G5: https://www.rtings.com/afflink/Aq8AAVoZAAA=  The LG G5 OLED, Samsung S95F OLED and Sony BRAVIA 8 II are three of the best 2025 TVs available. All have distinct strengths: the Samsung looks the most dramatic, the LG is the most balanced all‑rounder, and the Sony is a specialist aimed at film purists who can overlook its price and gaming shortcomings. But which one is the best pick for you? Stay tuned...   Sony BRAVIA 8 II: https://www.rtings.com/tv/reviews/sony/bravia-8-ii-oled   Samsung S95F:  https://www.rtings.com/tv/reviews/samsung/s95f-oled   LG G5 OLED:  https://www.rtings.com/tv/reviews/lg/g5-oled   Vote for our next TV review: https://www.rtings.com/vote/tv    Follow our 100+ TV (and 3 Monitor!) Longevity Test @RTINGScomRD   Support Us: https://www.rtings.com/insider  Careers: https://grnh.se/eb4de72f7us  Don't miss a beat - join our newsletters: https://www.rtings.com/newsletters   Join our Discord server: https://discord.gg/UpwKBSvc54    Follow Us:  https://www.facebook.com/rtingscom  https://twitter.com/rtingsdotcom  https://www.instagram.com/rtingsdotcom/   ---  00:00 Intro 00:54 Design & Core Features  02:36 HDR Brightness  03:30 SDR Brightness  04:23 Reflections  05:43 Colors  07:58 Processing  09:10 Gaming  10:53 Price snapshot – July 2025  11:13 Who should buy the Samsung S95F?  12:04 Who should buy the LG G5?  12:53 Who should buy Sony BRAVIA 8 II?  13:51 Outro  ---   We make money directly from you via insider access on our website (which gives you access to extra features: https://www.rtings.com/insider) and when you buy a product after clicking a link to a retailer. Learn more about how we work: https://www.rtings.com/company/about-us",UCAi6GKtTPoYxUheIbVhnwqw,RTINGS Home Theater,2025-07-31T17:00:15Z,28,en,en-CA,none,"TV,television,showdown,review,sony,samsung,LG,G5,S95F,BRAVIA 8 II,Flagship,2025,Best TV's,comparison,rtings",https://i.ytimg.com/vi/6vbB_HAYb9g/default.jpg,https://i.ytimg.com/vi/6vbB_HAYb9g/mqdefault.jpg,https://i.ytimg.com/vi/6vbB_HAYb9g/hqdefault.jpg,https://i.ytimg.com/vi/6vbB_HAYb9g/sddefault.jpg,https://i.ytimg.com/vi/6vbB_HAYb9g/maxresdefault.jpg,131587,2410,0,0,590,879,PT14M39S,2d,hd,false,True,{},rectangular,False,processed,public,youtube,True,True,False,False,,,https://en.wikipedia.org/wiki/Technology,,,,,390000,588,78454374,FIND THE BEST PRODUCT FOR YOUR NEEDS! Straight to the point buying recommendations on TVs. We purchase our own products and put them under the same test bench so that you can compare the results easily. No cherry-picked units sent by brands. No ads. Only real tests.,,@rtingsdotcom,2011-09-27T02:20:52Z
mmngyVQd4wM,Samsung OLED,US,relevance,2025-10-12T13:08:19.590224,OLED TEST | Amazing Dolby Vision 4K HDR 60fps,"OLED TEST | Amazing Dolby Vision 4K HDR 60fps, 4K Video ULTRA HD (8K / 4K TV TEST), featuring Meditation music and relaxing background music for stress relief, soothing, and deep sleep. You can also use our content to test your screen devices, such as 4K HDR TV, 8K TV, OLED TV, QLED TV, 12K TV, Samsung TV, LG HDR TV, LG C1, C2, Sony Bravia HDR TV, Hisense TV, Philips TV, Apple XDR TV, iPhone Pro MAX, Xiaomi, POCO, Samsung Galaxy, Huawei, and more. We recommend testing your data connection capacity to fully enjoy the bandwidth.  👉More 4K Videos: https://www.youtube.com/channel/UCRauo6y9tx0FB0OLLtqLA-g?gsub_confirmation=1 👉More Relaxing Music Videos:https://www.youtube.com/playlist? list=PL8RfAAdr4qWRMh8FwfzI8ie9D4pDo2SpV 👉More 8K HDR Videos(4320p): https://www.youtube.com/playlist?list=PL8RfAAdr4qWRFCj7KtdkmYExwaNZwqR-W  🌼 Experience Nature Like Never Before! 🌼   Welcome to our channel! Here, we bring you! Stunning 8K Video and 4K Video ULTRA HD of nature and animals set to calming music. This channel is dedicated to offering you a peaceful escape from the daily hustle and bustle. Whether you're looking to relax, meditate, or simply enjoy the beauty of the world around you, our videos are designed to soothe your mind and spirit. Join our community and subscribe for your daily dose of tranquility!  🔶Optimal Viewing Tips: ✅Use updated browsers like Google Chrome and Microsoft Edge to view at 8K Resolution.  ✅Enable the HDR option in your settings on your devices. ✅Use an HDR-compatible device for the best experience. ✅Be sure to watch the video to the end to enjoy its full potential. ✅Maximize resolution for unparalleled detail.               --------------------------------------------------------------------- 🔶Join this channel to access the perk by clicking on the link: https://www.youtube.com/channel/UCRauo6y9tx0FB0OLLtqLA-g/join               --------------------------------------------------------------------- 😀Please like, comment, and share your thoughts on our content.  😀Click the notification bell to be the first to view new releases.  Most Popular 4K Videos: ▶️https://youtu.be/HZ8VF0EdITk ▶️https://youtu.be/RIE_oRNp1-8 ▶️https://youtu.be/s6Zqrcp4Ps0 ▶️https://youtu.be/ldvY1477YP4  Most Popular 4K HDR Videos (Dolby Atmos): ▶️https://youtu.be/cHozGTLDTpk ▶️https://youtu.be/Bh2kR5kSbqU ▶️https://youtu.be/o093-99rEmE ▶️https://youtu.be/MZ815dveFOg ▶️https://youtu.be/qZBXyr1ph80 ▶️https://youtu.be/9mQbsIoKHtU  🎙️Music Attribution: Use Paid Music.  📸Thumbnail: Use Paid Stock Photo.  ▶© Disclaimer: 》All the Video Footage used in this video is licensed by 4K Video ULTRA HD. 》Video Footage Copyright Under Standard License. 》I tried to present the Video in a new way by changing the color of the Video. I have done High color correction, Special Effects, Color changing, Log and Raw video editing, HDR color Setting, merged files & 8K Export files, etc. ------------ ▶ All Credits Goes to YouTube. -------------- 4к видео, 4к видео 120 fps, видео 4к, 4k hdr, hdr, 8k hdr, 8k video, dolby vision, 16k video, 16k hdr, 12k hdr 60fps, 4k, 12k video, 12k hdr, 12k hdr dolby vision,8k hdr 60fps,12k, hdr 4k 60fps,4k hdr 60fps dolby vision, real 4k hdr 60fps,8k video ultra hd,8k,4k hdr video,12k video ultra hd,8k 60fps,12k hdr video,lg 8k hdr,8k demo,12k hdr 120fps,16k,8k hdr demo,qled 8k hdr,60fps,nuture,4k 60fps,12k video hdr,hlg, 8к видео, 8к видео 120 fps, видео 8к,16к видео 8к, 16к видео, видео 16к, 4k hdr dolby vision,dolby vision demo 4k,4k hdr demo,8k hdr 120fps,4k video hdr, hdr 4k,4k 60fps hdr,4k hdr 60fps video,dolby vision 4k, best 4k hdr demo,dolby vision demo 4k hdr, best 4k hdr demo video, best of 4k hdr dolby vision, hdr demo 4k, 16k video ultra hd, 2k video, 32k video, 24k video, calming music,4k video nature, our palnet, relaxing music, study music, meditation music, 4k video songs, piano relaxing music, deep sleep, soothing music, calm music, relaxing music for stress reliefe.   #4kvideos #oled #hdr #relaxingmusic #stressrelief #dolbyatmos #hdr #8k #colors #4khdr #4kvideo #DolbyVision #4kvideoultrahd #8kvideoultrahd #12k   #hdrvideo #8khdr #12khdr #highdynamicrange #4kresolution",UCRauo6y9tx0FB0OLLtqLA-g,4K Video ULTRA HD,2025-10-10T13:29:07Z,22,en-US,en-US,none,"4k video ultra hd,4k videos,4k,8k,12k,16k,4k hdr,4k video,8k video,16k video,video 4k,dolby vision,dolby atmos,hdr 4k,60fps video,120 fps,12k video,4k 120fps,4k hdr 60fps,4k hdr video,8k video ultra hd,HDR 4K 60FPS,hdr video,16k video ultra hd,4k 60fps hdr,relaxing music,4к видео,12k video ultra hd,4к видео 120 fps,8k hdr,8к видео,hdr,видео 4к,8к видео 120 fps,видео 8к,16к видео,4k 60fps,relax music,calming music,nature",https://i.ytimg.com/vi/mmngyVQd4wM/default.jpg,https://i.ytimg.com/vi/mmngyVQd4wM/mqdefault.jpg,https://i.ytimg.com/vi/mmngyVQd4wM/hqdefault.jpg,https://i.ytimg.com/vi/mmngyVQd4wM/sddefault.jpg,https://i.ytimg.com/vi/mmngyVQd4wM/maxresdefault.jpg,227497,927,0,0,53,1275,PT21M15S,2d,hd,false,True,{},rectangular,False,processed,public,youtube,True,True,False,False,,,https://en.wikipedia.org/wiki/Technology,,,,,180000,303,86482796,"Mind Blowing 4K Video ULTRA HD Resolution.  Welcome to this channel, we provide you with an amazing Creative high-quality HDR Dolby Vision Concept with voice narration (Documentary and Declamation). Scenic views of our beautiful planet Earth with high brightness, enhanced detail, and richer color. O",US,@4kvideoultrahd.,2023-02-06T17:46:47.375137Z
cK-Bb-JXvjw,Samsung OLED,US,relevance,2025-10-12T13:08:19.590224,2025 Samsung S95F OLED | The BEST things about it! ,"What are in my opinion the best things about the 2025 65"" Samsung S95F OLED.  Thanks to Peter Tyson for sending over the tv for testing - https://petertyson.co.uk/  Buy the Samsung S95F OLED here - https://petertyson.co.uk/samsung-qe65s95f-65-oled-4k-smart-ai-tv-2025?srsltid=AfmBOoqGIgbjBli20oK2MQ4erqVFy99YZAq4S4pKMWboDPfSI3hJVWNK  Like what i do on the channel or have helped you out? then you can show your appreciation with the new Super Thanks feature on the YouTube or you can simply buy me a coffee!  https://www.buymeacoffee.com/Thetechgiant  Check out my Amazon affiliate shop🙂  Make your next Amazon purchase via my affiliate link,Amazon then pay me a small percentage of that sale,but at NO EXTRA COST TO YOU WHATSOEVER 😀  UK link - (link also contains tech that I use and have purchased) https://www.amazon.co.uk/shop/thetechgiant?ref=ac_inf_hm_vp  US link -  https://amzn.to/2Pr5qr4  Follow me on Facebook - https://m.facebook.com/The-Tech-Giant-109638417154803/?ref=bookmarks  Follow me on Twitter - https://mobile.twitter.com/TheTechGiant1  Follow me on Instagram - https://www.instagram.com/thetechgiant1/  If you are a company and have a product that you would like me to unbox and test out on my channel then you can contact me directly at -  thetechgiant@yahoo.com",UCDZ95EUKhw9wrwXdiKskgKw,The Tech Giant,2025-08-13T18:17:44Z,28,en,en-GB,none,"samsung s95f,samsung s95f oled,samsung oled,Samsung,samsung,Samsung s95f,samsung s95f demo,Samsung S95F OLED,best thing about samsung s95f oled,OLED,oled,Samsung OLED,best oled tv,best oled tv 2025,best samsung oled,samsung s95f review,smasung s95f oled review",https://i.ytimg.com/vi/cK-Bb-JXvjw/default.jpg,https://i.ytimg.com/vi/cK-Bb-JXvjw/mqdefault.jpg,https://i.ytimg.com/vi/cK-Bb-JXvjw/hqdefault.jpg,https://i.ytimg.com/vi/cK-Bb-JXvjw/sddefault.jpg,https://i.ytimg.com/vi/cK-Bb-JXvjw/maxresdefault.jpg,11675,261,0,0,45,674,PT11M14S,2d,hd,false,True,{},rectangular,False,processed,public,youtube,True,True,False,False,,,https://en.wikipedia.org/wiki/Technology,,,,,145000,1017,56907523,"Hi, I’m Paul The Tech Giant and thanks for dropping by.  The aim of my videos is help people out who are looking to buy new tech and to provide tech advance and tips. I unbox and demonstrate tech products to you and give my open and honest opinion on them, be it good or bad. I test out many differen",GB,@thetechgiantyoutube,2018-09-22T17:09:14Z
DFbghV74vP4,Samsung OLED,US,relevance,2025-10-12T13:08:19.590224,LG G5 vs Samsung S95F - An Obvious Choice,"I compared the Samsung S95F and LG G5 to decide which deserves the top spot in my lounge. Both are flagship 2025 OLED models, but which one is better?  🛒 FEATURED PRODUCTS 👇 ▸ https://geni.us/LG_G5 ▸ https://geni.us/SAMSUNG_S95F  🤝 COMMUNITY STUFF  ▸ Get my thumbnail wallpapers on Patreon:  https://www.patreon.com/petematheson ▸ Discord:  https://discord.com/invite/3y9bKzA32w  💬 SOCIAL STUFF  ▸ Instagram:  https://www.instagram.com/petematheson/ ▸ LinkedIn: https://www.linkedin.com/petematheson ▸ Website: https://www.petematheson.com/  🥇 MY TOP RECOMMENDED TECH 👇 💟 Best Password Manager: https://geni.us/BestPasswordManager (up to 25% off) 💟 Best Family Password Manager: https://geni.us/FamilyPasswordManager (up to 25% off) 💟 The Best VPN: https://geni.us/BestVPNService (83% off AND 3 months free) 💟 The Best Cloud Storage: https://geni.us/BestCloudStorage (90% Off) 💟 The Best Unlimited Cloud Storage: https://geni.us/BestUnlimitedStorage 💟 The Best Cloud Backup: https://geni.us/BestCloudBackup 💟 The Best CRM: https://geni.us/BestCRM 💟 The Best Email Platform: https://geni.us/BestEmailPlatform 💟 The Best Course Platform: https://geni.us/Ok7OAvA 💟 MUST HAVE for IT Business Owners: https://geni.us/HdD9Q 💟 Paperlike for iPad: https://geni.us/GetYourPaperLike 💟 Brain.fm: https://geni.us/LkmfvCBKdTE-2 (20% off) 💟 Magnetic iPhone and Android Cases: https://geni.us/Magbak 💟 Medium: https://geni.us/Medium  🎶 Track: Starboy by The Weeknd, https://lickd.lnk.to/bPXQO3ID License ID: 5zqM0Bjm891",UCZzV1zRj0oLYNv-GBSilJZw,Pete Matheson,2025-08-01T14:00:16Z,28,en-GB,en-GB,none,,https://i.ytimg.com/vi/DFbghV74vP4/default.jpg,https://i.ytimg.com/vi/DFbghV74vP4/mqdefault.jpg,https://i.ytimg.com/vi/DFbghV74vP4/hqdefault.jpg,https://i.ytimg.com/vi/DFbghV74vP4/sddefault.jpg,https://i.ytimg.com/vi/DFbghV74vP4/maxresdefault.jpg,102228,1557,0,0,274,1008,PT16M48S,2d,hd,false,True,{},rectangular,False,processed,public,youtube,True,True,False,False,,,https://en.wikipedia.org/wiki/Technology,,,,,277000,697,96428844,"Telling stories with tech📱  Welcome! 👋🏼 My name is Pete, and I REALLY enjoy telling stories about using tech in a busy, 40yr old, Husband and Dad of 2, family life.   Particular favourites for me are: * Mobile Phones, Headphones & Watches * TVs and Monitors (especially super ultrawide screens) * Clo",GB,@petematheson,2017-01-04T09:52:14Z
vU3L_dV0Etc,Samsung OLED,US,relevance,2025-10-12T13:08:19.590224,Clean Samsung S90D setup on the stand - stunning OLED picture and sleek design 👌,Clean Samsung S90D setup on the stand – stunning OLED picture and sleek design 👌🔥   #SamsungS90D #OLEDTV #HomeSetup,UC8BSZ6Kq4LIN9RZQ7QM-8tQ,Simply AV,2025-07-18T22:28:37Z,24,en,zxx,none,"#SamsungS90D,#OLEDTV,#TVSetup,#HomeEntertainment,#SimplyAV,#TechInstallation,#ModernLiving,#HomeTheater,#OLEDDisplay,#TVStandSetup,#HomeCinema,#TVUnboxing,#4KTV,#SmartTV,#InteriorTech,#TVInstaller,#AVInstaller,#HomeTech,#LuxuryLiving,#ElectronicsSetup,#CleanSetup,#TVDesign,#FlatScreenTV,#TechStyle,#LivingRoomGoals,#TechUpgrade,#EntertainmentSetup,#HomeImprovement,#GadgetGoals,#AVSolutions",https://i.ytimg.com/vi/vU3L_dV0Etc/default.jpg,https://i.ytimg.com/vi/vU3L_dV0Etc/mqdefault.jpg,https://i.ytimg.com/vi/vU3L_dV0Etc/hqdefault.jpg,https://i.ytimg.com/vi/vU3L_dV0Etc/sddefault.jpg,https://i.ytimg.com/vi/vU3L_dV0Etc/maxresdefault.jpg,32630,638,0,0,16,41,PT41S,2d,hd,false,True,{},rectangular,False,processed,public,youtube,True,True,False,False,,,"https://en.wikipedia.org/wiki/Lifestyle_(sociology),https://en.wikipedia.org/wiki/Technology",,51.617676,-0.311451,0,123000,689,136040797,"Website: www.simplyav.co.uk  WhatsApp or Call: 07780350222  Email: sales@simplyav.co.uk  From consultation to installation, we take care of everything. Subscribe for expert advice, inspiration, and behind-the-scenes content.",GB,@16ktv,2014-11-14T21:39:28Z
LeszJ2J6apY,Samsung OLED,US,relevance,2025-10-12T13:08:19.590224,OLED: Feel the Champion’s Rhythm with T1 (feat. BEATPELLAHOUSE) | Samsung,"Feel the champion's rhythm and find the path to victory with the OLED TV and Odyssey OLED. With smooth, uninterrupted visuals supported by G-Sync Compatible and FreeSync Premium Pro, ignite the passion within you and remain cold-hearted.  Discover Odyssey OLED G60SF at http://smsng.co/6053AGR8c   Discover OLED S95F at http://smsng.co/6057AGR8W   Track: “Eternal Ember - BEATPELLA HOUSE"" Music provided by AEYL MUSIC  #Odyssey #OLED #Gamingmonitor #Gaming #Samsung #Togetheras1 #BEATPELLAHOUSE #TeamOdyssey #OLEDTV",UCG2D173IlWnQHUTS07ytGsw,Samsung Singapore,2025-09-09T04:00:51Z,24,en,en,none,,https://i.ytimg.com/vi/LeszJ2J6apY/default.jpg,https://i.ytimg.com/vi/LeszJ2J6apY/mqdefault.jpg,https://i.ytimg.com/vi/LeszJ2J6apY/hqdefault.jpg,https://i.ytimg.com/vi/LeszJ2J6apY/sddefault.jpg,,103,3,0,0,1,78,PT1M18S,2d,hd,false,False,{},rectangular,False,processed,public,youtube,True,True,False,False,,,"https://en.wikipedia.org/wiki/Electronic_music,https://en.wikipedia.org/wiki/Music,https://en.wikipedia.org/wiki/Technology",,,,,67000,2015,80673577,"Welcome to the official channel of Samsung Singapore, where you can find the latest videos about our company and products. Subscribe to our channel so you will be the first to see Samsung product news, releases and promotions.",SG,@samsungsingapore,2010-01-05T03:19:04Z
d8RWYdaXkys,Samsung OLED,US,relevance,2025-10-12T13:08:19.590224,The new OLED S95F TV is here 💙,"Perfect for movie nights, playoff games and an amazing gaming experience with Samsung Gaming Hub. Looking for a new TV? Follow us to see more 👀   #OLED #TvGuide #tech #SamsungTV #TV",UC2PyUUBPi7llRGplhMuD4pQ,Samsung Canada,2025-09-01T14:00:32Z,28,en,en,none,,https://i.ytimg.com/vi/d8RWYdaXkys/default.jpg,https://i.ytimg.com/vi/d8RWYdaXkys/mqdefault.jpg,https://i.ytimg.com/vi/d8RWYdaXkys/hqdefault.jpg,https://i.ytimg.com/vi/d8RWYdaXkys/sddefault.jpg,https://i.ytimg.com/vi/d8RWYdaXkys/maxresdefault.jpg,11736,108,0,0,0,16,PT16S,2d,hd,false,False,{},rectangular,False,processed,public,youtube,True,True,False,False,,,"https://en.wikipedia.org/wiki/Technology,https://en.wikipedia.org/wiki/Video_game_culture",,,,,63600,1222,101496488,"Welcome to the official channel of Samsung Canada, where you can find the latest videos about our company and products. Subscribe to our channel so you will be the first to see Samsung product news, releases and promotions.  Discover more about our products here, including Galaxy Z Fold7, Galaxy Z F",CA,@samsungcanada,2008-07-03T15:54:30Z
XBY3L5Z-cXs,Samsung OLED,US,relevance,2025-10-12T13:08:19.590224,"Samsung 65"" OLED 2025 = Next Level","Not your average TV 😮‍💨  This 65” OLED S95F (144cm wide, 83cm tall) has Samsung’s new Vision AI which makes EVERYTHING look cinematic.  Full review soon.  #samsung #tv #oled #tech #samsungs95f #hometech #65inchtv #visionai 6m",UCu4CgqXB6NtWvpXPUbp_KJQ,ProductNation,2025-08-23T06:57:03Z,28,en,en-US,none,"samsung,65 inch tv,oled tv,samsung oled 65,65"" OLED S95F 4K Samsung Vision AI Smart TV (2025),S95F 4K samsung,vision ai,samsung tv,samsung tv 65 inch,samsung tv review,samsung tv 4k 55 inch,best 65 inch tv,best oled tv,best samsung tv,oled,samsung s95f,new samsung oled tv,new samsung tv,samsung s95f gaming,best 65 inch tv for gaming,samsung s95f review,samsung ai tv,samsung oled",https://i.ytimg.com/vi/XBY3L5Z-cXs/default.jpg,https://i.ytimg.com/vi/XBY3L5Z-cXs/mqdefault.jpg,https://i.ytimg.com/vi/XBY3L5Z-cXs/hqdefault.jpg,https://i.ytimg.com/vi/XBY3L5Z-cXs/sddefault.jpg,https://i.ytimg.com/vi/XBY3L5Z-cXs/maxresdefault.jpg,12148,239,0,0,4,37,PT37S,2d,hd,false,True,{},rectangular,False,processed,public,youtube,True,True,False,False,,,"https://en.wikipedia.org/wiki/Entertainment,https://en.wikipedia.org/wiki/Technology",,,,,177000,647,117901420,"ProductNation is your destination for all the latest product reviews and roundups that are at the right price, on-trend, consumer favourites, and timely in Malaysia. Check out reviews, inspiring and funny videos of products here!  Get in touch with us over Instagram!",MY,@productnation,2017-11-29T04:00:06Z
KDdGC1CsBLo,Samsung OLED,US,relevance,2025-10-12T13:08:19.590224,"TEST : TV OLED Panasonic Z95B (vs Z95A, LG, Samsung...) Vidéo 4K chapitrée","(Vidéo 4K chapitrée non sponso) Bonjour, Sylvain ( @frandroid ) et moi-même sommes heureux de vous offrir le test ultra complet et chapitré du téléviseur OLED 4K Panasonic Z95B : descriptif, essais, test audio en captation 3D, les mesure de Sylvain commentées clairement avec comparatif (LG, Samsung, Pana Z95A). Merci !  #tv #4k #oled #pp   Mes vidéos ne sont pas sponsorisées, mais si vous le produit vous intéresse, et si vous le souhaitez, voici des liens affiliées :)  Merci :)   Son Vidéo Com (Z95B) https://c3po.link/QJvXQsV4xT https://c3po.link/QtgPFUqRWE https://c3po.link/QJvNRECprS  (Z95A) https://c3po.link/QR6tr235Ph  LG G5 https://c3po.link/QRsJr5ZrrH  Samsung S95F https://c3po.link/QbHt4cYQF7  Chapitrage   00:00 L’intro qu’il vous faut 01:40 Gamme, prix, design 03:40 Une dalle OLED tandem RGB ventilée ! 07 :00 Super traitement vidéo 08:45 Modes « image » 10:10 Le Gaming cinématic ! 12:00 connectique, Fire TV, 13:40 Audio par TECHNICS (Atmos) (avec test calibrage) 17:00 Des réglages de folie !  19:40 TEST QUALITÉ image (PP) 31:40 TEST QUALITÉ audio (PP) avec captation en audio 3D 35:40 Les mesures commentées par Sylvain (Frandroid) 45:30 Les « PLUS » ! 47:50 Les « MOINS » !       Si tu as aimé la vidéo → Clique sur ""J'aime"" !    Si tu kiffes et que tu souhaites t'abonner, c'est ici: https://www.youtube.com/ppworld?sub_confirmation=1    Pour me suivre :     Twitter → @ppgarcia75  Facebook → PP.Bizness  Instagram → PPGarcia75  Snapchat → PPGarcia75",UCPQsSFJurluaMOG1qL0Y7sA,PP World,2025-10-11T08:02:16Z,28,fr,fr,none,"Panasonic,TV,Télé,Téléviseur,télévision,4K,LED,OLED,PP,PP World,Panasonic Z95,TEST : TV OLED Panasonic Z95B (vs Z95A,LG,Samsung...) Vidéo 4K chapitrée,Sony,Samsung,LG G5,TV OLED,gaming,Gamers,Test,review,TV test,Panasonic Z95A,Panasonic Z95B",https://i.ytimg.com/vi/KDdGC1CsBLo/default.jpg,https://i.ytimg.com/vi/KDdGC1CsBLo/mqdefault.jpg,https://i.ytimg.com/vi/KDdGC1CsBLo/hqdefault.jpg,https://i.ytimg.com/vi/KDdGC1CsBLo/sddefault.jpg,https://i.ytimg.com/vi/KDdGC1CsBLo/maxresdefault.jpg,21394,1259,0,0,194,3049,PT50M49S,2d,hd,false,True,{},rectangular,False,processed,public,youtube,True,True,False,False,,,https://en.wikipedia.org/wiki/Technology,,,,,439000,972,73699221,"Bonjour ! PP World est une chaine High Tech / vidéos de Voyages NON SPONSORISEE créée par le journaliste PP Garcia. Il n'y a AUCUN placement de produit ni AUCUN jeux concours sur PP World. Un panneau placée au début de chaque vidéo indique ""Vidéo non sponso"", ce qui vous permet d'être certain de reg",FR,@ppworld,2015-09-08T21:24:22Z
