video_id,search_keyword,search_region,search_order,collected_at,title,description,channel_id,channel_title,published_at,category_id,default_language,default_audio_language,live_broadcast_content,tags,thumbnail_default,thumbnail_medium,thumbnail_high,thumbnail_standard,thumbnail_maxres,view_count,like_count,dislike_count,favorite_count,comment_count,duration_seconds,duration_iso,dimension,definition,caption,licensed_content,content_rating,projection,has_custom_thumbnail,upload_status,privacy_status,license,embeddable,public_stats_viewable,made_for_kids,self_declared_made_for_kids,topic_ids,relevant_topic_ids,topic_categories,recording_date,location_latitude,location_longitude,location_altitude,channel_subscriber_count,channel_video_count,channel_total_view_count,channel_description,channel_country,channel_custom_url,channel_published_at
oAsSsVkQHKg,Samsung TV,US,relevance,2025-10-12T13:08:04.771470,Installing a Samsung QEF1 the Cheapest QLED TV | How to Mount Above a Fireplace,"Watch as we install Samsung’s QEF1 – the most affordable QLED TV – mounted perfectly above a fireplace. At Simply AV (SimplyAV.co.uk), we provide expert TV wall mounting, home cinema, and AV installation services across the UK.  Looking for professional TV installation or want advice on the best AV setup for your home? Get in touch with Simply AV today!  👉 Visit us: https://SimplyAV.co.uk 👉 Subscribe for more installs, tips & guides!",UC8BSZ6Kq4LIN9RZQ7QM-8tQ,Simply AV,2025-09-30T16:59:35Z,24,en,zxx,none,"#SamsungQEF1,#SamsungQLED,#QLEDTV,#TVInstallation,#FireplaceTVMount,#HomeTheaterSetup,#SamsungTVInstall,#CheapestQLED,#TVWallMounting,#HomeCinema,#AVInstallation,#SamsungElectronics,#TVAboveFireplace,#UKAVInstallers,#WallMountedTV,#QLEDInstallation,#SamsungSetup,#FlatScreenTV,#TVMountingIdeas,#SamsungQLED2025,#TVInstallUK,#ProfessionalAV,#TVMountingService,#AVExperts,#SamsungHome,#QLEDTVInstall,#MountedQLED,#SamsungDisplay,#AffordableQLED,#FireplaceInstall,#TVMountUK,#AVSolutions,#TVWallMount",https://i.ytimg.com/vi/oAsSsVkQHKg/default.jpg,https://i.ytimg.com/vi/oAsSsVkQHKg/mqdefault.jpg,https://i.ytimg.com/vi/oAsSsVkQHKg/hqdefault.jpg,https://i.ytimg.com/vi/oAsSsVkQHKg/sddefault.jpg,https://i.ytimg.com/vi/oAsSsVkQHKg/maxresdefault.jpg,26294,454,0,0,1,60,PT1M,2d,hd,false,True,{},rectangular,False,processed,public,youtube,True,True,False,False,,,"https://en.wikipedia.org/wiki/Lifestyle_(sociology),https://en.wikipedia.org/wiki/Technology",,51.6570766,0.0412824,0,123000,689,136040797,"Website: www.simplyav.co.uk  WhatsApp or Call: 07780350222  Email: sales@simplyav.co.uk  From consultation to installation, we take care of everything. Subscribe for expert advice, inspiration, and behind-the-scenes content.",GB,@16ktv,2014-11-14T21:39:28Z
ybyIn_qNnMw,Samsung TV,US,relevance,2025-10-12T13:08:04.772466,RGB Mini-LED vs Samsung Micro RGB: TV Tech Explained,"It's ok if you're a little confused. TV technology is hard enough, never mind confusing versions of the same TV terms making it worse. In this video, I explain how it works and what the nuanced differences are between the hottest new TV backlighting technologies.",UCGQ3yQ0mbQqO6bY6eqsbjGQ,CalebRated,2025-09-30T11:45:07Z,22,en,en-US,none,,https://i.ytimg.com/vi/ybyIn_qNnMw/default.jpg,https://i.ytimg.com/vi/ybyIn_qNnMw/mqdefault.jpg,https://i.ytimg.com/vi/ybyIn_qNnMw/hqdefault.jpg,https://i.ytimg.com/vi/ybyIn_qNnMw/sddefault.jpg,https://i.ytimg.com/vi/ybyIn_qNnMw/maxresdefault.jpg,59821,4624,0,0,344,692,PT11M32S,2d,hd,false,True,{},rectangular,False,processed,public,youtube,True,True,False,False,,,https://en.wikipedia.org/wiki/Technology,,,,,74300,15,1054752,"CalebRated is your trusted guide to the world of home entertainment and consumer tech. Founded by veteran tech journalist Caleb Denison, CalebRated delivers insightful reviews, practical buying advice, and deep-dive explainers — all with a dose of storytelling that makes complex topics easy to under",US,@calebrated,2025-02-21T13:14:47.939648Z
EJ_Y4kZLZKM,Samsung TV,US,relevance,2025-10-12T13:08:04.772466,Best TV 2025 | 43 inch | Sony vs Samsung vs LG | Hisense vs VU vs TCL vs Lumio,"I compared 75+ 43 inch TVs to bring you the best picks across budget, mid-range, and premium brands. 👆Amazon buying links below👇  Click here 👆for best TVs - https://amzn.to/3WtGeQY  *⚡⚡ BEST 43 inch TVs in INDIA⚡⚡* ✅ Best value TV - 20-30K - MOTOROLA EnvisionX - see tagged product - VU GloQled https://amzn.to/46i54qK - Hisense E7Q https://amzn.to/4mAISOQ - Hisense E68N (lower cost, last year model) https://amzn.to/3FJ9rBJ - Vu Vibe DB QLED https://amzn.to/4gnvCeE - Lumio Vision 7 https://amzn.to/3I3gLc8  ✅ Best premium TV  - Samsung Crystal 4K Vista https://amzn.to/46cXvmq - XIAOMI X Pro CineMagiQLED - see tagged product - LG UA 8200 https://amzn.to/3VqQMiA - Sony BRAVIA 2M2 https://amzn.to/48jhReX - Sony Bravia 3 https://amzn.to/3G0qPSP  ✅ Best on a budget - iFFALCON by TCL U65 - see tagged product  *⚡⚡ All Grapevine Recommended Products⚡⚡* https://amzn.to/3s2CuJL   Consider *SUBSCRIBING* to the channel if you would like to support me to make videos that are *SUPER USEFUL* for you.  You'd make my day 😁  *⚡⚡ IN THIS VIDEO⚡⚡* 00:00 What it's good at and what it's not 00:24 Picture Quality Comparison 01:44 Audio Quality Comparison 02:23 Usability Comparison 03:44 Pricing, Warranty & Satsifaction 04:24 Best 43"" TV - 20000 to 30000 07:20 Best 43"" TV - Under 20000 08:10 Best Premium 43"" TVs  *CONNECT WITH ME* 📸 Instagram:   https://www.instagram.com/thegrapevineindia/    💼 LinkedIn:   https://www.linkedin.com/in/saumyaupadhyaya/ 🛍️ Amazon: https://amzn.to/3s2CuJL   Disclaimer: Some of the links are affiliate links, which means if you use it to buy something, it will support me to make more such videos and I get a small incentive at no extra cost to you 😊 #thegrapevineindia  *Video Summary* Looking for the best 43 inch TV in 2025? I compared 75+ models to bring you the best picks across budget, mid-range, and premium brands. From Vu Vibe DV QLED, Motorola EnvisionX, Hisense E7Q, Lumio Vision 7, iFFALCON U65 to premium options like Xiaomi X Pro CineMagiQLED, LG UA 8200, Sony Bravia 2M2, and Samsung Crystal Vista — find out which 43” TV offers the best value for your needs.  *Products compared* Uniboom ULTIMA, VW Playwall, Coocaa TV, Kodak Special Edition, Infinix QLED, Coocaa Frameless, iFFALCON by TCL U64, MOTOROLA EnvisionX, Hisense E5Q, iFFALCON by TCL U65, Thomson TV, Hisense E43N, Wobble QD Series, VW Smart, Acer G plus Series, BLACK+DECKER A1 Series, realme TechLife, realme TechLife CineSonic, Coocaa Frameless Pro, MOTOROLA EnvisionX, Mi Xiaomi X Series, realme TechLife CineSonic Q, IBELL GTV, REDMI By Xiaomi, Hisense E6N, Toshiba C350NP, JVC AI Vision, MI Xiaomi A Series, Hisense E68N, Toshiba C450, VU GloQled, XIAOMI A Series, Vu GloLED, Onida QLED, Onida Google TV, Samsung Crystal Vivid, TCL V6C, Acer V Pro, Hisense E63N, Hisense E7Q, Xiaomi FX Ultra, Samsung UA43F5550FUXXL, Sansui 4K, Vu Vibe DB QLED, TCL C655, Xiaomi FX Pro, Hisense P71K, Acer Super Series, Xiaomi X Pro MagiQLED, Samsung Crystal Vivid Pro, Lumio Vision 7, Samsung Crystal 4K Vista, XIAOMI X Pro CineMagiQLED, Samsung Crystal 4K Dynamic, Samsung Crystal Vista Pro, LG UA 8200, Haier S800, Samsung Crystal 4K Ultra, Sony BRAVIA 2M2, Samsung VIsion AI QLED, XIAOMI X Series, LG QNED 8AA, Sony Bravia 3",UCKUHl9qrizvt_cfldeVXuyw,The Grapevine,2025-09-28T05:30:05Z,26,en-IN,en-IN,none,"43 inch TV 2025,best 43 inch TV India,Vu Vibe DV QLED 43,Motorola EnvisionX 43 TV,Vu GloQLED 43,Hisense E7Q 43 TV,Hisense E68N 43 TV,Lumio Vision 7 43 TV,iFFALCON U65 43 TV,Xiaomi X Pro CineMagiQLED 43,LG UA 8200 43 TV,Sony Bravia 2M2 43,Samsung Crystal Vista 43 TV,best budget 43 inch TV,best QLED 43 inch TV,best LED TV 2025,Dolby Vision 43 inch TV,HDR10+ 43 inch TV,Google TV 43 inch,best value TV 20K to 30K.",https://i.ytimg.com/vi/EJ_Y4kZLZKM/default.jpg,https://i.ytimg.com/vi/EJ_Y4kZLZKM/mqdefault.jpg,https://i.ytimg.com/vi/EJ_Y4kZLZKM/hqdefault.jpg,https://i.ytimg.com/vi/EJ_Y4kZLZKM/sddefault.jpg,https://i.ytimg.com/vi/EJ_Y4kZLZKM/maxresdefault.jpg,52510,481,0,0,99,643,PT10M43S,2d,hd,false,True,{},rectangular,False,processed,public,youtube,True,True,False,False,,,https://en.wikipedia.org/wiki/Technology,,,,,189000,307,42050097,✅ Subscribe to make smart decisions ✅ Your go-to source for the best home appliances  Hi 👋 This is SAUMYA!  (Best way for viewers to reach me is via the comments section of the video. Kindly excuse if you do not hear back from me on any personal requests via email. The published email id is only for,IN,@thegrapevineindia,2020-08-06T11:00:07.451694Z
yBuli7vp9xc,Samsung TV,US,relevance,2025-10-12T13:08:04.772466,How To Fix Screen Mirroring Not Working On Samsung TV - Step By Step,"Learn how to fix screen mirroring not working on samsung tv in this video. For more videos like this then please leave a like.  GuideRealm is the home of technology-based how-to's, guides & tips.  Equipment & tools I use (affiliate links): Tubebuddy (YouTube tools): https://www.tubebuddy.com/pricing?a=Tucker Microphone: https://amzn.to/43H8dAy Laptop: https://amzn.to/3ITBwom PC: https://amzn.to/3MPNgJL  Some of the links in this description are affiliate links. As an Amazon Associate and a partner of other affiliate programs, this means I will earn a small commission from qualifying purchases through these links.  Please like, subscribe, and comment.  GuideRealm",UCWdCOEFAsnzUJQgQOw3vu5Q,GuideRealm,2025-09-19T18:01:05Z,26,en,en,none,"how to fix screen mirroring not working on samsung tv,screen mirroring not working on samsung tv",https://i.ytimg.com/vi/yBuli7vp9xc/default.jpg,https://i.ytimg.com/vi/yBuli7vp9xc/mqdefault.jpg,https://i.ytimg.com/vi/yBuli7vp9xc/hqdefault.jpg,https://i.ytimg.com/vi/yBuli7vp9xc/sddefault.jpg,https://i.ytimg.com/vi/yBuli7vp9xc/maxresdefault.jpg,1245,6,0,0,1,81,PT1M21S,2d,hd,false,True,{},rectangular,False,processed,public,youtube,True,True,False,False,,,https://en.wikipedia.org/wiki/Technology,,,,,1630000,13213,543977364,"Welcome to GuideRealm - Your go-to destination for technology-based how-to's, guides & tips. ",US,@guiderealmvideos,2012-11-03T17:03:50Z
I_GQPrCf90s,Samsung OLED,US,relevance,2025-10-12T13:08:19.590224,This Could Be The Last Glossy Samsung OLED TV Ever… [REVIEW],"We review the 65-inch Samsung S90F featuring a QD-OLED panel, which could potentially be the last glossy OLED TV from the South Korean brand.  The ""Includes Paid Promotion"" message in this video refers to the sponsorship by British AV retailer Richer Sounds. If you're interested in getting a new TV, even if it's not a new Samsung OLED, please support this channel by considering buying from them. Visit your local Richer Sounds store to get the best deals through cheaper 'VIP exclusive' in-store only prices,  or call telesales for your next TV purchase on 0333 900 0093. Thanks again for your support.  ======================== **Click Below to SUBSCRIBE for More Reviews, Sneak Peeks & Tips: https://www.youtube.com/channel/UCcCYOO2uYPnG-21WDOWdwew?sub_confirmation=1 ========================  VISIT HDTV Test http://www.hdtvtest.co.uk/  FOLLOW US! https://bsky.app/profile/hdtvtest.bsky.social https://www.threads.net/@hdtvtest https://www.tiktok.com/@hdtvtest https://www.instagram.com/hdtvtest https://twitter.com/vincent_teoh https://www.patreon.com/hdtvtest",UCcCYOO2uYPnG-21WDOWdwew,HDTVTest,2025-10-10T20:56:27Z,28,en,en,none,,https://i.ytimg.com/vi/I_GQPrCf90s/default.jpg,https://i.ytimg.com/vi/I_GQPrCf90s/mqdefault.jpg,https://i.ytimg.com/vi/I_GQPrCf90s/hqdefault.jpg,https://i.ytimg.com/vi/I_GQPrCf90s/sddefault.jpg,https://i.ytimg.com/vi/I_GQPrCf90s/maxresdefault.jpg,21982,806,0,0,198,691,PT11M31S,2d,hd,false,True,{},rectangular,False,processed,public,youtube,True,True,False,False,,,https://en.wikipedia.org/wiki/Technology,,,,,599000,961,165856427,"Youtube's leading voice on TV technology, with many videos getting at least 20000 views, 1000 likes & tons of comments. ",GB,@hdtvtest,2007-03-02T19:38:24Z
mnSKN5Wbi_s,Samsung OLED,US,relevance,2025-10-12T13:08:19.590224,Samsung S95F vs Samsung S90F: Which 2025 Samsung OLED Should You Buy?,"Get the Samsung S95F Oled here: https://www.rtings.com/afflink/As8AAVoUAAA= Get the Samsung S90F Oled here: https://www.rtings.com/afflink/As8AAWhNAAA=  The Samsung S95F and the Samsung S90F are Samsung’s two big heavy hitters in 2025. The S95F is brighter in HDR and SDR, uses a matte anti-glare finish that cuts mirror-like reflections, and includes the Slim One Connect box for cleaner installs, plus 4k at 165Hz for PC. The S90F delivers most of the same picture quality for less, offers 4k at 144Hz, and adds 42- and 48-inch options for desk setups. We compare HDR brightness, daytime SDR performance, reflection handling, gaming features, sizes, and pricing to help you decide which one fits your room and your budget.   Samsung S95F – https://www.rtings.com/tv/reviews/samsung/s95f-oled  Samsung S90F - https://www.rtings.com/tv/reviews/samsung/s90f-oled   Vote for our next TV review: https://www.rtings.com/vote/tv   Follow our 100+ TV (and 3 Monitor!) Longevity Test @RTINGScomRD    Support Us: https://www.rtings.com/insider  Careers: https://grnh.se/eb4de72f7us  Don't miss a beat - join our newsletters: https://www.rtings.com/newsletters   Join our Discord server: https://discord.gg/UpwKBSvc54    Follow Us:  https://www.facebook.com/rtingscom  https://twitter.com/rtingsdotcom  https://www.instagram.com/rtingsdotcom/   ---  00:00 Intro 00:49 HDR brightness  01:30 HDR PQ EOTF Tracking  01:46 SDR Brightness and Reflections  02:58 Color volume and panel notes  03:40 Processing and Gradients  04:07 Gaming Performance  04:36 Inputs and Connectivity  05:24 The One Connect Box Difference  06:12 Price and Value Snapshot  06:40 Compared to Non-Samsung Options  07:09 Who Should Buy the S95F?  07:34 Who Should Buy the S90F?  07:54 Verdict  08:32 Outro  ---   We make money directly from you via insider access on our website (which gives you access to extra features: https://www.rtings.com/insider) and when you buy a product after clicking a link to a retailer. Learn more about how we work: https://www.rtings.com/company/about-us",UCAi6GKtTPoYxUheIbVhnwqw,RTINGS Home Theater,2025-09-18T20:35:17Z,28,en,en-CA,none,"samsung oled TV,best samsung oled tv,samsung s90f,samsung s95f,samsung s90f vs s95f,samsung oled gaming tv",https://i.ytimg.com/vi/mnSKN5Wbi_s/default.jpg,https://i.ytimg.com/vi/mnSKN5Wbi_s/mqdefault.jpg,https://i.ytimg.com/vi/mnSKN5Wbi_s/hqdefault.jpg,https://i.ytimg.com/vi/mnSKN5Wbi_s/sddefault.jpg,https://i.ytimg.com/vi/mnSKN5Wbi_s/maxresdefault.jpg,15857,443,0,0,85,553,PT9M13S,2d,hd,false,True,{},rectangular,False,processed,public,youtube,True,True,False,False,,,https://en.wikipedia.org/wiki/Technology,,,,,390000,588,78454374,FIND THE BEST PRODUCT FOR YOUR NEEDS! Straight to the point buying recommendations on TVs. We purchase our own products and put them under the same test bench so that you can compare the results easily. No cherry-picked units sent by brands. No ads. Only real tests.,,@rtingsdotcom,2011-09-27T02:20:52Z
RgR0HZcKRpM,Samsung OLED,US,relevance,2025-10-12T13:08:19.590224,2025 S95F: Full Feature Video | Samsung,"Enrich your experience with Samsung Vision AI. Powered by the NQ4 AI Gen3 Processor, the S95F boasts a Glare Free screen with OLED HDR Pro, for unrivalled immersion. Experience Ultimate Gaming Pack with S95F now! 🕹️  For more information, visit http://smsng.co/tvs  #2025NewAITV #VisionAI #4KTV #S95F #OLED #SamsungTV #AITV",UCWwgaK7x0_FR1goeSRazfsQ,Samsung,2025-09-11T01:03:32Z,28,en,en,none,,https://i.ytimg.com/vi/RgR0HZcKRpM/default.jpg,https://i.ytimg.com/vi/RgR0HZcKRpM/mqdefault.jpg,https://i.ytimg.com/vi/RgR0HZcKRpM/hqdefault.jpg,https://i.ytimg.com/vi/RgR0HZcKRpM/sddefault.jpg,https://i.ytimg.com/vi/RgR0HZcKRpM/maxresdefault.jpg,83474,2340,0,0,142,289,PT4M49S,2d,hd,false,False,{},rectangular,False,processed,public,youtube,True,True,False,False,,,"https://en.wikipedia.org/wiki/Technology,https://en.wikipedia.org/wiki/Video_game_culture",,,,,7460000,2351,2916266607,"Welcome to the official Samsung global channel, a place to discover the latest Samsung brand stories, events, innovative technologies, apps & services, B2B solutions, and developer community.   Samsung inspires the world and shapes the future with transformative ideas and technologies. The company i",KR,@samsung,2006-03-11T06:57:39Z
LBURlc3e4Wo,Samsung OLED,US,relevance,2025-10-12T13:08:19.590224,Did I Find the PERFECT Living Room TV? Samsung S95F OLED Review,"Check out my SAMSUNG S95F REVIEW GUIDE BY OPENING THIS BOX!!  Find the S95F here: https://amzn.to/4natBVF • https://bit.ly/41grCGB, or use the in-video 🛍 links above!  🆘  Need Help/Advice or want to give back? ☝️Click THANKS to ELEVATE your comment! 🙋‍♂️ Questions about our review policy or commercial/editorial use of this video?  ↳↳↳  As always, thank you for watching.  Samsung S95F Review, 2025 Copyright Andrew Robinson. For info about commercial/editorial use of any kind, please see the LEGAL NOTICE at the bottom under Channel Disclosures.  ➕ THE SAMSUNG S95F REVIEW GUIDE   Samsung S95F: https://amzn.to/4natBVF • https://bit.ly/41grCGB or look for the 🛍 above!  2025 Model Shown: SAMQN65S95F Size Shown: 65 inch  🛍 Look for these product links embedded in the video by hovering over the video’s timeline. You’ll also see them at the very top when you open the description box.  ➕ COMPARABLE TVs  LG C5 https://amzn.to/4kE612m  Samsung S95C https://bit.ly/3qtNlvk  Sony A95K https://amzn.to/3EEk9VB  Sony Bravia 8 II https://amzn.to/4fLxDB5   Not tested, but would be comparable options LG G5 https://amzn.to/4l0Dm7r  Samsung S95D https://amzn.to/3V7Hatm   Also mentioned TCL QM8K https://amzn.to/4mKltL7    🧪 TESTING THE SAMSUNG S95F OLED TV  MY PROFESSIONAL CALIBRATION TOOLS  Calibrite Display Plus HL Colorimeter  🛍 Portrait Displays CalMAN Studio Software 🛍 VideoForge Pattern Generator  EXTERNAL SOUND The Canvas 🛍 Samsung Q990F https://bit.ly/4lpLY8q   SOURCES Apple 4K TV: https://amzn.to/3em0YUp Sony PS5 https://amzn.to/3Cku2qD  Zidoo Media Player https://amzn.to/3Xszt2o  iPhone https://bit.ly/3Q4G4Mw   MEDIA Jurassic World Rebirth https://amzn.to/4mG11ee  Superman https://amzn.to/3JdXw0i  Ripley Test patterns and HD content  Did I Find the PERFECT Living Room TV? Samsung S95F OLED Review  ➕ SAMSUNG S95F REVIEW (VIDEO CHAPTERS)  00:00 SAMSUNG S95F OLED REVIEW by Andrew Robinson 03:42 HOW THE S95F LOOKS OUT OF THE BOX 05:05 SHOULD YOU CALIBRATE THE S95F? 06:02 BRIGHTNESS, REAL WORLD PICTURE QUALITY, VIEWING ANGLES, DSE & MOTION 09:33 MY NOTES FOR THE CUSTOMER & MANUFACTURER 11:14 SAMSUNG S95F vs OTHER TVs  ➕ EXTRAs  MEDIA BENCH 🛍 ANDREW’s Uniqlo Crew Neck T Shirt and Jean Jacket 🛍 ANDREW’s WATCH 🛍   📌 OUR HIFI AND HOME THEATER FAVs   POWER ($) Marantz https://bit.ly/4cUbiii  ($) Yamaha https://bit.ly/3RLCIPT ($$) Yamaha https://bit.ly/3RGwr6d   SPEAKERS ($) ELAC https://bit.ly/3Y5BFx5  ($$) Q Acoustics https://bit.ly/406YIoU  ($$) SVS https://bit.ly/3z7MNiV • https://bit.ly/4aWUq9S  ($$$) KEF https://bit.ly/3UPOhFs    TURNTABLE & DAC/STREAMER TT2 https://bit.ly/3tWwdxd   Z8 https://bit.ly/44e0h6P   TVs  BEST QLED TV https://bit.ly/4eLhTMx  BEST BIG TV https://bit.ly/47xtPhI & https://amzn.to/3WJ9dAs  HOME THEATER Media Player ($$) https://bit.ly/3VRsgYu • ($) https://bit.ly/49P1c1K  In Ceiling Speakers https://bit.ly/3I3gAbg  Receiver ($) https://amzn.to/4hfaOWN ($$) https://bit.ly/3DyHEjb Subwoofer https://bit.ly/3Ud6D40 • https://bit.ly/4896DI7  Soundbar ($) https://bit.ly/3COjDHz  Soundbar/Bar-like Systems ($) https://bit.ly/43OfVWi ($$) https://bit.ly/3D0buzK ($$) https://bit.ly/4ikjtbc  🗒️ ABOUT US • CHANNEL POLICIES • FTC & LEGAL DISCLOSURES  📍BECOME A MEMBER: https://bit.ly/ARobMbr 📍INSTAGRAM:  https://bit.ly/AndRobIG 📍BUSINESS INQUIRIES: https://bit.ly/andrewbiz 📍VIEWER QUESTIONS: Click THANKS above to highlight your question. It’s a great way to show your support for the channel & get the help you need.  FTC DISCLOSURE: This video is NOT SPONSORED. We received no payment to make this video or to review this product. PUBLICATION DATE: 08/24/2025, Copyright 2025 Andrew Robinson PRODUCT REVIEWED: The S95F was sent “on temporary loan” for review and a return was requested on 08/18/25. OUR REVIEW POLICY: We do not accept payment or free products for reviews. Manufacturers do not see reviews before publication and have no control over the outcome. All items are returned after review, unless the loan is extended or the product is purchased by the channel. AFFILIATE NOTICE: Some links are affiliate links. When used, we may earn a small percentage, which helps us manage production costs. It does not change your cost or the content of our reviews. LEGAL NOTICE: The content in this video—including all visuals, audio, and pull quotes—is protected by copyright. Unauthorized use, reproduction, or distribution for commercial or editorial purposes is strictly prohibited without explicit written permission. For more information, please use our website’s contact form.  #andrewrobinson #tvreview #samsungOLED",UCBABCFhPeGFwW8WdjoQjk3Q,Andrew Robinson,2025-08-24T15:59:30Z,28,en,en,none,"samsung s95f,samsung s95f oled,samsung s95f review,s95f oled,samsung oled tv,samsung s95f 65 inch review,best samsung tv 2025,best oled tv 2025,s95f review,andrew robinson tv reviews,andrew robinson samsung,SAMQN65S95F,samsung s95f oled tv,samsung oled,Samsung S95F OLED Review,Did I Find the PERFECT Living Room TV,s95f samsung,samsung oled s95f,tv review,oled s95f,samsung s95f qd-oled,tv samsung s95f,samsung s95f 65,samsung tv oled,oled s95f review",https://i.ytimg.com/vi/LBURlc3e4Wo/default.jpg,https://i.ytimg.com/vi/LBURlc3e4Wo/mqdefault.jpg,https://i.ytimg.com/vi/LBURlc3e4Wo/hqdefault.jpg,https://i.ytimg.com/vi/LBURlc3e4Wo/sddefault.jpg,https://i.ytimg.com/vi/LBURlc3e4Wo/maxresdefault.jpg,50200,1694,0,0,321,873,PT14M33S,2d,hd,false,True,{},rectangular,False,processed,public,youtube,False,True,False,False,,,https://en.wikipedia.org/wiki/Technology,2025-08-24T00:00:00Z,,,,418000,578,89175419,"NEW VIDEOS FRIDAY & SUNDAY! How we work 👉 👉  OUR REVIEW POLICY: We don’t accept payment or free products for reviews. All items are returned after review, unless the loan is extended or the product is purchased by the channel. BRAND INVOLVEMENT: Manufacturers don’t see reviews before publication and",US,@andrewrobinsonreviews,2012-05-28T19:22:13Z
0agKva2O34Y,Samsung OLED,US,relevance,2025-10-12T13:08:19.590224,Is This The BEST OLED TV For Beginners? | Samsung S90F OLED TV,"Let's take a quick look at the 65"" Samsung S90F OLED to see if it's a good option for someone looking into experiencing an OLED TV for the first time. I'll also give you a solution to speed up your Samsung TV if it's running slow.  💥💥*UPDATED PRICES*💥💥  👉 Samsung S90F OLED Amazon https://geni.us/wIxyXCG Best Buy https://geni.us/quF4O Samsung Direct https://howl.link/bph4tvsyzxje1  👉 Samsung HW-QS700F Soundbar Amazon https://geni.us/FGWYN  Best Buy https://geni.us/NFOX512 Samsung Direct Samsung Direct https://howl.link/seqfb3ag8hws5  📢  Stay Connected With Me:  Instagram: https://www.instagram.com/justcallme_antwan TikTok : https://www.tiktok.com/@newstufftv Threads: https://www.threads.net/@justcallme_antwan Facebook: https://www.facebook.com/JustCallMeAntwan   ============================== Links listed in this video are affiliate links and the content creator may be paid a commission based on purchases made  For Collaboration and Business inquiries, please use the contact information below: 📩  Email: NewStuff@justdoinlife.com",UCnFHXvPvKR0eezgZLYhzlhg,New Stuff TV,2025-08-30T15:45:18Z,28,en,en,none,"New Stuff TV,Samsung S90F OLED,Samsung S95F OLED,samsung tv running slow",https://i.ytimg.com/vi/0agKva2O34Y/default.jpg,https://i.ytimg.com/vi/0agKva2O34Y/mqdefault.jpg,https://i.ytimg.com/vi/0agKva2O34Y/hqdefault.jpg,https://i.ytimg.com/vi/0agKva2O34Y/sddefault.jpg,https://i.ytimg.com/vi/0agKva2O34Y/maxresdefault.jpg,16260,405,0,0,51,450,PT7M30S,2d,hd,false,True,{},rectangular,False,processed,public,youtube,True,False,False,False,,,https://en.wikipedia.org/wiki/Technology,,,,,168000,1243,34715806,"Down-to-earth video showcases of projectors, TVs, soundbars, and home theater stuff. Enjoy your stay, keep coming back and share with your friends! 🙌  For Collaboration and Business inquiries, please use the contact information below:  📩  Email: NewStuff@justdoinlife.com  ",US,@newstufftv1,2016-09-17T13:56:48Z
Hb2SDbCv3ds,Samsung OLED,US,relevance,2025-10-12T13:08:19.590224,77” Samsung S90F OLED 4K Vision AI Smart TV (2025) at Costco $3499.99 #CostcoFinds #TechDeal,,UCrPhfnTPOESo_578cO3yZaw,Ghure Ashi,2025-08-22T06:04:19Z,24,en-US,en-US,none,,https://i.ytimg.com/vi/Hb2SDbCv3ds/default.jpg,https://i.ytimg.com/vi/Hb2SDbCv3ds/mqdefault.jpg,https://i.ytimg.com/vi/Hb2SDbCv3ds/hqdefault.jpg,https://i.ytimg.com/vi/Hb2SDbCv3ds/sddefault.jpg,https://i.ytimg.com/vi/Hb2SDbCv3ds/maxresdefault.jpg,30802,136,0,0,0,9,PT9S,2d,hd,false,True,{},rectangular,False,processed,public,youtube,True,True,False,False,,,https://en.wikipedia.org/wiki/Technology,,,,,29000,4677,4144043,"Join this channel to get access to perks: https://www.youtube.com/channel/UCrPhfnTPOESo_578cO3yZaw/join  Welcome to the purr-fectly adorable world of Cat Iroh and Cat Mishty! Join us for daily doses of feline fun, cuddles, and heartwarming moments that will melt your heart.  Cat Iroh and Cat Mishty ",US,@ghureashi,2020-08-25T05:48:35.451683Z
