video_id,search_keyword,search_region,search_order,collected_at,title,description,channel_id,channel_title,published_at,category_id,default_language,default_audio_language,live_broadcast_content,tags,thumbnail_default,thumbnail_medium,thumbnail_high,thumbnail_standard,thumbnail_maxres,view_count,like_count,dislike_count,favorite_count,comment_count,duration_seconds,duration_iso,dimension,definition,caption,licensed_content,content_rating,projection,has_custom_thumbnail,upload_status,privacy_status,license,embeddable,public_stats_viewable,made_for_kids,self_declared_made_for_kids,topic_ids,relevant_topic_ids,topic_categories,recording_date,location_latitude,location_longitude,location_altitude,channel_subscriber_count,channel_video_count,channel_total_view_count,channel_description,channel_country,channel_custom_url,channel_published_at
9X-3uLoRYp8,Samsung TV,US,relevance,2025-10-12T13:08:04.771470,Top 5 Best Smart TV in 2025 with GST Cut | 📺🤩 #SmartTV #Technology #Electronics #TV #Innovation,"​Looking for a new Smart TV in 2025? With the recent GST rate cut, now is the perfect time to upgrade your home entertainment system! In this video, we break down the Top 5 Best Smart TVs of 2025 from leading brands like Sony, Samsung, LG, and more. ​We'll cover everything you need to know, including: ​Our Top 5 Picks: The best smart TVs for every budget, from premium OLEDs to value-for-money options. ​Key Features: What to look for in a 2025 Smart TV, including 4K/8K resolution, 120Hz refresh rates, HDMI 2.1, and the latest smart platforms like Google TV, Tizen, and WebOS.  ​The GST Cut Explained: How the recent reduction from 28% to 18% affects TV prices and how much you can save. ​Detailed Reviews: We compare picture quality, sound, gaming features, and smart functionality for each model. ​Whether you're a movie buff, a dedicated gamer, or just looking for a fantastic TV for your living room, this video will help you make the best buying decision. Don't buy a new TV without watching this! ​Don't forget to like, share, and subscribe for more tech reviews and buying guides! ​ ​#BestSmartTV #SmartTV2025 #GSTCut #SonyTV #SamsungTV #LGTV #4KTV #OLED #QLED #TechReview #BuyingGuide #India #Gadgets #Television #BestTV2025",UCqQBDs_f3v3h-UFFld9PcKQ,Seven Sense Tech,2025-09-22T15:42:37Z,28,en-IN,hi,none,"best smart tv 2025,top 5 smart tv 2025,smart tv gst cut,gst on tv,sony smart tv,samsung smart tv,lg smart tv,best tv under 50000,best tv under 30000,4k tv 2025,oled tv,qled tv,mini led tv,tv buying guide,best television 2025,latest smart tv,new tv 2025,tech india,smart tv review,sony bravia,samsung crystal,lg oled c5,lg g5,best tv for gaming,smart tv features",https://i.ytimg.com/vi/9X-3uLoRYp8/default.jpg,https://i.ytimg.com/vi/9X-3uLoRYp8/mqdefault.jpg,https://i.ytimg.com/vi/9X-3uLoRYp8/hqdefault.jpg,https://i.ytimg.com/vi/9X-3uLoRYp8/sddefault.jpg,https://i.ytimg.com/vi/9X-3uLoRYp8/maxresdefault.jpg,73721,971,0,0,31,93,PT1M33S,2d,hd,false,True,{},rectangular,False,processed,public,youtube,True,True,False,False,,,https://en.wikipedia.org/wiki/Technology,,,,,131000,1879,33664664,"Welcome to Seven Sense Tech, your go-to channel for making technology simple and easy to understand. We dive deep into the world of gadgets to bring you comprehensive reviews and comparisons of the latest smartphones, smart TVs, laptops, and other consumer electronics.  Our goal is to help you make ",IN,@sevensensetech,2016-10-06T17:41:35Z
zkC0dpz3AWw,Samsung TV,US,relevance,2025-10-12T13:08:04.771470,Samsung’s new $30k Micro RGB TV is insane (Please… I’ll do ANYTHING) #c#carterpcst#techtechtok,Samsung’s new $30k Micro RGB TV is insane (Please… I’ll do ANYTHING) #c#carterpcst#techtechtok #samsung,UCi7wDE2ZTiR5QYYrUY5WhtA,CarterPCs,2025-08-25T20:01:43Z,22,en,en,none,,https://i.ytimg.com/vi/zkC0dpz3AWw/default.jpg,https://i.ytimg.com/vi/zkC0dpz3AWw/mqdefault.jpg,https://i.ytimg.com/vi/zkC0dpz3AWw/hqdefault.jpg,https://i.ytimg.com/vi/zkC0dpz3AWw/sddefault.jpg,https://i.ytimg.com/vi/zkC0dpz3AWw/maxresdefault.jpg,1087108,53116,0,0,689,45,PT45S,2d,hd,false,True,{},rectangular,False,processed,public,youtube,True,True,False,False,,,"https://en.wikipedia.org/wiki/Lifestyle_(sociology),https://en.wikipedia.org/wiki/Technology",,,,,1860000,3397,2890775751,"Making consumer tech interesting, 4 times a day. ",US,@actuallycarterpcs,2020-02-26T19:20:23.850035Z
7grOJAfotI4,Samsung TV,US,relevance,2025-10-12T13:08:04.771470,best TV specs? #lindseyszn #Techtok #techgirl #tvbrand #rokutv #samsung #samsungtv,best TV specs? #lindseyszn #Techtok #techgirl #tvbrand #rokutv #samsung #samsungtv,UCer4SkWXjeN7SJo0Mqn4Slw,Lindseyszn,2025-07-31T16:47:38Z,22,en,en,none,,https://i.ytimg.com/vi/7grOJAfotI4/default.jpg,https://i.ytimg.com/vi/7grOJAfotI4/mqdefault.jpg,https://i.ytimg.com/vi/7grOJAfotI4/hqdefault.jpg,https://i.ytimg.com/vi/7grOJAfotI4/sddefault.jpg,https://i.ytimg.com/vi/7grOJAfotI4/maxresdefault.jpg,12835,1980,0,0,76,115,PT1M55S,2d,hd,false,False,{},rectangular,False,processed,public,youtube,True,True,False,False,,,"https://en.wikipedia.org/wiki/Lifestyle_(sociology),https://en.wikipedia.org/wiki/Technology",,,,,38000,621,10340489,https://lindseyszn.com,US,@lindseyszn,2013-03-17T17:21:16Z
gdriFKO8Ye8,Samsung TV,US,relevance,2025-10-12T13:08:04.771470,"Samsung 55"" Crystal 4k UHD ismart TV| UA55UE84AFULXL | #rahulkhurana #samsungtv #4ktv",#rahulkhurana #samsung #4ktv #uhd #smarttv  #samsungtv  Led 55 inch Samsung  Samsung 55inch smart tv  Best Led tv 2025  Best 55 inch smart tv 2025  Best Led tv 📺 2025 under budget  Penasonic 55 inch smart Tv  Haier 55 ich smart tv 2025 #rahulkhurana #samsungtv #bestledtv #55inch #shortsfeed #viralgrowth,UCJ57ypzKvVWlYsmUgJ_p9aw,Rahul Khurana,2025-09-27T18:42:28Z,24,en-IN,hi,none,"Led 55 inch Samsung,Samsung 55inch smart tv,Best Led tv 2025,Best 55 inch smart tv 2025,Best Led tv 📺 2025 under budget,Penasonic 55 inch smart Tv,Haier 55 ich smart tv 2025",https://i.ytimg.com/vi/gdriFKO8Ye8/default.jpg,https://i.ytimg.com/vi/gdriFKO8Ye8/mqdefault.jpg,https://i.ytimg.com/vi/gdriFKO8Ye8/hqdefault.jpg,https://i.ytimg.com/vi/gdriFKO8Ye8/sddefault.jpg,https://i.ytimg.com/vi/gdriFKO8Ye8/maxresdefault.jpg,53462,0,0,0,27,25,PT25S,2d,hd,false,True,{},rectangular,False,processed,public,youtube,True,True,False,False,,,"https://en.wikipedia.org/wiki/Lifestyle_(sociology),https://en.wikipedia.org/wiki/Technology",,,,,7690,294,4337900,"Namaste🙏...    Welcome to my channel, my name is Rahul Khurana and this channel is your  destination for electronic appliance unboxings, in-depth testing, and practical tips and tricks. We bring you honest reviews and hands-on insights to help you make informed decisions. Whether you’re shopping for",IN,@rahulkhurana2,2024-03-05T06:16:50.741922Z
kW4QcM3l27k,Samsung TV,US,relevance,2025-10-12T13:08:04.771470,2025 QN85F: Full Feature Video | Samsung,"Upscale your experience with Samsung Vision AI.    Feast your eyes on the NQ4 AI Gen2 Processor, Quantum Mini LED Pro, and Neo Quantum HDR+, and take your ears on a delightful journey with Dolby Atmos®. Get ready to explore the fantastic features of the QN85F 🦸   For more information, visit http://smsng.co/tvs    #2025NewAITV #VisionAI #4KTV #QN85F #NeoQLED #SamsungAI #SamsungTV #AITV #Samsung",UChO7xlACgCNpOOIA3Wk6MVQ,Samsung Australia,2025-10-09T04:54:21Z,28,en,en-GB,none,,https://i.ytimg.com/vi/kW4QcM3l27k/default.jpg,https://i.ytimg.com/vi/kW4QcM3l27k/mqdefault.jpg,https://i.ytimg.com/vi/kW4QcM3l27k/hqdefault.jpg,,,405,3,0,0,0,229,PT3M49S,2d,hd,false,True,{},rectangular,False,processed,public,youtube,True,True,False,False,,,https://en.wikipedia.org/wiki/Technology,,,,,118000,1766,60287535,"Welcome to the official channel of Samsung Australia, where you can find the latest videos about our company and products. Subscribe to our channel so you will be the first to see Samsung product news, releases and promotions.",AU,@samsungaustralia,2010-03-24T23:25:14Z
Dq3gUqDA-Xw,Samsung TV,US,relevance,2025-10-12T13:08:04.771470,"Would You Spend $30,000 for a Samsung TV 🤔",,UCik8xvfR6s8GQ74QNEGNzwg,Tom’s Guide,2025-08-24T16:06:12Z,28,en,en,none,,https://i.ytimg.com/vi/Dq3gUqDA-Xw/default.jpg,https://i.ytimg.com/vi/Dq3gUqDA-Xw/mqdefault.jpg,https://i.ytimg.com/vi/Dq3gUqDA-Xw/hqdefault.jpg,https://i.ytimg.com/vi/Dq3gUqDA-Xw/sddefault.jpg,https://i.ytimg.com/vi/Dq3gUqDA-Xw/maxresdefault.jpg,34205,2298,0,0,66,62,PT1M2S,2d,hd,false,True,{},rectangular,False,processed,public,youtube,True,True,False,False,,,"https://en.wikipedia.org/wiki/Lifestyle_(sociology),https://en.wikipedia.org/wiki/Technology",,,,,109000,2531,62273300,"Think of us as your geeky friend who's always on call. From smartphones to cord-cutting to video games, we've got your tech needs covered.   ",US,@tomsguideus,2014-12-18T15:52:53Z
vl_JdsRPu_Y,Samsung TV,US,relevance,2025-10-12T13:08:04.771470,"Best 4K TV 2025 - Budget to Ultimate - Sony, LG, Samsung, Panasonic, Hisense & TCL! (Must Watch!)","Looking for the best 4K TV this year? In this video, we rank and review the top models from Sony, LG, Samsung, TCL, and Hisense — covering everything from budget options to ultimate flagship TVs. Whether you want a bright Mini-LED, a cinematic OLED, or a gaming powerhouse with HDMI 2.1 and high refresh rates, we’ve got you covered. #BestTV2025 #4KTV #SonyTV #LGOLED #SamsungTV #TCLTV #HisenseTV #MiniLED #OLEDTV #GamingTV #hometheater   We break down key features like picture quality, HDR performance, refresh rates, gaming support, and smart TV platforms so you can find the perfect screen for movies, sports, and gaming. From value-packed TVs like TCL and Hisense to premium OLEDs from Sony, LG, and Samsung, this guide will help you choose the right TV for your home theater or living room setup.  ⭐🌟⭐ Top 7 BEST 4K TVs of 2025 | Check Today’s Prices & Deals Here 👇 👇  📺 TCL  QM7K Series QD-Mini LED 4K UHD Google Smart TV Best Premium Mini-LED TV - QLED, 144hz, 240hz Gaming Rate, Anti-Reflective Screen, Bang & Olufsen Audio, Atmos (QM7K, 2025 Model) 👉 https://amzn.to/41VyvNU  📺 Hisense U8N/U8 Series Mini-LED ULED 4K UHD Google Smart TV (U8N) - QLED, Dolby Vision IQ, Dolby Atmos, Full Array Local Dimming Pro, 144Hz Game Mode Pro, Alexa Compatibility 👉 https://amzn.to/4n1LTZn  📺 PANASONIC Z95 Series (2025 Model) 55-inch OLED 4K Ultra HD Smart Fire TV, HDR10+ Adaptive, Dolby Vision IQ, 360 Soundscape Pro, 144Hz Refresh Rate and Hands-Free Alexa 👉 https://amzn.to/48jbJDt  📺 Sony BRAVIA 8 II TV, QD OLED, 4K Smart Google TV, XR Processor with AI Technology, Ultra Slim Design, 120hz Television, Dolby Vision/Atmos, Exclusive Features for PS5, 2025 Model👉 https://amzn.to/4ny3VCj  📺 LG C5 OLED evo AI 4K C5 Series Smart TV w/Dolby Atmos, Dolby Vision, HDR10, AI Super Upscaling 4K, Filmmaker Mode, Wow Orchestra, Alexa Built-in 👉 https://amzn.to/3IgMF5K  📺 Samsung S95F OLED S95F 4K Glare Free Smart TV (2025 Model) NQ4 AI Gen3 Processor, OLED HDR Pro, Motion Xcelerator 164Hz, Dolby Atmos, Samsung Vision AI, Alexa Built-in 👉 https://amzn.to/3VnvzpH  📺 LG G5 OLED evo AI 4K G5 Series Smart TV w/Dolby Atmos, Dolby Vision, HDR10, AI Super Upscaling 4K, Filmmaker Mode, Wow Orchestra, Alexa Built-in 👉 https://amzn.to/42pR9h6   ✮✮✮ Try Amazon Prime 30-Day FREE Trial | Unlimited Fast and Free Two-Day Shipping with Amazon Prime ► https://amzn.to/3oJ04DB ◄ ✮✮✮ Get a FREE 6 Month Amazon Prime Shipping, if you're a STUDENT: ► https://amzn.to/2MlVRZG ◄ ✮✮✮ Try FREE Audible Plus and Get Two Free Audiobooks ► https://amzn.to/3ar4Dxn ◄ ✮✮✮ Try 30 Days Free Amazon Prime Video ► https://amzn.to/36CQnk2 ◄ ✮✮✮ Try Amazon Fresh  ► https://amzn.to/3NXFRcW ◄  Amazon Affiliate Disclosure Notice: Tech Legend is a participant in the Amazon Services LLC Associates Program. As an Amazon Associate, I earn from qualifying purchases made through affiliate links. Your support through these links helps us continue creating content that assists you in making informed decisions.  Business inquiries: techlegendofficial@gmail.com  Subscribe: https://www.youtube.com/techlegend?sub_confirmation=1 Facebook: https://facebook.com/techlegendhq Twitter: https://twitter.com/techlegendhq Instagram: https://www.instagram.com/techlegendhq/ Website: https://www.techlegend.us  ⏱️ Timestamps 0:00 – Intro: Best 4K TVs Ranked from Budget to Flagship 0:40 – TCL QM7K Series QD-Mini LED – Affordable Premium with 288Hz Gaming 2:19 – Hisense U8N Mini-LED – Value Workhorse with Hi-View Engine Pro 3:58 – Panasonic Z95 OLED – Cinematic Accuracy & HDR Brilliance 5:46 – Sony Bravia 8 II OLED – QD-OLED with Acoustic Surface Audio+ 10:05 – LG C5 OLED – The All-Around Gaming & Entertainment TV 13:08 – Samsung S95F OLED – QD-OLED with Best Anti-Glare Screen 14:36 – LG G5 OLED – Brightest OLED Ever with META Technology 17:57 – Final Verdict – Best TV for Value, Gaming, Movies & Overall Winner  Best TV 2025, Best 4K TV 2025, Sony Bravia 8, LG C5 OLED, LG G5 OLED, Samsung S95F OLED, TCL QM7K, Hisense U8N, Best OLED TV 2025, Best Mini-LED TV 2025, Best Gaming TV 2025, Top TVs 2025, Budget TV 2025, Flagship TV 2025, Best Smart TV 2025, Best TV for PS5 2025, Best TV for Xbox Series X 2025, Dolby Vision TV 2025, HDR10+ TV 2025, HDMI 2.1 TV 2025, 144Hz TV, 120Hz TV, Best Home Theater TV 2025, Best TV for Movies 2025, Best TV for Sports 2025, Best Value TV 2025, TCL vs Hisense 2025, Sony vs LG OLED 2025, Samsung vs LG OLED 2025, best 4k tv 2025  Disclaimer: The footage in this video was made with fair use in mind and was created as promotional/educational material. Some of the footage of these products was gathered from multiple sources, including manufacturers, fellow creators, and various other sources. However, if you are the creator or owner of any footage and prefer not to have your content promoted or have any concerns about its use in our video, please contact us at [techlegendofficial@gmail.com], and we will promptly remove it. Thank you!  © All rights reserved by respective owners",UCybLjt4Vp59aSXVVcI2RS1w,Tech Legend,2025-09-17T02:53:13Z,28,en,en,none,"best 4k tv,best 4k tv 2025,best 4k tv for gaming,best 4k tv under 500,best 4k tv for ps5,best 4k tv for movies,best 4k tv for xbox series x,best 4k tv under 1000,best 4k tv on a budget,best 4k tv as computer monitor,best affordable 4k tv,best 4k android tv,best 4k tv budget,best 4k tv brand,Best TV 2025,Best 4K TV 2025,Sony Bravia 8,LG C5 OLED,LG G5 OLED,Samsung S95F OLED,TCL QM7K,Hisense U8N,Best OLED TV 2025,Best Gaming TV 2025,4k,120hz,gaming,pc",https://i.ytimg.com/vi/vl_JdsRPu_Y/default.jpg,https://i.ytimg.com/vi/vl_JdsRPu_Y/mqdefault.jpg,https://i.ytimg.com/vi/vl_JdsRPu_Y/hqdefault.jpg,https://i.ytimg.com/vi/vl_JdsRPu_Y/sddefault.jpg,https://i.ytimg.com/vi/vl_JdsRPu_Y/maxresdefault.jpg,1347,265,0,0,3,1204,PT20M4S,2d,hd,false,True,{},rectangular,False,processed,public,youtube,True,False,False,False,,,https://en.wikipedia.org/wiki/Technology,,,,,110000,129,1979653,"👋 Welcome to our channel, where we provide comprehensive and insightful content on the latest and most advanced technology available in today's market across each category that we review. Our videos cover a broad range of tech products, meticulously reviewing them to help you make informed purchasin",US,@techlegend,2017-09-06T09:14:21Z
vuViFdaj7-k,Samsung TV,US,relevance,2025-10-12T13:08:04.771470,"Just installed the stunning Samsung QN90F Neo QLED 55” - sleek design, and insane brightness!","Another flawless install by the team at SimplyAV.co.uk 💪  Samsung QN90F Neo QLED 55” — ultra-slim, ultra-bright, and perfectly mounted ✅  Picture quality that speaks for itself 👌  Need your setup done right? You know who to call. 📞🎯 07780350222  #SimplyAV #TVInstallationExperts #SamsungQN90F #NeoQLED #55InchTV #HomeCinema #WallMountTV #SmartHomeSetup #UKInstallers",UC8BSZ6Kq4LIN9RZQ7QM-8tQ,Simply AV,2025-07-21T18:34:37Z,24,en,zxx,none,"Samsung,Samsung TV,Samsung OLED,Samsung QLED,New Tv,New Samsung TV,How to wall mount Samsung,Samsung TV unboxing,Unboxing ATV,ASMR unboxing,ASMR TV unboxing,ASMR TV bracket,ASMR Tv Install,Tv Install installation,Tv Install,Audiovisual,AV installation,Technology Install,How to wall mount,How to hang,Hanging in the TV,Hanging in a TV,Mounting a TV on the wall hidden cables,Hidden cables",https://i.ytimg.com/vi/vuViFdaj7-k/default.jpg,https://i.ytimg.com/vi/vuViFdaj7-k/mqdefault.jpg,https://i.ytimg.com/vi/vuViFdaj7-k/hqdefault.jpg,https://i.ytimg.com/vi/vuViFdaj7-k/sddefault.jpg,https://i.ytimg.com/vi/vuViFdaj7-k/maxresdefault.jpg,71778,1523,0,0,35,57,PT57S,2d,hd,false,True,{},rectangular,False,processed,public,youtube,True,True,False,False,,,"https://en.wikipedia.org/wiki/Hobby,https://en.wikipedia.org/wiki/Lifestyle_(sociology),https://en.wikipedia.org/wiki/Technology",,51.7668369,0.4757762,0,123000,689,136040797,"Website: www.simplyav.co.uk  WhatsApp or Call: 07780350222  Email: sales@simplyav.co.uk  From consultation to installation, we take care of everything. Subscribe for expert advice, inspiration, and behind-the-scenes content.",GB,@16ktv,2014-11-14T21:39:28Z
LKdztNtK6G8,Samsung TV,US,relevance,2025-10-12T13:08:04.771470,Top 3 Best 32 inch Smart TV Under 15000 Deals on Flipkart Big Billion Days Sale 2025,first samsung led second lg third xiaomi by mi,UCcrlfuLcQGdjYsgePISy-9A,CHROME TECH,2025-09-21T14:58:07Z,28,en-IN,ta,none,"best smart tv under 15000,best smart tv under 15000 in 2025,best 32 inch tv,best 32 inch tv under 15000,best 32 inch smart tv 2025 under 15000,best 32 inch smart tv,best 32 inch smart tv 2025,best tv under 15000,best smat tv 32 inch,32 inch smart tv best 2025",https://i.ytimg.com/vi/LKdztNtK6G8/default.jpg,https://i.ytimg.com/vi/LKdztNtK6G8/mqdefault.jpg,https://i.ytimg.com/vi/LKdztNtK6G8/hqdefault.jpg,https://i.ytimg.com/vi/LKdztNtK6G8/sddefault.jpg,https://i.ytimg.com/vi/LKdztNtK6G8/maxresdefault.jpg,25042,167,0,0,2,23,PT23S,2d,hd,false,True,{},rectangular,False,processed,public,youtube,True,True,False,False,,,https://en.wikipedia.org/wiki/Technology,,,,,86800,2434,33139320,AC TV Laptop Review in Tamil Welcome to our CHROME TECH India Official Channel. Our Videos Contains a Honest Full Review of Air Conditioner LED TV Refrigerator Washing Machine Dishwasher Air Cooler and Stabilizer etc. Including product comparison Buying guide - pros and cons explained for viewers. W,IN,@chrometech,2020-06-28T15:50:27.538535Z
uW9azYNJ6Vg,Samsung TV,US,relevance,2025-10-12T13:08:04.771470,"Samsung TV Secret Service Menu Codes to Fix YouTube, Netflix, WiFi, HDMI & More!","Samsung TV Secret Service Menu Codes to Fix YouTube, Netflix, WiFi, HDMI & More! 📺 Having problems with your Samsung Smart TV? Apps not working? YouTube or Netflix not loading? TV stuck on the boot logo, Wi-Fi keeps disconnecting, or you're getting that annoying HDMI ""No Signal"" error?  👉Get Amazing Fireplace Tv Stand Console with LED Light Entertainment 👉https://amzn.to/4gkb4Um   👉Get World's Best Android Box in 2025, Contains Everything  👉https://amzn.to/4n0Fi1u    👍Electronic Secret Recommended VPN with Discount and Extra 4 Month👍  👉 https://nordvpn.com/ElectronicSecret  OR  👉 http://get.affiliatescn.net/aff_c?offer_id=153&aff_id=130354&url_id=613   For Promotions & Collaborations, Contact Electronic Secret  🌐 Business Email: ebusiness618@gmail.com   Don’t worry — in this video, I’ll show you how to access the Samsung TV’s Secret Service Menu using hidden codes that most people don’t even know exist!   This powerful menu can help you:  ✅ Fix app errors  ✅ Restore YouTube & Netflix  ✅ Reconnect or reset Wi-Fi  ✅ Solve HDMI / No Signal issues  ✅ Fix boot loop problems  ✅ Reinstall or update Samsung Store  ✅ Reset your TV internally — and more!   ⚙️ I'll show you ALL the working service menu codes across different Samsung TV models, including both older and newer versions.  🔍 Tried the codes but nothing worked?   💬 Drop your TV model number in the comments, and I’ll help you find the right code for YOUR specific TV!   Your Queries: Samsung TV secret menu, Samsung service menu code, Samsung TV hidden menu, Samsung TV troubleshooting, YouTube not working on Samsung TV, Netflix not working on Samsung TV, Samsung TV WiFi problem, Samsung TV HDMI no signal, Samsung TV stuck on boot logo, Samsung TV reset code, Samsung smart hub not working, Samsung TV app store problem, Samsung TV factory reset, Samsung TV service mode, Samsung TV service menu access, Samsung TV repair, Samsung smart TV not working, Samsung TV secret codes, fix Samsung TV apps, Samsung TV error fix, Samsung TV WiFi disconnecting, Samsung TV YouTube fix, Samsung TV Netflix error, Samsung TV app issues, Samsung TV code to reset, Samsung TV screen freeze, how to open Samsung TV secret menu, Samsung TV boot loop fix, Samsung TV hidden settings, Samsung TV remote codes #SamsungTV #SmartTVFix #ServiceMenu      #YouTubeNotWorking #NetflixFix #WiFiIssues #HDMIError #NoSignalTV #SecretCodes #ElectronicSecret",UCpl5wnBauLidkZtmFiAozcQ,Electronic Secret,2025-09-12T18:00:38Z,26,en-US,en-US,none,"Samsung TV secret menu,Samsung service menu code,Samsung TV hidden menu,Samsung TV troubleshooting,YouTube not working on Samsung TV,Netflix not working on Samsung TV,Samsung TV WiFi problem,Samsung TV HDMI no signal,Samsung TV stuck on boot logo,Samsung TV reset code,Samsung smart hub not working,Samsung TV app store problem,Samsung TV factory reset,Samsung TV service mode,Samsung TV service menu access,Samsung smart TV not working,electronic secret,samsung,tv",https://i.ytimg.com/vi/uW9azYNJ6Vg/default.jpg,https://i.ytimg.com/vi/uW9azYNJ6Vg/mqdefault.jpg,https://i.ytimg.com/vi/uW9azYNJ6Vg/hqdefault.jpg,https://i.ytimg.com/vi/uW9azYNJ6Vg/sddefault.jpg,https://i.ytimg.com/vi/uW9azYNJ6Vg/maxresdefault.jpg,1391,35,0,0,3,303,PT5M3S,2d,hd,false,True,{},rectangular,False,processed,public,youtube,True,True,False,False,,,https://en.wikipedia.org/wiki/Technology,,,,,89000,727,20414061,"Welcome to Electronic Secret – your ultimate hub for TV repairs, troubleshooting, and Firestick hacks! Whether it's fixing a broken screen, updating software, or solving Smart TV issues, we've got the tips and tricks you need.  👉 Subscribe now and never miss a fix! shorts, Got a problem? Drop a comm",US,@electronicsecret,2020-08-21T09:02:53.640964Z
t-fh_HIcX8Q,Samsung TV,US,relevance,2025-10-12T13:08:04.771470,Samsung TV 32 inch 🔥 UA32H4500FUXXL Unboxing Video #samsung #viral #smarttv #unboxing,Samsung TV 32 inch 🔥 UA32H4500FUXXL Unboxing Video #samsung #viral #smarttv #unboxing   #samsung  #tv,UCsJk98tScVXFWgvfErq_Vzg,Meher Kitchen's Vlogs ,2025-07-23T14:13:50Z,22,en,ru,none,"#samsung,#tv,#unboxing,#smarttv",https://i.ytimg.com/vi/t-fh_HIcX8Q/default.jpg,https://i.ytimg.com/vi/t-fh_HIcX8Q/mqdefault.jpg,https://i.ytimg.com/vi/t-fh_HIcX8Q/hqdefault.jpg,https://i.ytimg.com/vi/t-fh_HIcX8Q/sddefault.jpg,https://i.ytimg.com/vi/t-fh_HIcX8Q/maxresdefault.jpg,80754,922,0,0,29,37,PT37S,2d,hd,false,False,{},rectangular,False,processed,public,youtube,True,True,False,False,,,"https://en.wikipedia.org/wiki/Lifestyle_(sociology),https://en.wikipedia.org/wiki/Technology",,,,,86,9,97957,"🙏 ସ୍ୱାଗତ କରୁଛି Meher Kitchen Vlogs | ସ୍ୱାଦ ଓ ପ୍ରେମରେ ପରିପୂର୍ଣ୍ଣ 🏡ଘରୋଇ ରେସିପି 😋  Meher Kitchen Vlogs କୁ ସ୍ୱାଗତ! 🙏 ଏଠି ଆପଣ ପାଇବେ ସହଜ, ସ୍ୱାସ୍ଥ୍ୟକର ଓ ସ୍ୱାଦିଷ୍ଟ ଘରୋଇ ରେସିପି ଯାହା ଘରେ ସହଜରେ ବନାଇପାରିବେ। ଆମ ଉଦ୍ଦେଶ୍ୟ — ପ୍ରତ୍ୟେକ ବୟସ ଓ ଆବଶ୍ୟକତା ପାଇଁ ଘରୋଇ ଶୈଳୀରେ କିଛି ବିଶେଷ ପ୍ରସ୍ତୁତ କରିବା।  ଆମର ଚ୍ୟାନେଲ୍‌ରେ ଆପଣ ପା",,@meherkitchenvlogs,2020-09-01T11:08:26.731894Z
