video_id,search_keyword,search_region,search_order,collected_at,title,description,channel_id,channel_title,published_at,category_id,default_language,default_audio_language,live_broadcast_content,tags,thumbnail_default,thumbnail_medium,thumbnail_high,thumbnail_standard,thumbnail_maxres,view_count,like_count,dislike_count,favorite_count,comment_count,duration_seconds,duration_iso,dimension,definition,caption,licensed_content,content_rating,projection,has_custom_thumbnail,upload_status,privacy_status,license,embeddable,public_stats_viewable,made_for_kids,self_declared_made_for_kids,topic_ids,relevant_topic_ids,topic_categories,recording_date,location_latitude,location_longitude,location_altitude,channel_subscriber_count,channel_video_count,channel_total_view_count,channel_description,channel_country,channel_custom_url,channel_published_at
Jfgi3X5jBY0,Samsung TV,US,relevance,2025-10-12T13:08:04.770472,9 Samsung TV Settings Tips And Tricks For The Ultimate Experience,"On this video, I'm going to show you nine of my favorite features on a Samsung TV. The reason I say premium tv is because all of these options are not available on every Samsung TV. These features will enhance your 4k tv viewing experience and makes your tv a smart tv.  Samsung S95F 83"" https://geni.us/804H Samsung S95F 77"" https://geni.us/AXQvoJK Samsung S95F 65"" https://geni.us/5P0TQUy ""USED ON VIDEO"" Samsung S95F 55"" https://geni.us/0GgF  🔹 Join My Community https://geni.us/KZ0yXs8 🔹 Steve Merch https://geni.us/PuwI6C 🔹 Camera Gear I Use:  https://geni.us/FCGtGM 🔹Social Media https://geni.us/yBwF  🔉🔉🔉 Listen To Podcast On 🔉🔉🔉  ➡️Apple Podcast https://geni.us/NaZPyL7 ➡️iHeart Radio https://geni.us/6ZXAni ➡️Deezer https://geni.us/oRCki ➡️Spotify https://geni.us/cT5tv ➡️Amazon Music https://geni.us/B3AgaJK  Subscribe Tech Steve YouTube Channel https://geni.us/TWuA8F  Support The Creator 🏪Amazon Store https://www.amazon.com/shop/techsteve 💵Buy Me A Coffee https://geni.us/oI3KX 💵Donate Via Paypal https://geni.us/qmLi  👍🏽 Subscribe, Why not it’s FREE! https://geni.us/TWuA8F  ➡️ DISCLAIMER: This video and description contains affiliate links, The channel gets a small commission for purchases made via these links.  This helps the channel purchase more products for reviews and allow me to create better content for your viewing.  Chapters 00:00 Introduction 00:24 INITIAL SETUP WITH REMOTE 03:01 HOW TO FACTORY RESET TV 03:25 INITIAL SETUP WITH SMARTTHINGS MOBILE APP 05:12 AMBIENT MODE, DAILY+, SMARTTHINGS, DEX 08:31 BUILT-IN STREAMING GAMING APPS 10:54 HOME SCREEN AND CUSTOMIZE APPS 12:33 SMARTTHING APP CALIBRATION 13:42 HOW TO STOP AUTOMATIC FEATURES 14:26 HOW TO SET UP AMAZON ALEXA 16:33 HOW TO USE MULTI VIEW",UCmHO0Rw7nBFK2233om_vyWA,Tech Steve,2025-09-19T20:26:45Z,28,en,en,none,"Samsung TV Tips,9 Cool Things You Didn't Know Your Samsung,samsung tv tips and tricks,samsung smart tv,samsung tv,samsing s95f,samsung s95f,samsung s95f review,samsung s95f oled,samsung oled,samsung s95f gaming,samsung oled tv,samsung tv guide,samsung tv tips and tricks 2024,samsung tv guide 2025,samsung frame tv tips,samsung tv tips adn tricks,samsung tv remote tips,samsung tv picture settings,s95f samsung,samsung tv settings",https://i.ytimg.com/vi/Jfgi3X5jBY0/default.jpg,https://i.ytimg.com/vi/Jfgi3X5jBY0/mqdefault.jpg,https://i.ytimg.com/vi/Jfgi3X5jBY0/hqdefault.jpg,https://i.ytimg.com/vi/Jfgi3X5jBY0/sddefault.jpg,https://i.ytimg.com/vi/Jfgi3X5jBY0/maxresdefault.jpg,4084,109,0,0,12,1096,PT18M16S,2d,hd,false,True,{},rectangular,False,processed,public,creativeCommon,True,True,False,False,,,https://en.wikipedia.org/wiki/Technology,,32.7157402038574,-117.1610794067383,0,218000,1033,69162157,"Hello everyone, and welcome to The Tech Steve Channel! Here, I share my passion for technology—from televisions and audio, to the latest gadgets shaping the consumer market. Over the years, I’ve worked across industries, from wireless and electronic sales to IT and computer building, always driven b",US,@techsteve,2013-11-18T22:01:27Z
fE3Goap-Q1I,Samsung TV,US,relevance,2025-10-12T13:08:04.770472,Best Samsung TVs 2025  [don’t buy one before watching this],"#SamsungTVs #TechReview #HomeEntertainment #SmartTV #QLED  All Samsung Products - 5% OFF at https://geni.us/JSuojH  ► Links to the Best Samsung TVs   Chapters 01:01    ► 6. Samsung S95F OLED  https://geni.us/zG7YBc 02:49    ► 5. Samsung QN65S95D   https://geni.us/QOfGbUr 04:47    ► 4. Samsung S90F OLED  https://geni.us/lje9q 06:26    ► 3. Samsung S85F OLED   https://geni.us/9iDJMc 08:05    ► 2. Samsung Q60D      https://geni.us/Knpa 10:01    ► 1. Samsung Q80D       https://geni.us/25CYLdg  In this comprehensive guide, we’ll delve into the top models that Samsung has to offer, including their stunning QLED options and cutting-edge Neo QLED technology. Whether you're a movie buff, a gaming enthusiast, or simply looking for a sleek addition to your living room, we’ve got you covered! 🛋️🎮  🎁 Get your FREE 30-day trial of Amazon Prime,  👉  Free Shipping! / Unlimited streaming / Daily Deals     👉  https://amzn.to/4fuDpHl  Subscribe for more content (IT'S FREE): https://www.youtube.com/c/LegitPick?sub_confirmation=1  It would make my day if you could also follow me on: 😊 Facebook: https://www.facebook.com/LegitPick​ 🌈 Instagram: http://instagram.com/LegitPick​​ 🐦 Twitter: http://twitter.com/LegitPick​​  ►Disclaimer◄ Some of the footage used in this video is not original content produced by LegitPick. Portions of stock footage of products were gathered from multiple sources including, manufactures, fellow creators, and various other sources. If something belongs to you, and you want it to be removed, please do not hesitate to contact us at thelegitpick[at]gmail.com  LegitPick is a participant in the Amazon Services LLC Associates Program, an affiliate advertising program designed to provide a means for sites to earn advertising fees by advertising and linking to Amazon.com. As an Amazon Associate, I earn from qualifying purchases.  Thanks a lot for watching, if you are any questions feel free to ask in the comments.",UCiMf_b_9J-w-sQSlj7HyCJw,Legit Pick,2025-07-25T14:01:10Z,28,en-US,en-US,none,,https://i.ytimg.com/vi/fE3Goap-Q1I/default.jpg,https://i.ytimg.com/vi/fE3Goap-Q1I/mqdefault.jpg,https://i.ytimg.com/vi/fE3Goap-Q1I/hqdefault.jpg,https://i.ytimg.com/vi/fE3Goap-Q1I/sddefault.jpg,https://i.ytimg.com/vi/fE3Goap-Q1I/maxresdefault.jpg,9184,56,0,0,4,760,PT12M40S,2d,hd,false,True,{},rectangular,False,processed,public,youtube,True,True,False,False,,,https://en.wikipedia.org/wiki/Technology,,,,,37800,785,21353338," If you are like us, then you understand how important it is to find the perfect products, This is the reason we created this channel, just as the name suggests, you don't need to buy anything without know if it's worth your money or not.  Legit Pick helps you find the Top 5 Reviews in every niche l",US,@legitpick,2021-03-16T14:26:15.280744Z
ovSa5WhVp4M,Samsung TV,US,relevance,2025-10-12T13:08:04.770472,Use Your Samsung Galaxy Watch to Control Your Samsung TV,"Did you know you could do this with your Samsung Galaxy Watch and Samsung TV? It is called pointer mode. If you have a recent 2025+ Samsung TV with Vision AI and a supported Samsung Galaxy Watch, you can enable a mode that lets you move your hand around like a pointer and make different hand gestures for various actions.   Do you think this is cool, or a gimmick?.   #samsung #samsunggalaxywatch #samsungtv #samsunggalaxywatch6 #samsungqled #samsunggalaxyultra #samsunggalaxy #galaxyultra #galaxywatch",UCEAMLkMKtq6YhmaZdUT1ywA,This is Tech Today,2025-09-01T03:14:15Z,28,en,en,none,,https://i.ytimg.com/vi/ovSa5WhVp4M/default.jpg,https://i.ytimg.com/vi/ovSa5WhVp4M/mqdefault.jpg,https://i.ytimg.com/vi/ovSa5WhVp4M/hqdefault.jpg,https://i.ytimg.com/vi/ovSa5WhVp4M/sddefault.jpg,https://i.ytimg.com/vi/ovSa5WhVp4M/maxresdefault.jpg,18833,820,0,0,14,43,PT43S,2d,hd,false,True,{},rectangular,False,processed,public,youtube,True,True,False,False,,,"https://en.wikipedia.org/wiki/Lifestyle_(sociology),https://en.wikipedia.org/wiki/Technology",,,,,471000,1045,97574706,"As the host of ""This is Tech Today,"" M. Brandon Lee delves into how technology intersects with our daily lives, businesses, and creative pursuits. Technology has permeated every aspect of our existence, changing how we work, play, interact, create, and live. We aim to better understand what tomorrow",US,@thisistechtoday,2016-12-07T07:58:42Z
ugpcp1Dt8Dk,Samsung TV,US,relevance,2025-10-12T13:08:04.770472,How to install google play store app on Samsung Smart TV,How to get google play store on Samsung tv Tizen. How to install 3rd party apps on samsung smart tv. How to install google play store on smart tv. How to enable google play services on smart tv   ************************************************************************************ If you are really interested in my video please follow me on YouTube and Facebook …………………………………………………………………………………………………. Subscribe to my channel: https://www.youtube.com/channel/UC_J9mmyih3YF-sKXK1fwyFQ  FACEBOOK GROUP: https://web.facebook.com/groups/411530109484518   FACEBOOK PAGE: https://web.facebook.com/itmagicsbd …………………………………………………………………………………………………..  Background music: https://studio.youtube.com/channel/UC_J9mmyih3YF-sKXK1fwyFQ/music,UCDqoeeWJSingko0Vky3Upuw,IT Magics,2025-09-17T04:30:04Z,26,en,en,none,"it magics,how to,how to enable google play services on smart tv,how to install google play store on smart tv,how to install 3rd party apps on samsung smart tv,how to get google play store on samsung tv tizen,How to install google play store app on Samsung Smart TV",https://i.ytimg.com/vi/ugpcp1Dt8Dk/default.jpg,https://i.ytimg.com/vi/ugpcp1Dt8Dk/mqdefault.jpg,https://i.ytimg.com/vi/ugpcp1Dt8Dk/hqdefault.jpg,https://i.ytimg.com/vi/ugpcp1Dt8Dk/sddefault.jpg,https://i.ytimg.com/vi/ugpcp1Dt8Dk/maxresdefault.jpg,8590,20,0,0,6,115,PT1M55S,2d,hd,false,True,{},rectangular,False,processed,public,youtube,True,True,False,False,,,"https://en.wikipedia.org/wiki/Lifestyle_(sociology),https://en.wikipedia.org/wiki/Technology",2025-09-16T00:00:00Z,,,,278000,1601,150972635,"👋 Hi friends! In this video, I shared a little about the problems I faced in my personal life and how I solved them. Just like that, I also love helping people fix their software and hardware issues in simple and easy ways.  💻 If you want your technical problems solved faster, don’t forget to subscr",IN,@itmagics,2013-04-19T12:00:25Z
I_GQPrCf90s,Samsung TV,US,relevance,2025-10-12T13:08:04.770472,This Could Be The Last Glossy Samsung OLED TV Ever… [REVIEW],"We review the 65-inch Samsung S90F featuring a QD-OLED panel, which could potentially be the last glossy OLED TV from the South Korean brand.  The ""Includes Paid Promotion"" message in this video refers to the sponsorship by British AV retailer Richer Sounds. If you're interested in getting a new TV, even if it's not a new Samsung OLED, please support this channel by considering buying from them. Visit your local Richer Sounds store to get the best deals through cheaper 'VIP exclusive' in-store only prices,  or call telesales for your next TV purchase on 0333 900 0093. Thanks again for your support.  ======================== **Click Below to SUBSCRIBE for More Reviews, Sneak Peeks & Tips: https://www.youtube.com/channel/UCcCYOO2uYPnG-21WDOWdwew?sub_confirmation=1 ========================  VISIT HDTV Test http://www.hdtvtest.co.uk/  FOLLOW US! https://bsky.app/profile/hdtvtest.bsky.social https://www.threads.net/@hdtvtest https://www.tiktok.com/@hdtvtest https://www.instagram.com/hdtvtest https://twitter.com/vincent_teoh https://www.patreon.com/hdtvtest",UCcCYOO2uYPnG-21WDOWdwew,HDTVTest,2025-10-10T20:56:27Z,28,en,en,none,,https://i.ytimg.com/vi/I_GQPrCf90s/default.jpg,https://i.ytimg.com/vi/I_GQPrCf90s/mqdefault.jpg,https://i.ytimg.com/vi/I_GQPrCf90s/hqdefault.jpg,https://i.ytimg.com/vi/I_GQPrCf90s/sddefault.jpg,https://i.ytimg.com/vi/I_GQPrCf90s/maxresdefault.jpg,21982,806,0,0,198,691,PT11M31S,2d,hd,false,True,{},rectangular,False,processed,public,youtube,True,True,False,False,,,https://en.wikipedia.org/wiki/Technology,,,,,599000,961,165856427,"Youtube's leading voice on TV technology, with many videos getting at least 20000 views, 1000 likes & tons of comments. ",GB,@hdtvtest,2007-03-02T19:38:24Z
qNn1SLTjA2g,Samsung TV,US,relevance,2025-10-12T13:08:04.770472,You bought the wrong TV!,"➡️ Stay connected with an @UbigiOfficial Travel eSIM: https://go.ubigi.com/RG9062 💵 Use promo code JON10 to save 10%!   Shopping for a Samsung TV in 2025 can be confusing, but this guide explains what the letters mean, which models are better for bright rooms or gaming, and why clearance 2024 sets like the Q80D and QN95D are often a better choice. So, here's your Samsung lineup cheat sheet for 2025!  📢 Check out The Viewing Angle - https://www.youtube.com/channel/UCEZkzP56Hp79jBA2B2j_-Xw  📺 TVs Featured Samsung QN90F https://amzn.to/3Wa8S8E Samsung S95F https://amzn.to/3Is70VN Samsung QN990F https://amzn.to/4pFBXGD Samsung U8000F https://amzn.to/4pOgLyr Samsung Q7F https://amzn.to/4pHwEqe Samsung Q8F https://amzn.to/3Wesg4l Samsung Q80D (2024) https://amzn.to/42JtOXJ Samsung QN95D (2024) https://www.bestbuy.com/product/samsung-qn95d-qn75qn95daf-75-inches-4k-smart-led-tv-titan-black-graphite-black-2024-uhd-3840-x-2160-resolution-high-d/J3ZYG2H4FK/sku/10772937?ref=212&loc=marketplace Samsung QN900F https://amzn.to/4pFCcS3 Samsung S95D (2024) https://amzn.to/3IHWABk Samsung S90F https://amzn.to/4mGwtc1 Samsung S85F https://amzn.to/4nSIPPf Samsung The Frame Pro https://amzn.to/4gKEco4  🎥 GEAR: https://kit.co/JonRettinger/youtube-gear-2020 🎵 My music comes from Musicbed; check them out: http://share.mscbd.fm/jonrettinger  👋 Follow me! Instagram: https://www.instagram.com/jonrettinger/ X: https://twitter.com/Jon4Lakers Facebook: https://www.facebook.com/JonRettingerYT/ Website: https://www.jon4lakers.tech",UCR0AnNR7sViH3TWMJl5jyxw,Jon Rettinger,2025-09-25T23:06:29Z,28,en,en,none,"jon rettinger,jon4lakers,technobuffalo,samsung 2025 tv lineup,best samsung tv 2025,samsung tv buying guide,samsung qn90f,samsung qn95d,qn90f vs qn95d,samsung s95f,s95d vs s95f,samsung qn990f,samsung qn900f,samsung q8f,samsung u8000f,samsung q80d,samsung frame pro,samsung oled vs qled,qd oled,neo qled,mini led tv,best tv for ps5,gaming tv 120hz,bright room tv,8k tv vs 4k,should you buy 8k,best 4k tv 2025,which samsung tv to buy",https://i.ytimg.com/vi/qNn1SLTjA2g/default.jpg,https://i.ytimg.com/vi/qNn1SLTjA2g/mqdefault.jpg,https://i.ytimg.com/vi/qNn1SLTjA2g/hqdefault.jpg,https://i.ytimg.com/vi/qNn1SLTjA2g/sddefault.jpg,https://i.ytimg.com/vi/qNn1SLTjA2g/maxresdefault.jpg,498263,789,0,0,41,804,PT13M24S,2d,hd,false,True,{},rectangular,False,processed,public,youtube,True,True,False,False,,,"https://en.wikipedia.org/wiki/Lifestyle_(sociology),https://en.wikipedia.org/wiki/Technology",,,,,1650000,5057,717196311,"Welcome to the video home of Jon Rettinger, formerly of TechnoBuffalo.   This channel is a forum for all things electronic. It's an open forum, so feel free to speak your mind.  NOTE: All company e-mails will come from the below address. Any communication from another address is fraudulent. Email: j",US,@jon4lakers,2007-06-08T00:48:45Z
iv3gFxZak0I,Samsung TV,US,relevance,2025-10-12T13:08:04.770472,Samsung U8000F Crystal UHD VS Q7F QLED 4K TV,"Samsung U8000F 43"" https://geni.us/cOl9ZS2 Samsung U8000F 50"" https://geni.us/Z6KaIid Samsung U8000F 55""  https://geni.us/9lQJd Samsung U8000F 58"" https://geni.us/I8f6BD8 Samsung U8000F 65""  https://geni.us/WZX8lJ Samsung U8000F 75""  https://geni.us/TtOcPA8 Samsung U8000F 85""  https://geni.us/7oNI  85"" Samsung Q7F https://geni.us/CzNzbTC 75"" Samsung Q7F https://geni.us/xoppYy 65"" Samsung Q7F https://geni.us/Qfg1bnp 55"" Samsung Q7F https://geni.us/KHTv 50"" Samsung Q7F https://geni.us/NEVKKAM 43"" Samsung Q7F https://geni.us/XXGqhkg  HDMI eARC to optical and RCA Adapter https://geni.us/7DzriNW  ➡️ DISCLAIMER: This video and description contains affiliate links, The channel gets a small commission for purchases made via these links.  This helps the channel purchase more products for reviews and allow me to create better content for your viewing.  🔹 Join 4K TV Chat Community https://geni.us/KZ0yXs8 🔹 Steve Merch https://geni.us/PuwI6C 🔹 Camera Gear I Use:  https://geni.us/FCGtGM 🔹Social Media https://geni.us/yBwF 🔹5% Slant Wall From Videos https://geni.us/STJIJm   Promo Code ""TECHSTEVEHD"" Video https://youtu.be/ynxmrOHYN9U  *********************************************************  ""Game Content Usage Rules"" using assets and it is not endorsed *********************************************************  #techsteve #samsung   👍🏽 Subscribe,❤️ Like &  Share 📲 Share ---- Hit The Notification 🔔",UCmHO0Rw7nBFK2233om_vyWA,Tech Steve,2025-08-06T17:48:52Z,28,en,en,none,"Samsung U8000F Crystal UHD TV,tech steve,samsung,tech steve samsung,samsung 2023 crystal uhd tv,samsung tu7020 crystal uhd 4k smart tv,samsung crystal hd tv,samsung u8000f crystal uhd tv,crystal processor 4k,samsung crystal uhd,samsung tv,samsung u8000f tv,samsung u8000f,crystal uhd u8000f,My HONEST Review of The Samsung U8000F TV Performance",https://i.ytimg.com/vi/iv3gFxZak0I/default.jpg,https://i.ytimg.com/vi/iv3gFxZak0I/mqdefault.jpg,https://i.ytimg.com/vi/iv3gFxZak0I/hqdefault.jpg,https://i.ytimg.com/vi/iv3gFxZak0I/sddefault.jpg,https://i.ytimg.com/vi/iv3gFxZak0I/maxresdefault.jpg,65377,658,0,0,161,767,PT12M47S,2d,hd,false,True,{},rectangular,False,processed,public,creativeCommon,True,True,False,False,,,https://en.wikipedia.org/wiki/Technology,,32.7157402038574,-117.1610794067383,0,218000,1033,69162157,"Hello everyone, and welcome to The Tech Steve Channel! Here, I share my passion for technology—from televisions and audio, to the latest gadgets shaping the consumer market. Over the years, I’ve worked across industries, from wireless and electronic sales to IT and computer building, always driven b",US,@techsteve,2013-11-18T22:01:27Z
obJToKcbvBo,Samsung TV,US,relevance,2025-10-12T13:08:04.770472,Samsung TV Volume Not Working? Easy Fix in 2 Minutes! #samsung #tv #tech,,UCTVIPLc17qcdQV6QhU8oNzA,Alex Torres,2025-07-30T21:10:09Z,28,en,en,none,,https://i.ytimg.com/vi/obJToKcbvBo/default.jpg,https://i.ytimg.com/vi/obJToKcbvBo/mqdefault.jpg,https://i.ytimg.com/vi/obJToKcbvBo/hqdefault.jpg,https://i.ytimg.com/vi/obJToKcbvBo/sddefault.jpg,https://i.ytimg.com/vi/obJToKcbvBo/maxresdefault.jpg,19783,288,0,0,60,54,PT54S,2d,hd,false,True,{},rectangular,False,processed,public,youtube,True,True,False,False,,,https://en.wikipedia.org/wiki/Technology,,,,,6020,324,1756128,"Welcome to My Channel! Hi there! I'm Alex, and this channel is your go-to destination for everything tech. From reviews and tutorials to the latest gadget updates, I’m here to help you make smarter choices, learn new skills, and stay ahead in the world of technology. 💻 What You’ll Find Here: - Step-",US,@alextorres3282,2018-06-04T16:19:02Z
MwE6G9OvK0Q,Samsung TV,US,relevance,2025-10-12T13:08:04.770472,How to Program Samsung TV Remote to Spectrum Cable Box – Universal Remote Setup,Learn how to program your Samsung TV remote to control your Spectrum Cable Box! 📺 Follow this easy universal remote setup guide to simplify your TV experience. 🔧 #Samsung #Spectrum #RemoteSetup,UCwh4QmgdiLArhnzrVHTJ6iQ,Internet Tips,2025-10-10T08:44:02Z,27,en,en-US,none,,https://i.ytimg.com/vi/MwE6G9OvK0Q/default.jpg,https://i.ytimg.com/vi/MwE6G9OvK0Q/mqdefault.jpg,https://i.ytimg.com/vi/MwE6G9OvK0Q/hqdefault.jpg,https://i.ytimg.com/vi/MwE6G9OvK0Q/sddefault.jpg,https://i.ytimg.com/vi/MwE6G9OvK0Q/maxresdefault.jpg,64,0,0,0,0,102,PT1M42S,2d,hd,false,True,{},rectangular,False,processed,public,youtube,True,False,False,False,,,https://en.wikipedia.org/wiki/Technology,,,,,118000,2983,110275,"Internet Tips helps you solve problems, learn tools, and stay ahead in the digital world. From step-by-step tutorials and troubleshooting tips to smart tech guides, we make gadgets, apps, and websites easy to use. Whether you're fixing a device, learning software, or exploring new features, you’ll f",IN,@internettipss,2016-12-24T02:45:25Z
hf-sEOuvcRA,Samsung TV,US,relevance,2025-10-12T13:08:04.770472,LG Vs Samsung TV | LG QNED TV | Samsung Crystal TV ✅,"#LGVsSamsung, #LGQNED, #SamsungCrystal, #TVComparison, #BestTV, #SmartTV, #4KTV, #QLEDvsQNED, #LGTV, #SamsungTV, #TVReview, #TechReview, #HomeEntertainment, #Gadgets, #BuyingGuide  Don’t buy LG TV light bleeding issue explained: https://hosturl.site/vtpdF4  Buy LG UHDTV: https://amzn.to/47eNh63  Thanks for watching ❤️👍🏻",UCxQQblsU34uzb0qS54QGSzA,Cars 2 Explore,2025-08-24T13:01:16Z,28,en,hi,none,"LGVsSamsung,LGQNEDTV,SamsungCrystalTV,TVComparison,QNEDvsCrystal,BestTV2024,TVReview,SmartTV,4KTV,TVTech,HomeTheater,Gadgets,Electronics,TVBuyingGuide,TechReview,LGTV,SamsungTV,QuantumDot,Nanocell,LEDTV,WhichTVToBuy,TVBattle,TechBattle,TVGaming,MovieNight",https://i.ytimg.com/vi/hf-sEOuvcRA/default.jpg,https://i.ytimg.com/vi/hf-sEOuvcRA/mqdefault.jpg,https://i.ytimg.com/vi/hf-sEOuvcRA/hqdefault.jpg,https://i.ytimg.com/vi/hf-sEOuvcRA/sddefault.jpg,https://i.ytimg.com/vi/hf-sEOuvcRA/maxresdefault.jpg,5182,30,0,0,1,52,PT52S,2d,hd,false,True,{},rectangular,False,processed,public,youtube,True,True,False,False,,,https://en.wikipedia.org/wiki/Technology,,,,,138000,1954,72386353,"Hello friends,  WELCOME to ""CARS2EXPLORE"", On this channel you'll get videos of Cars and some V-logs. Please SUBSCRIBE to Cars 2 Explore, Thanks for visiting my channel keep supporting, loving & exploring. Thank you so much.",IN,@cars2explore,2013-04-04T06:24:03Z
nMMmLxoa_Vg,Samsung TV,US,relevance,2025-10-12T13:08:04.770472,Samsung 43 Inch Smart TV 🤑| 2025 Edition💥|,"Samsung 43-Inch Full HD Smart TV (2025 Edition) | Unboxing, Features, & Review!  In this video, I bring you a full unboxing and review of the Samsung 43-inch Full HD Smart TV (2025 model). Get a complete look at its design, display quality, audio performance, smart features, and more. Is it worth buying in 2025? Watch till the end to find out! =====================================  🔍 Key Highlights:  1. Full HD 1080p Display Quality  2. Smart TV Features with Tizen OS  3. Voice Assistant Support  4. Screen Mirroring & Casting  5. Slim Design & Bezel-less Look  6. Ideal for Bedrooms & Small Rooms =============================/==/=====  💬 Let me know in the comments if you would choose this over a 4K TV!  👍 Like | 🔔 Subscribe | 💬 Comment  #SamsungSmartTV #Samsung43InchTV #SmartTV2025 #SamsungTVReview #TechUnboxing",UC7r_9ZLRNNuKFD4disbVZzg,TechTraveller Blend,2025-07-21T17:12:02Z,28,en,hi,none,"Samsung,samsung smart tv,samsung 43 inch smart tv,smart tv,smart tv unboxing,smart tv review,samsung smart tv unboxing,samsung 32 inch smart tv,smart tv under 20k,Samsung 2025 Edition tv,tv review,Best tv 2025",https://i.ytimg.com/vi/nMMmLxoa_Vg/default.jpg,https://i.ytimg.com/vi/nMMmLxoa_Vg/mqdefault.jpg,https://i.ytimg.com/vi/nMMmLxoa_Vg/hqdefault.jpg,https://i.ytimg.com/vi/nMMmLxoa_Vg/sddefault.jpg,https://i.ytimg.com/vi/nMMmLxoa_Vg/maxresdefault.jpg,74179,1771,0,0,14,75,PT1M15S,2d,hd,false,True,{},rectangular,False,processed,public,youtube,True,True,False,False,,,"https://en.wikipedia.org/wiki/Lifestyle_(sociology),https://en.wikipedia.org/wiki/Technology",,,,,103000,506,41588853,Where products get naked  This channel is all about tech and traveling. You will get cool and amazing videos related to tech and travel vlogs. Here you will find a variety of videos showing the amazing products in market. Here you can also watch mind-blowing traveling vlogs. It's all here on TechTra,IN,@techtravellerblend,2015-07-23T19:07:29Z
YbuJ1XW_LSg,Samsung TV,US,relevance,2025-10-12T13:08:04.770472,Samsung’s MASSIVE new 115” 4K QLED TV (QN90F),"I remember when 50” TVs were coming out and thought they were HUGE. Now, ultra large TVs over 98” are the fastest growing segment, and the Samsung QN90F is Samsung’s largest TV at a maximum size of 115”. It’s MASSIVE! This Quantum Dot /QLED TV is also great for gamers with a high refresh rate in every single HDMI port, so you can have multiple systems hooked up to it. It’s also bright and has Samsung’s “Glare-Free” technology, so it’s great for bright rooms as well.  Are you amongst those looking for ultra-large TVs? Let me know in the comments.   #samsung #samsungtv #TV #QLED #QLEDTV",UCEAMLkMKtq6YhmaZdUT1ywA,This is Tech Today,2025-09-02T22:22:27Z,28,en,en,none,,https://i.ytimg.com/vi/YbuJ1XW_LSg/default.jpg,https://i.ytimg.com/vi/YbuJ1XW_LSg/mqdefault.jpg,https://i.ytimg.com/vi/YbuJ1XW_LSg/hqdefault.jpg,https://i.ytimg.com/vi/YbuJ1XW_LSg/sddefault.jpg,https://i.ytimg.com/vi/YbuJ1XW_LSg/maxresdefault.jpg,8770,217,0,0,10,69,PT1M9S,2d,hd,false,True,{},rectangular,False,processed,public,youtube,True,True,False,False,,,https://en.wikipedia.org/wiki/Technology,,,,,471000,1045,97574706,"As the host of ""This is Tech Today,"" M. Brandon Lee delves into how technology intersects with our daily lives, businesses, and creative pursuits. Technology has permeated every aspect of our existence, changing how we work, play, interact, create, and live. We aim to better understand what tomorrow",US,@thisistechtoday,2016-12-07T07:58:42Z
