video_id,search_keyword,search_region,search_order,collected_at,title,description,channel_id,channel_title,published_at,category_id,default_language,default_audio_language,live_broadcast_content,tags,thumbnail_default,thumbnail_medium,thumbnail_high,thumbnail_standard,thumbnail_maxres,view_count,like_count,dislike_count,favorite_count,comment_count,duration_seconds,duration_iso,dimension,definition,caption,licensed_content,content_rating,projection,has_custom_thumbnail,upload_status,privacy_status,license,embeddable,public_stats_viewable,made_for_kids,self_declared_made_for_kids,topic_ids,relevant_topic_ids,topic_categories,recording_date,location_latitude,location_longitude,location_altitude,channel_subscriber_count,channel_video_count,channel_total_view_count,channel_description,channel_country,channel_custom_url,channel_published_at
fE3Goap-Q1I,samsung tv,US,relevance,2025-10-05T13:42:55.482969,Best Samsung TVs 2025  [don’t buy one before watching this],"#SamsungTVs #TechReview #HomeEntertainment #SmartTV #QLED  All Samsung Products - 5% OFF at https://geni.us/JSuojH  ► Links to the Best Samsung TVs   Chapters 01:01    ► 6. Samsung S95F OLED  https://geni.us/zG7YBc 02:49    ► 5. Samsung QN65S95D   https://geni.us/QOfGbUr 04:47    ► 4. Samsung S90F OLED  https://geni.us/lje9q 06:26    ► 3. Samsung S85F OLED   https://geni.us/9iDJMc 08:05    ► 2. Samsung Q60D      https://geni.us/Knpa 10:01    ► 1. Samsung Q80D       https://geni.us/25CYLdg  In this comprehensive guide, we’ll delve into the top models that Samsung has to offer, including their stunning QLED options and cutting-edge Neo QLED technology. Whether you're a movie buff, a gaming enthusiast, or simply looking for a sleek addition to your living room, we’ve got you covered! 🛋️🎮  🎁 Get your FREE 30-day trial of Amazon Prime,  👉  Free Shipping! / Unlimited streaming / Daily Deals     👉  https://amzn.to/4fuDpHl  Subscribe for more content (IT'S FREE): https://www.youtube.com/c/LegitPick?sub_confirmation=1  It would make my day if you could also follow me on: 😊 Facebook: https://www.facebook.com/LegitPick​ 🌈 Instagram: http://instagram.com/LegitPick​​ 🐦 Twitter: http://twitter.com/LegitPick​​  ►Disclaimer◄ Some of the footage used in this video is not original content produced by LegitPick. Portions of stock footage of products were gathered from multiple sources including, manufactures, fellow creators, and various other sources. If something belongs to you, and you want it to be removed, please do not hesitate to contact us at thelegitpick[at]gmail.com  LegitPick is a participant in the Amazon Services LLC Associates Program, an affiliate advertising program designed to provide a means for sites to earn advertising fees by advertising and linking to Amazon.com. As an Amazon Associate, I earn from qualifying purchases.  Thanks a lot for watching, if you are any questions feel free to ask in the comments.",UCiMf_b_9J-w-sQSlj7HyCJw,Legit Pick,2025-07-25T14:01:10Z,28,en-US,en-US,none,,https://i.ytimg.com/vi/fE3Goap-Q1I/default.jpg,https://i.ytimg.com/vi/fE3Goap-Q1I/mqdefault.jpg,https://i.ytimg.com/vi/fE3Goap-Q1I/hqdefault.jpg,https://i.ytimg.com/vi/fE3Goap-Q1I/sddefault.jpg,https://i.ytimg.com/vi/fE3Goap-Q1I/maxresdefault.jpg,8320,49,0,0,4,760,PT12M40S,2d,hd,false,True,{},rectangular,False,processed,public,youtube,True,True,False,False,,,https://en.wikipedia.org/wiki/Technology,,,,,37800,780,21316024," If you are like us, then you understand how important it is to find the perfect products, This is the reason we created this channel, just as the name suggests, you don't need to buy anything without know if it's worth your money or not.  Legit Pick helps you find the Top 5 Reviews in every niche l",US,@legitpick,2021-03-16T14:26:15.280744Z
Jfgi3X5jBY0,samsung tv,US,relevance,2025-10-05T13:42:55.482969,9 Samsung TV Settings Tips And Tricks For The Ultimate Experience,"On this video, I'm going to show you nine of my favorite features on a Samsung TV. The reason I say premium tv is because all of these options are not available on every Samsung TV. These features will enhance your 4k tv viewing experience and makes your tv a smart tv.  Samsung S95F 83"" https://geni.us/804H Samsung S95F 77"" https://geni.us/AXQvoJK Samsung S95F 65"" https://geni.us/5P0TQUy ""USED ON VIDEO"" Samsung S95F 55"" https://geni.us/0GgF  🔹 Join My Community https://geni.us/KZ0yXs8 🔹 Steve Merch https://geni.us/PuwI6C 🔹 Camera Gear I Use:  https://geni.us/FCGtGM 🔹Social Media https://geni.us/yBwF  🔉🔉🔉 Listen To Podcast On 🔉🔉🔉  ➡️Apple Podcast https://geni.us/NaZPyL7 ➡️iHeart Radio https://geni.us/6ZXAni ➡️Deezer https://geni.us/oRCki ➡️Spotify https://geni.us/cT5tv ➡️Amazon Music https://geni.us/B3AgaJK  Subscribe Tech Steve YouTube Channel https://geni.us/TWuA8F  Support The Creator 🏪Amazon Store https://www.amazon.com/shop/techsteve 💵Buy Me A Coffee https://geni.us/oI3KX 💵Donate Via Paypal https://geni.us/qmLi  👍🏽 Subscribe, Why not it’s FREE! https://geni.us/TWuA8F  ➡️ DISCLAIMER: This video and description contains affiliate links, The channel gets a small commission for purchases made via these links.  This helps the channel purchase more products for reviews and allow me to create better content for your viewing.  Chapters 00:00 Introduction 00:24 INITIAL SETUP WITH REMOTE 03:01 HOW TO FACTORY RESET TV 03:25 INITIAL SETUP WITH SMARTTHINGS MOBILE APP 05:12 AMBIENT MODE, DAILY+, SMARTTHINGS, DEX 08:31 BUILT-IN STREAMING GAMING APPS 10:54 HOME SCREEN AND CUSTOMIZE APPS 12:33 SMARTTHING APP CALIBRATION 13:42 HOW TO STOP AUTOMATIC FEATURES 14:26 HOW TO SET UP AMAZON ALEXA 16:33 HOW TO USE MULTI VIEW",UCmHO0Rw7nBFK2233om_vyWA,Tech Steve,2025-09-19T20:26:45Z,28,en,en,none,"Samsung TV Tips,9 Cool Things You Didn't Know Your Samsung,samsung tv tips and tricks,samsung smart tv,samsung tv,samsing s95f,samsung s95f,samsung s95f review,samsung s95f oled,samsung oled,samsung s95f gaming,samsung oled tv,samsung tv guide,samsung tv tips and tricks 2024,samsung tv guide 2025,samsung frame tv tips,samsung tv tips adn tricks,samsung tv remote tips,samsung tv picture settings,s95f samsung,samsung tv settings",https://i.ytimg.com/vi/Jfgi3X5jBY0/default.jpg,https://i.ytimg.com/vi/Jfgi3X5jBY0/mqdefault.jpg,https://i.ytimg.com/vi/Jfgi3X5jBY0/hqdefault.jpg,https://i.ytimg.com/vi/Jfgi3X5jBY0/sddefault.jpg,https://i.ytimg.com/vi/Jfgi3X5jBY0/maxresdefault.jpg,3111,100,0,0,10,1096,PT18M16S,2d,hd,false,True,{},rectangular,False,processed,public,creativeCommon,True,True,False,False,,,https://en.wikipedia.org/wiki/Technology,,32.7157402038574,-117.1610794067383,0,217000,1033,68931987,"Hello everyone, and welcome to The Tech Steve Channel! Here, I share my passion for technology—from televisions and audio, to the latest gadgets shaping the consumer market. Over the years, I’ve worked across industries, from wireless and electronic sales to IT and computer building, always driven b",US,@techsteve,2013-11-18T22:01:27Z
qNn1SLTjA2g,samsung tv,US,relevance,2025-10-05T13:42:55.482969,You bought the wrong TV!,"➡️ Stay connected with an @UbigiOfficial Travel eSIM: https://go.ubigi.com/RG9062 💵 Use promo code JON10 to save 10%!   Shopping for a Samsung TV in 2025 can be confusing, but this guide explains what the letters mean, which models are better for bright rooms or gaming, and why clearance 2024 sets like the Q80D and QN95D are often a better choice. So, here's your Samsung lineup cheat sheet for 2025!  📢 Check out The Viewing Angle - https://www.youtube.com/channel/UCEZkzP56Hp79jBA2B2j_-Xw  📺 TVs Featured Samsung QN90F https://amzn.to/3Wa8S8E Samsung S95F https://amzn.to/3Is70VN Samsung QN990F https://amzn.to/4pFBXGD Samsung U8000F https://amzn.to/4pOgLyr Samsung Q7F https://amzn.to/4pHwEqe Samsung Q8F https://amzn.to/3Wesg4l Samsung Q80D (2024) https://amzn.to/42JtOXJ Samsung QN95D (2024) https://www.bestbuy.com/product/samsung-qn95d-qn75qn95daf-75-inches-4k-smart-led-tv-titan-black-graphite-black-2024-uhd-3840-x-2160-resolution-high-d/J3ZYG2H4FK/sku/10772937?ref=212&loc=marketplace Samsung QN900F https://amzn.to/4pFCcS3 Samsung S95D (2024) https://amzn.to/3IHWABk Samsung S90F https://amzn.to/4mGwtc1 Samsung S85F https://amzn.to/4nSIPPf Samsung The Frame Pro https://amzn.to/4gKEco4  🎥 GEAR: https://kit.co/JonRettinger/youtube-gear-2020 🎵 My music comes from Musicbed; check them out: http://share.mscbd.fm/jonrettinger  👋 Follow me! Instagram: https://www.instagram.com/jonrettinger/ X: https://twitter.com/Jon4Lakers Facebook: https://www.facebook.com/JonRettingerYT/ Website: https://www.jon4lakers.tech",UCR0AnNR7sViH3TWMJl5jyxw,Jon Rettinger,2025-09-25T23:06:29Z,28,en,en,none,"jon rettinger,jon4lakers,technobuffalo,samsung 2025 tv lineup,best samsung tv 2025,samsung tv buying guide,samsung qn90f,samsung qn95d,qn90f vs qn95d,samsung s95f,s95d vs s95f,samsung qn990f,samsung qn900f,samsung q8f,samsung u8000f,samsung q80d,samsung frame pro,samsung oled vs qled,qd oled,neo qled,mini led tv,best tv for ps5,gaming tv 120hz,bright room tv,8k tv vs 4k,should you buy 8k,best 4k tv 2025,which samsung tv to buy",https://i.ytimg.com/vi/qNn1SLTjA2g/default.jpg,https://i.ytimg.com/vi/qNn1SLTjA2g/mqdefault.jpg,https://i.ytimg.com/vi/qNn1SLTjA2g/hqdefault.jpg,https://i.ytimg.com/vi/qNn1SLTjA2g/sddefault.jpg,https://i.ytimg.com/vi/qNn1SLTjA2g/maxresdefault.jpg,479330,768,0,0,39,804,PT13M24S,2d,hd,false,True,{},rectangular,False,processed,public,youtube,True,True,False,False,,,"https://en.wikipedia.org/wiki/Lifestyle_(sociology),https://en.wikipedia.org/wiki/Technology",,,,,1650000,5052,716245642,"Welcome to the video home of Jon Rettinger, formerly of TechnoBuffalo.   This channel is a forum for all things electronic. It's an open forum, so feel free to speak your mind.  NOTE: All company e-mails will come from the below address. Any communication from another address is fraudulent. Email: j",US,@jon4lakers,2007-06-08T00:48:45Z
ovSa5WhVp4M,samsung tv,US,relevance,2025-10-05T13:42:55.482969,Use Your Samsung Galaxy Watch to Control Your Samsung TV,"Did you know you could do this with your Samsung Galaxy Watch and Samsung TV? It is called pointer mode. If you have a recent 2025+ Samsung TV with Vision AI and a supported Samsung Galaxy Watch, you can enable a mode that lets you move your hand around like a pointer and make different hand gestures for various actions.   Do you think this is cool, or a gimmick?.   #samsung #samsunggalaxywatch #samsungtv #samsunggalaxywatch6 #samsungqled #samsunggalaxyultra #samsunggalaxy #galaxyultra #galaxywatch",UCEAMLkMKtq6YhmaZdUT1ywA,This is Tech Today,2025-09-01T03:14:15Z,28,en,en,none,,https://i.ytimg.com/vi/ovSa5WhVp4M/default.jpg,https://i.ytimg.com/vi/ovSa5WhVp4M/mqdefault.jpg,https://i.ytimg.com/vi/ovSa5WhVp4M/hqdefault.jpg,https://i.ytimg.com/vi/ovSa5WhVp4M/sddefault.jpg,https://i.ytimg.com/vi/ovSa5WhVp4M/maxresdefault.jpg,18556,816,0,0,14,43,PT43S,2d,hd,false,True,{},rectangular,False,processed,public,youtube,True,True,False,False,,,"https://en.wikipedia.org/wiki/Lifestyle_(sociology),https://en.wikipedia.org/wiki/Technology",,,,,469000,1040,96298441,"As the host of ""This is Tech Today,"" M. Brandon Lee delves into how technology intersects with our daily lives, businesses, and creative pursuits. Technology has permeated every aspect of our existence, changing how we work, play, interact, create, and live. We aim to better understand what tomorrow",US,@thisistechtoday,2016-12-07T07:58:42Z
iv3gFxZak0I,samsung tv,US,relevance,2025-10-05T13:42:55.482969,Samsung U8000F Crystal UHD VS Q7F QLED 4K TV,"Samsung U8000F 43"" https://geni.us/cOl9ZS2 Samsung U8000F 50"" https://geni.us/Z6KaIid Samsung U8000F 55""  https://geni.us/9lQJd Samsung U8000F 58"" https://geni.us/I8f6BD8 Samsung U8000F 65""  https://geni.us/WZX8lJ Samsung U8000F 75""  https://geni.us/TtOcPA8 Samsung U8000F 85""  https://geni.us/7oNI  85"" Samsung Q7F https://geni.us/CzNzbTC 75"" Samsung Q7F https://geni.us/xoppYy 65"" Samsung Q7F https://geni.us/Qfg1bnp 55"" Samsung Q7F https://geni.us/KHTv 50"" Samsung Q7F https://geni.us/NEVKKAM 43"" Samsung Q7F https://geni.us/XXGqhkg  HDMI eARC to optical and RCA Adapter https://geni.us/7DzriNW  ➡️ DISCLAIMER: This video and description contains affiliate links, The channel gets a small commission for purchases made via these links.  This helps the channel purchase more products for reviews and allow me to create better content for your viewing.  🔹 Join 4K TV Chat Community https://geni.us/KZ0yXs8 🔹 Steve Merch https://geni.us/PuwI6C 🔹 Camera Gear I Use:  https://geni.us/FCGtGM 🔹Social Media https://geni.us/yBwF 🔹5% Slant Wall From Videos https://geni.us/STJIJm   Promo Code ""TECHSTEVEHD"" Video https://youtu.be/ynxmrOHYN9U  *********************************************************  ""Game Content Usage Rules"" using assets and it is not endorsed *********************************************************  #techsteve #samsung   👍🏽 Subscribe,❤️ Like &  Share 📲 Share ---- Hit The Notification 🔔",UCmHO0Rw7nBFK2233om_vyWA,Tech Steve,2025-08-06T17:48:52Z,28,en,en,none,"Samsung U8000F Crystal UHD TV,tech steve,samsung,tech steve samsung,samsung 2023 crystal uhd tv,samsung tu7020 crystal uhd 4k smart tv,samsung crystal hd tv,samsung u8000f crystal uhd tv,crystal processor 4k,samsung crystal uhd,samsung tv,samsung u8000f tv,samsung u8000f,crystal uhd u8000f,My HONEST Review of The Samsung U8000F TV Performance",https://i.ytimg.com/vi/iv3gFxZak0I/default.jpg,https://i.ytimg.com/vi/iv3gFxZak0I/mqdefault.jpg,https://i.ytimg.com/vi/iv3gFxZak0I/hqdefault.jpg,https://i.ytimg.com/vi/iv3gFxZak0I/sddefault.jpg,https://i.ytimg.com/vi/iv3gFxZak0I/maxresdefault.jpg,54218,592,0,0,138,767,PT12M47S,2d,hd,false,True,{},rectangular,False,processed,public,creativeCommon,True,True,False,False,,,https://en.wikipedia.org/wiki/Technology,,32.7157402038574,-117.1610794067383,0,217000,1033,68931987,"Hello everyone, and welcome to The Tech Steve Channel! Here, I share my passion for technology—from televisions and audio, to the latest gadgets shaping the consumer market. Over the years, I’ve worked across industries, from wireless and electronic sales to IT and computer building, always driven b",US,@techsteve,2013-11-18T22:01:27Z
ugpcp1Dt8Dk,samsung tv,US,relevance,2025-10-05T13:42:55.482969,How to install google play store app on Samsung Smart TV,How to get google play store on Samsung tv Tizen. How to install 3rd party apps on samsung smart tv. How to install google play store on smart tv. How to enable google play services on smart tv   ************************************************************************************ If you are really interested in my video please follow me on YouTube and Facebook …………………………………………………………………………………………………. Subscribe to my channel: https://www.youtube.com/channel/UC_J9mmyih3YF-sKXK1fwyFQ  FACEBOOK GROUP: https://web.facebook.com/groups/411530109484518   FACEBOOK PAGE: https://web.facebook.com/itmagicsbd …………………………………………………………………………………………………..  Background music: https://studio.youtube.com/channel/UC_J9mmyih3YF-sKXK1fwyFQ/music,UCDqoeeWJSingko0Vky3Upuw,IT Magics,2025-09-17T04:30:04Z,26,en,en,none,"it magics,how to,how to enable google play services on smart tv,how to install google play store on smart tv,how to install 3rd party apps on samsung smart tv,how to get google play store on samsung tv tizen,How to install google play store app on Samsung Smart TV",https://i.ytimg.com/vi/ugpcp1Dt8Dk/default.jpg,https://i.ytimg.com/vi/ugpcp1Dt8Dk/mqdefault.jpg,https://i.ytimg.com/vi/ugpcp1Dt8Dk/hqdefault.jpg,https://i.ytimg.com/vi/ugpcp1Dt8Dk/sddefault.jpg,https://i.ytimg.com/vi/ugpcp1Dt8Dk/maxresdefault.jpg,5431,13,0,0,4,115,PT1M55S,2d,hd,false,True,{},rectangular,False,processed,public,youtube,True,True,False,False,,,"https://en.wikipedia.org/wiki/Lifestyle_(sociology),https://en.wikipedia.org/wiki/Technology",2025-09-16T00:00:00Z,,,,277000,1589,149960704,"👋 Hi friends! In this video, I shared a little about the problems I faced in my personal life and how I solved them. Just like that, I also love helping people fix their software and hardware issues in simple and easy ways.  💻 If you want your technical problems solved faster, don’t forget to subscr",IN,@itmagics,2013-04-19T12:00:25Z
9wd3vpYnvA4,samsung tv,US,relevance,2025-10-05T13:42:55.482969,Unboxing & wall mounting the Samsung 65” Q60C! Cables hidden & setup clean.,"Watch us unbox, mount, and fully set up the Samsung 65” Q60C TV including cable management, TV mount install, and a clean wall finish. Professional AV installation done right.   Subscribe for more home tech setups from Simply AV.",UC8BSZ6Kq4LIN9RZQ7QM-8tQ,Simply AV,2025-10-04T20:39:38Z,24,en,zxx,none,"#SamsungQ60C,#TVWallMount,#CableManagement,#HomeTheater,#TechInstall,#SimplyAV,#TVMounting,#CleanInstall,#AVSetup,#HomeTech,#WallMountedTV,#SamsungTV,#ThiviMount,#SmartTV,#TechUnboxing,#TVInstaller,#HomeImprovement,#LivingRoomSetup,#FlatScreenTV,#AVSolutions,#EntertainmentSetup,#TechUpgrade,#HomeAV,#TVInstallersUK,#MediaWall,#NeatWiring,#4KTV,#SmartHome,#AVSpecialists,#TVMountingService,#AVExperts,#TVWallMountUK,#HomeCinema,#MountingDoneRight,#CleanLook",https://i.ytimg.com/vi/9wd3vpYnvA4/default.jpg,https://i.ytimg.com/vi/9wd3vpYnvA4/mqdefault.jpg,https://i.ytimg.com/vi/9wd3vpYnvA4/hqdefault.jpg,https://i.ytimg.com/vi/9wd3vpYnvA4/sddefault.jpg,https://i.ytimg.com/vi/9wd3vpYnvA4/maxresdefault.jpg,1877,65,0,0,1,77,PT1M17S,2d,hd,false,True,{},rectangular,False,processed,public,youtube,True,True,False,False,,,"https://en.wikipedia.org/wiki/Lifestyle_(sociology),https://en.wikipedia.org/wiki/Technology",,51.7668369,0.4757762,0,117000,679,128813320,"Website: www.simplyav.co.uk  WhatsApp or Call: 07780350222  Email: sales@simplyav.co.uk  From consultation to installation, we take care of everything. Subscribe for expert advice, inspiration, and behind-the-scenes content.",GB,@16ktv,2014-11-14T21:39:28Z
Qvp4hYSbLMg,samsung tv,US,relevance,2025-10-05T13:42:55.482969,Best Samsung TVs 2025 | Top 5 Samsung TV Review!,"Best Samsung TVs 2025 | OLED vs QLED Which is Best? 👉 Links to The Best Samsung TVs we listed in this video:  1. Samsung S95D QD-OLED TV  https://bit.ly/4noy730  2. SAMSUNG 65-Inch QLED The Frame Series   https://bit.ly/4nSpbCS  3. Samsung QLED Q80D  https://bit.ly/42eTMCv  4. Samsung QN90D Neo QLED  https://bit.ly/4nqoFfD  5. Samsung Q60D QLED  https://bit.ly/3VBqFFI     #tv #samsungtv #samsung #hometheater  Searching for the perfect Samsung TV to upgrade your entertainment setup? In this video, we explore the Best Samsung TVs that deliver stunning picture quality, immersive sound, and cutting-edge features. Whether you want a cinematic 4K experience, a premium QLED display with vibrant colors, or a sleek smart TV loaded with apps and streaming options, we’ve got you covered. From budget-friendly models to top-tier options, you’ll find the right fit for your home. Discover which Samsung TV is worth your investment and why. Stay tuned and make your next binge-watch or gaming session truly unforgettable!   📌 You Can Also Watch:  https://youtu.be/BKGcGHZYl0A?si=rN4c-z6xiK2iKZow https://youtu.be/gfcri31eFTQ?si=vLxg3G2r9ulPWnBs  ************************** Thank you for watching this video. Please like and subscribe to our channel, and for more updated videos, hit the bell button. If you have any questions related to the products in this video, please leave a comment below, and I will respond as soon as possible.  ************************** Disclaimer: The following video abides by the YouTube Community Guidelines. The footage used in this video is for educational purposes.  Copyright Issue:- If you find any of your copyrighted material in this video, please leave us a message so we can resolve the issue within 24 hours.  I hope you enjoyed the 'Best Samsung TVs 2025' Video.",UC-Lp4ovh92NA76KM6tqYHBg,Best 5 Zone,2025-09-28T19:08:59Z,28,en,en-US,none,"Best Samsung TVs,2025 samsung tv lineup,2025 samsung tv,Samsung TVs 2025,Top 5 Samsung TVs,which samsung tv to buy,samsung 2025 tv lineup,samsung tvs,samsung tv,best samsung tv 2025,samsung 2025 tvs,new samsung tv 2025,all samsung tv models,OLED TV 2025,QLED TV 2025,Smart TVs 2025,Samsung Vision AI,8K TV 2025,4K TV 2025,Best TVs for gaming,Samsung TV review,Neo QLED 2025,Top TVs 2025,best samsung tv,tv,samsung frame pro,4k tv,Best TVs,oledtv",https://i.ytimg.com/vi/Qvp4hYSbLMg/default.jpg,https://i.ytimg.com/vi/Qvp4hYSbLMg/mqdefault.jpg,https://i.ytimg.com/vi/Qvp4hYSbLMg/hqdefault.jpg,https://i.ytimg.com/vi/Qvp4hYSbLMg/sddefault.jpg,https://i.ytimg.com/vi/Qvp4hYSbLMg/maxresdefault.jpg,840,5,0,0,1,520,PT8M40S,2d,hd,false,False,{},rectangular,False,processed,public,youtube,True,True,False,False,,,https://en.wikipedia.org/wiki/Technology,,38.7945952,-106.5348379,0,1590,155,221687,"Welcome to‘’best 5 zone’’   Hello, I am a product reviewer. The ‘’best 5 zone’’ help you get acquainted with the latest technology through our channel. We are analyzing the market and find out the best product for you. Follow and subscribe to the ‘’best 5 zone’’ for more updates.  Disclosure: Someti",US,@best5zone1,2022-03-17T13:28:41.984393Z
k3jHeHwc5JQ,samsung tv,US,relevance,2025-10-05T13:42:55.482969,How to Set Apple AirPlay iPhone to SAMSUNG Smart TV,"In today's video, I am going to show you how to set Apple AirPlay from iPhone to SAMSUNG smart TV.  First of all, you need to set the Apple AirPlay setting in your SAMSUNG TV. After that turn ON air play from your iPhone to connect both devices. After connect your will see your phone screen on the TV. Let watch detail in the video.  Please also check out our related video in below link:  How to Mirror Screen iPhone to SAMSUNG Smart TV https://www.youtube.com/watch?v=SRDpPzkKqgI  How to Connect Bluetooth Soundbar to SAMSUNG Smart TV https://www.youtube.com/watch?v=hNEgjifT4GM",UCtZaGDaN2qm88AWDDFFL_Xw,Hak Nuk Man,2025-10-03T02:15:06Z,26,en,en,none,"how to set apple airplay iphone to samsung smart tv,apple airplay to samsung smart tv,how to connect apple airplay to samsung smart tv,apple airplay on samsung tv,mirror iphone to samsung tv,samsung smart tv apple airplay,airplay,samsung smart tv airplay,how to use apple airplay on samsung smart tv,how to use airplay on samsung tv",https://i.ytimg.com/vi/k3jHeHwc5JQ/default.jpg,https://i.ytimg.com/vi/k3jHeHwc5JQ/mqdefault.jpg,https://i.ytimg.com/vi/k3jHeHwc5JQ/hqdefault.jpg,https://i.ytimg.com/vi/k3jHeHwc5JQ/sddefault.jpg,https://i.ytimg.com/vi/k3jHeHwc5JQ/maxresdefault.jpg,101,0,0,0,0,174,PT2M54S,2d,hd,false,True,{},rectangular,False,processed,public,youtube,True,True,False,False,,,"https://en.wikipedia.org/wiki/Lifestyle_(sociology),https://en.wikipedia.org/wiki/Technology",,,,,49200,951,33380124,"This channel is create to show you guy some tip and tool for your house repairing and electric device problem. Most of our video are about how to fix, repair, setup and review.  We hope you guy enjoy the show. Thank you.....!!!  ",,@haknukman,2012-06-29T05:33:51Z
hf-sEOuvcRA,samsung tv,US,relevance,2025-10-05T13:42:55.482969,LG Vs Samsung TV | LG QNED TV | Samsung Crystal TV ✅,"#LGVsSamsung, #LGQNED, #SamsungCrystal, #TVComparison, #BestTV, #SmartTV, #4KTV, #QLEDvsQNED, #LGTV, #SamsungTV, #TVReview, #TechReview, #HomeEntertainment, #Gadgets, #BuyingGuide  Don’t buy LG TV light bleeding issue explained: https://hosturl.site/vtpdF4  Buy LG UHDTV: https://amzn.to/47eNh63  Thanks for watching ❤️👍🏻",UCxQQblsU34uzb0qS54QGSzA,Cars 2 Explore,2025-08-24T13:01:16Z,28,en,hi,none,"LGVsSamsung,LGQNEDTV,SamsungCrystalTV,TVComparison,QNEDvsCrystal,BestTV2024,TVReview,SmartTV,4KTV,TVTech,HomeTheater,Gadgets,Electronics,TVBuyingGuide,TechReview,LGTV,SamsungTV,QuantumDot,Nanocell,LEDTV,WhichTVToBuy,TVBattle,TechBattle,TVGaming,MovieNight",https://i.ytimg.com/vi/hf-sEOuvcRA/default.jpg,https://i.ytimg.com/vi/hf-sEOuvcRA/mqdefault.jpg,https://i.ytimg.com/vi/hf-sEOuvcRA/hqdefault.jpg,https://i.ytimg.com/vi/hf-sEOuvcRA/sddefault.jpg,https://i.ytimg.com/vi/hf-sEOuvcRA/maxresdefault.jpg,4179,22,0,0,1,52,PT52S,2d,hd,false,True,{},rectangular,False,processed,public,youtube,True,True,False,False,,,https://en.wikipedia.org/wiki/Technology,,,,,137000,1886,73779090,"Hello friends,  WELCOME to ""CARS2EXPLORE"", On this channel you'll get videos of Cars and some V-logs. Please SUBSCRIBE to Cars 2 Explore, Thanks for visiting my channel keep supporting, loving & exploring. Thank you so much.",IN,@cars2explore,2013-04-04T06:24:03Z
