video_id,search_keyword,search_region,search_order,collected_at,title,description,channel_id,channel_title,published_at,category_id,default_language,default_audio_language,live_broadcast_content,tags,thumbnail_default,thumbnail_medium,thumbnail_high,thumbnail_standard,thumbnail_maxres,view_count,like_count,dislike_count,favorite_count,comment_count,duration_seconds,duration_iso,dimension,definition,caption,licensed_content,content_rating,projection,has_custom_thumbnail,upload_status,privacy_status,license,embeddable,public_stats_viewable,made_for_kids,self_declared_made_for_kids,topic_ids,relevant_topic_ids,topic_categories,recording_date,location_latitude,location_longitude,location_altitude,channel_subscriber_count,channel_video_count,channel_total_view_count,channel_description,channel_country,channel_custom_url,channel_published_at
j6U9ut1Hclw,samsung tv,US,relevance,2025-10-05T13:42:55.947636,How To Set Up Samsung Account On Samsung TV - Step By Step,"Learn how to set up samsung account on samsung tv in this video. For more videos like this then please leave a like.  GuideRealm is the home of technology-based how-to's, guides & tips.  Equipment & tools I use (affiliate links): Tubebuddy (YouTube tools): https://www.tubebuddy.com/pricing?a=Tucker Microphone: https://amzn.to/43H8dAy Laptop: https://amzn.to/3ITBwom PC: https://amzn.to/3MPNgJL  Some of the links in this description are affiliate links. As an Amazon Associate and a partner of other affiliate programs, this means I will earn a small commission from qualifying purchases through these links.  Please like, subscribe, and comment.  GuideRealm",UCWdCOEFAsnzUJQgQOw3vu5Q,GuideRealm,2025-09-06T10:01:22Z,26,en,en,none,"how to set up samsung account on samsung tv,set up samsung account on samsung tv",https://i.ytimg.com/vi/j6U9ut1Hclw/default.jpg,https://i.ytimg.com/vi/j6U9ut1Hclw/mqdefault.jpg,https://i.ytimg.com/vi/j6U9ut1Hclw/hqdefault.jpg,https://i.ytimg.com/vi/j6U9ut1Hclw/sddefault.jpg,https://i.ytimg.com/vi/j6U9ut1Hclw/maxresdefault.jpg,667,3,0,0,0,49,PT49S,2d,hd,false,True,{},rectangular,False,processed,public,youtube,True,True,False,False,,,https://en.wikipedia.org/wiki/Technology,,,,,1620000,13120,539857676,"Welcome to GuideRealm - Your go-to destination for technology-based how-to's, guides & tips. ",US,@guiderealmvideos,2012-11-03T17:03:50Z
Sy9zZgXhOFQ,samsung tv,US,relevance,2025-10-05T13:42:55.947636,How To Get HDMI On Samsung TV - Step By Step,"Learn how to get hdmi on samsung tv in this video. For more videos like this then please leave a like.  GuideRealm is the home of technology-based how-to's, guides & tips.  Equipment & tools I use (affiliate links): Tubebuddy (YouTube tools): https://www.tubebuddy.com/pricing?a=Tucker Microphone: https://amzn.to/43H8dAy Laptop: https://amzn.to/3ITBwom PC: https://amzn.to/3MPNgJL  Some of the links in this description are affiliate links. As an Amazon Associate and a partner of other affiliate programs, this means I will earn a small commission from qualifying purchases through these links.  Please like, subscribe, and comment.  GuideRealm",UCWdCOEFAsnzUJQgQOw3vu5Q,GuideRealm,2025-09-07T20:00:17Z,26,en,en,none,"get hdmi on samsung tv,hdmi on samsung tv,how to get hdmi on samsung tv",https://i.ytimg.com/vi/Sy9zZgXhOFQ/default.jpg,https://i.ytimg.com/vi/Sy9zZgXhOFQ/mqdefault.jpg,https://i.ytimg.com/vi/Sy9zZgXhOFQ/hqdefault.jpg,https://i.ytimg.com/vi/Sy9zZgXhOFQ/sddefault.jpg,https://i.ytimg.com/vi/Sy9zZgXhOFQ/maxresdefault.jpg,517,2,0,0,2,31,PT31S,2d,hd,false,True,{},rectangular,False,processed,public,youtube,True,True,False,False,,,https://en.wikipedia.org/wiki/Technology,,,,,1620000,13120,539857676,"Welcome to GuideRealm - Your go-to destination for technology-based how-to's, guides & tips. ",US,@guiderealmvideos,2012-11-03T17:03:50Z
si0s2ufjAAI,samsung tv,US,relevance,2025-10-05T13:42:55.947636,How to Reset Samsung TV PIN,I show you how to reset your Samsung TV PIN code if you have forgotten it. This will reset the PIN back to 0000 so that you can reset your TV. I also show you how to factory reset your Samsung TV if you have forgotten the PIN.,UCSdbJpQua6ORS9d1s-LhlWA,Tech Tests & Troubleshooting,2025-09-17T14:48:58Z,22,en,en,none,,https://i.ytimg.com/vi/si0s2ufjAAI/default.jpg,https://i.ytimg.com/vi/si0s2ufjAAI/mqdefault.jpg,https://i.ytimg.com/vi/si0s2ufjAAI/hqdefault.jpg,https://i.ytimg.com/vi/si0s2ufjAAI/sddefault.jpg,https://i.ytimg.com/vi/si0s2ufjAAI/maxresdefault.jpg,1103,3,0,0,1,52,PT52S,2d,hd,false,True,{},rectangular,False,processed,public,youtube,True,True,False,False,,,https://en.wikipedia.org/wiki/Technology,,,,,27700,388,19456744,"All product testing videos and b-roll footage for reviews from Lapse of the Shutter, plus tech troubleshooting videos.  See the full reviews of these products at lapseoftheshutter.com ",GB,@techtests,2022-09-28T11:40:59.885654Z
G0n6_ONE5rw,samsung tv,US,relevance,2025-10-05T13:42:55.947636,Avoid These Samsung TV Buying MISTAKES At All Costs in 2025,"🔥 Best Samsung TV in 2025? 🤯 You Won’t Believe The Features! (Ultimate Review)  Links to the BEST Samsung Smart TVs we listed in this video:  ➜5:  Samsung QN900D ➜4: Samsung Q80D ➜3:Samsung Q60D ➜2: Samsung S95D ➜1:  Samsung S90C  ABOUT THIS Video: Welcome to Best Samsung TV 2025 📺✨ – your go-to spot for everything Samsung TV! From in-depth reviews, unboxings, and comparisons to tips & tricks that help you get the most out of your screen, we’ve got you covered. Whether you’re looking for the best budget-friendly option, the latest QLEDs, or Samsung’s premium 8K beasts, we break it all down in a fun, honest, and easy-to-understand way.  Hit that subscribe button so you never miss out on the newest drops, smart features, and must-know updates in the Samsung TV world. 🔔🔥  Let’s make sure your next TV upgrade is the best one yet. 🚀  https://www.youtube.com/@UCwx6RzMckmZrdI54NfeCarw   Follow Us: 🌐 Website: 📸 Instagram:          pinterest:        facebook: ************************** ►: Copyright Concerns: - If you identify any of your copyrighted material in this video, kindly drop us a message. We are committed to resolving any such issues promptly within 24 hours. ************************** #SamsungTV #BestSamsungTV2025 #SamsungQLED #SamsungNeoQLED #Samsung8K #SmartTV #TechReview #HomeTheater #SamsungElectronics #BestTV2025 #TVReview  ▬▬▬▬▬▬▬▬▬▬▬▬▬▬▬▬▬▬▬▬▬▬▬▬▬▬▬  Amazon Disclaimer: We are a participant in the Amazon Services LLC Associates Program, an affiliate advertising program designed to provide a means for sites to earn advertising fees by advertising and linking to Amazon.com  Hope you enjoyed  https://youtu.be/G0n6_ONE5rw",UCwx6RzMckmZrdI54NfeCarw,Prime Legit Reviews,2025-09-24T21:20:04Z,22,en,en-GB,none,"best samsung tv review,best budget samsung tv 2025,best samsung tv 2025,best qled samsung tv 2025,best samsung oled tv 2025,best samsung tvs 2025 - watch this before you decide to buy!,best samsung tvs 2025,best budget samsung tv,best 65 inch tv in 2025,best samsung tv,top 5 best 65 inch tv in 2025,best samsung 55 inch tv,which samsung tv is best,samsung tv 2025,best 8k samsung tv,best samsung oled tv,best qled samsung tv,top 5 samsung tv 2025",https://i.ytimg.com/vi/G0n6_ONE5rw/default.jpg,https://i.ytimg.com/vi/G0n6_ONE5rw/mqdefault.jpg,https://i.ytimg.com/vi/G0n6_ONE5rw/hqdefault.jpg,https://i.ytimg.com/vi/G0n6_ONE5rw/sddefault.jpg,https://i.ytimg.com/vi/G0n6_ONE5rw/maxresdefault.jpg,249,1,0,0,1,517,PT8M37S,2d,hd,false,False,{},rectangular,False,processed,public,youtube,True,True,False,False,,,https://en.wikipedia.org/wiki/Technology,2025-09-24T00:00:00Z,55.378051,-3.435973,0,394,211,236277,"Welcome to Prime Legit Reviews – your ultimate destination for honest and in-depth reviews of the latest products and services! At Prime Legit Reviews, we cut through the noise to bring you trustworthy insights on everything from tech gadgets and beauty products to lifestyle essentials and more.  Ou",GB,@primelegitreviews,2024-07-28T18:26:27.64108Z
BEAOVJvkUWI,samsung tv,US,relevance,2025-10-05T13:42:55.947636,Best TV 2025 | 55 inch | Sony vs Samsung vs LG | Hisense vs VU vs TCL vs Lumio,"Mega comparison of over 100 55 inch TVs to help identify the best TV for you. 👆Amazon buying links below👇  Click here 👆for best TVs https://amzn.to/3WtGeQY  *⚡⚡ BEST 55 inch TVs in INDIA⚡⚡* ✅ Best under 30K  - iFFALCON by TCL U65 LED (see linked product) - MOTOROLA QLED (see linked product)  ✅ Best under 40K - Vu Vibe DV QLED https://amzn.to/465sgZe - Hisense E7Q QLED https://amzn.to/3I1kzes - Lumio Vision 7 QLED https://amzn.to/4p49QAu - TCL V6C LED https://amzn.to/3HWmfGa  ✅ Best under 50K - Xiaomi Mi X Pro CineMagiQLED (see linked product) - TCL T89C QLED (see linked product) - LG UA8200 LED https://amzn.to/4g3qPyU - Samsung Crystal 4K Vista Pro LED https://amzn.to/3VBjVHC  ✅ Best under 60K - TCL Q6C Mini LED https://amzn.to/4p2bMtD - Hisense U7Q Mini LED https://amzn.to/465xDaL - Sony BRAVIA 2M2 LED https://amzn.to/47lnA3E - LG 8AA QNED https://amzn.to/3I5ikXx  ✅ Best premium TVs - Sony BRAVIA 3 LED https://amzn.to/41BA1oh - Sony BRAVIA 5 Mini LED https://amzn.to/462PYVJ - LG C4 OLED https://amzn.to/45MIOGp  *⚡⚡ All Grapevine Recommended Products⚡⚡* https://amzn.to/3s2CuJL   Consider *SUBSCRIBING* to the channel if you would like to support me to make videos that are *SUPER USEFUL* for you.  You'd make my day 😁  *⚡⚡ IN THIS VIDEO⚡⚡* 00:00  How to shortlist the right TV 02:42  Video Performance 05:44  Audio Performance 07:07  Convenience aspects 08:28  Warranty and Service  09:12  Best 55” TV Under ₹30,000 09:59  Best 55” TV Under ₹40,000 12:57  Best 55” TV Under ₹50,000 15:11  Best 55” TV In ₹50,000 - ₹70,000 17:56  Best 55” TV Above ₹70,000  *CONNECT WITH ME* 📸 Instagram:   https://www.instagram.com/thegrapevineindia/    💼 LinkedIn:   https://www.linkedin.com/in/saumyaupadhyaya/ 🛍️ Amazon: https://amzn.to/3s2CuJL   Disclaimer: Some of the links are affiliate links, which means if you use it to buy something, it will support me to make more such videos and I get a small incentive at no extra cost to you 😊 #thegrapevineindia  *Video Summary* Comparing LED, QLED, mini LED, and OLED 55 inch TVs. I compare Samsung, LG, Sony Bravia, TCL, Hisense, Vu, Mi, Redmi, Motorola, and iFFalcon to help you find the right TV for your budget. From Dolby Vision TV 55 inch, HDR10+ TV 55 inch, to 4K TV 55 inch review, get the best options for movies, sports, or gaming. Perfect guide for budget 55 inch TV and premium 55 inch TV buyers.   *Products compared* iFFALCON by TCL U65 LED, VW Pro QLED, ONIDA Nexg LED, realme TechLife QLED, Acer I PRO LED, Acerpure Swift LED, Blaupunkt Quantum Dot QLED, TOSHIBA C350NP LED, Hisense E6N LED, MOTOROLA QLED, Wobble UD Series LED, NU LED, Acer V PRO QLED, Vu GloQLED, TOSHIBA C450ME QLED, TCL V6C LED, Vu Vibe DV QLED, Xiaomi FX LED, Hisense E7Q QLED, NU Borderless QLED, TOSHIBA M450RP QLED, Acerpure Elevate QLED, Xiaomi Mi X Series LED, Xiaomi F Pro Series QLED, Xiaomi FX Pro Series QLED, TOSHIBA M550NP QLED, Aiwa Magnifiq QLED, Lumio Vision 7 QLED, TOSHIBA Z570RP QLED, Hisense E7Q PRO QLED, TCL T8C QLED, TCL P71K QLED, Xiaomi Mi X Pro CineMagiQLED, Samsung DUE70 LED, TCL T89C QLED, Samsung Crystal 4K Vista LED, LG UR75 LED, Haier P7GT LED, LG UA8200 LED, Samsung Crystal 4K Vista Pro LED, Samsung D Brighter Crystal LED, LG QNED-75 QNED, TCL Q6C Mini LED, Haier S800 QLED, Samsung Vision AI QLED, Sony BRAVIA 2 LED, Lumio Vision 9 Mini LED, Hisense U7Q Mini LED, Hisense U7N Mini LED, Sony BRAVIA 2M2 LED, Haier M80F Mini LED, LG 8AA QNED, Sony BRAVIA 3 LED, Samsung The Frame QLED, Samsung Neo-QLED QNX1D Mini LED, Samsung Neo-QLED QN85F Mini LED, LG B4 OLED, Sony BRAVIA 5 Mini LED, LG C4 OLED, Sony BRAVIA 7 Mini LED, Sony BRAVIA 8M2 OLED",UCKUHl9qrizvt_cfldeVXuyw,The Grapevine,2025-09-21T05:30:14Z,26,en-IN,en-IN,none,,https://i.ytimg.com/vi/BEAOVJvkUWI/default.jpg,https://i.ytimg.com/vi/BEAOVJvkUWI/mqdefault.jpg,https://i.ytimg.com/vi/BEAOVJvkUWI/hqdefault.jpg,https://i.ytimg.com/vi/BEAOVJvkUWI/sddefault.jpg,https://i.ytimg.com/vi/BEAOVJvkUWI/maxresdefault.jpg,108638,1947,0,0,323,1184,PT19M44S,2d,hd,false,True,{},rectangular,False,processed,public,youtube,True,True,False,False,,,https://en.wikipedia.org/wiki/Technology,,,,,187000,306,41368043,✅ Subscribe to make smart decisions ✅ Your go-to source for the best home appliances  Hi 👋 This is SAUMYA!  (Best way for viewers to reach me is via the comments section of the video. Kindly excuse if you do not hear back from me on any personal requests via email. The published email id is only for,IN,@thegrapevineindia,2020-08-06T11:00:07.451694Z
d8Q-5wx3f2s,samsung tv,US,relevance,2025-10-05T13:42:55.947636,TOP 5 Best Samsung TVs in 2025,"📌Product Link📌:  No 1. Samsung 65-inch S90D OLED 4K TV. 🛒https://amzn.to/47MBiwB  No 2. Samsung 65-inch U8000F 4K TV. 🛒https://amzn.to/4miItjK  No 3. Samsung 65-inch S95F OLED 4K TV. 🛒https://amzn.to/4mgd3KN  No 4. Samsung 65-inch QN90D Neo QLED 4K TV. 🛒https://amzn.to/4mgVzxN  No 5. Samsung 65-inch Frame TV (LS03F). 🛒https://amzn.to/42znQIS  In this video, we listed the Best Samsung TVs that are available on the market for their true quality, actually, I tried to make the list based on their popularity quality-price durability user opinions and more. #excellent_review  ➤ Don't forget to:      ★ Subscribe      ★ Like      ★ Comment      ★ Share with your friends  ➤ All This products in this video belong to the website owner and        the product owner. This is not a promotional video, just some        cool gadgets that makes our life better.   ➤ Disclaimer: As an Amazon Associate I earn from qualifying purchases.  ➤ Copyright Issue:-       If you find any of your copyrighted material in this video, please        leave us a message (excellentreview579@gmail.com)        so we can resolve the issue.© All rights reserved by respective owners.  Thanks for watching! Tags:- #excellent_review  best samsung tv #bestsamsungtv #bestsamsungtv2025 #samsungtv2025 #samsungtv #tv #tv2025",UCsdj8XA-ytXKsQsi8mCuCNA,Excellent Review,2025-09-17T17:37:50Z,2,en-US,en,none,"excellent review,samsung tv,samsung tv fix,new samsung tv,samsung tv hack,samsung tv tips,2025 samsung tv,best samsung tv,qled samsung tv,samsung vs lg tv,samsung 8k tv,samsung ai tv,samsung tv reset,samsung tv setup,samsung tv guide,samsung tv how to,samsung tv qn990f,samsung tv remote,samsung tv review,samsung s95d tv,samsung 2024 tv,samsung qled tv,new samsung tv 2025,samsung tv feature,best samsung tv 2025,samsung tv settings,Samsung,TVs,tv",https://i.ytimg.com/vi/d8Q-5wx3f2s/default.jpg,https://i.ytimg.com/vi/d8Q-5wx3f2s/mqdefault.jpg,https://i.ytimg.com/vi/d8Q-5wx3f2s/hqdefault.jpg,https://i.ytimg.com/vi/d8Q-5wx3f2s/sddefault.jpg,https://i.ytimg.com/vi/d8Q-5wx3f2s/maxresdefault.jpg,906,4,0,0,0,745,PT12M25S,2d,hd,false,True,{},rectangular,False,processed,public,youtube,True,True,False,False,,,https://en.wikipedia.org/wiki/Technology,2025-09-17T00:00:00Z,38.7945952,-106.5348379,0,2830,772,1013583,"Welcome, Best Excellent Review. Do you want to save your time and painful search for finding the best of the best product on Amazon?  I am provide you the regular trending product reviews related to electronics, home appliances, sports equipment, entertainment, skincare, makeup, hair care, and many ",US,@excellentreview-xk3dj,2023-07-01T10:50:27.227571Z
OawxH8e1TIQ,samsung tv,US,relevance,2025-10-05T13:42:55.947636,Samsung 77-Inch Class OLED 4K S90D Series HDR+ Smart TV w/Dolby Atmos #samsung  #tv,,UCrPhfnTPOESo_578cO3yZaw,Ghure Ashi,2025-07-08T16:15:52Z,24,en-US,en-US,none,,https://i.ytimg.com/vi/OawxH8e1TIQ/default.jpg,https://i.ytimg.com/vi/OawxH8e1TIQ/mqdefault.jpg,https://i.ytimg.com/vi/OawxH8e1TIQ/hqdefault.jpg,https://i.ytimg.com/vi/OawxH8e1TIQ/sddefault.jpg,https://i.ytimg.com/vi/OawxH8e1TIQ/maxresdefault.jpg,1396,5,0,0,0,13,PT13S,2d,hd,false,True,{},rectangular,False,processed,public,youtube,True,True,False,False,,,https://en.wikipedia.org/wiki/Technology,,,,,28900,4655,4095603,"Join this channel to get access to perks: https://www.youtube.com/channel/UCrPhfnTPOESo_578cO3yZaw/join  Welcome to the purr-fectly adorable world of Cat Iroh and Cat Mishty! Join us for daily doses of feline fun, cuddles, and heartwarming moments that will melt your heart.  Cat Iroh and Cat Mishty ",US,@ghureashi,2020-08-25T05:48:35.451683Z
0obFP96CUDw,samsung tv,US,relevance,2025-10-05T13:42:55.947636,This TV Will Blow Your Mind 🤯 | Samsung 75″ 4K UHD #india #nepal #samsung #tv #srilanka,"Samsung 75″ 4K UHD Smart TV – Big Screen. Bigger Experience This is the Samsung 75-inch 4K UHD Smart TV—huge, sleek, and built to transform your movie nights   With its ultra-slim design and nearly bezel-less screen, it blends right into your space. The 4K UHD resolution means over 8 million pixels, giving you stunning clarity and lifelike colors    “Whether it’s a blockbuster, a football match, or a Netflix binge, everything looks sharper and more immersive   It’s a Smart TV powered by Samsung’s Tizen OS, so you get quick access to all your favorite apps—streaming, gaming, even voice control with Bixby, Alexa, or Google Assistant and with Samsung’s adaptive sound technology, the audio adjusts to what you’re watching—whether it’s dialogue, music, or action scenes  So if you’re looking for a massive screen with crystal-clear 4K, smart features, and a premium design, the Samsung 75-inch 4K UHD Smart TV is a solid choice",UCYMnzYVYyp-uDtzdNWKf5YQ,Timodh Ekanayake,2025-09-13T06:30:02Z,24,en,zh-CN,none,,https://i.ytimg.com/vi/0obFP96CUDw/default.jpg,https://i.ytimg.com/vi/0obFP96CUDw/mqdefault.jpg,https://i.ytimg.com/vi/0obFP96CUDw/hqdefault.jpg,https://i.ytimg.com/vi/0obFP96CUDw/sddefault.jpg,https://i.ytimg.com/vi/0obFP96CUDw/maxresdefault.jpg,1318,11,0,0,0,60,PT1M,2d,hd,false,False,{},rectangular,False,processed,public,youtube,True,True,False,False,,,"https://en.wikipedia.org/wiki/Entertainment,https://en.wikipedia.org/wiki/Technology",,20.593684,78.96288,0,695,230,304648,"🎬 Timodh Ekanayake | Sri Lanka 🇱🇰 Welcome to my world — where everyday life meets creativity! I bring you real moments, exciting unboxings, events, film talk, and more. New vibes, fresh content — always from the heart.  👉 Subscribe, like & share the journey!  ""From my lens to your screen."" ",LK,@timodhekanayake,2017-08-21T16:21:20Z
2x4bZazkIvk,samsung tv,US,relevance,2025-10-05T13:42:55.947636,Samsung Frame vs Samsung Frame Pro: Which Is Right For You?,"Shop The Frame: https://smarthomesounds.link/zpxrry Shop The Frame Pro: https://smarthomesounds.link/u822ws Visit us for all things audio visual: https://smarthomesounds.link/ggt1yr  Interested in the FITUEYES TV stands? Shop The ZEN FT88 & Eiffel V2 FT88 along with the rest of the range here: https://uk.fitueyes.com/?ref=shs ⭐ Use code SHS10 for 10% off!  Thinking of upgrading your space with a TV that doubles as art? In this video, we compare the Samsung Frame and the new Frame Pro side by side to help you decide which one is worth your money in 2025...  Chapters: 00:00 Introduction 01:48 Key Differences 05:52 Design 07:41 Picture Quality 12:21 FITUEYES 14:05 Sound Performance 15:32 Gaming 17:05 Verdict  Book an appointment at our Showroom - https://smarthomesounds.link/ZwXFz2  GET IN TOUCH  Got any questions or looking for more personal advice? Get in touch - we’d love to help!  ✉️ Email - info@smarthomesounds.co.uk  📞 Call - 0800 677 1100   💬 Live chat - https://smarthomesounds.link/8b4nrw  FOLLOW US:  📸 Instagram - https://smarthomesounds.link/tOqdNo  🐦 Twitter - https://smarthomesounds.link/HbK60Y  📕 Facebook - https://smarthomesounds.link/iRYsdP  VISIT OUR BLOG  📝 - https://smarthomesounds.link/xK3hNl  📚 Read More - https://www.smarthomesounds.co.uk/blog/faqs/samsung-frame-vs-samsung-frame-pro  WHO ARE WE?  Smart Home Sounds is one of the leading UK online audio retailers. We sell a range of wireless speakers, turntables, headphones, HIFI equipment and much more.  ✅ Free Next Day Delivery  ✅ 6 Year Extended Sonos Warranty  ✅ 30 Day Listen Better Promise  ✅ VIP Loyalty Scheme  ✅ Expert help & advice",UCTIFIULcxN0sh8b3uXgDX6g,Smart Home Sounds,2025-08-24T16:42:55Z,28,en,en-GB,none,,https://i.ytimg.com/vi/2x4bZazkIvk/default.jpg,https://i.ytimg.com/vi/2x4bZazkIvk/mqdefault.jpg,https://i.ytimg.com/vi/2x4bZazkIvk/hqdefault.jpg,https://i.ytimg.com/vi/2x4bZazkIvk/sddefault.jpg,https://i.ytimg.com/vi/2x4bZazkIvk/maxresdefault.jpg,17191,160,0,0,31,1127,PT18M47S,2d,hd,false,True,{},rectangular,False,processed,public,youtube,True,True,False,False,,,https://en.wikipedia.org/wiki/Technology,,,,,145000,535,43343144,Audio Visual & Tech Enthusiasts  Reviews | Comparisons | Unboxing | Buying Guides | How-To | Top Tips  If you would like to collaborate or work with us: marketing@smarthomesounds.co.uk ,GB,@smarthomesounds,2014-03-11T13:14:03Z
6vbB_HAYb9g,samsung tv,US,relevance,2025-10-05T13:42:55.947636,LG G5 vs Samsung S95F vs Sony BRAVIA 8 II: Best OLED For You in 2025?,"Get the Sony BRAVIA 8 II: https://www.rtings.com/afflink/Aq8AAWhYAAA= Get the Samsung S95F: https://www.rtings.com/afflink/Aq8AAVoUAAA= Get the LG G5: https://www.rtings.com/afflink/Aq8AAVoZAAA=  The LG G5 OLED, Samsung S95F OLED and Sony BRAVIA 8 II are three of the best 2025 TVs available. All have distinct strengths: the Samsung looks the most dramatic, the LG is the most balanced all‑rounder, and the Sony is a specialist aimed at film purists who can overlook its price and gaming shortcomings. But which one is the best pick for you? Stay tuned...   Sony BRAVIA 8 II: https://www.rtings.com/tv/reviews/sony/bravia-8-ii-oled   Samsung S95F:  https://www.rtings.com/tv/reviews/samsung/s95f-oled   LG G5 OLED:  https://www.rtings.com/tv/reviews/lg/g5-oled   Vote for our next TV review: https://www.rtings.com/vote/tv    Follow our 100+ TV (and 3 Monitor!) Longevity Test @RTINGScomRD   Support Us: https://www.rtings.com/insider  Careers: https://grnh.se/eb4de72f7us  Don't miss a beat - join our newsletters: https://www.rtings.com/newsletters   Join our Discord server: https://discord.gg/UpwKBSvc54    Follow Us:  https://www.facebook.com/rtingscom  https://twitter.com/rtingsdotcom  https://www.instagram.com/rtingsdotcom/   ---  00:00 Intro 00:54 Design & Core Features  02:36 HDR Brightness  03:30 SDR Brightness  04:23 Reflections  05:43 Colors  07:58 Processing  09:10 Gaming  10:53 Price snapshot – July 2025  11:13 Who should buy the Samsung S95F?  12:04 Who should buy the LG G5?  12:53 Who should buy Sony BRAVIA 8 II?  13:51 Outro  ---   We make money directly from you via insider access on our website (which gives you access to extra features: https://www.rtings.com/insider) and when you buy a product after clicking a link to a retailer. Learn more about how we work: https://www.rtings.com/company/about-us",UCAi6GKtTPoYxUheIbVhnwqw,RTINGS Home Theater,2025-07-31T17:00:15Z,28,en,en-CA,none,"TV,television,showdown,review,sony,samsung,LG,G5,S95F,BRAVIA 8 II,Flagship,2025,Best TV's,comparison,rtings",https://i.ytimg.com/vi/6vbB_HAYb9g/default.jpg,https://i.ytimg.com/vi/6vbB_HAYb9g/mqdefault.jpg,https://i.ytimg.com/vi/6vbB_HAYb9g/hqdefault.jpg,https://i.ytimg.com/vi/6vbB_HAYb9g/sddefault.jpg,https://i.ytimg.com/vi/6vbB_HAYb9g/maxresdefault.jpg,121794,2290,0,0,576,879,PT14M39S,2d,hd,false,True,{},rectangular,False,processed,public,youtube,True,True,False,False,,,https://en.wikipedia.org/wiki/Technology,,,,,390000,587,78274219,FIND THE BEST PRODUCT FOR YOUR NEEDS! Straight to the point buying recommendations on TVs. We purchase our own products and put them under the same test bench so that you can compare the results easily. No cherry-picked units sent by brands. No ads. Only real tests.,,@rtingsdotcom,2011-09-27T02:20:52Z
